imdb_title_id,title,original_title,year,date_published,genre,duration,country,language,director,writer,production_company,actors,description,avg_vote,votes,budget,usa_gross_income,worlwide_gross_income,metascore,reviews_from_users,reviews_from_critics,avg_vote_10,avg_vote_100,avg_vote_1000
tt0047149,Guerra tra i pianeti,Killers from Space,1954,1954-01-23,"Horror, Mystery, Sci-Fi",71,USA,English,W. Lee Wilder,"William Raynor, Myles Wilder",Planet Filmplays,"Peter Graves, James Seay, Steve Pendleton, Frank Gerstle, John Frederick, Barbara Bestar, Shepard Menken, Jack Daly, Ron Gans, Ben Welden, Burt Wenland, Lester Dorr, Robert Roark, Ruth Bennett, Mark Scott",An atomic scientist claims he was abducted by aliens after being injured in a plane crash.,3.4,1920,"","","",,88,40,3.4,49.8230604749645,340
tt0047366,La principessa del Nilo,Princess of the Nile,1954,1954-07-01,"Adventure, Fantasy, Romance",71,USA,English,Harmon Jones,Gerald Drayson Adams,Panoramic Productions,"Debra Paget, Jeffrey Hunter, Michael Rennie, Dona Drake, Michael Ansara, Edgar Barrier, Wally Cassell, Jack Elam, Lisa Daniels, Phyllis Winger, Merry Anders, Honey Bruce Friedman, Suzanne Alexander, Genice Grayson, Jeanne Vaughn","In 1249, an Egyptian princess allies herself with the son of the Caliph of Baghdad in order to rid Egypt of its Bedouin invaders.",6.4,317,$ 475000,"","",,18,2,6.4,87.0130454795745,640
tt0047877,The Big Bluff,The Big Bluff,1955,1955-06-05,"Crime, Drama, Film-Noir",71,USA,English,W. Lee Wilder,"Fred Freiberger, Mindret Lord",Planet Filmplays,"John Bromfield, Martha Vickers, Robert Hutton, Rosemarie Stack, Eve Miller, Max Palmer, Eddie Bee, Robert Bice, Pierre Watkin, Beal Wong, Rusty Wescoatt, Mitchell Kowall, Jack Daly, Paul McGuire, George Conrad","When a scheming fortune hunter finds his rich wife is not going to die as expected, he and his lover make other plans to get her millions.",5.8,400,"","","",,19,3,5.8,80.1161731645172,580
tt0048139,L'arma che conquistò il West,The Gun That Won the West,1955,1955-09-01,"Action, Adventure, Western",71,USA,English,William Castle,Robert E. Kent,Sam Katzman Productions,"Dennis Morgan, Paula Raymond, Richard Denning, Chris O'Brien, Robert Bice, Michael Morgan, Roy Gordon, Howard Wright","In the late 1860s, Colonel Carrington and his command are assigned the job of constructing a chain of forts in the Sioux Indian territory - of Wyoming. Carrington recruits former cavalry ...",4.7,197,"","","",,9,1,4.7,65.2814801851409,470
tt0049235,Pistola nuda,Frontier Gambler,1956,1956-07-01,Western,71,USA,English,Sam Newfield,Orville H. Hampton,Sigmund Neufeld Productions,"John Bromfield, Coleen Gray, Kent Taylor, Jim Davis, Margia Dean, Veda Ann Borg, Stanley Andrews, Nadine Ashdown, Tracey Roberts, Roy Engel, John Merton, Frank Sully","A marshal investigating the death of a woman who owned a gambling house finds that he's developing an attraction to the image of the dead woman, and then she shows up very much alive.",5.5,125,"","","",,4,1,5.5,74.9563518078169,550
tt0049370,Il conquistatore del mondo,It Conquered the World,1956,1956-07-15,"Horror, Sci-Fi",71,USA,English,Roger Corman,Lou Rusoff,Sunset Productions (III),"Peter Graves, Beverly Garland, Lee Van Cleef, Sally Fraser, Russ Bender, Jonathan Haze, Dick Miller, Taggart Casey, Paul Harbor, Karen Kadler, Charles B. Griffith, Marshall Bradford, Thomas E. Jackson, David McMahon, Jim Knight","A well meaning scientist guides an alien monster to Earth from Venus, so that he can rid mankind of feelings and emotions - but only death and sorrow results.",5,2077,"","","",,70,30,5,68.4538686835312,500
tt0049962,Blonde Bait,Blonde Bait,1956,1956-04-01,"Action, Adventure, Crime",71,"UK, USA","English, Spanish",Elmo Williams,"",Hammer Films,"Beverly Michaels, Jim Davis, Joan Rice, Richard Travis, Paul Cavanagh, Thora Hird, Avril Angers, Gordon Jackson, Valerie White, April Olrich, Ralph Michael, Harry Lauter","U.S. State Department agent Kent Foster, on the trail of a murderous traitor, Nick Randall, hopes to trap Randall through singer/stripper Angela Booth. The latter has promised to marry ...",5.4,112,"","","",,8,5,5.4,77.0404160636457,540
tt0050210,The Brain from Planet Arous,The Brain from Planet Arous,1957,1957-10-01,"Action, Adventure, Horror",71,USA,English,Nathan Juran,Ray Buffum,Marquette Productions Ltd.,"John Agar, Joyce Meadows, Robert Fuller, Thomas Browne Henry, Ken Terrell, Henry Travis, E. Leslie Thomas, Tim Graham, Bill Giorgio","Gor, a powerful criminal brain from the planet Arous, assumes the body of scientist Steve March. Through March, he begins to control the world by threatening destruction to any country ...",5.3,1382,$ 58000,"","",,52,44,5.3,67.9623572609669,530
tt0050285,I fuorilegge del Colorado,The Dalton Girls,1957,1958-04-25,Western,71,USA,English,Reginald Le Borg,"Maurice Tombragel, Herbert Purdom",Bel-Air Productions,"Merry Anders, Lisa Davis, Penny Edwards, Sue George, John Russell, Ed Hinton, Glenn Dixon, Johnny Western, Malcolm Atterbury, Douglas Henderson, Kevin Enright, Al Wyatt Sr.",Female relatives of the infamous Dalton gang carry on the family tradition.,5.7,158,"","","",,8,1,5.7,79.420120622115,570
tt0050292,La figlia del dott. Jekyll,Daughter of Dr. Jekyll,1957,1957-07-28,"Fantasy, Horror",71,USA,English,Edgar G. Ulmer,Jack Pollexfen,Film Venturers,"John Agar, Gloria Talbott, Arthur Shields, John Dierkes, Mollie McCard, Martha Wentworth, Marjorie Stapp, Reita Green, Marel Page, Ken Terrell","A young woman discovers she is the daughter of the infamous Dr. Jekyll, and begins to believe that she may also have a split personality, one of whom is a ruthless killer.",5.5,449,"","","",,26,28,5.5,75.8522937728539,550
tt0050414,From Hell It Came,From Hell It Came,1957,1957-08-25,"Horror, Sci-Fi",71,USA,English,Dan Milner,"Richard Bernstein, Richard Bernstein",Milner Brothers Productions,"Tod Andrews, Tina Carver, Linda Watkins, John McNamara, Gregg Palmer, Robert Swan, Baynes Barron, Suzanne Ridgway, Mark Sheeler, Lee Rhodes, Grace Mathews, Tani Marsh, Chester Hayes, Lenmana Guerin","A wrongfully accused South Seas prince is executed, and returns as a walking tree stump.",3.7,1307,"","","",,65,44,3.7,51.6917295777019,370
tt0050675,Prigionieri dell'eternità,The Man Who Turned to Stone,1957,1957-03-01,"Horror, Sci-Fi",71,USA,English,László Kardos,Bernard Gordon,Sam Katzman Productions,"Victor Jory, William Hudson, Charlotte Austin, Jean Willes, Ann Doran, Paul Cavanagh, George Lynn, Victor Varconi, Friedrich von Ledebur, Tina Carver, Barbara Wilson","Jory and his followers stay immortal by siphoning off the life forces of others. If they don't get renewed, they petrify.",5.3,279,"","","",,19,9,5.3,73.0387491988297,530
tt0050723,Il pianeta dove l'inferno è verde,Monster from Green Hell,1957,1957,"Horror, Sci-Fi",71,USA,English,Kenneth G. Crane,"Louis Vittes, Endre Bohem",Gross-Krasne Productions,"Jim Davis, Robert Griffin, Joel Fluellen, Barbara Turner, Eduardo Ciannelli, Vladimir Sokoloff","A scientific expedition in Africa investigates wasps that have been exposed to radiation and mutated into giant, killing monsters.",3.5,842,"","","",,41,21,3.5,44.0742770127903,350
tt0050822,Bill il bandito,The Parson and the Outlaw,1957,1957-09-01,Western,71,USA,English,Oliver Drake,"Oliver Drake, John Mantley",Charles 'Buddy' Rogers Productions,"Anthony Dexter, Sonny Tufts, Marie Windsor, Charles 'Buddy' Rogers, Jean Parker, Robert Lowery, Madalyn Trahey, Bob Steele, Joe Sodja, Bob Duncan, Bob Gilbert, Jack Lowell, John Davis, Paul Spahn, Herman Pulver","Billy the Kid tries to live in peace, under a new name and in a frontier town, but is approached by a preacher who asks for his help in freeing the town from a ruthless man and his gunman.",4.3,107,"","","",,5,2,4.3,56.4289596911198,430
tt0050890,Reform School Girl,Reform School Girl,1957,1957-08-01,"Crime, Drama",71,USA,English,Edward Bernds,Edward Bernds,Carmel Productions,"Gloria Castillo, Ross Ford, Edd Byrnes, Ralph Reed, Jan Englund, Yvette Vickers, Helen Wallace, Donna Jo Gribble, Luana Anders, Diana Darrin, Nesdon Booth, Wayne Taylor, Sharon Lee, Jack Kruschen, Linda Rivera","A young man steals a car and ends up involved in a pedestrian fatality. The only witness is a girl he had just met. He threatens her life if she talks, so when she refuses to tell what she knows she is sent to reform school.",5.7,208,"","","",,8,4,5.7,77.5067202854252,570
tt0051062,Teenage Doll,Teenage Doll,1957,1957-09-22,"Crime, Drama, Film-Noir",71,USA,English,Roger Corman,Charles B. Griffith,Woolner Brothers Pictures Inc.,"June Kenney, Fay Spain, John Brinkley, Colette Jackson, Barbara Wilson, Ziva Rodann, Sandra Smith, Barboura Morris, Richard Devon, Jay Sayer, Richard H. Cutting, Dorothy Neumann, Ed Nelson, Bruno VeSota, Paul Bryar","A delinquent girls' gang pursues a nice ingenue linked romantically to the male leader of a rival gang, and apparently to the murder of one of their members.",5.7,228,"","","",,4,9,5.7,80.8488308364611,570
tt0051128,La sopravvissuta,The Undead,1957,1957-03-15,"Fantasy, Horror",71,USA,"English, French",Roger Corman,"Charles B. Griffith, Mark Hanna",Roger Corman Productions,"Pamela Duncan, Richard Garland, Allison Hayes, Val Dufour, Mel Welles, Dorothy Neumann, Billy Barty, Bruno VeSota, Richard Devon, Maurice Manson, Aaron Saxon, Don Garrett, Dick Miller","A beautiful woman is sent back in time via hypnosis to the Middle Ages where she finds she is suspected of being a witch, and subject to being executed.",4.4,1630,$ 70000,"","",,56,21,4.4,59.52659890254,440
tt0051369,Apache Territory,Apache Territory,1958,1958-09-01,"Action, Western",71,USA,English,Ray Nazarro,"Charles R. Marion, George W. George",Columbia Pictures,"Rory Calhoun, Barbara Bates, John Dehner, Carolyn Craig, Tom Pittman, Leo Gordon, Myron Healey, Francis De Sales, Frank DeKova, Regis Parton, Bob Woodward, Fred Krone",A no-nonsense drifter leads a ragtag collective surrounded by a deadly tribe of Apaches.,5.8,402,"","","",,10,6,5.8,78.3695521752613,580
tt0051947,The Monster of Piedras Blancas,The Monster of Piedras Blancas,1959,1959-09-14,"Horror, Sci-Fi",71,USA,English,Irvin Berwick,H. Haile Chace,Vanwick Productions,"Les Tremayne, Forrest Lewis, John Harmon, Frank Arvidson, Jeanne Carmen, Don Sullivan, Pete Dunn, Joseph La Cava, Wayne Berwick","The monster, which looks like a snarling """"Creature from the Black Lagoon,"""" invades a sleepy seaside town. The lighthouse keeper, newly widowed and estranged from the town folk, has been ...",5.4,684,"","","",,35,40,5.4,82.859101525674,540
tt0052194,La vera storia di Lucky Welsh,Showdown at Boot Hill,1958,1958-05-01,Western,71,USA,English,Gene Fowler Jr.,Louis Vittes,Regal Films,"Charles Bronson, Robert Hutton, John Carradine, Carole Mathews, Fintan Meyler, Paul Maxey, Thomas Browne Henry, William Stevens, Martin Smith, Joe McGuinn, George Douglas, Mike Mason, George Pembroke, Argentina Brunetti, Ed Wright","A deputy marshal kills a murderer in a town that loved him, and when no one is willing to identify him, he can't collect any reward.",6.4,378,"","","",,14,15,6.4,87.5189253308661,640
tt0052228,Space Master X-7,Space Master X-7,1958,1958-06-01,"Horror, Sci-Fi, Thriller",71,USA,English,Edward Bernds,"George Worthing Yates, Daniel Mainwaring",Regal Films,"Bill Williams, Lyn Thomas, Robert Ellis, Paul Frees, Rhoda Williams, Joan Barry, Carol Varga, Thomas Browne Henry, Thomas Wilde, Fred Sherman, Gregg Martell, Jess Kirkpatrick, Court Shepard, Moe Howard, Al Baffert","A fungus brought from space threatens to grow and spread, devouring everyone in its path.",5.3,342,$ 125000,"","",,26,8,5.3,71.9821022010187,530
tt0053156,Paracadutisti d'assalto,Paratroop Command,1959,1959-02-01,"Drama, War",71,USA,English,William Witney,Stanley Shpetner,Santa Rosa Productions,"Richard Bakalyan, Ken Lynch, Jack Hogan, Jimmy Murphy, Jeff Morris, James Beck, Carolyn Hughes, Patricia Huston, Paul Busch, Sydney Lassick, Brad Trumbull",A squad member of the U.S. Paratroop unit in WWII accidently shoots one of his unit. Over the forthcoming months there is some anamosity against him as they battle their way across Italy.,5.3,176,"","","",,9,4,5.3,73.4274672082914,530
tt0053418,Il sindacato del vizio,Vice Raid,1959,1959-12-01,"Crime, Drama",71,USA,English,Edward L. Cahn,Charles Ellis,Edward Small Productions,"Mamie Van Doren, Richard Coogan, Brad Dexter, Barry Atwater, Carol Nugent, Frank Gerstle, Joseph Sullivan, Chris Alcaide, Shepherd Sanders, George Cisar, Nestor Paiva",The bosses of the prostitution racket have one of their prostitutes go to New York City to entrap a police officer and get him thrown off the force. She does as she is told but then the gangsters make a mistake.,5.5,263,"","","",,9,11,5.5,82.6079820091274,550
tt0054017,L'ultima donna sulla Terra,Last Woman on Earth,1960,1960-08-05,"Drama, Horror, Mystery",71,USA,English,Roger Corman,Robert Towne,"","Betsy Jones-Moreland, Antony Carbone, Robert Towne","Ev, along with her husband, Harold, and their lawyer friend Martin, are scuba diving while on vacation in Puerto Rico. When they resurface, they gradually conclude that an unexplained, ...",4.8,1719,"","","",,56,32,4.8,63.3913687307493,480
tt0054350,Subete ga kurutteru,Subete ga kurutteru,1960,1960-10-08,"Action, Crime",71,Japan,Japanese,Seijun Suzuki,"Seiji Hoshikawa, Akira Ichijo",Nikkatsu,"Tamio Kawaji, Yoshiko Nezu, Sayuri Yoshinaga, Shinako Nakagawa, Shinsuke Ashida, Tomoko Naraoka, Kotoe Hatsui, Chikako Miyagi, Takanobu Hozumi, Kôichi Uenoyama, Shirô Yanase, Shigerô Hayashi, Teruaki Toki, Masaru Yamamoto, Kyôsuke Sawai","The young rebel Jiro has to deal with an environment of crime and prostitution, and the impact of its choices on personal relationships: one with his mother, with the lover of the latter and with a girl in love with him.",6.9,274,"","","",,6,9,6.9,95.077644152989,690
tt0054793,The Dead One,The Dead One,1961,1961,Horror,71,USA,English,Barry Mahon,Barry Mahon,Mardi Gras Productions Inc.,"John McKay, Linda Ormond, Monica Davis, Clyde Kelly, Darlene Myrick, Lacey Kelly, Paula Morris, Robert Henderson, Wilson Scott, Joe Burton, The Joe Burton Trio, Joe Jones' Orchestra, George Trussell, Jean Wade, Herman Alfonso",A voodoo priestess sends out zombies to bring back live victims for her sacrificial rituals.,3.3,182,"","","",,13,10,3.3,45.9399472805453,330
tt0054878,Cinque pistole,Five Guns to Tombstone,1960,1961-01-07,"Action, Crime, Romance",71,USA,English,Edward L. Cahn,"Richard Schayer, Jack DeWitt",Robert E. Kent Productions,"James Brown, John Wilder, Walter Coy, Robert Karnes, Della Sharman, Gregg Palmer, Willis Bouchey, Joe Haworth, Quentin Sondergaard, Boyd 'Red' Morgan, Jon Locke, John Eldredge","Matt Wade escapes from prison and tries to persuade his brother Bill, a reformed gunslinger, to participate in a hold-up. Billy refuses but Matt frames him and he is forced to ride off with...",5,111,"","","",,7,2,5,72.3675666923106,500
tt0054881,Flight That Disappeared,Flight That Disappeared,1961,1961-09-01,"Adventure, Fantasy, Sci-Fi",71,USA,English,Reginald Le Borg,"Ralph Hart, Judith Hart",Harvard Film,"Craig Hill, Paula Raymond, Dayton Lummis, Gregory Morton, Harvey Stephens, John Bryant, Nancy Hale, Addison Richards, Brad Trumbull, Bernadette Hale, Meg Wyllie, Roy Engel","A cross-country airliner, whose passengers include a nuclear physicist, a rocket expert, and a mathematical genius, is drawn beyond radar range by an unknown, unbreakable force.",5.6,426,"","","",,19,8,5.6,79.865004044732,560
tt0055247,Colpo sensazionale,Offbeat,1961,1961,Crime,71,UK,English,Cliff Owen,"Peter Barnes, Peter Barnes",Northiam Films Limited,"William Sylvester, Mai Zetterling, John Meillon, Anthony Dawson, Neil McCarthy, Harry Baird, John Phillips, Victor Brooks, Joseph Fürst, Diana King, Gerard Heinz, Nan Munro, Ronald Adam, Anthony Baird, Neil Wilson",An MI5 officer goes undercover to catch a gang of criminals.,6.7,111,"","","",,5,3,6.7,99.1551380803281,670
tt0055452,The Sinister Urge,The Sinister Urge,1960,1960-12-08,"Crime, Drama, Thriller",71,USA,English,Edward D. Wood Jr.,Edward D. Wood Jr.,Headliner Productions,"Kenne Duncan, Duke Moore, Jean Fontaine, Carl Anthony, Dino Fantini, Jeanne Willardson, Harvey B. Dunn, Reed Howes, Fred Mason, Vic McGee, Harry Keaton, Conrad Brooks",A flunky for a porno movie ring starts murdering the smut films' lead actresses.,2.7,1357,$ 20152,"","",,30,20,2.7,41.6853792812358,270
tt0055902,The Devil's Hand,The Devil's Hand,1961,1961-09-13,Horror,71,USA,English,William J. Hole Jr.,Jo Heims,Rex Carlton Productions,"Linda Christian, Robert Alda, Ariadne Welter, Neil Hamilton, Gere Craft, Jeanne Carmen, Julie Scott, Diane Spears, Gertrude Astor, Bruno VeSota, Dick Lee, Jim Knight, Coleen Vico, Roy Wright, Romona Ravez","A man is haunted by visions of a beautiful woman. When he finally meets her, he winds up involved in a Satanic cult.",4.6,1073,"","","",,51,28,4.6,64.0571198207003,460
tt0056144,Kiru,Kiru,1962,1962-07-01,"Action, Drama",71,Japan,Japanese,Kenji Misumi,"Renzaburô Shibata, Kaneto Shindô","","Raizô Ichikawa, Shiho Fujimura, Mayumi Nagisa, Masayo Banri, Jun'ichirô Narita, Matasaburô Niwa, Teru Tomota, Eijirô Yanagi, Shigeru Amachi, Yoshio Inaba, Toshio Chiba, Shinjirô Asano, Toshio Hosokawa, Shôzô Nanbu, Seishirô Hara",A samurai seeks revenge and redemption after his family is executed by a rival clan.,7.1,347,"","","",,5,8,7.1,95.2131707894386,710
tt0056415,Ring of Terror,Ring of Terror,1961,1962-02-01,"Drama, Horror",71,USA,English,Clark L. Paylow,"Lewis Simeon, Lewis Simeon",Playstar,"George E. Mather, Austin Green, Esther Furst, Norman Ollestad, Lomax Study, Pamela Raymond, Jerry Zinnamon, Joseph Conway, June Smaney, Ed Erwin, Ann Morgan, Tom Brandt, Hal Hoover, Charles G. Martin, Ollie O'Toole",A group of medical students undertake some silly and frightening endeavors in order to pledge a fraternity.,1.8,1128,"","","",,47,14,1.8,26.5208390568683,180
tt0059541,One Shocking Moment,One Shocking Moment,1965,1965-07-23,Drama,71,USA,English,Ted V. Mikels,Ted V. Mikels,Mark Brown Productions,"Gary Kent, Lee Anna, Verné Martine, Maureen Gaffney, Jerry Fitzpatrick, Victor Izay, Dominic Levi, Shirl Simmons, Robin Willas, Marie Moore, Dick Bing, Zenobia","Hunky businessman Cliff and his sweet wife Mindy move from Grand Rapids, Michigan to Los Angeles, California. They take up residence in an apartment complex where several lovely young ...",4.8,196,"","","",,5,4,4.8,72.3262764004628,480
tt0059650,The Return of Mr. Moto,The Return of Mr. Moto,1965,1965-10-18,"Crime, Drama, Mystery",71,UK,English,Ernest Morris,Fred Eggers,Lippert Films,"Henry Silva, Terence Longdon, Suzanne Lloyd, Marne Maitland, Martin Wyldeck, Brian Coburn, Stanley Morgan, Peter Zander, Harold Kasket, Anthony Booth, Gordon Tanner, Henry Gilbert, Richard Evans, Denis Holmes, Ian Fleming",Mr. Moto goes undercover to find out who has been blowing up oil wells and trying to gain total control of all the oil leases from a petroleum-rich Middle Eastern country.,6.1,179,"","","",,10,5,6.1,79.8977124706995,610
tt0059762,Stryapukha,Stryapukha,1966,1966-05-23,"Comedy, Romance",71,Soviet Union,Russian,Edmond Keosayan,"Anatoli Sofronov, Anatoli Sofronov",Mosfilm,"Svetlana Svetlichnaya, Lyudmila Khityaeva, Inna Churikova, Konstantin Sorokin, Georgiy Yumatov, Ivan Savkin, Lyudmila Marchenko, Vladimir Vysotskiy, Zoya Fyodorova, Sergey Filippov, Valeriy Nosik, Eduard Abalov, Valentina Berezutskaya, Lyudmila Karaush, Vladimir Kolokoltsev","In one of the Kuban collective farms a new cook appeared. Many began to look after her, but the girl was not a timid and quickly repulsed hapless suitors.",6.4,126,"","","",,,,6.4,92.3436861054637,640
tt0060111,"Another Day, Another Man","Another Day, Another Man",1966,1966-10-19,Drama,71,USA,English,Doris Wishman,Doris Wishman,Juri Productions,"Agustin Mayor, Barbara Kemp, Sam Stewart, Mary O'Hara, Bob Oran, Darlene Bennett, John B. Brandt, Dawn Bennett","A young couple move into an expensive new apartment after the husband gets a big pay raise. Unfortunately, he is soon stricken with a mysterious ailment and becomes bedridden. The wife, ...",5.2,183,"","","",,5,10,5.2,73.8627413265081,520
tt0060543,Intimní osvetlení,Intimní osvetlení,1965,1965-04-08,"Comedy, Drama, Music",71,Czechoslovakia,Czech,Ivan Passer,"Jaroslav Papousek, Ivan Passer",Ceskoslovenský Státní Film,"Zdenek Bezusek, Karel Blazek, Miroslav Cvrk, Vera Kresadlová, Dagmar Redinová, Jaroslava Stedra, Karel Uhlík, Vlastimila Vlková, Jan Vostrcil","One of the most important images of the Czech New Wave 60s, which was ranked among the top ten domestic films of all time. Feature debut screenwriter and director Ivan Passer is currently ...",7.3,1228,"","","",,4,26,7.3,97.1147604483325,730
tt0060718,Mucedníci lásky,Mucedníci lásky,1967,1967-04-21,"Comedy, Fantasy, Music",71,Czechoslovakia,Czech,Jan Nemec,"Ester Krumbachová, Jan Nemec",Filmové studio Barrandov,"Lindsay Anderson, Jaroslav Bota, Alena Cepková, Jitka Cerhová, Denisa Dvoráková, Libor Fára, Karel Gott, Jirina Jandová, Marta Kadlecíková, Ivana Karbanová, Jan Klusák, Josef Konícek, Petr Kopriva, Hana Kuberová, Marta Kubisová","A series of loosely connected shorts comprised of three tales representing different aspects of love: temptation, dreams, and adventure.",6.7,144,"","","",,,3,6.7,94.4558345116885,670
tt0061029,Happy End,Happy End,1967,1967,"Comedy, Crime",71,Czechoslovakia,Czech,Oldrich Lipský,"Oldrich Lipský, Oldrich Lipský",Filmové studio Barrandov,"Vladimír Mensík, Jaroslava Obermaierová, Josef Abrhám, Bohus Záhorský, Stella Zázvorková, Jaroslav Stercl, Helena Ruzicková, Josef Hlinomaz, Martin Ruzek, Jirí Steimar, Bedrich Prokos, Mirko Musil, Lena Birková, Ilona Bradácová, Lubomír Bryg","A dark comedy about a murder and its consequences presented in a backwards manner, where death is actually a rebirth. The film starts with an """"execution"""" of the main protagonist and goes ...",8,998,"","","",,6,16,8,114.254096752977,800
tt0062973,"Marinai in guardia, amanti gementi!","Finders Keepers, Lovers Weepers!",1968,1969-08-28,"Crime, Drama",71,USA,English,Russ Meyer,"Richard Zachary, Russ Meyer",Eve Productions,"Anne Chapman, Paul Lockwood, Gordon Wescourt, Duncan McLeod, Robert Rudelson, Lavelle Roby, Jan Sinclair, Joey DuPrez, Pamela Collins, John Furlong, Nick Wolcuff, Vickie Roberts, Michael Roberts","Paul, the owner of a topless go-go bar on the Sunset Strip, isn't having a good day. His girlfriend, unbeknownst to him, is planning to rob his club, and his wife is having an affair with the hunky bartender.",5.5,462,$ 82000,"","",,4,12,5.5,71.0930334939427,550
tt0063371,La festa e gli invitati,O slavnosti a hostech,1966,1968-09-11,"Comedy, Drama",71,Czechoslovakia,Czech,Jan Nemec,"Ester Krumbachová, Ester Krumbachová",Filmové studio Barrandov,"Ivan Vyskocil, Jan Klusák, Jiri Nemec, Pavel Bosek, Karel Mares, Evald Schorm, Jana Pracharová, Zdena Skvorecka, Milon Novotny, Helena Pejsková, Dana Nemcova, Antonin Prazak, Josef Skvorecký, Adolf Siroký, Václav Vodák","A small group of adult bourgeois friends are on a day outing in the country, that outing which includes having a picnic. While they are going for a walk after the picnic, they encounter a ...",7.2,1365,"","","",,9,25,7.2,98.5536164079711,720
tt0064160,"Cherry, Harry & Raquel!","Cherry, Harry & Raquel!",1969,1972,"Action, Comedy",71,USA,English,Russ Meyer,"Russ Meyer, Tom McGowan",Eve Productions,"Larissa Ely, Linda Ashton, Charles Napier, Bert Santos, Frank Bolger, Uschi Digard, Michelle Grand, John Milo, Michaelani, Robert Aiken, John Koester, Daniel Roberts","In a small border town, a sheriff and his 'associate' who are involved in an operation in which they divert marijuana through the border, must kill another smuggler who has gone into business for himself.",5.5,1087,$ 90000,"","",,13,15,5.5,75.8717279745115,550
tt0067012,Dornröschen,Dornröschen,1971,1971-03-26,"Family, Fantasy",71,East Germany,German,Walter Beck,"Jacob Grimm, Wilhelm Grimm",Deutsche Film (DEFA),"Juliane Korén, Vera Oelschlegel, Helmut Schreiber, Burkhard Mann, Martin Hellberg, Angela Brunner, Sonja Hörbing, Brigitte Krause, Barbara Dittus, Evamaria Heyse, Fritz Decho, Dieter Wien, Thomas Langhoff, Jaecki Schwarz, Jörg Knochée","The King and Queen plan an opulent feast to celebrate the birth of their long-awaited child, Dornröschen. They invite not only the members of the court, but also the fairies, so that they ...",5.9,110,"","","",,2,,5.9,82.9575997623439,590
tt0072270,The Devil in Miss Jonas,Der Teufel in Miss Jonas,1974,1974-03-29,"Horror, Mystery",71,Switzerland,German,Erwin C. Dietrich,"Erwin C. Dietrich, Erwin C. Dietrich",Elite Film,"Christa Free, Marianne Dupont, Herbert Fux, Michel Jacot, Jürg Coray, Roman Huber","Miss Jonas, prone to a decadent life, has been sentenced to death. In Hell, she is told she's three days early and therefore sent back to life. Her friends are confused but expecting Hell anyway, she's determined to really deserve it.",4.7,114,"","","",,3,10,4.7,65.0347976992113,470
tt0077964,My Way Home,My Way Home,1978,1982-10-01,"Biography, Drama",71,UK,English,Bill Douglas,Bill Douglas,British Film Institute (BFI),"Stephen Archibald, Paul Kermack, Jessie Combe, William Carrol, Morag McNee, Lennox Milne, Gerald James, Andrew, John Young, Ian Spowart, Sheila Scott, Rebecca Haddick, Archie, Joseph Blatchley, Radir","Jamie leaves the children's home to live with his paternal grandmother. After working in a mine and in a tailor's shop, he is conscripted into the RAF, and goes to Egypt, where he is ...",7.5,664,"","","",,3,11,7.5,106.975947912724,750
