imdb_title_id,title,original_title,year,date_published,genre,duration,country,language,director,writer,production_company,actors,description,avg_vote,votes,budget,usa_gross_income,worlwide_gross_income,metascore,reviews_from_users,reviews_from_critics,avg_vote_10,avg_vote_100,avg_vote_1000
tt2464812,Licks,Licks,2013,2016-02-02,Drama,113,USA,English,Jonathan Singer-Vine,"Jonathan Singer-Vine, Jonathan Singer-Vine","","Stanley Doe Hunt, Koran Streets, Les Aderibigbe, Devon Libran, Tatiana Monet, Bennie Bell, Sabrina J Corbett, Thomas Dalby, Theresa Anderson Downs, Skipper Elekwachi, Dominique Jackson, Kizzmett Pringle, William Pulliam, Jon Jerrell Stallings, Jonathon Jerrell-Yasir Stallings","'LICKS' follows the story of a young man, D, as he returns to his Oakland neighborhood after two years served in prison for a botched robbery. In the days after his release, we are taken ...",6.5,351,"","","",,3,1,6.5,90.4729792150069,650
tt2491500,L'ultima ruota del carro,L'ultima ruota del carro,2013,2013-11-14,"Comedy, Drama",113,Italy,Italian,Giovanni Veronesi,"Filippo Bologna, Ugo Chiti",Fandango,"Elio Germano, Alessandra Mastronardi, Ricky Memphis, Sergio Rubini, Virginia Raffaele, Alessandro Haber, Francesca Antonelli, Maurizio Battista, Francesca d'Aloja, Elena Di Cioccio, Luis Molteni, Ubaldo Pantani, Dalila Di Lazzaro, Massimo Wertmüller, Francesca De Martini","The life of a sub-proletarian boy in Rome through the Seventies and Eighties, choosing his own path with his lifetimes friends and family.",6.4,631,"","",$ 2664483,,1,8,6.4,88.624963640048,640
tt2512170,Kenau,Kenau,2014,2014-03-06,"Action, Adventure, Drama",113,"Netherlands, Hungary, Belgium","Dutch, French, Spanish",Maarten Treurniet,"Marnie Blok, Karin van Holst Pellekaan",Fu Works,"Barry Atsma, Sallie Harmsen, Lisa Smit, Monic Hendrickx, Peter Van den Begin, Attila C. Arpa, Sophie van Winden, Matthijs van de Sande Bakhuyzen, Antoin Cox, Gabi Fon, Jaap Spijkers, Thomas Ryckewaert, Steven van Watermeulen, Simon Nader, Bert Luppes","While she fights a heroic battle against the Spanish besieger with her female army, Kenau, driven by hate and sorrow of the execution of her youngest daughter, is threatened to also lose ...",6.5,1431,EUR 6000000,"",$ 581801,,6,14,6.5,90.4318694836113,650
tt2513074,Billy Lynn: Un giorno da eroe,Billy Lynn's Long Halftime Walk,2016,2017-02-02,"Action, Drama, Sport",113,"UK, China, USA",English,Ang Lee,"Ben Fountain, Jean-Christophe Castelli",Bona Film Group,"Joe Alwyn, Garrett Hedlund, Arturo Castro, Mason Lee, Astro, Beau Knapp, Ismael Cruz Cordova, Barney Harris, Vin Diesel, Steve Martin, Chris Tucker, Kristen Stewart, Makenzie Leigh, Ben Platt, Bruce McKinnon","19-year-old Billy Lynn is brought home for a victory tour after a harrowing Iraq battle. Through flashbacks, the film shows what really happened to his squad - contrasting the realities of war with America's perceptions.",6.2,20742,$ 40000000,$ 1738477,$ 30930984,53,113,180,6.2,85.5190381745429,620
tt2528814,God's Not Dead - Dio non è morto,God's Not Dead,2014,2016-02-25,Drama,113,USA,English,Harold Cronk,"Hunter Dennis, Chuck Konzelman",Pure Flix Productions,"Kevin Sorbo, Shane Harper, David A.R. White, Dean Cain, Willie Robertson, Korie Robertson, Hadeel Sittu, Paul Kwo, Trisha LaFache, Cory Oliver, Benjamin A. Onyango, Marco Khan, Cassidy Gifford, Jesse Wang, Lenore Banks","College philosophy professor Mr. Radisson's curriculum is challenged by his new student, Josh, who believes God exists.",4.7,39834,$ 2000000,$ 60755732,$ 64676349,16,721,57,4.7,63.2935051096282,470
tt2543472,Wonder,Wonder,2017,2017-12-21,"Drama, Family",113,"USA, Hong Kong, Canada",English,Stephen Chbosky,"Stephen Chbosky, Steve Conrad",Lionsgate,"Jacob Tremblay, Owen Wilson, Izabela Vidovic, Julia Roberts, Mark Dozlaw, Rukiya Bernard, Jennifer March, Mandy Patinkin, Noah Jupe, Bryce Gheisar, Elle McKinnon, Daveed Diggs, Ty Consiglio, Kyle Breitkopf, James A Hughes","Based on the New York Times bestseller, this movie tells the incredibly inspiring and heartwarming story of August Pullman, a boy with facial differences who enters the fifth grade, attending a mainstream elementary school for the first time.",8,134456,$ 20000000,$ 132422809,$ 323253714,66,464,235,8,105.295822113064,800
tt2567026,Alice attraverso lo specchio,Alice Through the Looking Glass,2016,2016-05-25,"Adventure, Family, Fantasy",113,"USA, UK",English,James Bobin,"Linda Woolverton, Lewis Carroll",Walt Disney Pictures,"Johnny Depp, Mia Wasikowska, Helena Bonham Carter, Anne Hathaway, Sacha Baron Cohen, Rhys Ifans, Matt Lucas, Lindsay Duncan, Leo Bill, Geraldine James, Andrew Scott, Richard Armitage, Ed Speleers, Alan Rickman, Timothy Spall",Alice returns to the whimsical world of Wonderland and travels back in time to help the Mad Hatter.,6.2,89612,$ 170000000,$ 77041381,$ 299457024,34,231,274,6.2,86.1744583912841,620
tt2582576,Castello di sabbia,Sand Castle,2017,2017-04-21,"Action, Drama, War",113,USA,"English, Arabic",Fernando Coimbra,Chris Roessner,The Mark Gordon Company,"Henry Cavill, Nicholas Hoult, Logan Marshall-Green, Tommy Flanagan, Glen Powell, Navid Negahban, Beau Knapp, Neil Brown Jr., Parker Sawyers, Anthony Welsh, Sam Spruell, Sope Dirisu, Gonzalo Menendez, Nabil Elouahabi, Sammy Sheik","The story follows a young soldier, and his introduction into the 2003 invasion of Iraq. Based on true events, it bears witness to the destruction, and horrors of war.",6.3,18409,"","","",45,63,26,6.3,87.3934327554523,630
tt2605454,Kharej ala el kanoun,Kharej ala el kanoun,2007,2007-11-11,"Crime, Drama",113,Egypt,Arabic,Ahmed Nader Galal,Belal Fadl,"","Karim Abdel Aziz, Magdy Edris, Hany El Sabagh, Hasan Husni, Maya Nasry",A guy whose father was an assisstant to a drug dealer who killed him . So when the guy when he grow up he worked with the same dealer . At the end he killed the dealer for his father .,6.2,1036,EGP 18000000,"",$ 366456,,,,6.2,82.6980722810106,620
tt2609222,Quai d'Orsay,Quai d'Orsay,2013,2013-11-06,Comedy,113,France,French,Bertrand Tavernier,"Antonin Baudry, Christophe Blain",Little Bear,"Thierry Lhermitte, Raphaël Personnaz, Niels Arestrup, Bruno Raffaelli, Julie Gayet, Anaïs Demoustier, Thomas Chabrol, Thierry Frémont, Alix Poisson, Marie Bunel, Jean-Marc Roulot, Sonia Rolland, Didier Bezace, Jane Birkin, Renaud Calvet","Alexandre Taillard de Vorms is tall and impressive, a man with style, attractive to women. He also happens to be the Minister of Foreign Affairs for the land of enlightenment: France. With ...",6.3,3140,"",$ 12027,$ 5586646,65,15,32,6.3,88.9912929819167,630
tt2631098,Nee Ko Nja Cha,Nee Ko Nja Cha,2013,2013-01-04,"Comedy, Romance",113,India,Malayalam,Gireesh,Gireesh,Urvashi Theaters,"Sunny Wayne, Praveen Anidil, Sanju Sivram, Shani Shaki, Sija Rose, Poojitha Menon, Rohini Idicula, Parvati Nair, Merin Mathew, Chinnu Kuruvila, Shammi Thilakan, Mithun Ramesh, Suraj Ramakrishnan, Damodar Prasad, Shameer Muhammed","Three friends travel to Goa as one of them broke up with his girlfriend. They meet two girls there, become friends, but soon get into trouble.",4.2,152,"","","",,3,,4.2,55.9808490156533,420
tt2729142,Aborto,Aborto,2013,2013-03-01,Drama,113,India,Bengali,Arindam Sil,"Samik Bandyopadhyay, Padmanabha Dasgupta",Cinemine Entertainment,"Barun Chanda, Abir Chatterjee, Jaya Ahsan, Tota Roy Chowdhury, Reshmi Ghosh, Saswata Chatterjee, Abhishek Bagchi, Sambaran Banerjee, Putul Bhattacharya, Sourasrita Bhattacharya, Bikash Bhowmick, Ranadeb Bose, Ritwick Chakraborty, Bably Chatterjee, Biplab Chatterjee","Aborto is a film which talks about the relentless pursuit of prominence in professional career, and the resulting alienation from loved ones in terms of sensitivity, feeling and emotion. ...",6.1,213,$ 500000,"","",,,,6.1,87.509227877888,610
tt2776074,Angélique,Angélique,2013,2013-12-18,"Adventure, History, Romance",113,"France, Belgium, Czech Republic, Austria",French,Ariel Zeitoun,"Nadia Golon, Philippe Blasband",A.J.O.Z. Films,"Nora Arnezeder, Gérard Lanvin, Tomer Sisley, David Kross, Simon Abkarian, Matthieu Boujenah, Miguel Herz-Kestranek, Julian Weigend, Rainer Frieb, Florence Coste, Michel Carliez, Mathieu Kassovitz, John Dobrynine, Fabrice Rodriguez, Patrick Descamps","In France, prior to Louis XIV ascending the throne, a young baroness is forced to marry against her will and is caught up in a web of treachery and murder, threatening her and her husband, whom she has come to love deeply.",6.2,1433,"","",$ 996304,,8,26,6.2,79.5753996862143,620
tt2827058,Mississippi Murder,Mississippi Murder,2017,2017-01-03,"Crime, Mystery, Thriller",113,USA,English,Price Hall,"Bill Badalato, Billy Badalato",Repertory Films,"Malcolm McDowell, Luke Goss, Bryan Batt, Kate Orsini, Andrew James Allen, Hani Furstenberg, Marco St. John, Thomas Francis Murphy, Jay Caputo, Philip Fornah, Derek Anthony, Christopher Emerson, Kelly Tippens, Michael Hartson","A murder mystery which takes place on the Mississippi Gulf Coast. A young woman tries to live a normal life, despite a horrible upbringing. She will learn her past will haunt her once more.",3.5,168,"","","",,2,,3.5,46.4850478218798,350
tt2884018,Macbeth,Macbeth,2015,2016-01-05,"Drama, History, War",113,"UK, France, USA",English,Justin Kurzel,"Todd Louiso, Jacob Koskoff",See-Saw Films,"Jack Madigan, Frank Madigan, Michael Fassbender, Marion Cotillard, Paddy Considine, Lochlann Harris, Kayla Fallon, Lynn Kennedy, Seylan Baxter, Amber Rissmann, Scot Greenan, Hilton McRae, David Thewlis, David Hayman, Jack Reynor","Macbeth, the Thane of Glamis, receives a prophecy from a trio of witches that one day he will become King of Scotland. Consumed by ambition and spurred to action by his wife, Macbeth murders his king and takes the throne for himself.",6.6,51991,$ 15000000,$ 1110707,$ 16322067,71,220,317,6.6,89.1168885960231,660
tt2907640,L.DK,L.DK,2014,2014-04-12,"Comedy, Drama, Romance",113,Japan,Japanese,Taisuke Kawamura,"Ayu Watanabe, Yûko Matsuda",Toei Company,"Kento Yamazaki, Ayame Gôriki, Ren Kiriyama, Takashi Fujii, Akiyoshi Nakao, Reiko Takashima, Anna Ishibashi, Miho Shiraishi, Seiji Fukushi, Wataru Kuriyama, Kokoro Terada, Rei Okamoto, Takeshi James Yamada, Chiharu Tomita, Shôhei Abe","Aoi lives in an apartment by herself. Shusei moves in next to Aoi's apartment. Shusei is a very popular student. Due to a mistake, Aoi makes the sprinkler go off in his room. Until his room is fixed, he stays with Aoi.",6.3,1047,JPY 200000000,"",$ 3758081,,4,2,6.3,88.2157628462772,630
tt2910300,Ah Boys to Men II,Ah Boys to Men II,2013,2013-02-01,Comedy,113,Singapore,"English, Chinese",Jack Neo,"",J Team Productions,"Tosh Zhang, Daniel Ang, Irene Ang, Vivek Arora, Ridhwan Azman, Fish Chaar, Sarah Chen, Tian Wen Chen, Charlie Goh, Steven Goh, Luke Lee, Wang Lei, Janson Lim, Maxi Lim, Hanrey Low",A bunch of mischievous recruits go through National Service in Singapore.,6.2,222,SGD 1500000,"",$ 7517054,,2,1,6.2,90.5406622801009,620
tt3014866,Criminal,Criminal,2016,2016-04-14,"Action, Sci-Fi, Thriller",113,"USA, UK, Bulgaria","English, French, Russian",Ariel Vromen,"Douglas Cook, David Weisberg",Summit Entertainment,"Kevin Costner, Gary Oldman, Tommy Lee Jones, Ryan Reynolds, Jordi Mollà, Gal Gadot, Michael Pitt, Amaury Nolasco, Alice Eve, Antje Traue, Scott Adkins, Lara Decaro, Freddy Bosche, Emmanuel Imani, Harry Hepple","In a last-ditch effort to stop a diabolical plot, a dead CIA operative's memories, secrets, and skills are implanted into a death-row inmate in hopes that he will complete the operative's mission.",6.3,57738,$ 31500000,$ 14708696,$ 38803993,36,218,173,6.3,92.6070178860866,630
tt3031896,Lakeer Ka Fakeer,Lakeer Ka Fakeer,2013,2013-06-14,Crime,113,India,Hindi,Zubair Khan,"","","Vicky Ahuja, Saaikat Bagbaan, Ajaz Khan, Maarisha","The film revolves around the lives of three friends-cum-petty crooks whose biggest crime is the fact that they reside in Mumbai's notorious area, where nefarious activities of the organized-crime syndicates take shape.",5.7,122,INR 10000000,"","",,1,,5.7,78.1163640940231,570
tt3075596,Bairro,Bairro,2013,2013-06-27,"Action, Crime, Drama",113,Portugal,Portuguese,"Jorge Cardoso, Lourenço de Mello","Francisco Moita Flores, Tiago Alvarez Marques",Plural Entertainment,"Maria João Bastos, Paulo Pires, Carloto Cotta, Afonso Pimentel, João Lagarto, Dânia Neto, Carlos Malvarez, Duarte Gomes, Leandro Pires, Sara Santos, Joana Timbal, Luís Gaspar, Rui Unas, Margarida Moreira, Julie Sergeant",The police tries to stop a gang of criminals responsible for several robberies in Lisbon.,5.6,272,"","","",,1,1,5.6,75.7224824740572,560
tt3086582,Xiao shi dai 2: Qing mu shi dai,Xiao shi dai 2: Qing mu shi dai,2013,2013-08-30,"Drama, Romance",113,China,Mandarin,Jingming Guo,Jingming Guo,Desen International Media,"Mi Yang, Amber Kuo, Kai Ko, Rhydian Vaughan, Bea Hayden Kuo, Yi-Lin Sie, Cheney Chen, Shiping Cao, Carolyn Chen, Chao Jiang, Qinyun Jiang, Chen Li, Xinlong Li, Aaron C. Shang, Kiwi Shang","Set four years after the first movie, Lin Xiao, Lily, Nan Xiang, and Ruby, confront opportunities and challenges as their school days come to an end.",3.3,978,CNY 25000000,$ 43788,$ 47289937,40,3,,3.3,45.3873045710339,330
tt3097966,Zoe.Misplaced,Zoe.Misplaced,2014,2014-02-15,"Comedy, Drama, Romance",113,Australia,English,Mekelle Mills,Mekelle Mills,Stylish Lullaby Productions,"Hannah Raven Smith, Clementine Mills, Harvey Zielinski, Ryan Bennett, John Manning, Annie Schofield, Isaro Kayitesi, Jeremy Burtenshaw, Linda Nicholls-Gidley, Scarlett Nicholls-Gidley, Angela Downing, Switch, Penny-Maree Fergus","Zoe's regimented life is thrown into upheaval when she unexpectedly falls in love. In doing so, she is faced with making a series of choices whose outcomes not only impact on her ...",5.1,103,AUD 8000,"","",,4,6,5.1,68.0654058088874,510
tt3100274,Manhattan Nocturne,Manhattan Nocturne,2016,2016-05-20,"Crime, Drama, Mystery",113,USA,English,Brian DeCubellis,"Brian DeCubellis, Colin Harrison",DeCubellis Films,"Adrien Brody, Yvonne Strahovski, Campbell Scott, Jennifer Beals, Steven Berkoff, Linda Lavin, Frank Deal, Stan Carp, Madison Elizabeth Lagares, Thomas Bair, Theis Weckesser, Alex Echevarria, Chinasa Ogbuagu, Jahni Brown, Karin Collison",A reporter becomes involved with a mysterious woman while investigating her late husband's death.,6.2,11392,"","",$ 184656,44,51,32,6.2,85.4278403108002,620
tt3121474,Daan san nam nui 2,Daan san nam nui 2,2014,2014-11-11,Romance,113,"Hong Kong, China","Mandarin, Cantonese",Johnnie To,"Ryker Chan, Ka-Fai Wai",Hairun Movies & TV Group,"Louis Koo, Yuanyuan Gao, Miriam Chin Wah Yeung, Vic Chou, Daniel Wu, Suet Lam, Aaron Chow, Man-Yin Ho, Kibby Lau, Vicky Liao, Mingze Liu, Chor-Lam Ma, Jingyao Yan","Two former lovers find themselves irresistibly drawn back together, despite the fact that each of them is engaged to someone else.",5.4,587,HKD 75000000,"",$ 33801759,,5,12,5.4,75.6373997198121,540
tt3127022,La casa dei libri,The Bookshop,2017,2018-09-27,Drama,113,"UK, Spain, Germany, France",English,Isabel Coixet,"Isabel Coixet, Penelope Fitzgerald",Diagonal TV,"Emily Mortimer, Bill Nighy, Hunter Tremayne, Honor Kneafsey, Michael Fitzgerald, Frances Barber, Reg Wilson, James Lance, Patricia Clarkson, Lucy Beckwith, Nigel O'Neill, Jorge Suquet, Harvey Bennett, Lana O'Kell, Adie Allen","England 1959. In a small East Anglian town, Florence Green decides, against polite but ruthless local opposition, to open a bookshop.",6.5,11710,$ 5400000,$ 1588150,$ 12055868,62,144,108,6.5,92.8047420965215,650
tt3142958,Su ve Ates,Su ve Ates,2013,2013-11-15,"Drama, Romance",113,Turkey,Turkish,Özcan Deniz,"Özcan Deniz, Avni Tuna Dilligil",Avsar Film,"Özcan Deniz, Yasemin Kay Allen, Kaan Çakir, Pelin Akil, Yusuf Akgün, Cem Uçan, Irem Candar, Burçin Birben, Burcu Kiratli, Sefika Tolun, Baris Yalçin, Sera Tokdemir, Açelya Elmas, Deniz Ali Cankorur, Metin Coskun","A pretty young girl falls for an enigmatic, shy man who sweeps her off her feet. She becomes pregnant but is not allowed to tell him. His advisers are adamant. Back home, they have set up a...",6.2,3868,"","",$ 5919180,,2,2,6.2,87.9724406759039,620
tt3144098,Dong-chang-saeng,Dong-chang-saeng,2013,2013-11-06,"Action, Drama",113,South Korea,Korean,Hong-soo Park,Soo-young Kim,CJ Entertainment,"Seung-Hyun Choi, Yeri Han, Je-mun Yun, Sung-ha Jo, Yoo-Jeong Kim, Ho-bin Jeong, Joo-sil Lee, Sun-kyung Kim, Min-seok Kwak, Ji-il Park, Sin-seong Lee, Min-Jae Kim, Yun-min Jeong, Ik-Hoon Jyeok, Gwang-jae Seo",The son of a North Korean spy decides to follow in his father's footsteps to protect his little sister.,6.7,2725,"",$ 76543,$ 6834802,36,11,31,6.7,91.997164068833,670
tt3219106,Inferno,Inferno,2014,2014-09-09,Drama,113,"Slovenia, Croatia, Republic of North Macedonia, Serbia",Slovenian,Vinko Moderndorfer,Vinko Moderndorfer,Delirium,"Marko Mandic, Medea Novak, Renato Jencek, Jernej Sugman, Jana Zupancic, Marko Bukvic, Lara Volavsek, Sebastian Cavazza, Silva Cusin, Marko Okorn, Silvo Bozic, Jozica Avbelj, Marinka Stern, Valter Dragan, Mirjam Korbar","The film focuses on a young unemployed working class family and their everyday struggle for survival. The family is like any ordinary European family, trying to make a living with the work ...",6.2,198,"","","",,2,7,6.2,88.0744653325845,620
tt3219194,Uncle John,Uncle John,2015,2015-09-18,"Crime, Drama, Mystery",113,USA,English,Steven Piet,"Erik Crary, Steven Piet","","John Ashton, Alex Moffat, Jenna Lyng Adams, Ronnie Gene Blevins, Cynthia Baker, Andy Cameron, Adria Dawn, Tim Decker, Don Forston, Janet Glimme, Gary Houston, Matt Kozlowski, Ashleigh LaThrop, Tawny Newsome, Ian Pfaff","In this tale of small town intrigue, an urbanite returns to his quiet hometown on an impromptu trip as his Uncle, widely respected in town, struggles to evade suspicion of a murder.",6.2,1619,"","","",56,24,18,6.2,82.4672525257924,620
tt3254752,Qalb el-Asad,Qalb el-Asad,2013,2013-10-10,Drama,113,Egypt,Arabic,Karim El Sobky,"","","Mohamed Elareef, Houria Farghally, Hasan Husni, Mohamad Ramadan","An action-thriller film about a small child being kidnapped and brought up behind the curtains of a circus among lions and tigers which made him strong hearted with a solid personality, and...",3.4,283,"","",$ 11328,,2,,3.4,44.9453713182333,340
tt3329774,Thira,Thira,2013,2013-11-14,Thriller,113,India,Malayalam,Vineeth Sreenivasan,Rakesh Mantodi,ReelsMagic,"Deepak Parambol, Shobana, Dhyan Sreenivasan","Rohini Pranab, a cardiac surgeon and a social worker, sets out to find the girls kidnapped from her NGO. She is joined by Naveen, who is looking for his kidnapped sister. The duo goes deeper into the human trafficking mafia in Karnataka.",7.3,867,"","",$ 5973,,10,3,7.3,103.234129656055,730
tt3351428,Stuk!,Stuk!,2014,2014-06-11,"Crime, Drama, Thriller",113,Netherlands,Dutch,Steven de Jong,"Judith Visser, Steven de Jong",Steven de Jong Producties,"Amin Ait Bihi, Mees Bink, Sanneke Bos, Yolanthe Cabau, Tatum Dagelet, Yldau de Boer, Steven de Jong, Wietske de Jong, Fleur de Lisle, Andre de Zee, Rosalinde den Outer, Henk Douwsma, Romke Gabe Draaijer, Nynke Faber, Nick Golterman","Elizabeth, a voluptuous, shy and unpopular girl, is the object of ridicule at school by the cool in-crowd. Her life spirals downward after the death of her only friend, her grandmother. But...",5,210,"","",$ 28839,,1,1,5,68.3842931538471,500
tt3397754,"10,000 Saints","10,000 Saints",2015,2015-08-14,"Comedy, Drama, Music",113,USA,English,"Shari Springer Berman, Robert Pulcini","Robert Pulcini, Shari Springer Berman",Archer Gray,"Henry Kelemen, Julianne Nicholson, Ethan Hawke, Asa Butterfield, Avan Jogia, Nadia Alexander, Hailee Steinfeld, Emily Mortimer, Austin Ramsey, Jeff O'Donnell, Matthew James Ballinger, Emile Hirsch, Tracy Westmoreland, Warren Kelly, Ellie Bensinger","Set in the 1980s, a teenager from Vermont moves to New York City to live with his father in East Village.",5.9,5240,"",$ 59333,"",62,21,33,5.9,82.8082396946493,590
tt3421616,Hana to hebi: Zero,Hana to hebi: Zero,2014,2014-05-17,Thriller,113,Japan,Japanese,Hajime Hashimoto,"Oniroku Dan, Takehiko Minato",Toei Company,"Maiko Amano, Noriko Hamada, Rina Sakuragi, Naoki Kawano, Yûichi Kimura, Hideo Sakaki, Daikichi Sugawara, Kanji Tsuda, Yuki Tsujimoto",Misaki Amemiya is an assistant inspector for the Metropolitan Police Department's Community Safety Bureau who becomes ensnared in a trap while investigating a mysterious illegal video ...,4.9,346,"","","",,2,1,4.9,62.4212306733288,490
tt3474788,An Bronntanas,An Bronntanas,2014,2014-03-08,"Action, Drama, Thriller",113,"UK, Ireland","English, Irish, Polish",Tom Collins,"Tom Collins, Eoin McNamee",De Facto Film and Video,"Michelle Beamish, Charlotte Bradley, Ciarán Charles, Lee Crowley, Dara Devaney, John Finn, Owen McDonnell, Pól Ó Griofa",A lifeboat crew discovers millions of euros worth of drugs on a fishing boat off the coast of Ireland.,7.2,452,GBP 2000000,"","",,,1,7.2,101.4087880924,720
tt3495000,Mardaani,Mardaani,2014,2014-08-22,"Action, Crime, Drama",113,India,Hindi,Pradeep Sarkar,"Gopi Puthran, Vibha Singh",Yash Raj Films,"Rani Mukerji, Tahir Raj Bhasin, Priyanka Sharma, Habib Al Aidroos, Mona Ambegaonkar, Gautam Babbar, Vishwa Bhanu, Probir Dutt, Anil George, Kinjal Jain, Rio Kapadia, Avneet Kaur, Peter Manuel, Peter Muxka Manuel, Sharika Raina","A story of Shivani Shivaji Roy, Crime Branch, who sets out to confront the mastermind behind a child trafficking mafia.",7.3,11316,"","",$ 183205,,65,32,7.3,101.538754258158,730
tt3520488,La regina della notte,Bamui Yeowang,2013,2013-10-17,"Comedy, Romance",113,South Korea,"English, Korean",Je-Yeong Kim,"Je-Yeong Kim, Jeong-gon Kim",Ivision Entertainment,"Jeong-myeong Cheon, Min-Jung Kim, Bo-reum Han, Jeong-su Han, Dae-han Ji, Sung-Ho Kang, Byeong-ok Kim, Gi-Bang Kim, Min Kim, Sung-Eun Kim, Dong-hwi Lee, Joo-won Lee, Mi-do Lee, Tae-boo Nam, Kang-min No","Nerdy Yeong-soo has married the perfect housewife Hee-joo. But at the reunion for his university class, the allure of winning a kimchi-fridge makes her dance a super-sexy show. Yeong-soo wonders if her past isn't as pristine as he thought.",5.8,254,"","",$ 1628465,,2,4,5.8,84.9397863667452,580
tt3544326,Sunsu-ui sidae,Sunsu-ui sidae,2015,2015-03-05,"Action, Drama, Romance",113,South Korea,Korean,Sang-hoon Ahn,Se-hee Kim,Fineworks,"Hyuk Jang, Ha-Neul Kang, Ha-kyun Shin, Han-na Kang, Sa Hee, Ju-bong Gi, Da-Ye Kim, Yoo-Bin Sung, Jae-Yong Lee, Gu-taek Kim, Han Seok-jun, Hyung-joo Moon, Sung Yu-bin, Kyung Heon Kang, Son Byong-ho","Kim Min-jae (Shin Ha-kyun), is a brilliant general who's distinguished himself by protecting the borders of the recently established Joseon dynasty. He keeps a close eye on Yi Bang-won (...",5.9,361,"",$ 10654,$ 3191168,,4,2,5.9,86.2708682442768,590
tt3582088,Tian mi sha ji,Tian mi sha ji,2014,2014-01-17,"Comedy, Crime, Romance",113,"Taiwan, China","",Yi-chi Lien,"Shang-Min Yu, Jia-Jhen Chen",Arrow Cinematic Group,"Alec Su, Ariel Lin, Hung Lei, Matt Chung-tien Wu, Tsu-Jun Lang, Ken Lin, Zhi-Ying Zhu, Meng-Chieh Kao, Po-Hung Lin, Ruby Lin, Kuo-Hung Li, Tsai-Hsing Chang, BeBe Du, Nien-Hsien Ma, Vincent Sang","Starting from a seemingly pointless case of a puppy's accidental death, from eating chocolate, the essentially incompatible pair unexpectedly digs up the clues to a series of mysterious deaths.",6.1,344,"","",$ 5707253,,,5,6.1,84.6574886317286,610
tt3589450,Mon-seu-teo,Mon-seu-teo,2014,2014-03-13,"Action, Drama, Thriller",113,South Korea,Korean,In-ho Hwang,In-ho Hwang,CJ E&M Film Financing & Investment Entertainment & Comics,"Min-ki Lee, Go-eun Kim, Seo-hyun Ahn, Jin-Woong Bae, Da-Eun Han, Bo-ra Kim, Bu-seon Kim, Roe-ha Kim, Sun-young Kim, Jin-Ha Yoon","Bok-Soon (KIM Go-Eun) runs a street stall while taking care of her younger sister. Bok-Soon may not be the brightest girl but what she lacks in intelligence, she makes up for in ...",6.4,946,"","",$ 3820199,,4,10,6.4,90.2755182596909,640
tt3613648,Belles familles,Belles familles,2015,2015-10-14,"Comedy, Drama, Romance",113,France,"French, English, Chinese",Jean-Paul Rappeneau,"Jean-Paul Rappeneau, Philippe Le Guay",ARP Sélection,"Mathieu Amalric, Marine Vacth, Gilles Lellouche, Nicole Garcia, Karin Viard, Guillaume de Tonquédec, André Dussollier, Gemma Chan, Claude Perron, Jean-Marie Winling, Yves Jacques, Noël Hamann, Olga Sokolow, Crispin Redman, Marie-Christine Orry","Jérôme Varenne, a French financier, lives and works in Shanghai with Chen-Li, his life and business partner. One day, during a short stay in Paris, while paying a call to his mother, he is ...",5.7,838,EUR 8000000,"",$ 3424810,,5,24,5.7,80.6999260029728,570
tt3645014,The Xpose,The Xpose,2014,2014-05-16,"Mystery, Thriller",113,India,Hindi,Ananth Narayan Mahadevan,"Himesh Reshammiya, Jainesh Ejardar",H.R. Musik,"Himesh Reshammiya, Yo Yo Honey Singh, Irrfan Khan, Zoya Afroz, Sonali Raut, Adil Hussain, Ananth Narayan Mahadevan, Manish Bharati, Blake Curtis-Woodcock, Bharat Dabholkar, Kanika Dang, Ashwin Dhar, Daya Shankar Pandey, Jesse Randhawa, Rajesh Sharma","This is a dramatic chain of events in the most glamorous ,swinging era of Hindi films... the 1960s. It was a decade when film stars tasted success and carried their larger than life screen ...",3.2,1470,"","","",,21,14,3.2,45.2013408178374,320
