imdb_title_id,title,original_title,year,date_published,genre,duration,country,language,director,writer,production_company,actors,description,avg_vote,votes,budget,usa_gross_income,worlwide_gross_income,metascore,reviews_from_users,reviews_from_critics,avg_vote_10,avg_vote_100,avg_vote_1000
tt0081520,Sir Henry at Rawlinson End,Sir Henry at Rawlinson End,1980,1980-10-01,Comedy,71,UK,English,Steve Roberts,"Vivian Stanshall, Steve Roberts",Charisma Films,"Trevor Howard, Patrick Magee, Denise Coffey, J.G. Devlin, Harry Fowler, Sheila Reid, Vivian Stanshall, Suzanne Danielle, Daniel Gerroll, Ben Aris, Liz Smith, Jeremy Child, Susan Porrett, Gary Waldhorn, Simon Jones","The very eccentric English peer Sir Henry Rawlinson attempts, with the help of his mad family & servants, to exorcise the ghost of his brother Humbert.",6.9,377,"","","",,18,5,6.9,93.2117764771904,690
tt0093608,Nekromantik,Nekromantik,1987,1987,Horror,71,West Germany,German,Jörg Buttgereit,"Jörg Buttgereit, Franz Rodenkirchen",Jelinski & Buttgereit,"Bernd Daktari Lorenz, Beatrice Manowski, Harald Lundt, Collosseo, Henri Boeck, Clemens Schwender, Jörg Buttgereit, Holger Suhr, Volker Hauptvogel, Harald Weis, Heike Surban, Patricia Leipold, Elke Fuchs, Margit Im Schlaa, Suza Kohlstedt","A street sweeper who cleans up after grisly accidents brings home a full corpse for him and his wife to enjoy sexually, but is dismayed to see that his wife prefers the corpse over him.",5.1,8205,"","","",,99,95,5.1,72.494910409574,510
tt0095643,Mirai Ninja: Keiun Kinin Gaiden,Mirai Ninja: Keiun Kinin Gaiden,1988,1988-05-01,"Action, Fantasy, Sci-Fi",71,Japan,Japanese,Keita Amemiya,"Satoshi Kitahara, Satoshi Kitahara",Gaga Communications,"Hanbei Kawai, Kunihiko Ida, Eri Morishita, Makoto Yokoyama, Satoshi Itô, Fuyukichi Maki, Masaaki Emori, Shôhei Yamamoto, Mizuho Yoshida, Hiroaki Mita, Hideki Sasaki, Chikara Aragaki, Kiichirou Tai, Hajime Iwasaki, Satou Anada","In a futuristic version of medieval Japan, a band of swordsmen battles an evil warlord and his mechanical army of ninjas, and are aided by a mysterious heroic cyborg ninja, Shiranui.",6.4,257,"","","",,9,21,6.4,85.1038540461977,640
tt0098700,Za prekrasnykh dam!,Za prekrasnykh dam!,1989,1989,"Comedy, Crime",71,Soviet Union,Russian,Anatoly Eyramdzhan,Anatoly Eyramdzhan,Fora Film,"Aleksandr Pankratov-Chyornyy, Aleksandr Abdulov, Elena Tsyplakova, Irina Shmeleva, Irina Rozanova, Margarita Sergeyecheva, Sergey Stepanchenko, Lena Zhanik","",5.7,122,"","","",,,,5.7,81.3851773895563,570
tt0100694,Sto dney do prikaza,Sto dney do prikaza,1991,1991-02-01,Drama,71,"Russia, Soviet Union",Russian,Hussein Erkenov,"Vladimir Kholodov, Yuri Polyakov",Gorky Film Studios,"Vladimir Zamanskiy, Armen Dzhigarkhanyan, Oleg Vasilkov, Roman Grekov, Valeriy Troshin, Aleksandr Chislov, Mikhail Solomatin, Sergei Romantsov, Sergey Bystritskiy, Elena Kondulaynen, Oleg Khusainov, Sergey Semyonov, Aleksey Volkov, Vladimir Puchkov, Pavel Stepanov",Five young Soviet Army recruits struggle for survival against the merciless violence that surrounds them on a daily basis. Their only means of saving their dignity is by preserving the ...,5.3,377,"","","",,12,3,5.3,76.6666915091078,530
tt0107745,C'era una volta nella foresta,Once Upon a Forest,1993,1993-06-18,"Animation, Adventure, Drama",71,"UK, USA, Taiwan, Spain, Canada, Denmark, Argentina, China",English,Charles Grosvenor,"Rae Lambert, Mark Young",Hanna-Barbera Productions,"Michael Crawford, Ben Vereen, Ellen Blain, Benji Gregory, Paige Gosney, Elisabeth Moss, Paul Eiding, Janet Waldo, Susan Silo, Will Estes, Charlie Adler, Rickey D'Shon Collins, Angel Harper, Don Reed, Robert David Hall","A young mouse, mole and hedgehog risk their lives to find a cure for their badger friend, who's been poisoned by men.",6.5,4935,$ 13000000,$ 6582052,$ 6582052,,33,12,6.5,86.4894442889086,650
tt0112274,Aberne og det hemmelige våben,Aberne og det hemmelige våben,1995,1995-02-03,Animation,71,Denmark,Danish,Jannik Hastrup,Bent Haller,Dansk Tegnefilm,"Otto Brandenburg, Sofie Bredesen, Lisbet Dahl, Anne Marie Helger, Bendt Hildebrandt, Hektor Bjoljahn Hougaard, Cecilie Hastrup Karshøj, Tommy Kenter, Jesper Klein, Kirsten Lehfeldt, Per Pallesen, Claus Ryskjær, Kasper Fønns Stilling, Barbara Topsøe-Rothenborg, Bodil Udsen","When Hector and Elvira, a pair of young monkeys from two opposing families, fall in love, Elvira comes into possession of a secret weapon, war breaks out among the families and only she can choose between power and love.",6.2,168,"","","",,1,,6.2,83.9828091468385,620
tt0122027,Convict Stage,Convict Stage,1965,1965-06-17,Western,71,USA,English,Lesley Selander,"Don 'Red' Barry, Daniel Mainwaring",Steve Productions,"Harry Lauter, Don 'Red' Barry, Jodi Mitchell, Hanna Landy, Joe Patridge, Eric Matthews, Walter Reed, Michael Carr, Fred Krone, George Sawaya, Karl MacDonald","Ben has been after the Sims brothers since they gunned down his sister. His wife, threatening to leave him, sees his chance to get her back and get his revenge when the brothers are ...",5.1,117,"","","",,5,,5.1,75.0791724339414,510
tt0122072,Un killer per lo sceriffo,The Forty-Niners,1954,1954-05-04,"Action, Adventure, Drama",71,USA,English,Thomas Carr,Daniel B. Ullman,Westwood Productions,"Bill Elliott, Virginia Grey, Harry Morgan, John Doucette, Lane Bradford, I. Stanford Jolley, Harry Lauter, Earle Hodgins, Dean Cromer, Ralph Sanford","During California's gold-rush, an undercover marshal, posing as a gunfighter, investigates the murder of another marshal who had been assigned to the region.",6.1,128,"","","",,7,3,6.1,85.6878298368027,610
tt0124777,Latin Boys Go to Hell,Latin Boys Go to Hell,1997,1997-09-05,"Comedy, Drama, Crime",71,"USA, Germany, Spain, Japan","English, Spanish",Ela Troyano,"Andre Salas, Andre Salas",Latin Boys Production,"Irwin Ossa, John Bryant, Jenifer Lee Simard, Alexis Artiles, Mike Ruiz, Anne Iobst, Dashia Imperiale, Norma Maldonado, Jehad Nga, Guinevere Turner, Rebecca Sumner Burgos, Umberto González, Yvonne Washington, Reynier Molenaar, Iris Prado Salas","A cute, openly gay latin boy's hormones go into overdrive when his hunky cousin (Angel) arrives for an extended stay. The two explore the young and sometimes dangerous gay scene in the ...",4.9,289,"",$ 199033,$ 199033,,7,13,4.9,65.5580594733002,490
tt0126428,Midnite Plowboy,Midnite Plowboy,1971,1971-12-13,Comedy,71,USA,English,Bethel Buckalew,Bethel Buckalew,Pure Gold Productions,"John Tull, Nan Cee, Jack Richesin, Terri Johnson, Debbie Osborne, Cristy Anna, Linda McCrae","Junior comes from the country to Hollywood where he soon ends up living in a house full of prostitutes. As payment for his rent, Junior is assigned the task of driving the girls around in a...",4.4,162,"","","",,5,6,4.4,65.8528167605967,440
tt0126659,Shadow of Chinatown,Shadow of Chinatown,1936,1936-10-10,Thriller,71,USA,English,Robert F. Hill,"William Buchanan, Robert F. Hill",Victory Pictures Corporation,"Bela Lugosi, Bruce Bennett, Joan Barclay, Luana Walters, Maurice Liu, Charles King, William Buchanan, Forrest Taylor, John Cowell, James B. Leong, Henry T. Tung, Paul Fung, George Chan, Moy Ming","Feature version of the 1936 serial """"Shadow of Chinatown.""""",4.1,128,"","","",,11,6,4.1,61.8588426563998,410
tt0131400,Footrot Flats: The Dog's Tale,Footrot Flats: The Dog's Tale,1986,1986-04-09,"Animation, Comedy",71,"Australia, New Zealand",English,Murray Ball,"Murray Ball, Murray Ball",Magpie Productions Ltd.,"John Clarke, Peter Rowley, Rawiri Paratene, Fiona Samuel, Peter Hayden, Dorothy McKegg, Billy T. James, Brian Sergent, Marshall Napier, Michael Haigh","Featuring the characters from Murray Ball's """"Footrot Flats"""". Questions will be answered as the small town of Raupo comes to life on the big screen.",7.1,834,"","",$ 1243,,14,,7.1,100.816722694297,710
tt0136491,Riverdance: The Show,Riverdance: The Show,1995,1995,Music,71,Ireland,English,John McColgan,"",Raidió Teilifís Éireann (RTÉ),"Michael Flatley, Jean Butler, Brendán de Gallaí, Eileen Martin, Areleen Ni Bhaoill, María Pagés, Pat Roddy","Riverdance is rooted in a three-part suite of baroque-influenced traditional music called Timedance composed, recorded and performed for the 1981 Eurovision Song Contest, which was hosted by Ireland.",7.9,550,"","","",,7,1,7.9,114.718534175713,790
tt0144187,Vechir na Ivana Kupala,Vechir na Ivana Kupala,1968,1968-09-14,"Drama, Fantasy, Mystery",71,Soviet Union,Ukrainian,Yuri Ilyenko,"Nikolay Gogol, Yuri Ilyenko",Dovzhenko Film Studios,"Boris Khmelnitskiy, Larisa Kadochnikova, Yefim Fridman, Dmitri Franko, Boryslav Brondukov, Mykhailo Illienko, Dzhemma Firsova, Viktor Panchenko, Konstantin Ershov, David Yanover, Nikolai Silis, Aleksandr Sergienko","Piotr is a modest farmhand living in an impoverished village in some unspecified long ago era. He wants to marry the lovely Pidorka, but her stern father won't hear of it. Luckily, the ...",7.1,296,"","","",,4,3,7.1,100.473988112773,710
tt0145891,Daisy Town,Daisy Town,1971,1971-12-15,"Animation, Adventure, Comedy",71,"France, Belgium",French,René Goscinny,"Morris, René Goscinny",Belvision,"Marcel Bozzuffi, Pierre Trabaud, Jacques Balutin, Jacques Jouanneau, Pierre Tornade, Jean Berger, Roger Carel, Jacques Fabbri, Jacques Legras, Claude Dasset, Jacques Bodoin, Georges Atlas, André Le Gall, Jacques Hilling, Rosy Varte",When the members of a caravan of pioneers find a daisy growing in the middle of the desert they decide to stop there and to build their town on this very spot. Houses soon spring up like ...,7,1432,"","","",,4,5,7,97.3328431421418,700
tt0165904,Riesutu duona,Riesutu duona,1977,1980-02-01,Romance,71,"Soviet Union, Lithuania","Lithuanian, Russian",Arunas Zebriunas,Saulius Saltenis,Lietuvos Kinostudija,"Regina Arbaciauskaite, Vladas Bagdonas, Stasys Jonynas, Doloresa Kazragyte, Algirdas Latenas, Leonid Obolensky, Elvyra Piskinaite, Saulius Sipaitis, Kostas Smoriginas, Antanas Surna","Lithuania, 1977. Memories of childhood, adolescence, and first love in a small provincial town, shown through complexity of human relations at this periodical film.",8.3,622,"","","",,1,,8.3,115.67609652707,830
tt0173701,Sesso e pazzia,Bube u glavi,1970,1971,"Drama, Romance",71,Yugoslavia,Serbo-Croatian,Milos 'Misa' Radivojevic,"Miodrag Ilic, Milos 'Misa' Radivojevic",Inex Film,"Milja Vujanovic, Dragan Nikolic, Slobodan Aligrudic, Rahela Ferari, Aleksandar Markovic, Djordje Martinovic, Branislav 'Ciga' Milenkovic, Svetolik Nikacevic, Neda Ognjanovic, Milivoje 'Mica' Tomic, Dragan Vilotic",Psychological drama about two young lovers who are emotionally and mentally unstable. Through the flashback they are telling what did they do before they end up in asylum.,6.1,119,"","","",,,,6.1,84.2836990379681,610
tt0180177,"A Smell of Honey, a Swallow of Brine","A Smell of Honey, a Swallow of Brine",1966,1966-06-10,Drama,71,USA,English,Byron Mabe,David F. Friedman,"","Stacey Walker, Sam Melville, Bob Todd, Sharon Carr, Michael Wright, Michael O'Kelly, Larry Jones, Linda Gearhart, Tom Hughes","A young woman teases, seduces, and emotionally destroys young men for her own twisted enjoyment.",6,183,"","","",,9,11,6,86.9682647334492,600
tt0181627,Kirikù e la strega Karabà,Kirikou et la sorcière,1998,1999-12-22,"Animation, Adventure, Family",71,"France, Belgium, Luxembourg",French,"Michel Ocelot, Raymond Burlet","",Les Armateurs,"Doudou Gueye Thiaw, Maimouna N'Diaye, Awa Sene Sarr, Robert Liensol, William Nadylam, Sebastien Hebrant, Thilombo Lubambu, Marie Augustine Diatta, Moustapha Diop, Isseu Niang, Selly Raby Kane, Erick Patrick Correa, Adjoua Barry, Charles Edouard Gomis Correa, Marie-Louise Shedeye Diiddi","In a troubled African village, an unusual baby is born.",7.5,8448,EUR 3800000,"",$ 281179,,64,41,7.5,96.2333932205478,750
tt0185532,Neispravimyy lgun,Neispravimyy lgun,1973,1974-05-27,"Comedy, Music",71,Soviet Union,Russian,Villen Azarov,"Yakov Kostyukovskiy, Moris Slobodskoy",Mosfilm,"Georgiy Vitsin, Inna Makarova, Nikolai Prokopovich, Vladimir Etush, Edita Pekha, Boris Sichkin, Emmanuil Geller, Nikolay Parfyonov, Ivan Ryzhov, Larisa Barabanova, Valentina Berezutskaya, Yuliya Tsoglin, Valentina Khmara, Larissa Vadko, Galina Mikeladze","Hairdresser Alexey Ivanovich Tyuturin constantly gets into fantastic situations on the way to work. His colleagues consider him a dreamer and a liar, but everything that happens with Alexey Ivanovich is true.",7,264,"","","",,,,7,98.5084380221413,700
tt0186449,Pinocchio in Outer Space,Pinocchio in Outer Space,1965,1965-12-22,"Animation, Adventure, Family",71,"Belgium, USA",English,Ray Goossens,"Norm Prescott, Fred Ladd",Belvision,"Peter Lazer, Arnold Stang, Jess Cain, Conrad Jameson, Kevin Kennedy, Mavis Mims, Bret Morrison, Ray Owens, Minerva Pious, Norman Rose","Pinocchio must prove himself as a real boy when he takes off to Mars with Nurtle in the capture of Astro, a flying killer space whale.",6.5,214,"","","",,12,6,6.5,91.5160290683047,650
tt0187687,Aladino e la sua lampada meravigliosa,Aladin et la lampe merveilleuse,1970,1970-01-28,"Animation, Adventure, Family",71,France,"French, English",Jean Image,"France Image, Jean Image",Films Jean Image,"Gaston Guez, Henri Virlojeux, Claire Guibert, René Hiéronimus, Lucie Dolène, Fred Pasquali, Georges Atlas, Jim Bauman, Maggie Brenner, Colin Drake, Pascal Dufar, Steve Eckardt, Jean Fontaine, Richard Francoeur, Michel Gudin","The magician travels to Aladdin's village, identified as being near the border with China, where he enlists Aladdin's help by pretending to be his long-lost uncle and offering to leave his ...",6.2,140,"","","",,3,7,6.2,83.7348043038024,620
tt0200280,"What's Up, Hideous Sun Demon","What's Up, Hideous Sun Demon",1983,1983,"Comedy, Sci-Fi",71,USA,English,"Craig Mitchell, Robert Clarke",Craig Mitchell,"","Bernard Behrens, Zachary Berger, Bill Capizzi, Cam Clarke, Robert Clarke, Del Courtney, Pearl Driggs, Paul Frees, Robert Garry, Barbara Goodson, Googy Gress, Mark Holton, Ron Honthaner, Robin C. Kirkman, Jay Leno","Z-grade horror flick """"The Hideous Sun Demon"""" re-dubbed and re-edited into monster-movie spoof about a suntan lotion that works from the inside out (it also has a certain side effect).",4.6,138,"","","",,7,,4.6,62.8760595306214,460
tt0202884,Goblet of Gore,Goblet of Gore,1996,1996,Horror,71,Germany,"",Andreas Schnaas,"Stefan Baumeister, Andreas Schnaas",House of Horror,"Vivian Giaretti, Tom Trambow, Karsten Holthusen, Gernot Rupnow, Christian Candini, Zara Satana, Karl-Heinz Geisendorf, Ulrich Giessel, Jorg Raufeisen, Finn Gaus, Christian Zakrewski, Florencio Hartungen, Per Gilomen, Sara Gilomen, Bela B.",A mystical chalice once used by the vikings spreads death and destruction as it passes through the centuries.,3.2,133,"","","",,2,3,3.2,46.7083602885109,320
tt0208502,L'uovo dell'angelo,Tenshi no tamago,1985,1985-12-22,"Animation, Drama, Fantasy",71,Japan,Japanese,Mamoru Oshii,"Yoshitaka Amano, Mamoru Oshii",Studio DEEN,"Mako Hyôdô, Jinpachi Nezu, Kei'ichi Noda","A mysterious young girl wanders a desolate, otherworldly landscape, carrying a large egg.",7.7,6793,"","","",,26,15,7.7,110.128653369791,770
tt0227170,Okasu!,Okasu!,1976,1976-02-07,"Crime, Horror, Thriller",71,Japan,Japanese,Yasuharu Hasebe,Seiji Matsuoka,Nikkatsu,"Natsuko Yashiro, Akemi Nijô, Naomi Tani, Keizô Kanie, Rei Okamoto, Yuri Yamashina, Chieko Harada, Hiroyuki Mikawa, Midori Mori, Akira Takahashi",A rape victim realizes that she enjoys sexual assault and continuously offers herself to be raped while searching for her original rapist.,6,144,"","","",,8,4,6,83.4707591675091,600
tt0228419,Ikenie fujin,Ikenie fujin,1974,1974-10-26,"Drama, Romance",71,Japan,Japanese,Masaru Konuma,Yôzô Tanaka,Nikkatsu,"Naomi Tani, Nagatoshi Sakamoto, Terumi Azuma, Hidetoshi Kageyama, Tessen Nakahira, Chigusa Takayama, Tamaki Komiyama, Saburô Shôji, Bunta Tani","A woman must endure an extreme ritual when her ex-husband, who has recently escaped from jail, kidnaps her.",6.1,453,"","","",,5,9,6.1,90.1896912041624,610
tt0229486,Jackpot,Jackpot,1960,1960,Drama,71,UK,English,Montgomery Tully,"Montgomery Tully, Maurice J. Wilson",Grand National Pictures,"William Hartnell, Betty McDowall, Eddie Byrne, George Mikell, Michael Ripper, Victor Brooks, Tim Turner, Ivan Craig, Howard Lang, Ian Fleming, Sylvia Davies, Frank Forsyth, Brian Phelan","A safe in 'The Jackpot Club' is robbed of £6,000. The police and the owner of the club want to track down the safecracker, but for very different reasons.",5.9,101,"","","",,7,,5.9,83.5132587178933,590
tt0253143,Inek Saban,Inek Saban,1978,1978,"Comedy, Family, Romance",71,Turkey,Turkish,Osman F. Seden,"Berrin Giz, Osman F. Seden",Çan Film,"Kemal Sunal, Defne Yalniz, Gülçin Akçay, Abdi Algül, Dündar Aydinli, Cevdet Balikçi, Çetin Basaran, Ihsan Bayraktar, Kemal Bekir, Ali Demirel, Ali Kemal Denizci, Süheyl Egriboz, Orhan Elmas, Macit Flordun, Saadet Gürses",A poor grocery owner becomes a popular goalkeeper.,7.6,3720,"","","",,,,7.6,111.209957858366,760
tt0261739,The law of the border,Hudutlarin Kanunu,1966,1966,"Crime, Drama",71,Turkey,Turkish,Lütfi Akad,"Lütfi Akad, Yilmaz Güney",Dadas Film,"Yilmaz Güney, Pervin Par, Erol Tas, Tuncer Necmioglu, Muharrem Gürses, Aydemir Akbas, Sirri Elitas, Tuncel Kurtiz, Atilla Ergün, Osman Alyanak, Ahmet Danyal Topatan","In order to keep his ailing son alive, an impoverished man agrees to sneak a herd of sheep across the border.",6.9,694,"","","",,2,8,6.9,96.1473937999493,690
tt0267972,The Text of Light,The Text of Light,1974,1974-10-26,Mystery,71,USA,"",Stan Brakhage,"","","","Time-lapse photography of books, paintings, reflections, and light falling on textures, shot entirely through a glass ashtray.",6.1,151,"","","",,3,4,6.1,80.1651800488838,610
tt0272202,Mysterious Planet,Mysterious Planet,1982,1982,Sci-Fi,71,USA,English,Brett Piper,"Brett Piper, Jules Verne","","Paula Taupier, Boydd Piper, Michael Quigley, Bruce E. Nadeau Jr., Vance Dallas, Hanna Landy, Marilyn Mullen, Bernard Nero, George Seavey, Cynthia Vacca","A spaceship crash-lands on a planet, and the crew is astonished to find that it holds a beautiful woman who can heal the sick and injured and a race of super-intelligent beings.",3.2,163,"","","",,6,7,3.2,44.5250834711596,320
tt0274470,Dot and the Kangaroo,Dot and the Kangaroo,1977,1977-12-15,"Animation, Family, Fantasy",71,Australia,English,Yoram Gross,"Yoram Gross, John Palmer",Yoram Gross Films,"Barbara Frawley, Joan Bruce, Spike Milligan, June Salter, Ross Higgins, Lola Brooks, Peter Gwynne, Ron Haddrick, Richard Meikle, George Assang, Kerrie Biddell, John Derum, Kevin Golsby, Nola Lester, Sue Walker",A young girl gets lost in the Australian outback and befriends a kangaroo,7.1,717,"","","",,28,2,7.1,97.3283114414994,710
tt0275204,El asadito,El asadito,2000,2000-11-09,Drama,71,Argentina,Spanish,Gustavo Postiglione,Gustavo Postiglione,"","Tito Gómez, Gerardo Dayub, Héctor Molina, Raúl Calandra, Carlos Resta, David Edery, Daniel Briguet, Pablo Fossa","The December 30, 1999. Seven friends on the terrace.",7,240,"","","",,3,4,7,95.8998650737281,700
tt0275524,Mkhiaruli romani,Mkhiaruli romani,1972,1972-09-01,Comedy,71,Soviet Union,Georgian,Levan Khotivari,"Levan Khotivari, Otar Razmadze","","Ipolite Khvichia, Khatuna Kotrikadze, Ramaz Giorgobiani, Megi Tsulukidze, Elene Chokheli, Medea Chakhava, Zurab Laperadze, Dodo Abashidze, Tengiz Chantladze, Aleksandre Edzgveradze, Giorgi Gabelashvili, Giorgi Jujunashvili, Baadur Kipiani, Sesika Kuprashvili, Nodar Piranishvili","Countryman Dato falls in love with uptown girl Eka. But, their romance faces difficulties due to Dato's revolver-like lighter, which Eka's tough father mixes with a real gun.",7.5,207,"","","",,,,7.5,108.682305293303,750
tt0285490,Crypt of Dark Secrets,Crypt of Dark Secrets,1976,1976-10-13,"Crime, Horror",71,USA,English,Jack Weis,"Irwin Blaché, Jack Weis",Omni National,"Ronald Tanet, Maureen Ridley, Herbert G. Jahncke, Wayne Mack, Butch Benit, Susie Sirmen, Harry Uher, Barbara Hagerty, Lois Tillman, Cindy Almario, Nattie Dear, Vernel Bagneris, Jack Flynn, John Simmons",A witch resurrects a murdered Vietnam vet and takes revenge on his killers.,4.4,150,"","","",,10,6,4.4,63.065176918009,440
tt0289670,The Book That Wrote Itself,The Book That Wrote Itself,1999,2000-08-08,Comedy,71,Ireland,English,Liam O Mochain,Liam O Mochain,Siar A Rachas Muid Productions,"Liam O Mochain, Antoinette Guiney, Orlaith Rafter, Paul Mahon, Phillip Owen, Marco van Belle, Kristian Marken, Edward Naessens, Carole Meyers, Mike Carberry, Sarah Pilkington, Seán Ó Coisdealbha, Fred McCluskey, Sarah O'Toole, Mo McMorrow","Vincent Macken has wriiten his magnus Opus but nobody will publish it. To prove to the publishers and his detractors that his novel is great, he decides to live out the story of his novel. ...",4.8,112,$ 25000,"","",,5,9,4.8,70.1917045601365,480
tt0291196,Violenza senza causa,Gendai sei hanzai zekkyô hen: Riyû naki bôkô,1969,1969-12-31,"Action, Crime",71,Japan,Japanese,Kôji Wakamatsu,Toshitaka Sakabe,"","Muraoka Hiroshi, Toshimasa Sakaguchi, Kazuya Jô, Rei Ikegami, Ei Tôjô, Yûko Ejima, Yuko Ohama, Naomi Asaka, Jôji Ichimura, Yôko Nakamura, Jirô Shibuya, Yado no Shinkô, Tarô Shinjuku, Hiroshi Imaizumi, Hiroshi Yajima","Three young men from the countryside spend their lives in Tokyo alternately complaining about their boring existence and brutalizing people. When they come to violent ends themselves, they claim to be victims of society.",6.4,110,"","","",,1,5,6.4,87.0138055132406,640
tt0292053,Kilink Istanbul'da,Kilink Istanbul'da,1967,1967-12-25,"Adventure, Crime, Fantasy",71,Turkey,Turkish,Yilmaz Atadeniz,"",Atadeniz Film,"Irfan Atasoy, Pervin Par, Muzaffer Tema, Suzan Avci, Hüseyin Peyda, Sevinç Pekin, Mine Soley, Ergun Köknar, Feridun Çölgeçen, Hüseyin Zan, Mete Mert, Enver Dönmez, Süheyl Egriboz","Kilink, the Turkish super anti-hero,who was a lookalike of the Italian comic-strip hero Killing, who was a lookalike of the other Italian super hero Kriminal,opens the long series of Kilink...",6.1,235,"","","",,5,15,6.1,77.4522458844023,610
tt0296177,Female Market,Ryôjoku mesu ichiba - Kankin,1986,1986-01-18,Horror,71,Japan,Japanese,Yasuaki Uegaki,Kazuo 'Gaira' Komizu,Nikkatsu,"Kaori Asô, Minako Ogawa, Kayo Kiyomoto, Tatsuya Aoki, Nobutaka Masutomi, Mami Fujimura, Kumi Anzai, Miki Kazehara, Chieko Oda, Noriko Hanai, Yumiko Komiya, Dennis Robertson, Arie Pretty, Tamaki Komiyama, Takahiko Okuyama",Unlucky women are imprisoned in a warehouse in preparation for being later sold into slavery.,4.6,216,"","","",,10,7,4.6,57.0753163710212,460
tt0308015,Bebek yüzlü,Bebek yüzlü,1973,1973,Drama,71,Turkey,Turkish,Vural Pakel,Vural Pakel,Özer Film,"Tarik Akan, Perihan Savas, Ahmet Mekin, Erol Tas, Yilmaz Gruda, Halit Akçatepe, Aysen Cansev, Seyhan Gümüs, Ilhan Hemseri, Altin Ser, Necdet Yakin, Feridun Çölgeçen","",5.9,116,"","","",,,,5.9,82.9637840488014,590
tt0309804,Ljubljana,Ljubljana,2002,2002-02-06,Drama,71,Slovenia,Slovenian,Igor Sterk,Igor Sterk,A.A.C. Production,"Manca Dorrer, Mojca Fatur, Uros Fürst, Jaka Ivanc, Primoz Pirnat, Rok Vihar, Tjasa Zeleznik, Grega Zorc",A story about a group of young Slovenians living in Ljubljana.,5.4,123,"","","",,1,1,5.4,74.3100644179657,540
tt0321983,Därvis Parisi partladir,Därvis Parisi partladir,1976,1979-12-27,"Comedy, Music",71,Soviet Union,"Azerbaijani, Russian","Shamil Makhmudbekov, Kyamil Rustambekov","Mirza Fatali Akhundov, Adham Qulubayov",Azerbaijanfilm,"Sergey Yurskiy, Mirza Babayev, Adil Iskenderov, Leyla Badirbayli, Safura Ibragimova, Enver Gasanov, Hasanagha Turabov, S. Bagirova, F. Elekberov, B. Eliyev, R. Ezizbelli, Osman Haggi, Memunat Kurbanova, Kamil Magerramov, V. Marianbey","A famous botanist, Monsieur Jordan is a guest in Karabakh to Hatamkhan Aga and Aga's son wants to go to French with Jordan in order to study. His family and lover try to discourage him and ...",7.4,194,"","","",,,,7.4,105.874834951655,740
tt0326143,La leggenda del ragazzo del sole,Seinto Seiya: Shinku no shônen densetsu,1988,1988-07-23,"Animation, Action, Fantasy",71,Japan,Japanese,Shigeyasu Yamauchi,"Masami Kurumada, Yoshiyuki Suga",Toei Doga,"Tôru Furuya, Hirotaka Suzuoki, Hideyuki Hori, Ryô Horikawa, Kôichi Hashimoto, Keiko Han, Rokurô Naya, Kazuyuki Sogabe, Kôji Totani, Keiichi Nanba, Ryôichi Tanaka, Yumiko Shibata, Kôji Yada, Akira Kamiya, Katsuji Mori","The Sun God Abel returns to life, bent on punishing the humans and cleansing the Earth from their presence. When Athena joins him, leaving humans to their fate, the Bronze Saints must defend the Earth in their greatest battle yet.",7.3,1070,"","","",,3,,7.3,104.090571179705,730
tt0329954,Thirteen Erotic Ghosts,Thirteen Erotic Ghosts,2002,2004-09-24,"Fantasy, Horror",71,USA,English,Fred Olen Ray,Fred Olen Ray,American Independent Productions,"Julie Strain, Richard Gabai, John Henry Richardson, Peter Spellos, Mia Zottoli, Aria Giovanni, Nicole Specht, Felony, Zen, Zero",Paranormal investigators arrive at a burned-down girlschool to check if the rumors of ghost appearances are true. With their special goggles they see that the ghosts are constantly engaging in lesbian sex which gets everyone horny.,4.1,273,"","","",,6,5,4.1,57.8298094102401,410
tt0349113,The Weekend It Lives,The Weekend It Lives,1992,1992-01-29,"Comedy, Horror, Mystery",71,USA,English,Michael Mfume,Michael Mfume,2 Smooth Film Productions,"Michael Mfume, Sandra Pulley, Joe Clair, Racquel Price, Tracy Wiggs, Maria Copper, Kelci Jeter, Greg Jones, Kristine Louisa, Fredrick Montgomery, Thomas Hunt, D-Taylor Murphy, Chris Gatewood, Archie Williams, Julia Gorin","A weekend retreat at a remote cabin in the woods for a group of childhood pals turns into a terrifying fight for survival, as a former friend whose family was killed years earlier comes along looking for revenge.",1.3,1691,$ 650,"","",,57,17,1.3,19.0787521616912,130
