imdb_title_id,title,original_title,year,date_published,genre,duration,country,language,director,writer,production_company,actors,description,avg_vote,votes,budget,usa_gross_income,worlwide_gross_income,metascore,reviews_from_users,reviews_from_critics,avg_vote_10,avg_vote_100,avg_vote_1000
tt0090583,A proposito della notte scorsa...,About Last Night...,1986,1986-10-02,"Comedy, Drama, Romance",113,USA,English,Edward Zwick,"David Mamet, Tim Kazurinsky",TriStar Pictures,"Rob Lowe, Demi Moore, Jim Belushi, Elizabeth Perkins, George DiCenzo, Michael Alldredge, Robin Thomas, Donna Gibbons, Megan Mullally, Patricia Duff, Rosanna DeSoto, Sachi Parker, Robert Neches, Joe Greco, Ada Maris","A man and woman meet and try to have a romantic affair, despite their personal problems and the interference of their disapproving friends.",6.3,14089,$ 8500000,$ 38702310,$ 38702310,70,88,44,6.3,93.6360317471632,630
tt0091326,Karate Kid II - La storia continua...,The Karate Kid Part II,1986,1986-09-04,"Action, Family, Romance",113,USA,English,John G. Avildsen,"Robert Mark Kamen, Robert Mark Kamen",Columbia Pictures,"Pat Morita, Ralph Macchio, Pat E. Johnson, Bruce Malmuth, Eddie Smith, Martin Kove, Garth Johnson, Brett Johnson, Will Hunt, Evan James, Lee Arnone, Sarah Kendall, Yuji Okumoto, Joey Miyashima, Danny Kamekona","Daniel accompanies his mentor, Mr. Miyagi, to Miyagi's childhood home in Okinawa. Miyagi visits his dying father and confronts his old rival, while Daniel falls in love and inadvertently makes a new rival of his own.",6,71251,"",$ 115103979,$ 115103979,55,129,49,6,84.5147168435788,600
tt0091480,Manon delle sorgenti,Manon des sources,1986,1986-11-19,"Comedy, Drama",113,"Switzerland, Italy, France",French,Claude Berri,"Claude Berri, Gérard Brach",DD Productions,"Yves Montand, Daniel Auteuil, Emmanuelle Béart, Hippolyte Girardot, Margarita Lozano, Yvonne Gamy, Ticky Holgado, Jean Bouchaud, Elisabeth Depardieu, Gabriel Bacquier, Armand Meffre, André Dupon, Pierre Nougaro, Jean Maurel, Roger Souza",A beautiful but shy shepherdess plots vengeance on the men whose greedy conspiracy to acquire her father's land caused his death years earlier.,8,20347,"",$ 3940542,$ 3940542,,80,25,8,108.111708804663,800
tt0092563,Angel Heart - Ascensore per l'inferno,Angel Heart,1987,1987-12-18,"Horror, Mystery, Thriller",113,"UK, Canada, USA","English, French",Alan Parker,"William Hjortsberg, Alan Parker",Carolco International N.V.,"Mickey Rourke, Robert De Niro, Lisa Bonet, Charlotte Rampling, Stocker Fontelieu, Brownie McGhee, Michael Higgins, Elizabeth Whitcraft, Eliott Keener, Charles Gordone, Dann Florek, Kathleen Wilhoite, George Buck, Judith Drake, Gerald Orange",A private investigator is hired by a man who calls himself Louis Cyphre to track down a singer named Johnny Favorite. But the investigation takes an unexpected and somber turn.,7.3,78672,$ 17000000,$ 17185632,$ 17185632,61,265,143,7.3,103.692587491573,730
tt0092709,Il burbero,Il burbero,1986,1986-12-20,Comedy,113,Italy,Italian,"Franco Castellano, Giuseppe Moccia","Franco Castellano, Giuseppe Moccia",C.G. Silver Film,"Adriano Celentano, Debra Feuer, Jean Sorel, Mattia Sbragia, Angela Finocchiaro, Peppe Lanzetta, Percy Hogan, Enzo De Toma, Francesco Scali, Franco Diogene, Iaia Forte, Loredana Addari, Michela Albanese, Claudia Balboni, Emilio Cappuccio","Tito and Mary meet at the airport, where he gives her his extra ticket not being aware of the fatal situation in which he will fall as a result of his kindness.",6.4,912,"","","",,1,2,6.4,86.4048271647711,640
tt0093209,Anni '40,Hope and Glory,1987,1987-10-09,"Comedy, Drama, Romance",113,"UK, USA",English,John Boorman,John Boorman,Columbia Pictures,"Sebastian Rice-Edwards, Geraldine Muir, Sarah Miles, David Hayman, Sammi Davis, Derrick O'Connor, Susan Wooldridge, Jean-Marc Barr, Ian Bannen, Annie Leon, Jill Baker, Amelda Brown, Katrine Boorman, Colin Higgins, Shelagh Fraser","Bill, a young boy living on the outskirts of London experiences the exhilaration of World War II. During this period, Bill learns about sex, death, love, hypocrisy, and the faults of adults as he prowls the ruins of bombed houses.",7.3,12196,"",$ 10021120,$ 10021120,86,82,33,7.3,100.764614967469,730
tt0094678,Arturo 2: On the Rocks,Arthur 2: On the Rocks,1988,1988-12-01,"Comedy, Romance",113,USA,English,Bud Yorkin,"Steve Gordon, Andy Breckman",Warner Bros.,"Dudley Moore, Liza Minnelli, John Gielgud, Geraldine Fitzgerald, Stephen Elliott, Paul Benedict, Cynthia Sikes, Kathy Bates, Jack Gilford, Ted Ross, Barney Martin, Thomas Barbour, David O'Brien, Ron Canada, John C. Vennema","Arthur loses all of his money, and his wife wants a baby.",4.7,5948,"",$ 14681192,$ 14681192,,51,23,4.7,67.5727442388858,470
tt0095008,Due,Deux,1989,1989-02-15,"Drama, Romance",113,France,French,Claude Zidi,"Catherine Rihoit, Charles Trieschmann",DD Productions,"Gérard Depardieu, Maruschka Detmers, Michelle Goddet, Philippe Leroy, Beata Tyszkiewicz, François Cluzet, Wojciech Pszoniak, Ronald Guttman, Catherine Alcover, Jonathan Bagault, Gérard Beaume, Marc Betton, Jacques Chayrousse, Madeleine Cheminat, Marc Chouppart",The manager of a contemporary music composer falls in love with the real estate agent with whom he is looking for a house in Paris. But both have been used to living an independent life: ...,5.8,189,"","","",,1,,5.8,78.5674510269184,580
tt0095484,Scarlatti - Il thriller,Lady in White,1988,1988-04-22,"Fantasy, Horror, Mystery",113,USA,"English, Italian, Spanish, German",Frank LaLoggia,Frank LaLoggia,New Sky Communications Inc.,"Lukas Haas, Len Cariou, Alex Rocco, Katherine Helmond, Jason Presson, Renata Vanni, Angelo Bertolini, Joelle Jacobi, Jared Rushton, Gregory Levinson, Lucy Lee Flippin, Tom Bower, Jack Andreozzi, Sydney Lassick, Rita Zohar","An author tells the story of how, as a young boy growing up in a 1960s small town, he was haunted after witnessing the murder of a little girl.",6.7,6096,$ 4700000,$ 1705139,$ 1705139,70,92,177,6.7,95.2879171822038,670
tt0095652,Monkey Shines - Esperimento nel terrore,Monkey Shines,1988,1988-10-14,"Drama, Horror, Sci-Fi",113,USA,English,George A. Romero,"Michael Stewart, George A. Romero",Orion Pictures,"Jason Beghe, John Pankow, Kate McNeil, Joyce Van Patten, Christine Forrest, Stephen Root, Stanley Tucci, Boo, Janine Turner, William Newman, Tudi Wiggins, Tom Quinn, Chuck Baker, Patricia Tallman, David Early","A quadriplegic man has a trained monkey help him with his paralysis, until the little monkey begins to develop feelings, and rage, against its new master.",6.2,10400,$ 7000000,$ 5344577,$ 5344577,71,76,70,6.2,86.799716497093,620
tt0096028,Salaam Bombay!,Salaam Bombay!,1988,1988-12-20,"Crime, Drama",113,"UK, India, France","Hindi, English",Mira Nair,"Hriday Lani, Mira Nair",Cadrage,"Shafiq Syed, Hansa Vithal, Chanda Sharma, Raghuvir Yadav, Anita Kanwar, Nana Patekar, Anjaan, Amrit Patel, Murari Sharma, Ram Murthy, Sarfuddin Qureshi, Raju Barnad, Irshad Hashmi, Mohanraj Babu, Chandrashekhar Naidu",The boy Krishna is abandoned by his mother at the Apollo Circus and she tells him that he can only return home when he can afford 500 rupees to pay for the bicycle of his brother that he ...,8,8408,"",$ 2080046,$ 2080758,78,65,34,8,111.930127755119,800
tt0096463,Una donna in carriera,Working Girl,1988,1989-03-10,"Comedy, Drama, Romance",113,USA,English,Mike Nichols,Kevin Wade,Twentieth Century Fox,"Harrison Ford, Sigourney Weaver, Melanie Griffith, Alec Baldwin, Joan Cusack, Philip Bosco, Nora Dunn, Oliver Platt, James Lally, Kevin Spacey, Robert Easton, Olympia Dukakis, Amy Aquino, Jeffrey Nordling, Elizabeth Whitcraft","When a secretary's idea is stolen by her boss, she seizes an opportunity to steal it back by pretending she has her boss' job.",6.8,50560,$ 28000000,$ 63779477,$ 102956984,73,147,52,6.8,94.4775970839056,680
tt0097027,Vittime di guerra,Casualties of War,1989,1990-01-01,"Crime, Drama, War",113,USA,"English, Vietnamese",Brian De Palma,"Daniel Lang, David Rabe",Art Linson Productions,"Michael J. Fox, Sean Penn, Don Harvey, John C. Reilly, John Leguizamo, Thuy Thu Le, Erik King, Jack Gwaltney, Ving Rhames, Dan Martin, Dale Dye, Steve Larson, John Linton, Vyto Ruginis, Al Shannon","During the Vietnam War, a soldier finds himself the outsider of his own squad when they unnecessarily kidnap a female villager.",7.1,40250,$ 22500000,$ 18671317,$ 18671317,75,136,83,7.1,100.47048768045,710
tt0097095,Coming Out,Coming Out,1989,1989-11-10,"Drama, Romance",113,East Germany,German,Heiner Carow,"Erika Richter, Wolfram Witt",Deutsche Film (DEFA),"Matthias Freihof, Dagmar Manzel, Dirk Kummer, Michael Gwisdek, Werner Dissel, Gudrun Ritter, Walfriede Schmitt, Axel Wandtke, Pierre Sanoussi-Bliss, René Schmidt, Thomas Gumpert, Ursula Staack, Robert Hummel, Horst Ziethen, Gertraud Kreissig",A young teacher in East Berlin struggles with accepting his homosexuality.,6.9,1492,"","","",,17,10,6.9,93.0435435856919,690
tt0097116,Cugini,Cousins,1989,1989-02-10,"Comedy, Romance",113,USA,English,Joel Schumacher,"Jean-Charles Tacchella, Stephen Metcalfe",Paramount Pictures,"Ted Danson, Isabella Rossellini, Sean Young, William Petersen, Lloyd Bridges, Norma Aleandro, Keith Coogan, Gina DeAngeles, George Coe, Katharine Isabelle, Alex Bruhanski, Stephen E. Miller, Gordon Currie, Saffron Henderson, Michele Goodger",Two couples go to a mutual friend's wedding and end up swapping partners.,6.3,4192,$ 13000000,$ 22026369,$ 22026369,,30,11,6.3,89.7228267124721,630
tt0097235,4 pazzi in libertà,The Dream Team,1989,1989-04-07,"Comedy, Crime, Thriller",113,USA,English,Howard Zieff,"Jon Connolly, David Loucka",Universal Pictures,"Michael Keaton, Christopher Lloyd, Peter Boyle, Stephen Furst, Dennis Boutsikaris, Lorraine Bracco, Milo O'Shea, Philip Bosco, James Remar, Jack Gilpin, MacIntyre Dixon, Michael Lembeck, Bill Goffi, Jack Duffy, Brad Sullivan","Four mental patients on a field trip in New York City must save their caring chaperon, who ends up being taken to a hospital in a coma after accidentally witnessing a murder, before the killers can find him and finish the job.",6.5,12539,$ 15000000,$ 28890240,$ 28890240,54,52,22,6.5,90.2381808823322,650
tt0097579,Un uomo innocente,An Innocent Man,1989,1990-04-26,"Action, Crime, Drama",113,USA,English,Peter Yates,Larry Brothers,Interscope Communications,"Tom Selleck, F. Murray Abraham, Laila Robins, David Rasche, Richard Young, Badja Djola, Todd Graff, M.C. Gainey, Peter Van Norden, Bruce A. Young, James T. Morris, Terry Golden, Dennis Burkley, Thomas B. Kackert, Vito Peterson","A man is framed by two corrupt cops for drugs. After he gets out of prison, he comes after them.",6.5,6017,"",$ 20047604,$ 20047604,39,47,19,6.5,89.0718454110824,650
tt0098165,The Rainbow,The Rainbow,1989,1989-11-03,"Action, Drama, Romance",113,UK,English,Ken Russell,"Ken Russell, Vivian Russell",Vestron Pictures,"Sammi Davis, Paul McGann, Amanda Donohoe, Christopher Gable, David Hemmings, Glenda Jackson, Dudley Sutton, Jim Carter, Judith Paris, Kenneth Colley, Glenda McKay, Mark Owen, Ralph Nossek, Nicola Stephenson, Molly Russell",A young woman deals in her own personal way with the trials of adolescence and young adulthood in early 1900s England.,6.2,1253,$ 11987578,$ 444055,$ 444055,,14,21,6.2,84.7001855058281,620
tt0098251,Ossessione d'amore,Sangre y arena,1989,1990-01-26,"Drama, Romance",113,"Spain, USA","Spanish, English",Javier Elorrieta,"Rafael Azcona, Vicente Blasco Ibáñez",José Frade Producciones Cinematográficas S.A.,"Christopher Rydell, Sharon Stone, Ana Torrent, Guillermo Montesinos, Albert Vidal, Simón Andreu, Antonio Flores, Margarita Calahorra, José Luis de Vilallonga, Tony Fuentes, Julia Torres, Aldo Sambrell, Daniel Martín, Luis Martin Carrasco, Luis Barboo",Juan is a young Spanish man whose dream is to become one of the famous toreros. When he was caught making an illegal (and in fact for the real torero life endangering) night bullfight with ...,4.7,959,"","","",,6,1,4.7,66.7717417768407,470
tt0098273,Seduzione pericolosa,Sea of Love,1989,1989-12-15,"Crime, Drama, Mystery",113,"USA, Canada",English,Harold Becker,Richard Price,Universal Pictures,"Al Pacino, Ellen Barkin, John Goodman, Michael Rooker, William Hickey, Richard Jenkins, Paul Calderon, Gene Canfield, Larry Joshua, John Spencer, Christine Estabrook, Barbara Baxley, Patricia Barry, Mark Phelan, Michael O'Neill",A detective investigating a series of murders becomes involved with a woman who may be the culprit.,6.8,37103,$ 19000000,$ 58571513,$ 110879513,66,132,49,6.8,95.4434644637615,680
tt0099005,Air America,Air America,1990,1990-08-10,"Action, Comedy, War",113,USA,"English, Lao",Roger Spottiswoode,"Christopher Robbins, John Eskow",Carolco Pictures,"Mel Gibson, Robert Downey Jr., Nancy Travis, Ken Jenkins, David Marshall Grant, Lane Smith, Art LaFleur, Ned Eisenberg, Marshall Bell, David Bowe, Burt Kwouk, Tim Thomerson, Harvey Jason, Sinjai Plengpanich, Natta Nantatanti",A young pilot finds himself recruited unwittingly into a covert and corrupt C.I.A. airlift organization operating in Vietnam War-era Laos.,5.8,26579,$ 35000000,$ 31053601,$ 33461269,33,52,29,5.8,82.267015475119,580
tt0099871,Allucinazione perversa,Jacob's Ladder,1990,1991-02-08,"Drama, Horror, Mystery",113,USA,English,Adrian Lyne,Bruce Joel Rubin,Carolco Pictures,"Tim Robbins, Elizabeth Peña, Danny Aiello, Matt Craven, Pruitt Taylor Vince, Jason Alexander, Patricia Kalember, Eriq La Salle, Ving Rhames, Brian Tarantina, Anthony Alessandro, Brent Hinkley, S. Epatha Merkerson, Suzanne Shepherd, Doug Barron","Mourning his dead child, a haunted Vietnam War veteran attempts to uncover his past while suffering from a severe case of dissociation. To do so, he must decipher reality and life from his own dreams, delusions, and perceptions of death.",7.5,96738,$ 25000000,$ 26118851,$ 26118851,62,405,134,7.5,101.581416462478,750
tt0100232,Navy Seals - Pagati per morire,Navy Seals,1990,1990-07-20,"Action, Adventure, Thriller",113,USA,"English, Arabic",Lewis Teague,"Chuck Pfarrer, Gary Goldman",Orion Pictures,"Charlie Sheen, Michael Biehn, Joanne Whalley, Rick Rossovich, Cyril O'Reilly, Bill Paxton, Dennis Haysbert, Paul Sanchez, Nicholas Kadi, Ronald G. Joseph, S. Epatha Merkerson, Gregory McKinney, Rob Moran, Richard Venture, Mark Carlton",A battle-hardened SEAL Team sets off on a mission to destroy a shipment of US-built Stinger missiles that have fallen into terrorist hands.,5.6,15511,"",$ 25069101,$ 25069101,38,95,26,5.6,81.2829269410457,560
tt0100650,Il sole anche di notte,Il sole anche di notte,1990,1990-05-15,"Drama, Romance",113,"Italy, France, Germany",Italian,"Paolo Taviani, Vittorio Taviani","Vittorio Taviani, Paolo Taviani",Filmtre,"Julian Sands, Charlotte Gainsbourg, Massimo Bonetti, Margarita Lozano, Patricia Millardet, Rüdiger Vogler, Pamela Villoresi, Geppy Gleijeses, Sonia Gessner, Tony Sperandeo, Matilde Piana, Vittorio Capotorto, Riccardo Parisio Perrotti, Salvatore Rossi, Teresa Brescianini","Young nobleman Baron Sergio Giuramondo, after discovering that his bride-to-be was the king's mistress, leaves Naples in disgust to become a monk. But his quest for perfect solitude is ...",7,651,"","","",,8,3,7,100.74296652554,700
tt0100802,Atto di forza,Total Recall,1990,1990-12-13,"Action, Sci-Fi, Thriller",113,"USA, Mexico",English,Paul Verhoeven,"Philip K. Dick, Ronald Shusett",Carolco Pictures,"Arnold Schwarzenegger, Rachel Ticotin, Sharon Stone, Ronny Cox, Michael Ironside, Marshall Bell, Mel Johnson Jr., Michael Champion, Roy Brocksmith, Ray Baker, Rosemary Dunsmore, David Knell, Alexia Robinson, Dean Norris, Mark Carlton","When a man goes for virtual vacation memories of the planet Mars, an unexpected and harrowing series of events forces him to go to the planet for real - or is he?",7.5,295762,$ 65000000,$ 119412921,$ 261317921,57,468,233,7.5,104.185973438632,750
tt0101587,"Scappo dalla città - La vita, l'amore e le vacche",City Slickers,1991,1991-11-06,"Comedy, Western",113,USA,English,Ron Underwood,"Lowell Ganz, Babaloo Mandel",Castle Rock Entertainment,"Billy Crystal, Daniel Stern, Bruno Kirby, Patricia Wettig, Helen Slater, Jack Palance, Noble Willingham, Tracey Walter, Josh Mostel, David Paymer, Bill Henderson, Jeffrey Tambor, Phill Lewis, Kyle Secor, Dean Hallo","On the verge of turning 40, an unhappy Manhattan yuppie is roped into joining his two friends on a cattle drive in the southwest.",6.8,47309,$ 27000000,$ 124033791,$ 179033791,70,96,54,6.8,96.8005780087386,680
tt0101629,Cuori incrociati,Crooked Hearts,1991,1991-09-06,"Drama, Romance",113,"USA, Canada",English,Michael Bortman,"Robert Boswell, Michael Bortman",A&M Films,"Peter Berg, Vincent D'Onofrio, Noah Wyle, Peter Coyote, Cindy Pickett, Juliette Lewis, Jennifer Jason Leigh, Wendy Gazelle, Marg Helgenberger, Deanna Milligan, Sacha Moiseiwitsch, Joshua Jackson, Ryan Jorgenson, Ian Tracey, Vincent Gale",How the discovery of a father's affair affects each member of his family.,6,916,"",$ 30964,$ 30964,,15,5,6,84.4501344751535,600
tt0102014,"Il mistero di Jo Locke, il sosia e miss Britannia '58",Hear My Song,1991,1992-03-13,"Comedy, Drama, Music",113,"Ireland, UK",English,Peter Chelsom,"Peter Chelsom, Peter Chelsom",British Screen Productions,"Brian Flanagan, Constance Cowley, Marie Mullen, Phil Kelly, Jean Blanchflower, Adrian Dunbar, Tara Fitzgerald, John Dair, Stephen Marcus, John Altman, Joe Cuddy, Britta Smith, Gladys Sheehan, Gina Moxley, Rúaidhrí Conroy",Owner of a failing club seeks infamous Irish singer Josef Locke in order to bring business and success to his club,7,1471,"",$ 4313473,$ 4313473,,26,12,7,95.9684536388213,700
tt0102432,Uomini d'onore,Men of Respect,1990,1991-01-18,"Crime, Drama, Thriller",113,USA,"English, Spanish",William Reilly,"William Reilly, William Shakespeare",Arthur Goldblatt Productions,"John Turturro, Katherine Borowitz, Dennis Farina, Peter Boyle, Lilia Skala, Steven Wright, Rod Steiger, Stanley Tucci, Carl Capotorto, Michael Badalucco, Robert Modica, David Thornton, Michael Sergio, Tony Gigante, Dan Grimaldi",A hitman heeds a spiritualist's prophesies that he will rise to the head of his family. He starts his ascension by clandestinely executing the heads of the family and casting the blame on ...,5.5,754,"",$ 139155,$ 139155,,14,7,5.5,78.9869749642337,550
tt0103670,American Heart,American Heart,1992,1993-05-07,"Crime, Drama, Romance",113,USA,English,Martin Bell,"Peter Silverman, Martin Bell",Avenue Pictures,"John Boylan, Jeff Bridges, Edward Furlong, Greg Sevigny, Jayne Entwistle, Willie Williams, Roosevelt Franklin, Melvyn Hayward, Don Harvey, Kit McDonough, Wren Walker, Cristine McMurdo-Wallis, Lucinda Jenney, Charlotte London, Loyd Catlett","An ex-convict is tracked down by his estranged teenage son, and the pair try to build a relationship and life together in Seattle.",6.8,3004,$ 10000000,$ 384048,$ 384048,,32,11,6.8,94.7106678453925,680
tt0104302,Frida - med hjertet i hånden,Frida - med hjertet i hånden,1991,1991-08-22,"Comedy, Romance",113,Norway,Norwegian,Berit Nesheim,Torun Lian,Teamfilm AS,"Maria Kvalheim, Ellen Horn, Helge Jordal, Andreas Bratlie, Cathrine Bang, Kristian Mejdell Nissen, Jan Hårstad, Elisabeth Eide Olsen, Elsa Lystad, Lasse Halvorsen, Christoffer Haug, Erik Hivju, Fridtjof Nilsen, Erik Magnus Ekjord, Nils Vogt","Frida, aged 13, has discovered a book by psychoanalyst Erich Fromm called """"The art of loving"""". Using it as a reference she sets out to better the love lives of her family and friends. But ...",5.7,415,"","","",,,1,5.7,77.4268247425454,570
tt0105175,Beyond Justice,Beyond Justice,1991,1992,"Action, Adventure, Drama",113,Italy,English,Duccio Tessari,"Adriano Bolzoni, Adriano Bolzoni",Reteitalia,"Rutger Hauer, Carol Alt, Omar Sharif, Elliott Gould, Kabir Bedi, Stewart Bick, David Flosi, Brett Halsey, Peter Sands, Christopher Ahrens, Larry Dolgin, Dilum Nanayakkara, David L. Thompson, Richard Buckingham Clark, Donald Hodson","Ex-C.I.A. Agent Tom Burton (Rutger Hauer) goes to Morocco with businesswoman Christine Sanders (Carol Alt) to rescue her son, the kidnapped heir to a desert fortune.",4.5,510,"","","",,18,4,4.5,67.3264494638892,450
tt0105480,Il mistero di Storyville,Storyville,1992,1992-09-30,"Drama, Mystery, Thriller",113,USA,English,Mark Frost,"Frank Galbally, Robert Macklin",Davis Entertainment,"James Spader, Joanne Whalley, Jason Robards, Charlotte Lewis, Michael Warren, Piper Laurie, Michael Parks, Chuck McCann, Charles Haid, Chino 'Fats' Williams, Woody Strode, Jeff Perry, Galyn Görg, Justine Shapiro, George Cheung","While investigating his own blackmailing, a young politician uncovers his family's deep secrets.",5.8,1106,"",$ 422503,$ 422503,,13,11,5.8,80.0926239073571,580
tt0105839,Once Upon a Time in China II,Wong Fei Hung II: Nam yee tung chi keung,1992,1992-04-16,"Action, Adventure, Biography",113,Hong Kong,"Cantonese, English",Hark Tsui,"Tin-suen Chan, Tan Cheung",Golden Harvest Company,"Jet Li, Rosamund Kwan, Siu Chung Mok, David Chiang, Donnie Yen, Tielin Zhang, Xin Xin Xiong, Paul Fonoroff, Shi-Kwan Yen, Ka-Kui Ho, Michael Miller, Dion Lam, Shu-Kei Chow, Joseph Chi, Chuen Chiang","In the sequel to the Tsui Hark classic, Wong Fei-Hung faces The White Lotus society, a fanatical cult seeking to drive the Europeans out of China through violence, even attacking Chinese ...",7.4,8876,"","",$ 3924438,,44,34,7.4,105.478279969655,740
tt0106291,Anni 90 - Parte II,Anni 90 - Parte II,1993,1993-12-17,Comedy,113,Italy,Italian,Enrico Oldoini,Enrico Oldoini,Filmauro,"Christian De Sica, Massimo Boldi, Nino Frassica, Andrea Roncato, Carol Alt, Francesco Benigno, Anna Falchi, Nadia Rinaldi, Silvio Spaccesi, Tano Cimarosa, Giuseppe Affer, Stefano Antonucci, Dorothy Barresi, Tamara Battistoni, Carlo Bianchessi","",4.1,268,"","","",,1,,4.1,56.7165030608257,410
tt0106315,Aspen - Sci estremo,Aspen Extreme,1993,1993-01-22,"Drama, Romance, Sport",113,USA,English,Patrick Hasburgh,Patrick Hasburgh,Hollywood Pictures,"Paul Gross, Peter Berg, Finola Hughes, Teri Polo, William Russ, Trevor Eve, Martin Kemp, Stewart Finlay-McLennan, Tony Griffin, Julie Royer, Patrick T. Johnson, William McNamara, Gary Eimiller, Andy Mill, Bill Ferrell","T.J. and his friend Dexter quit their jobs in Detroit to become ski-instructors in Aspen. While T.J. advances to the most popular instructor of the school during the season, he has to take ...",6,2687,$ 14000000,$ 8041049,$ 8041049,,40,10,6,80.7264573127752,600
tt0106582,Cliffhanger - L'ultima sfida,Cliffhanger,1993,1993-10-29,"Action, Adventure, Thriller",113,"USA, Italy, France",English,Renny Harlin,"John Long, Michael France",Carolco Pictures,"Sylvester Stallone, John Lithgow, Michael Rooker, Janine Turner, Rex Linn, Caroline Goodall, Leon, Craig Fairbrass, Gregory Scott Cummins, Denis Forest, Michelle Joyner, Max Perlich, Paul Winfield, Ralph Waite, Trey Brownell",A botched mid-air heist results in suitcases full of cash being searched for by various groups throughout the Rocky Mountains.,6.4,117604,$ 70000000,$ 84049211,$ 255000211,60,209,99,6.4,92.9599159809369,640
tt0106856,Un giorno di ordinaria follia,Falling Down,1993,1993-05-27,"Crime, Drama, Thriller",113,"France, USA, UK","English, Spanish, Korean",Joel Schumacher,Ebbe Roe Smith,Alcor Films,"Michael Douglas, Robert Duvall, Barbara Hershey, Rachel Ticotin, Tuesday Weld, Frederic Forrest, Lois Smith, Joey Singer, Ebbe Roe Smith, Michael Paul Chan, Raymond J. Barry, D.W. Moffett, Steve Park, Kimberly Scott, James Keane",An ordinary man frustrated with the various flaws he sees in society begins to psychotically and violently lash out against them.,7.6,166651,$ 25000000,$ 40903593,$ 40903593,56,441,86,7.6,104.865695238112,760
tt0107278,Le journal de Lady M,Le journal de Lady M,1993,1994-03-30,Drama,113,"Switzerland, Spain, Belgium, France","French, Spanish",Alain Tanner,Myriam Mézières,Filmograph,"Myriam Mézières, Juanjo Puigcorbé, Félicité Wouassi, Nanou, Marie Peyrucq-Yamou, Gladys Gambie, Antoine Basler, Makeda, Albert Planes, Roger Mendri, Carlota Soldevila, Olivier Ceyssens","She's a beautiful gifted performer, but her work is not the sort that invites popular acclaim. Despite the fact that she is unlikely to become famous, she enjoys her life as a performer who...",5.6,169,"","","",,2,1,5.6,77.7414423731864,560
tt0107480,Madregilda,Madregilda,1993,1993-10-01,Drama,113,"Spain, Germany, France",Spanish,Francisco Regueiro,"Ángel Fernández Santos, Francisco Regueiro",Canal+ España,"José Sacristán, Juan Echanove, Barbara Auer, Kamel Cherif, Sandra Rodríguez, Israel Biedma, Antonio Gamero, Juan Luis Galiardo, Fernando Rey, Coque Malla, Manuel Amat, Rafael Díaz, Manuel Alexandre, Lina Canalejas, Felipe García Vélez","Madrid in the 40s: in an old neighborhood tavern, every first Friday of the month at nightfall Moor Hauma organizes a unique and secret card game. The Caudillo, Francisco Franco, meets with several friends of Africa's campaign for a game.",6.3,149,"","","",,1,,6.3,85.9478809418919,630
tt0108146,Sista dansen,Sista dansen,1993,1993-12-25,"Drama, Thriller",113,"Sweden, Norway, Denmark, France","Swedish, English",Colin Nutley,Colin Nutley,Eurimages,"Helena Bergström, Reine Brynolfsson, Ewa Fröling, Peter Andersson, Rikard Wolff, Philip Jackson, Peter Marshall, Stellan Skarsgård, Sverre Anker Ousdal, Ernst Günther, Anneli Alhanko, Lena Söderblom, Pia Johansson, Hans Bergström, Elsa Quennerstedt","Blackpool, a dancing contest, a dead woman. This is the opening scene of this movie, which then continues by telling us the story preceding this sad accident - or is it a murder? We will ...",5,657,"","","",,1,,5,71.7377506322229,500
