imdb_title_id,title,original_title,year,date_published,genre,duration,country,language,director,writer,production_company,actors,description,avg_vote,votes,budget,usa_gross_income,worlwide_gross_income,metascore,reviews_from_users,reviews_from_critics,avg_vote_10,avg_vote_100,avg_vote_1000
tt0342520,Helmiä ja sikoja,Helmiä ja sikoja,2003,2003-08-29,Comedy,113,Finland,Finnish,Perttu Leppä,Perttu Leppä,Talent House,"Mikko Leppilampi, Laura Birn, Amanda Pilke, Unto Helo, Timo Lavikainen, Jimi Pääkallo, Pekka Valkeejärvi, Outi Mäenpää, Antti Reini, Antti Virmavirta, Tomi Salmela, Sakari Kuosmanen, Matti Onnismaa, Risto Salmi, Marko Tiusanen","When their bootlegging father ends up in jail, four twenty-something brothers need money to pay his debts to local crooks. Next, their 9-year-old half-sister is dumped on their doorstep by ...",6.4,2883,EUR 1300000,"",$ 1799636,,8,2,6.4,85.3622308361158,640
tt0348884,Viva Laldjérie,Viva Laldjérie,2004,2004-04-07,Drama,113,"France, Algeria, Belgium","French, Arabic",Nadir Moknèche,Nadir Moknèche,BL Prod.,"Lubna Azabal, Biyouna, Nadia Kaci, Jalil Naciri, Abbes Zahmani, Florence Giorgetti, Lounès Tazairt, Akim Isker, Fawzi B. Saichi, Serge Avedikian, Nabil Abada, Kamel Abdelli, Cheb Abdou Jr., Samir Abdoun, Rabah Aridj","This movie portrays three women living in today's Algeria between modern society and Islamic fundamentalism, self-determination and dependence. Goucem, a young woman who works for a ...",5.7,509,"","",$ 704260,,12,7,5.7,79.4452345505501,570
tt0349467,Il colore del crimine,Freedomland,2006,2006-07-14,"Crime, Drama, Mystery",113,USA,"English, Italian",Joe Roth,"Richard Price, Richard Price",Revolution Studios,"Samuel L. Jackson, Julianne Moore, Edie Falco, Ron Eldard, William Forsythe, Aunjanue Ellis, Anthony Mackie, LaTanya Richardson Jackson, Clarke Peters, Peter Friedman, Domenick Lombardozzi, Aasif Mandvi, Philip Bosco, Fly Williams III, Portia",A black police detective must solve a strange case of a kidnapped boy and deal with a big racial protest.,5.1,15263,$ 37665000,$ 12512886,$ 14655628,43,192,102,5.1,68.8432004827649,510
tt0359013,Blade: Trinity,Blade: Trinity,2004,2005-03-04,"Action, Adventure, Fantasy",113,USA,"English, Esperanto",David S. Goyer,"David S. Goyer, Marv Wolfman",New Line Cinema,"Wesley Snipes, Kris Kristofferson, Dominic Purcell, Jessica Biel, Ryan Reynolds, Parker Posey, Mark Berry, John Michael Higgins, Callum Keith Rennie, Paul Levesque, Paul Anthony, Françoise Yip, Michael Anthony Rawlins, James Remar, Natasha Lyonne","Blade, now a wanted man by the FBI, must join forces with the Nightstalkers to face his most challenging enemy yet: Dracula.",5.9,163547,$ 65000000,$ 52411906,$ 131977904,38,538,90,5.9,90.6831278489358,590
tt0359942,Sayew,Sayew,2003,2003-03-13,"Comedy, Drama",113,Thailand,Thai,"Kongdej Jaturanrasamee, Kiat Songsanant","Kongdej Jaturanrasamee, Kiat Songsanant","","Pimpaporn Leenutapong, Nuntawat Arsirapojcharnakul, Anon Saisangcharn, Phintusuda Tunphairao, Jutarat Atthakorn","Tao is a real tomboy, who writes the reader's experiences column of a porn magazine, """"Sayew"""". Lacking experience and imagination to write her column, Tao decides to go meet real people so as to get first hand accounts.",6.4,116,"","","",,2,,6.4,85.4913047817527,640
tt0367046,Sin ton ni Sonia,Sin ton ni Sonia,2003,2003-06-13,Comedy,113,Mexico,Spanish,Hari Sama,Hari Sama,Columbia Pictures,"Juan Manuel Bernal, Cecilia Suárez, Mariana Gajá, José María Yazpik, Tara Parra, Donal Cortés, Blake Gibbons, Byron Thames, Eugenio Bartilotti, Mónica Huarte, René García, Úrsula Pruneda, Ericka Sttetner, Cecilia Tijerina, Eduardo Rey","Low-budget ensemble comedy by Mexican director Carlos Sama, in which the lives and relationships of a colourful array of charcters become irretrievably entwined: neurotic B-list TV director...",5.1,254,"","",$ 1639450,,3,1,5.1,71.3565758563253,510
tt0368933,Principe azzurro cercasi,The Princess Diaries 2: Royal Engagement,2004,2005-01-21,"Comedy, Family, Romance",113,USA,"English, Greek, French, Spanish",Garry Marshall,"Meg Cabot, Gina Wendkos",Walt Disney Pictures,"Anne Hathaway, Julie Andrews, Hector Elizondo, John Rhys-Davies, Heather Matarazzo, Chris Pine, Callum Blue, Kathleen Marshall, Tom Poston, Joel McCrary, Kim Thomson, Raven-Symoné, Larry Miller, Caroline Goodall, Sean O'Bryan","Now settled in Genovia, Princess Mia faces a new revelation: she is being primed for an arranged marriage to an English suitor.",5.8,72487,$ 40000000,$ 95170481,$ 134734481,43,165,78,5.8,83.8896749069903,580
tt0371310,Tetsujin niju-hachigo,Tetsujin niju-hachigo,2005,2005-03-19,"Action, Adventure, Fantasy",113,"Japan, USA",Japanese,Shin Togashi,"Hiroshi Saitô, Kota Yamada",Cross Media,"Hiroshi Abe, Alistair Abell, Doug Abrahams, Yû Aoi, James Blight, Don Brown, Trevor Devall, Michael Dobson, Brian Drummond, Akira Emoto, Mark Gibbon, Maryke Hendrikse, Masatô Ibu, Sôsuke Ikematsu, Teruyuki Kagawa","",5.2,132,"","",$ 1997,,5,13,5.2,73.2108631525775,520
tt0372361,Karmen,Karmen,2003,2003-06-25,"Drama, Romance",113,Russia,Russian,Aleksandr Khvan,"Yuriy Korotkov, Prosper Mérimée",Ministry of Culture of the Russian Federation,"Igor Petrenko, Olga Filippova, Yaroslav Boyko, Aleksandr Sheyn Jr., Ramil Sabitov, Aleksey Gorbunov, Vasiliy Sedykh, Tamara Sovchi, Aleksandr Mezentsev",A young and handsome prison guard falls in love with a beautiful lady-prisoner. She makes him hooked on sex and manipulates him into becoming a gang member. He kills and steals under her control.,6.3,144,"","","",,1,2,6.3,90.6377403676408,630
tt0372937,Into the Mirror,Geoul sokeuro,2003,2003-08-14,"Action, Fantasy, Horror",113,South Korea,Korean,Sung-ho Kim,Sung-ho Kim,CJ Entertainment,"Ji-Tae Yoo, Myung-Min Kim, Hye-na Kim, Ju-bong Gi, Kim Myeong Su, Yeong-jin Lee, Eun-pyo Jeong, Sung-ho Kim, Jeong-se Oh","An ex-cop, now working as a security guard in a shopping mall, tries to uncover the secret behind a series of mysterious deaths linked to mirrors.",6.4,3185,"","",$ 70277,,22,45,6.4,90.1803255105153,640
tt0377042,Buleora bombaram,Buleora bombaram,2003,2003-09-05,"Comedy, Romance",113,South Korea,Korean,Hang-jun Jang,"",CJ Entertainment,"Seung-woo Kim, Jeong-eun Kim, Ji-ru Sung, Kyeong-Beom Kim, Hee-Bong Byun, Hang-jun Jang, Hyun-Sung Jang, In-han Jang, Chan Jung, Kyeong-ae Kim, Yeong-im Kim, Hyo-ju Park","Seon-guk, is a stingy writer who gets kicked out of his own room when a coffee shop hostess, Hwa-jung moves in.",5.8,126,"","","",,1,,5.8,82.6192050544562,580
tt0377062,Il volo della fenice,Flight of the Phoenix,2004,2005-04-29,"Action, Adventure, Drama",113,USA,English,John Moore,"Lukas Heller, Scott Frank",Twentieth Century Fox,"Dennis Quaid, Tyrese Gibson, Giovanni Ribisi, Miranda Otto, Tony Curran, Sticky Fingaz, Jacob Vargas, Hugh Laurie, Scott Michael Campbell, Kevork Malikyan, Jared Padalecki, Paul Ditchfield, Martin Hindy, Bob Brown, Anthony Brandon Wong",Survivors of a plane crash in the Mongolian desert work together to build a new plane.,6.1,51109,$ 45000000,$ 21009180,$ 35021497,47,224,119,6.1,85.2113634060494,610
tt0377834,Días de fútbol,Días de fútbol,2003,2003-09-19,"Adventure, Comedy, Sport",113,Spain,"Spanish, English",David Serrano,"Mischa Alexander, David Serrano",Telespan 2000,"Alberto San Juan, Ernesto Alterio, Natalia Verbeke, Pere Ponce, Fernando Tejero, Roberto Álamo, Secun de la Rosa, Luis Bermejo, Nathalie Poza, María Esteve, Lola Dueñas, Pilar Castro, Diego Martín, Eva Santolaria, Daniel Ruiperez",A group of thirty-year-old friends try to change their sad existence setting up a football team like when they were young to see if they finally win something in their life's.,6.2,2607,EUR 2600000,"",$ 14117202,,8,5,6.2,89.7170945474219,620
tt0379159,Abjad,Abjad,2003,2003-09-08,"Drama, Romance",113,"Iran, France",Persian,Abolfazl Jalili,Abolfazl Jalili,Novem Productions,"Mehdi Morady, Abdolreza Akbari, Gholamreza Tabatabai, Sharare Roohy, Fariba Khademy, Mina Molania","Iran, late 70s. Young Emkan falls in love with Maasoum, the mysterious daughter of the owner of the local movie theater. The revolution and the war break out. Maasoum escapes with her ...",6.3,104,"","","",,2,2,6.3,88.883739394484,630
tt0382804,Liberi,Liberi,2003,2003-09-03,"Drama, Romance",113,Italy,Italian,Gianluca Maria Tavarelli,"Angelo Carbone, Leonardo Fasoli",Fandango,"Elio Germano, Nicole Grimaudo, Anita Zagaria, Rosa Pianeta, Myriam Catania, Sebastiano Nardone, Luigi Ciavarelli, Francesco De Vito, Luigi Maria Burruano, Nemesio 'Mani' Espirito, Camillo la Gatta, Ivan Laterzo, Riccardo Padovano, Valerio Palusci, Alessandro Setta","",6.7,204,"","",$ 210603,,3,2,6.7,90.612192582625,670
tt0385077,Man Dancin',Man Dancin',2003,2004-02-20,Drama,113,UK,English,Norman Stone,"Sergio Casci, Norman Stone",1 A Productions,"Alex Ferns, Tom Georgeson, Kenneth Cranham, James Cosmo, Jenny Foulds, Gerald Lepkowski, Ron Donachie, Cas Harkins, Tam White, Stewart Porter, Sarah Finch, Gavin Mitchell, James Bryce, Alan Carrick, Fraser Ellis","After serving a jail term, tough Jimmy Kerrigan returns to his derelict Glasgow quarter, wanting a better, legal life for himself and his loved-ones. Not easy, as brother Terry is addicted ...",5.8,211,"","","",,10,5,5.8,78.3491286465713,580
tt0385752,La bussola d'oro,The Golden Compass,2007,2007-12-14,"Adventure, Family, Fantasy",113,"UK, USA","English, Icelandic, Russian, French",Chris Weitz,"Chris Weitz, Philip Pullman",New Line Cinema,"Nicole Kidman, Daniel Craig, Dakota Blue Richards, Ben Walker, Freddie Highmore, Ian McKellen, Eva Green, Jim Carter, Tom Courtenay, Ian McShane, Sam Elliott, Christopher Lee, Kristin Scott Thomas, Edward de Souza, Kathy Bates","In a parallel universe, young Lyra Belacqua journeys to the far North to save her best friend and other kidnapped children from terrible experiments by a mysterious organization.",6.1,176725,$ 180000000,$ 70107728,$ 372234864,51,710,262,6.1,81.9230953011328,610
tt0389722,30 giorni di buio,30 Days of Night,2007,2008-02-08,"Action, Horror, Thriller",113,"USA, New Zealand",English,David Slade,"Steve Niles, Stuart Beattie",Columbia Pictures,"Josh Hartnett, Melissa George, Danny Huston, Ben Foster, Mark Boone Junior, Mark Rendall, Amber Sainsbury, Manu Bennett, Megan Franich, Joel Tobeck, Elizabeth Hawthorne, Nathaniel Lees, Craig Hall, Chic Littlewood, Peter Feeney","After an Alaskan town is plunged into darkness for a month, it is attacked by a bloodthirsty gang of vampires.",6.6,161844,$ 30000000,$ 39569000,$ 75513170,53,582,302,6.6,87.040044660057,660
tt0396445,Amemasu no kawa,Amemasu no kawa,2004,2004-11-13,Drama,113,Japan,Japanese,Itsumichi Isomura,"Kenichi Kawakam, Hirotoshi Kobayashi",Kindai Eiga Kyokai,"Hiroshi Tamaki, Haruka Ayase, Shunsuke Matsuoka, Hiroshi Abe, Miki Nakatani, Akira Emoto, Ayumi Itô, Yuriko Hoshi, Mirai Shida, Kenta Suga","8-year old boy, Shinpei, who loves fishing and painting, lives with his beautiful mother, surrounded by nature. His mother, Satsuki, has a weak constitution and lost her husband years ago. ...",5.8,124,"","","",,,,5.8,78.4225769143075,580
tt0397065,La maschera di cera,House of Wax,2005,2005-05-27,"Horror, Thriller",113,"Australia, USA",English,Jaume Collet-Serra,"Charles Belden, Chad Hayes",Warner Bros.,"Elisha Cuthbert, Chad Michael Murray, Brian Van Holt, Paris Hilton, Jared Padalecki, Jon Abrahams, Robert Ri'chard, Dragicia Debert, Thomas Adamson, Murray Smith, Sam Harkess, Damon Herriman, Andy Anderson",A group of unwitting teens are stranded near a strange wax museum and soon must fight to survive and keep from becoming the next exhibit.,5.3,113634,$ 40000000,$ 32064800,$ 68766121,41,609,111,5.3,72.8854016776147,530
tt0397229,Venti trenta quaranta - L'età delle donne,Er shi san shi si shi,2004,2004-03-05,"Comedy, Drama, Music",113,"Hong Kong, Taiwan, Japan","Mandarin, Cantonese",Sylvia Chang,"Sylvia Chang, Sylvia Chang",Columbia Pictures Film Production Asia,"Sylvia Chang, Rene Liu, Angelica Lee, Kate Yeung, Tony Ka Fai Leung, Anthony Chau-Sang Wong, Richie Jen, Hung-Liang Chang, Bo-lin Chen, Shirwenna Ker, Chih-Hsiang Ma, Sticky-Rice, Phoenix Chang, Timothy Chao, Joanne Tseng","Three women in different stages of their lives - 20, 30, 40 - face the hardships of the female existence.",6.6,1202,"","",$ 704550,,8,5,6.6,90.6897223693509,660
tt0398165,L'altra sporca ultima meta,The Longest Yard,2005,2005-07-29,"Comedy, Crime, Sport",113,USA,English,Peter Segal,"Al Ruddy, Tracy Keenan Wynn",Paramount Pictures,"Adam Sandler, Chris Rock, Burt Reynolds, Nelly, Michael Irvin, Walter Williamson, Bill Goldberg, Terry Crews, Bob Sapp, Nicholas Turturro, Dalip Singh, Lobo Sebastian, Joey Diaz, Steve Reevis, David Patrick Kelly",Prison inmates form a football team to challenge the prison guards.,6.4,159468,$ 82000000,$ 158119460,$ 191466556,48,337,139,6.4,83.6356280306209,640
tt0404163,Even Money,Even Money,2006,2008-11-19,"Crime, Drama",113,"USA, Germany",English,Mark Rydell,Robert Tannen,Yari Film Group (YFG),"Kim Basinger, Kelsey Grammer, Michael Eaves, Forest Whitaker, Texas Battle, Nick Cannon, Charles Robinson, Ray Liotta, Carson Brown, Jay Mohr, Grant Sullivan, Jamie Marsh, Shanelle Gray, Tim Roth, Suzanne Covington",Gambling addiction bring the stories of three otherwise unconnected people together as it destroys each of their lives.,5.9,4279,"",$ 64458,$ 111974,34,31,49,5.9,80.7173907220629,590
tt0404215,Mafia,Mafia,2002,2002-07-23,"Action, Romance",113,Egypt,"Arabic, Italian",Sharif Arafah,Medhat El Adl,Adl Group,"Ahmed el-Sakka, Mostafa Shaaban, Mona Zaki, Ahmad Rizq, Aboelhassan Abbas, Tawfik Abdel Hamid, Hussein Fahmy, Gamal Ismail, Saeed Tarabek","The movie revolves around the problem of an important principle that has been missing from the minds and hearts of many Egyptian youth nowadays, that is loyalty to the motherland. The movie...",6.2,1479,"","",$ 2748744,,1,,6.2,85.8241571313798,620
tt0407205,The Sisters - Ogni famiglia ha i suoi segreti,The Sisters,2005,2008-06-26,Drama,113,USA,English,Arthur Allan Seidelman,"Richard Alfieri, Richard Alfieri",CSC Sisters,"Elizabeth Banks, Maria Bello, Erika Christensen, Steven Culp, Tony Goldwyn, Mary Stuart Masterson, Eric McCormack, Alessandro Nivola, Chris O'Donnell, Rip Torn, Greg Foote, Carolyn S. Chambers, Ed Ragozzino, Barbara Bechtel, Tegue DeLeon","Based on Anton Chekov's """"The Three Sisters"""" about siblings living in a college town who struggle with the death of their father and try to reconcile relationships in their own lives.",6.1,920,"","",$ 4784,40,19,18,6.1,87.693259371241,610
tt0407568,Mei li de xi yi ji,Mei li de xi yi ji,2004,2005-07-08,"Comedy, Drama",113,Malaysia,"Cantonese, Mandarin",James Lee,James Lee,Doghouse 73 Pictures,"Yuhang Ho, Berg Lee, Danny Lim, Bok Lai Loh, Len Siew Mee, Patrick Teoh","Teoh is dumped by his live-in girlfriend who takes all her possessions, including the washing machine. He buys a second-hand machine, which is when things go wrong.",5.8,144,SGD 35000,"","",,6,11,5.8,82.0205139180832,580
tt0408524,Bad News Bears - Che botte se incontri gli orsi!,Bad News Bears,2005,2005-07-22,"Comedy, Sport",113,USA,"English, Spanish",Richard Linklater,"Bill Lancaster, Glenn Ficarra",Paramount Pictures,"Billy Bob Thornton, Greg Kinnear, Marcia Gay Harden, Sammi Kane Kraft, Ridge Canipe, Brandon Craggs, Jeffrey Davies, Timmy Deters, Carlos Estrada, Emmanuel Estrada, Troy Gentile, Kenneth 'K.C.' Harris, Aman Johal, Tyler Patrick Jones, Jeffrey Tedmori",A grizzled little league coach tries to turn his team of misfits into champs.,5.8,20343,$ 35000000,$ 32868349,$ 34252847,65,123,107,5.8,76.0845563565204,580
tt0410666,State of Wonder,State of Wonder,1984,1984,Drama,113,UK,English,Martin Donovan,Martin Donovan,"","Nigel Court, David Meyer, Tony Meyer, James Telfer, Annie Chaplin, Martin Donovan, Anja Schüte, Michael Halphie, David Capri","Story of a naive and simple country boy, exposed to the conflicts of war within his local community, and his search for peace.",7.3,121,"","","",,6,,7.3,102.364814993735,730
tt0415819,Geu nom-eun meot-iss-eoss-da,Geu nom-eun meot-iss-eoss-da,2004,2004-06-23,"Comedy, Romance",113,South Korea,Korean,Hwan-kyung Lee,"Gwiyeoni, Seong-hun Kim",BM Entertainment,"Seung-heon Song, Da-bin Jeong, Ki-woo Lee, Hae-su Ahn, Yeong-hun Kim, Min-hyeok Lee, Jun-ha Jeong, Yun-bae Park, Bo-yeon Kim, Eun-soo Kim, Ji-hye Kim, Min-ah Park, Han Seo","A girl insults a bully on internet. He starts calling her repeatedly and finally finds her. On an escape attempt she trips and their lips meet. Being the first to kiss him, she now has to promise to marry him. Is life over or...?",6.3,1277,$ 2500000,"","",,12,2,6.3,85.2068418330287,630
tt0416073,Neukdaeui yuhok,Neukdaeui yuhok,2004,2004-07-23,"Action, Drama, Romance",113,South Korea,Korean,Tae-gyun Kim,"Gwiyeoni, Geon-hyang Kang",Sidus,"Han Sun Jo, Dong-Won Gang, Chung-Ah Lee, Da-hye Jeong, Ho-jin Chun, Ji-Yeong Hong, Woo-hyeok Jeong, Bo-yeon Kim, Eung-soo Kim, Cheon-hee Lee, Jung-Hee Nam","Han-kyung comes to town to live with her mom. Attracted to her pure charm, the most popular guys Hae-won and Tae-sung fight each other for her.",6.3,780,"","","",,14,3,6.3,90.598671061451,630
tt0416854,Insaat,Insaat,2003,2003-11-21,"Comedy, Crime, Drama",113,Turkey,Turkish,"Ömer Vargi, Tolgay Ziyal","Serdar Tantekin, Ömer Vargi",Filma-Cass,"Emre Kinay, Sevket Çoruh, Suna Pekuysal, Ahmet Mümtaz Taylan, Yesim Büber, Binnur Kaya, Tuncay Beyazit, Ali Yayli, Murat Bavli, Sehsuvar Aktas, Yildirim Bayazit, Hüseyin Baylan, Gökhan Bozkurt, Bahtiyar Engin, Osman Gidisoglu",The series of extreme events happens to two construction workers when one of them discovers something bad about their boss.,7.2,3376,"","",$ 936443,,4,,7.2,99.2254357381561,720
tt0420223,Vero come la finzione,Stranger Than Fiction,2006,2007-02-02,"Comedy, Drama, Fantasy",113,USA,English,Marc Forster,Zach Helm,Columbia Pictures,"Will Ferrell, William Dick, Guy Massey, Martha Espinoza, T.J. Jagodowski, Peter Grosz, Ricky Adams, Christian Stolte, Denise Hughes, Peggy Roeder, Tonray Ho, Tony Hale, Maggie Gyllenhaal, Danny Rhodes, Helen Young","I.R.S. auditor Harold Crick suddenly finds himself the subject of narration only he can hear: narration that begins to affect his entire life, from his work, to his love-interest, to his death.",7.5,215310,$ 30000000,$ 40660952,$ 53653224,67,595,252,7.5,102.290571164192,750
tt0422907,Palermo Hollywood,Palermo Hollywood,2004,2004-10-14,Drama,113,Argentina,Spanish,Eduardo Pinto,"Federico Finkielstain, Brian Maya",No Problem Cine,"Brian Maya, Matías Desiderio, Manuela Pal, Edgardo Nieva, Cristina Banegas, Martín Adjemián, Pablo Tagliani, David Di Napoli, Luis María Montanari, Hernán Dalo, Miguel Dedovich, Azul Lombardía, Lautaro Delgado, Alicia Schilman, Maya Lesca",Two petty criminal party boys get in over their heads when a kidnapping goes awry.,5.3,124,"","",$ 14087,,,5,5.3,75.2726455759344,530
tt0423293,Superstar Gam Sa-Yong,Superstar Gam Sa-Yong,2004,2004-09-17,"Action, Drama",113,South Korea,Korean,Jong-hyun Kim,Jong-hyun Kim,Sidus,"Beom-su Lee, Jin-Seo Yoon, Yoo Gong, Hyeok-jae Lee, Seung-su Ryu, Jung-woo Ha, Hang-Seon Jang, Jun-ha Jeong, Hie-bong Jo, Hyeok Kim, Hyun-seok Kim, Mi-seong Kim, Su-mi Kim, Jeong-jun Lee, Su-min Oh","A Dream Comes True - Superstar Gam Sa-yeong Height: 169cm Weight: 70kg A left-hander with small hands The underdog pitcher who threw his best - Gam Sa-yeong. The year is 1982, the first ...",6.8,155,"","","",,2,2,6.8,93.6833120492772,680
tt0427543,A Million Little Pieces,A Million Little Pieces,2018,2019-12-06,Drama,113,USA,English,Sam Taylor-Johnson,"James Frey, Aaron Taylor-Johnson",Momentum Pictures,"Aaron Taylor-Johnson, Billy Bob Thornton, Odessa Young, Giovanni Ribisi, Juliette Lewis, Dash Mihok, Charles Parnell, Ryan Hurst, David Dastmalchian, Tom Amandes, Charlie Hunnam, Andy Mackenzie, Eugene Byrd, Andy Buckley, Keith Barber",A drug dependent young man faces his past and his inner demons after he is interned in an institution for addicted.,6.2,1551,"","",$ 89825,45,36,23,6.2,89.9179134900256,620
tt0430051,Le particelle elementari,Elementarteilchen,2006,2006-04-21,"Drama, Romance",113,Germany,"German, English",Oskar Roehler,"Michel Houellebecq, Oskar Roehler",Medienfonds GFP,"Moritz Bleibtreu, Christian Ulmen, Martina Gedeck, Franka Potente, Nina Hoss, Uwe Ochsenknecht, Corinna Harfouch, Tom Schilling, Thomas Drechsel, Herbert Knaup, Michael Gwisdek, Jasmin Tabatabai, Ulrike Kriener, Hermann Beyer, Jelena Weber","Two half brothers in Berlin, 30+, one an introverted scientist, the other a sexually frustrated teacher, have no love life. That's about to change.",6.6,7783,EUR 6000000,"",$ 6628558,,26,55,6.6,93.7049835061839,660
tt0433927,A golpes,A golpes,2005,2005-11-04,Drama,113,Spain,Spanish,Juan Vicente Córdoba,"Juan Vicente Córdoba, María Reyes Arias",Canal+ España,"Natalia Verbeke, Daniel Guzmán, Juana Acosta, María Vázquez, Marian Álvarez, Zay Nuba, María Reyes Arias, Alfredo Villa, Carlos Kaniowsky, Andrés Gertrúdix, Javier Pereira, Adrián Gordillo, Jero García, Christopher de Andrés, Manuel Pinto","The story unfolds around five friends, Juanita, Nitzia, María, Vicky and Mena, who are under the age of 25. They are dissatisfied with the inequality and injustice that exists in the world....",4.6,206,"","",$ 174712,,3,,4.6,61.9634722038566,460
tt0434292,Princesas,Princesas,2005,2006-10-06,Drama,113,Spain,Spanish,Fernando León de Aranoa,Fernando León de Aranoa,Reposado Producciones,"Candela Peña, Micaela Nevárez, Mariana Cordero, Llum Barrera, Violeta Pérez, Mònica Van Campen, Flora Álvarez, María Ballesteros, Alejandra Lorente, Luis Callejo, Antonio Durán 'Morris', Pere Arquillué, Pepa Aniorte, Alberto Ferreiro, Enrique Villén",Friendship and love in the world of prostitution in Madrid.,7,4776,"",$ 29472,$ 8446185,64,22,46,7,99.4029320776569,700
tt0437273,Kaksipäisen kotkan varjossa,Kaksipäisen kotkan varjossa,2005,2005-09-09,"Drama, History, Musical",113,Finland,Finnish,Timo Koivusalo,Timo Koivusalo,Artista Filmi Oy,"Vesa-Matti Loiri, Mikko Leppilampi, Helena Vierikko, Anneli Saaristo, Tapio Liinoja, Anna-Kaisa Tommila, Vesa Vierikko, Eriikka Väliahde, Esko Nikkari, Seela Sella, Antti Luusuaniemi, Sampo Sarkola, Mikko Nousiainen, Raimo Grönberg, Harri Ekonen",A story about a Finnish poet in the early 20th century under the Russian regime.,3.1,337,EUR 1570000,"",$ 536737,,2,,3.1,44.5996955549094,310
tt0438314,The Path of Evil,The Path of Evil,2005,2005-12-27,"Drama, Horror",113,USA,English,Brad Goodman,"Justin Ament, Brad Goodman",JBA Productions,"Justin Ament, Ryan Deal, Carrie Finklea, Don Alder, Katie O'Grady, Thomas Nabhan, Brad Goodman, Ted Pfeifer, Eric Newsome, Curt Hanson, Betty Moyer, Brennan Bailey, Nicole Karnes, Wendy Watson, Jason Lawrence",Twenty Years ago the small coastal town of Devils Lake fell victim to a bizarre string of brutal murders. Deputy Jake Barker's parents were among the victims. As suddenly as the killings ...,3.6,176,$ 150000,"","",,4,5,3.6,51.510799144643,360
tt0439477,Boutique,Boutique,2004,2004-03-05,Drama,113,Iran,Persian,Hamid Nematollah,Hamid Nematollah,Hedayat Film,"Mohammad Reza Golzar, Golshifteh Farahani, Reza Rooygari, Ali Alaei, Hamed Behdad, Afsaneh Chehreh Azad, Saba Kamali, Kaveh Kavian, Akbar Moazezi, Alireza Nayini, Yousef Teymouri","A clothing store worker (Jahan) meets a poor girl named Eti. Jahan tries to help the girl and solve her problems, but...",6.5,2129,"","","",,1,8,6.5,87.676253432827,650
tt0439884,Tian xia wu zei,Tian xia wu zei,2004,2004-12-09,"Action, Crime, Drama",113,"China, Hong Kong",Mandarin,Xiaogang Feng,"Chia-Lu Chang, Xiaogang Feng",Focus Films,"Andy Lau, Rene Liu, You Ge, Baoqiang Wang, Bingbing Li, Fusheng Chen, Wei Fan, Yuanzheng Feng, Biao Fu, Ka Tung Lam, Lei Lee, Fan Xu, Yong You, Hanyu Zhang, Yue Zhang",A con-team couple (Andy Lau & Rene Liu) head west after taking a city businessman for his BMW. But an encounter with a naive young carpenter travelling home with his life savings challenges their fate as thieves.,7.2,4564,CNY 1300000,"",$ 662164,,25,14,7.2,100.02785533584,720
tt0443570,Liebesleben,Liebesleben,2007,2007-11-08,Drama,113,"Germany, Israel","English, French",Maria Schrader,"Maria Schrader, Zeruya Shalev",Bayerischer Rundfunk (BR),"Neta Garty, Rade Serbedzija, Tovah Feldshuh, Stephen Singer, Ishai Golan, Aryeh Moskona, Caroline Silhol, Assi Dayan, Clara Khoury, Gillian Buick, Zach Cohen, Leonie Kranzle, Shlomit Mandel, Zeruya Shalev, Esther Zewko",A married young academic falls under the sexual thrall of a much older man whose air of jaded ennui conceals a secret desire for vengeance...,6,416,"","",$ 1186250,,4,19,6,82.8522144604879,600
tt0444915,Tathastu,Tathastu,2006,2006-05-13,"Crime, Drama, Thriller",113,India,Hindi,Anubhav Sinha,Yash Keswani,Karma Entertainment,"Sanjay Dutt, Ameesha Patel, Jaya Prada, Gulshan Grover, Darshan Jariwala, Amit Divatia, Gagan Gupta, Ravi Jhankal, Manoj Pahwa, Yash Pathak, Anup Soni, Lalit Tiwari","A man captures a hospital and its staff for his child's operation, which turns into a hostage situation and a media circus.",4.5,443,"","",$ 21374,,9,2,4.5,58.5697476402043,450
tt0450099,Qing ren jie,Qing ren jie,2005,2005-02-13,"Drama, Romance",113,China,Mandarin,Jianqi Huo,"Wu Si, Renjie Zhang",PKU Starlight Group,"Wei Zhao, Yi Lu, Minjie Cui, Yujia Ding, Mu Liu, Xiaoying Song, Dianhua Wang, Jiadong Xing, Ren Yi, Miao Yu, Qian Zhang, Yijing Zhang, Yaying Zhao","A love story that should not have happened. But the Great Cultural Revolution fathered it. As memorable as Romeo and Juliet, their love tied with the same intrusion from their families ¨C ...",6.8,362,"","","",,4,7,6.8,91.3098584175928,680
