imdb_title_id,title,original_title,year,date_published,genre,duration,country,language,director,writer,production_company,actors,description,avg_vote,votes,budget,usa_gross_income,worlwide_gross_income,metascore,reviews_from_users,reviews_from_critics,avg_vote_10,avg_vote_100,avg_vote_1000
tt2404519,3G: A Killer Connection,3G: A Killer Connection,2013,2013-03-15,"Horror, Sci-Fi, Thriller",125,India,"English, Hindi","Sheershak Anand, Shantanu Ray Chhibber","Sheershak Anand, Shantanu Ray Chhibber",Eros Entertainment,"Neil Nitin Mukesh, Sonal Chauhan, Mrinalini Sharma, Asheesh Kapur, Prithviraj Choudhary, Kaajal Vashisht, Sailesh Singh, Vishaarad Sharan, Konrad Thorpe, Kayaan C. Contractor, Vanah Kelly, Devraj Das, Shantanu Ray Chhibber, Amol Lal, Sushila Ramesh",Sam purchase's a second hand cellphone and starts getting mysterious calls.,3.6,1103,"","","",,13,10,3.6,52.8090834322138,360
tt2530824,Saghira ala el-hob,Saghira ala el-hob,1966,1966,"Comedy, Musical, Romance",125,Egypt,Arabic,Neyazi Mustafa,"Abdel Hai Adib, Abul-Suood El-Ibyari","","Rushdi Abazah, Nadia El Gendy, Nour El-Demerdash, Samir Ghanem, Suad Husni, Zeinab Sedky",A Young woman who wants to be an actress pretends to be an 13 years old girl in order to win a role in a tv show .,7,636,"","","",,,,7,96.9481206383331,700
tt2551510,Blood Slaughter Massacre,Blood Slaughter Massacre,2013,2013-05-19,"Horror, Thriller",125,USA,English,Manny Serrano,"Louie Cortes, Manny Serrano",Devarez Films,"Matt W. Cody, Mike Roche, Byron M. Howard, Carmela Hayslett, Danielle Lenore, Melissa Roth, Bradley Creanzo, Loretta Vendetta, Samantha Quintana, Natasha Lee, Patrick Devaney, Christopher J. Murphy, Daniel Perez, David Garelik, Curtis Wilkerson","10 years ago, Officer James Fincher narrowly escaped being killed at the hands of a masked maniac. Now a Detective, a new string of murders has begun in Havenwood. Has the Ripper returned?",3.1,153,$ 50000,"","",,11,10,3.1,41.0638179983716,310
tt2553908,Cinco de Mayo: La batalla,Cinco de Mayo: La batalla,2013,2013-05-03,"Drama, History, War",125,Mexico,"Spanish, French, English",Rafa Lara,Rafa Lara,Estudios Splendor Omnia,"Christian Vazquez, Kuno Becker, Liz Gallardo, William Miller, Javier Oliván, J.C. Montes-Roldan, Álvaro García, Mauricio Isaac, Ginés García Millán, Angélica Aragón, Mario Zaragoza, Daniel Martínez, Javier Díaz Dueñas, Jorge Luis Moreno, Pascacio López","On May 5th, 1862, a few thousand Mexican soldiers put their lives on the line against the world's largest and most powerful army in one legendary battle for freedom and for Mexico.",6.2,820,$ 10000000,$ 173472,$ 2794852,,4,12,6.2,86.9960389128996,620
tt2713324,5 cm,5 cm,2012,2012-12-12,"Adventure, Drama, Romance",125,Indonesia,Indonesian,Rizal Mantovani,Donny Dhirgantoro,Soraya Intercine Film PT,"Herjunot Ali, Fedi Nuril, Pevita Pearce, Didi Petet, Saykoji, Raline Shah, Denny Sumargo","Five best friends try to find out what true friendship is by climbing Mount Semeru, the highest peak in Java.",7.2,1709,"","","",,4,2,7.2,98.5987255458959,720
tt2758890,Welcome to New York,Welcome to New York,2014,2014-05-22,Drama,125,"USA, France","English, French",Abel Ferrara,"Abel Ferrara, Christ Zois",Belladonna Productions,"Gérard Depardieu, Jacqueline Bisset, Shanyn Leigh, Charlotte Silvera, Ronald Guttman, Elizabeth Kemp, Drena De Niro, Anna Lakomy, Samantha Opitz, Ilinca Kiss, Paul Calderon, Paul Hipp, Kathryn Lill, Caroline Huet, Lucy Campbell",Mr. Devereaux is a powerful man. A man who handles billions of dollars every day. A man who controls the economic fate of nations. A man driven by a frenzied and unbridled sexual hunger. A ...,5.4,3460,"","",$ 324253,71,27,90,5.4,75.3705076067856,540
tt2800340,On the Milky Road: Sulla Via Lattea,On the Milky Road,2016,2017-05-11,"Comedy, Drama, Fantasy",125,"Serbia, UK, USA, Argentina","Serbian, Italian",Emir Kusturica,Emir Kusturica,Pinball London,"Emir Kusturica, Monica Bellucci, Sloboda Micalovic, Predrag 'Miki' Manojlovic, Aleksandar Sasa Saric, Bajram Severdzan, Novak Bilbija, Petar Mircevski, Vitomir Jefic, Milojka Andric, Ninoslav Culum, Milorad Ukropina, Stevan Uscumlic, Elvedin Musanovic, Zoran Cvijanovic","A story that stretches across war, blossoming love and living as a recluse.",6.4,3887,"","",$ 1075258,,20,52,6.4,89.4702713816442,640
tt2912144,Dast-neveshtehaa nemisoosand,Dast-neveshtehaa nemisoosand,2013,2013-11-01,Drama,125,Iran,Persian,Mohammad Rasoulof,Mohammad Rasoulof,"","Anonymous, Anonymous, Ramin Parham","Khosrow and Morteza set out on a mission to kill someone. The assassination ought to be arranged as a suicide. At the last minute however, they are obliged to change their initial plans...",7.2,831,"",$ 6295,$ 6295,88,6,37,7.2,105.015116851191,720
tt2926810,ABCs of Death 2,ABCs of Death 2,2014,2014-10-02,"Comedy, Fantasy, Horror",125,"USA, New Zealand, Canada, Israel, Japan, Nigeria","English, Japanese, Hebrew, Portuguese, French, Arabic, Filipino, German","Rodney Ascher, Julian Barratt","Ant Timpson, Ant Timpson",Arts+Labor,"Eric Jacobus, Andy Nyman, Simon Barrett, Teela LaRoux, Kelsey Hudson, Stefanie Wood, Xin Sarith Wuku, Ben Maccabee, Jason Cabell, Josh Ethier, David Gutierrez, Giovannie Dixon, Julian Barratt, Will Adamsdale, Matthew Steer",Another 26-chapter anthology that showcases death in all its vicious wonder and brutal beauty.,5.4,7823,"",$ 7171,$ 7171,53,37,137,5.4,71.6759848549893,540
tt2937898,1981: Indagine a New York,A Most Violent Year,2014,2016-02-04,"Action, Crime, Drama",125,"USA, United Arab Emirates","English, Spanish",J.C. Chandor,J.C. Chandor,Before The Door Pictures,"Oscar Isaac, Elyes Gabel, Jessica Chastain, Lorna Pruce, Christopher Abbott, Matthew Maher, Albert Brooks, Jerry Adler, Quinn Meyers, Chester Jones III, David Oyelowo, Ashley Williams, Glenn Fleshler, Jimmy Palumbo, Daisy Tahan","In New York City 1981, an ambitious immigrant fights to protect his business and family during the most dangerous year in the city's history.",7,65243,$ 20000000,$ 5749134,$ 12007070,79,220,378,7,104.396865932362,700
tt3008034,Four Sisters and a Wedding,Four Sisters and a Wedding,2013,2013-06-26,"Comedy, Drama",125,Philippines,"Filipino, Tagalog",Cathy Garcia-Molina,"Vanessa R. Valdez, Vanessa R. Valdez",ABS-CBN Film Productions,"Brenna Garcia, Bea Alonzo, Bea Basa, Veyda Inoval, Arbey Alegado, Shaina Magdayao, Coney Reyes, Sam Milby, Enchong Dee, Angeline Quinto, Toni Gonzaga, Carmi Martin, Boboy Garovillo, Janus del Prado, Angel Locsin","Four sisters try to stop the wedding of their younger brother and in doing so, all discover resentments among each other.",7.3,592,"","",$ 3351356,,2,2,7.3,99.3930788821245,730
tt3145558,Zhi qi,Zhi qi,2013,2013-02-08,"Drama, Sport",125,Taiwan,Mandarin,"Po-jui Chang, Hsun-Wei David Chang","Po-jui Chang, Shang-Min Yu",Vie Vision Pictures,"Shu-yao Kuo, Kaiser Chuang, Pink Yang, Yawei Basang, Akio Chen, Yu-Fang Chen, Hou Tao Hsiao, Yuki Hsu, Meng-Chieh Kao, Yu-Shan Kao, Cindy Mong, Ming-Hua Pai, Hannah Quinlivan, Belle Yu",A girl makes friends for life when she joins the tug of war team at her new school.,6.4,214,"","","",,,1,6.4,89.2907998665883,640
tt3152624,Un disastro di ragazza,Trainwreck,2015,2015-09-17,"Comedy, Drama, Romance",125,"USA, Japan","English, Mandarin",Judd Apatow,Amy Schumer,Universal Pictures,"Colin Quinn, Devin Fabry, Carla Oudin, Amy Schumer, Josh Segarra, Ryan Farrell, Robert E. Torres, Jim Florentine, Robert Kelly, Dan Soder, John Cena, Dave Attell, Vanessa Bayer, Tilda Swinton, Randall Park","Having thought that monogamy was never possible, a commitment-phobic career woman may have to face her fears when she meets a good guy.",6.2,127731,$ 35000000,$ 110212700,$ 140795793,75,407,355,6.2,87.375359810985,620
tt3181638,Courting Chaos,Courting Chaos,2014,2014-10-01,Comedy,125,USA,English,Alan Clay,Alan Clay,Artmedia,"Rachelle Dimaria, Alastair Bayardo, Nancy La Scala, Jessica Howell, Tristan Cunningham, Jeff Bee, Blake Young-Fountain, Amir Levi, George Loomis, Sandie West, Travis Richey, Naomi Glick, Josh Brodis, Christine Barger, Houston Rhines",An award winning romantic comedy in which a Beverly Hills girl falls for a Venice Beach street clown called Chaos and she must overcome her inhibitions and become a clown herself for the relationship to survive.,5.7,104,$ 180000,"","",,6,,5.7,82.2004953338265,570
tt3187080,Potugadu,Potugadu,2013,2013-09-14,"Comedy, Drama",125,India,Telugu,Pawan Wadeyar,"Sreedhar Seepana, Pawan Wadeyar",Ramalakshmi Cine Creations,"Manoj Kumar Manchu, Simran Kaur Mundi, Sakshi Chaudhary, Anupriya Goenka, Krishna Murali Posani, Chandramohan, Ali, Sayaji Shinde, Raghu Babu, Satyam Rajesh, Narsing Yadav, Srinivasa Reddy, Kasi Vishwanath, Pawan Wadeyar","Govinda Naama Sastry (Manoj Manchu) is a young man who decides to commit suicide. He goes to a lonely spot and decides to have one last drink. At about the same time, Venkata Rathnam (...",5.7,831,"","","",,,1,5.7,82.2771617735923,570
tt3224258,The Legend of Michael Mishra,The Legend of Michael Mishra,2016,2016-08-05,"Comedy, Drama",125,India,"",Manish Jha,"Anshuman Chaturvedi, Manish Jha",Eye Candy Films,"Aditi Rao Hydari, Arshad Warsi, Boman Irani, Saloni Batra, Gyanendra Tripathi, Yuri Suri, Gulfam Khan, Kayoze Irani, Ashish Warang, Abhay Bhargava, Sharat Sonu, Sumeet Samnani, Jack Wayne, Shashi Ranjan, Anshuman Chaturvedi","After a life of crime, a notorious kidnapper tries to change his ways and turn over a new leaf to win the heart of the woman he loves.",4.5,465,"","","",,4,9,4.5,62.0615965242075,450
tt3228886,Ben O Degilim,Ben O Degilim,2013,2014-06-25,"Crime, Drama, Thriller",125,"Turkey, Greece, Germany, France",Turkish,Tayfun Pirselimoglu,Tayfun Pirselimoglu,Arizona Films,"Ercan Kesal, Maryam Zaree, Hakan Karsak, Nikos Moustakas, Okan Saglam, Mirza Metin, Sencar Sagdic, Muharrem Bayrak, Mehmet Serif Tozlu, Mithat Alam, Murat Özben, Erdogan Karakas, Eren Vurmaz, Resad Baser, Sait Tasci",He works in a kitchen in Istanbul. She is working with him. Her husband goes to jail.,6.6,750,"","","",,2,9,6.6,87.1770816936109,660
tt3254548,Hotori no Sakuko,Hotori no Sakuko,2013,2014-01-18,Drama,125,"Japan, USA",Japanese,Kôji Fukada,Kôji Fukada,Wa Entertainment,"Fumi Nikaidô, Mayu Tsuruta, Taiga Nakano, Kanji Furutachi, Kiki Sugino, Takashi Ohtake, Ena Koshino, Natsuko Hori, Bryerly Long, Hiroko Matsuda, Kôtarô Shiga, Kazuhiro Sôda, Makiko Watanabe","After failing her university entrance exam, Sakuko is invited by her aunt Mikie to spend summer vacation in a beautiful seaside town. Sakuko gets to know the people of the town, including Takashi, a shy relative of her childhood friend.",7.1,296,"","","",,4,26,7.1,94.6936855601084,710
tt3526538,Che,Che,2014,2014-02-24,"Biography, War",125,Iran,Persian,Ebrahim Hatamikia,Ebrahim Hatamikia,Farabi Cinema Foundation,"Fariborz Arabnia, Saeed Rad, Merila Zare'i, Babak Hamidian, Mehdi Soltani, Esmail Soltanian, Amir Reza Delavari, Khosrow Shahraz, Payam Larian, Hasan Jamshidi, Sam Kaboudvnd, Mohammad Reza Torabi","An overview of the two-day doctor Mostafa Chamran life (commander of the Iran-Iraq War, who was educated in America and was expert in guerrilla warfare) this film about Defense for peace in the Paveh (city in Iran).",6.1,1843,"","","",,5,1,6.1,85.0514204224575,610
tt3636776,Samrat & Co.,Samrat & Co.,2014,2014-04-25,"Mystery, Thriller",125,India,Hindi,Kaushik Ghatak,"Kaushik Ghatak, Manish Shrivastav",Rajshri Productions,"Rajeev Khandelwal, Madalsa Sharma, Gopal Dutt, Girish Karnad, Priyanshu Chatterjee, Shreya Narayan, Indraneil Sengupta, Barkha Bisht, Ravi Jhankal, Puja Gupta, Rajniesh Duggall, Bhaumik Sampat, Pradeep Welankar, Smita Jaykar, Gufi Paintal",A small town tycoon gets murdered. The daughter hires a private investigator to catch the real culprit.,6.3,1146,"","","",,15,10,6.3,87.2215200599688,630
tt3658010,Cel ales,Cel ales,2015,2015-04-24,Drama,125,Romania,Romanian,Cristian Comeaga,Cristian Comeaga,Domino Film & Television International,"Laura Cosoi, Eugeniu Cozma, FDAEJI, Carmen Fulger, Mohamed Jbara, Puiu Mircea Lascus, Mariana Liurca, Mario Marian, Olimpia Melinte, Bogdan Stanoevici, Bogdan Talasman, Nicodim Ungureanu",A former political police agent that has left communist Romania decades ago in search of freedom has to go back to find it.,7.1,229,"","",$ 12319,,,,7.1,98.7517261519682,710
tt3681440,Yaamirukka Bayamey,Yaamirukka Bayamey,2014,2014-05-09,"Comedy, Horror",125,India,Tamil,Deekay,Deekay,RS Infotainment,"Krishna Sekhar, Rupa Manjari, Karunakaran, Oviya, Aadhav Kannadasan, Anaswara, Nalinikanth, Mayilsamy, Bose Venkat, Namo Narayana, Mahanadhi Shankar, Sona Heiden, Devipriya, Balaji Mohan, Rayil Ravi",Is a ghost haunting Kiran's ancestral property? Or is it a conman's master moves?,7.1,927,"","","",,9,2,7.1,100.833637256435,710
tt3682686,Sabina K.,Sabina K.,2015,2015-09-01,Drama,125,"Bosnia and Herzegovina, USA",Bosnian,Cristobal Krusen,Cristobal Krusen,Messenger Films,"Alena Dzebo, Ana Andelic, Mugdim Avdagic, Jelena Basic, Senad Basic, Enis Beslagic, Hasija Boric, Miodrag Brezo, Svjetlana Brezo, Ante Cash, Jasna Diklic, Admir Glamocak, Rijad Gvozden, Cristobal Krusen, Mirvad Kuric","Sabina, a divorced mother of two small children, falls in love with an old friend from the Bosnian war. The two plan to marry, but things go terribly wrong.",6.4,101,"","","",,3,1,6.4,84.7963106857437,640
tt3756046,Die Blumen von gestern,Die Blumen von gestern,2016,2017-01-12,"Comedy, Drama, Romance",125,"Austria, Germany, France","German, French, English",Chris Kraus,Chris Kraus,Dor Film-West Produktionsgesellschaft,"Lars Eidinger, Adèle Haenel, Jan Josef Liefers, Hannah Herzsprung, Sigrid Marquardt, Djenabuh Jalloh, Rolf Hoppe, Bibiane Zeller, Gerdy Zint, Cornelius Schwalm, Eva Löbau, Irene Rindje, Hans-Jochen Wagner, Heidi Baratta, Elda Sorra","A very romantic comedy on the edge of the abyss: in the middle of the deepest life crisis, the Holocaust researcher Toto is assigned an assistant for the congress preparation - Zazie, of ...",6.6,734,"","","",,4,18,6.6,90.105566632704,660
tt3814100,M.A.D: Mad About Dance,M.A.D: Mad About Dance,2014,2014-08-22,"Drama, Musical",125,India,"Hindi, English",Saahil Prem,Saahil Prem,PRBA Productions,"Saahil Prem, Amrit Maghera, Salah Benlemqawanssa, Akilesh Unnitan, Abhishek Saha, Raashul Tandon, Jon Jo, Kiyani Aziz, Sandeep Garcha, Helen Grayson, Emiko Ishii, Emma Jones, Mark Monero, Ameet Panesar, Sumeet Panesar","Essentially a dance film, it focuses on the youth, their dreams, anxieties, disappointments and hopes for their future. The film is based in the quaint and beautiful university town of ...",5.1,105,"","","",,2,3,5.1,73.2844195565414,510
tt3837196,Tacchi alti,Hai-hil,2014,2014-06-03,"Action, Comedy",125,South Korea,Korean,Jin Jang,Jin Jang,"","Seung-Won Cha, Jeong-se Oh, Esom, Kil-kang Ahn, Kyung-pyo Go, Eung-soo Kim, El Lee, Yong-nyeo Lee, Ji-Ho Oh, Sung-woong Park, Young-chang Song","From people's eyes he seems like a sadistic cop who give no mercy to his enemy. But, deep inside his heart Ji-wook hides his desire to become a woman.",6.6,1138,"","","",,6,16,6.6,93.8080644453775,660
tt3859076,Truth: Il prezzo della verità,Truth,2015,2016-03-17,"Biography, Drama, History",125,"Australia, USA",English,James Vanderbilt,"James Vanderbilt, Mary Mapes",Sony Pictures Classics,"Cate Blanchett, Robert Redford, Topher Grace, Dennis Quaid, Elisabeth Moss, Bruce Greenwood, Stacy Keach, John Benjamin Hickey, David Lyons, Dermot Mulroney, Rachael Blake, Andrew McFarlane, Natalie Saleeba, Noni Hazlehurst, Connor Burke","Newsroom drama detailing the 2004 CBS 60 Minutes report investigating then-President George W. Bush's military service, and the subsequent firestorm of criticism that cost anchor Dan Rather and producer Mary Mapes their careers.",6.8,18415,$ 9600000,$ 2541854,$ 5383097,66,115,193,6.8,97.6466295588662,680
tt3861006,Xiao shi dai 3: Ci jin shi dai,Xiao shi dai 3: Ci jin shi dai,2014,2014-07-17,"Drama, Romance",125,China,Mandarin,Jingming Guo,Jingming Guo,Heli Chen'guang International Media,"Mi Yang, Kai Ko, Amber Kuo, Cheney Chen, Bea Hayden Kuo, Yi-Lin Sie, Hyun Jae Lee, Vivian Dawson, Yan-Kai Ren, Chao Jiang, Miroslav Karel, Kiwi Shang, Lin Wang, Zhu Zhen","Lin xiao, Gu li,Nan xiang and Tang Wan ru grew up together graduated from university into the workplace. They start a new journey.",2.8,667,"","",$ 82320000,,2,,2.8,39.8491003863865,280
tt4010918,Sado,Sado,2015,2015-09-16,"Drama, History",125,South Korea,Korean,Joon-ik Lee,"Cheol-Hyeon Jo, Song-won Lee",Tiger Pictures,"Kang-ho Song, Ah-In Yoo, Geun-young Moon, Hae-sook Kim, Won-Sang Park, Ji-seong Eom, Hye-jin Jeon, Ji-hee Jin, So-dam Park, Ye-ji Seo, Ji-seob So","Set in 18th century Korea, long-ruling King Yeongjo's struggle with his son, Sado, sees the king take extreme measures in order to deal with his heir.",7,1919,"","",$ 42165755,,16,13,7,93.0127971830418,700
tt4016994,De ce eu?,De ce eu?,2015,2015-11-05,"Drama, Thriller",125,"Romania, Bulgaria, Hungary","Romanian, English",Tudor Giurgiu,"Tudor Giurgiu, Loredana Novak",Chouchkov Brothers,"Emilian Oprea, Mihai Constantin, Andreea Vasile, Dan Condurache, Liviu Pintileasa, Mihai Smarandache, Alin Florea, Lucretia Mandric, Sore Mihalache, Ionut Caras, Virgil Ogasanu, Barna Bányai Kelemen, Madalina Ciotea, Olga Delia Mateescu, Camelia Maxim","Cristian, a young idealistic prosecutor whose career is on the rise, tries to crack a case against a senior colleague accused of corruption. The dilemma of choosing between his career and ...",7.5,2132,EUR 1200000,"","",,8,11,7.5,104.728231283785,750
tt4069184,Money Ratnam,Money Ratnam,2014,2014-09-26,"Comedy, Thriller",125,India,Malayalam,Santhosh Nair,Anil Narayanan,Central Pictures,"Chempil Asokan, Fahadh Faasil, Joju George, Jaffer Idukki, Naveen Kumar, Dinesh Nair, Renji Panicker, Kochu Preman, Sunil Sukhada, Nivetha Thomas, Balu Varghese","Neil comes across an unexpected incident, while returning after the New Year party. He tries to escape from the scene by getting into a bus where he gets a bag containing money left by someone else.",5.3,214,"","","",,,,5.3,75.8828946673767,530
tt4108068,Los miércoles no existen,Los miércoles no existen,2015,2015-10-16,"Comedy, Drama, Romance",125,Spain,Spanish,Peris Romano,Peris Romano,Garra Producciones [ve],"Eduardo Noriega, Inma Cuesta, Alexandra Jiménez, Gorka Otxoa, Andrea Duro, William Miller, María León, Ester Rodríguez, Alberto Matesanz, Irene Anula, Candela Montesinos, Luis Alberto Bermúdez, Juan Carlos Lares, Inés de León, Marta Eguía",Three men and three women cross each others' paths at different times and places in Madrid during their daily life and amorous pursuits.,5.4,578,EUR 2500000,"","",,2,24,5.4,75.764152187148,540
tt4176776,Ryuzo and the Seven Henchmen,Ryûzô to 7 nin no kobun tachi,2015,2015-04-25,"Action, Comedy",125,Japan,Japanese,Takeshi Kitano,Takeshi Kitano,Bandai Visual Company,"Tatsuya Fuji, Ben Hiura, Kôjun Itô, Masanobu Katsumura, Naoki Kawano, Takeshi Kitano, Masaomi Kondô, Hisako Manda, Akira Nakao, Ichi Omiya, Akira Onodera, Fumika Shimizu, Atom Shimojô, Tôru Shinagawa, Ken Yasuda",Ryuzo and the Seven Henchmen (2015) is about the story of Ryuzo and the Seven Henchmen who love derby race want to do the last battle with Yakuza guys.,6.2,1684,"","",$ 11757243,,12,21,6.2,86.9771566141721,620
tt4202506,The Love Affair,The Love Affair,2015,2015-08-12,"Drama, Romance",125,Philippines,"Filipino, Tagalog",Nuel C. Naval,Vanessa R. Valdez,ABS-CBN Film Productions,"Dawn Zulueta, Richard Gomez, Bea Alonzo, Tom Rodriguez, Alex Vincent Medina, Eda Nolan, Ina Feleo, Victor Silayan, Kim Molina, Jane Oineza, Manolo Pedrosa, Grae Fernandez, Tonton Gutierrez, Marty Lopez",A married couple is on the verge of annulment after the husband discovers his wife having an affair with his best friend. He then consults a lawyer who just broke up with her boyfriend.,6.2,195,"","",$ 3624953,,3,1,6.2,86.5886960221913,620
tt4285496,El abrazo de la serpiente,El abrazo de la serpiente,2015,2016-08-04,"Adventure, Drama",125,"Colombia, Venezuela, Argentina","Spanish, Portuguese, Aboriginal, German, Catalan, Latin, English",Ciro Guerra,"Ciro Guerra, Theodor Koch-Grünberg",Buffalo Films,"Nilbio Torres, Antonio Bolivar, Jan Bijvoet, Brionne Davis, Miguel Dionisio Ramos, Luigi Sciamanna, Nicolás Cancino, Pediwake Daniel Martinez, José Sabogal","The story of the relationship between Karamakate, an Amazonian shaman and last survivor of his people, and two scientists who work together over the course of forty years to search the Amazon for a sacred healing plant.",7.9,20136,$ 1400000,$ 1329249,$ 3217176,82,73,215,7.9,107.058267121023,790
tt4511478,Bheetu: Coward,Bheetu: Coward,2015,2015-02-27,Thriller,125,India,"English, Bengali",Utsav Mukherjee,"Abhijit Mallick, Abhijit Mallik",Aadidev Motion Pictures,"Parno Mittra, Ritwick Chakraborty, Sudiptaa Chakraborty, Saheb Bhattacharjee, Kamaleswar Mukherjee, Anindya Pulak Banerjee, Bhaskar Banerjee, Anindya Chatterjee, Kheya Chattopadhyay, Dilip Sarkar, Mumtaz Sorcar","An intense Bengali psycho drama which weaves a story around two women (sisters), whose inter-personal relationship and their whole outlook towards life have been shaped by their experiences while growing up.",6.2,188,INR 8000000,"","",,2,1,6.2,89.9442824599864,620
tt4516324,El rey de La Habana,El rey de La Habana,2015,2015-10-16,Drama,125,"Spain, Dominican Republic",Spanish,Agustí Villaronga,"Pedro Juan Gutiérrez, Agustí Villaronga",Bord Cadre Films,"Maikol David, Yordanka Ariosa, Héctor Medina, Ileana Wilson, Kimbo, Chanel Terrero, Jonathan Maravilla, Lia Chapman, Jazz Vilá, Reina Oviedo, Daniel Luciano, Luis Orlando Olarreaga, Yessica Ramos Quezada, Hamlet Hiraldo Frías, Jean Luis Burgos","Recently escaped from reformatory, young Reinaldo struggles to get by in the streets of Havana in the late 90s, one of the worst decades for Cuban society. Hopes, disillusionment, rum, good...",6,494,"","",$ 148797,,3,16,6,82.4203616058117,600
tt4547514,El elegido,El elegido,2016,2016-09-02,"Drama, History, Thriller",125,"Mexico, Spain","English, Spanish, French",Antonio Chavarrías,"Antonio Chavarrías, Dominic Harari",Oberón Cinematográfica,"Alfonso Herrera, Hannah Murray, Henry Goodman, Julian Sands, Elvira Mínguez, Emilio Echevarría, Frances Barber, Alejandro Calva, Roger Casamajor, Javier Godino, Toby Harper, Alexander Holtmann, Brontis Jodorowsky, Gustavo Sánchez Parra, Humberto Busto","A man named Jacques Mornard arrives in Mexico in 1940, claiming to be a Belgian who is fleeing the war in Europe to join his girlfriend, one of refugee Leon Trotsky's secretaries. But ...",6.6,755,"","",$ 247979,,3,3,6.6,95.3809740769516,660
tt4555426,L'ora più buia,Darkest Hour,2017,2018-01-18,"Biography, Drama, History",125,"UK, USA","English, French, German",Joe Wright,Anthony McCarten,Focus Features,"Gary Oldman, Kristin Scott Thomas, Ben Mendelsohn, Lily James, Ronald Pickup, Stephen Dillane, Nicholas Jones, Samuel West, David Schofield, Richard Lumsden, Malcolm Storry, Hilton McRae, Benjamin Whitrow, Joe Armstrong, Adrian Rawlins","In May 1940, the fate of World War II hangs on",7.4,165715,$ 30000000,$ 56468410,$ 153129891,75,634,417,7.4,101.905472283613,740
tt4603080,Amor Impossível,Amor Impossível,2015,2015-12-24,"Crime, Drama",125,Portugal,Portuguese,António-Pedro Vasconcelos,Tiago Santos,MGN Filmes,"Victoria Guerra, José Mata, Soraia Chaves, Ricardo Pereira, Maria d'Aires, Lia Carvalho, Carlos Malvarez, Manuela Couto, Guilherme Filipe, José Martins, Bruno Miranda, Tiago Moreira, Pedro Camelrão, Pedro Santos, Maria Leite","Cristina disappears. Tiago, her boyfriend, says that she was kidnapped, two police officers (Marco and Madalena) investigate the case and try to find the truth.",6.3,398,EUR 900000,"",$ 209805,,,3,6.3,90.0127652319189,630
tt4623812,Luo man di ke xiao wang shi,Luo man di ke xiao wang shi,2016,2016-12-16,Drama,125,China,"Mandarin, Shanghainese, Japanese",Er Cheng,Er Cheng,Emperor Film Production,"You Ge, Ziyi Zhang, Tadanobu Asano, Chun Du, Gillian Chung, Baogang Zhao, Dahong Ni, Quan Yuan, Ni Yan, Geng Han, Siyan Huo, Jiang Du, Chuan-jun Wang, Xing Lv, Wallace Chung","Over the course of several decades, a deal between the Japanese army and criminals in Shanghai plays out with violence and betrayal.",7,1321,"",$ 386540,$ 18345372,,4,6,7,97.6135941570075,700
tt4648786,Harriet,Harriet,2019,2019-11-01,"Action, Biography, Drama",125,"China, USA",English,Kasi Lemmons,"Gregory Allen Howard, Kasi Lemmons",Martin Chase Productions,"Cynthia Erivo, Leslie Odom Jr., Joe Alwyn, Clarke Peters, Vanessa Bell Calloway, Omar J. Dorsey, Henry Hunter Hall, Tim Guinee, Nick Basta, Joseph Lee Anderson, Antonio J Bell, CJ McBath, Alexis Louder, Aria Brooks, Janelle Monáe",The extraordinary tale of,6.5,16802,$ 17000000,$ 43082155,$ 43347017,66,309,128,6.5,93.3889874063911,650
tt4691804,Mohican kokyô ni kaeru,Mohican kokyô ni kaeru,2016,2016-04-09,Comedy,125,Japan,Japanese,Shûichi Okita,Shûichi Okita,Asmik Ace Entertainment,"Yûdai Chiba, Akira Emoto, Katsumi Kiba, Ryota Koshiba, Atsuko Maeda, Ryûhei Matsuda, Jun Miho, Masako Motai, Miu Tomita, Mikito Tsurugi",A punk comes back to his family home on a small island when his girlfriend becomes pregnant.,6.8,206,"","","",,2,10,6.8,99.7564844545111,680
tt4692242,O Encantado,O Encantado,2015,2015-08-26,Drama,125,"Portugal, France, Germany, Switzerland","Portuguese, English, French, German, Mandarin",Miguel Gomes,"Telmo Churro, Miguel Gomes",O Som e a Fúria,"Crista Alfaiate, Américo Silva, Amar Bounachada, Lionel Franc, Carloto Cotta, Elvis Barrientos, Hervés Diasnas, Chico Chapas, Gonçalo Waddington, Quitério, Jing Jing Guo, Bernardo Alves, Louison Tresallet",The final trilogy of adaptation of Arabian Nights story by the structure in Portugal modern life between 2013-2014 in three chapter.,6.4,1078,"",$ 4502,$ 6681,80,3,50,6.4,89.6322320506874,640
