imdb_title_id,title,original_title,year,date_published,genre,duration,country,language,director,writer,production_company,actors,description,avg_vote,votes,budget,usa_gross_income,worlwide_gross_income,metascore,reviews_from_users,reviews_from_critics,avg_vote_10,avg_vote_100,avg_vote_1000
tt0329731,Velocità massima,Velocità massima,2002,2002-09-03,Drama,111,Italy,Italian,Daniele Vicari,"Maura Nuccetelli, Laura Paolucci",Fandango,"Valerio Mastandrea, Cristiano Morroni, Alessia Barela, Ivano De Matteo, Emanuela Barilozzi, Massimiliano Dau, Massimiliano Varrese, Ennio Girolami, Sara Franchetti, Antonio Obino, Tullio Sorrentino, Luca Paniconi, Artur Wyszomirski, Maria Gradi, Alessandra Guerra","Claudio, age 17, has a simple aspiration: he wants to be a mechanic. His father, though, would like him to take over his small auto-wrecker company that he has built up over his lifetime.",6.4,514,"","",$ 381162,,2,3,6.4,85.9936655798451,640
tt0329767,Wilbur Wants to Kill Himself,Wilbur Wants to Kill Himself,2002,2002-11-08,"Comedy, Drama, Romance",111,"Denmark, UK, Sweden, France",English,Lone Scherfig,"Lone Scherfig, Anders Thomas Jensen",Zentropa Entertainments,"Jamie Sives, Adrian Rawlins, Shirley Henderson, Lisa McKinlay, Mads Mikkelsen, Julia Davis, Susan Vidler, Robert McIntosh, Lorraine McIntosh, Gordon Brown, Mhairi Morrison, Andrew Townsley, Coral Preston, Colin McAllister, Owen Gorman","The chronically suicidal Wilbur and his good-hearted big brother Harbour are in their thirties, when their father dies, leaving them with nothing but a worn down second-hand bookshop in Glasgow.",6.8,7549,$ 4000000,$ 235294,$ 1873482,69,51,61,6.8,93.0299111353926,680
tt0337697,Un principe tutto mio,The Prince & Me,2004,2004-08-27,"Comedy, Family, Romance",111,"USA, Czech Republic","English, Danish, German",Martha Coolidge,"Mark Amin, Katherine Fugate",Lions Gate Films,"Julia Stiles, Luke Mably, Ben Miller, Miranda Richardson, James Fox, Alberta Watson, John Bourgeois, Zachary Knighton, Stephen O'Reilly, Elisabeth Waterston, Eliza Bennett, Devin Ratray, Clare Preuss, Yaani King Mondschein, Eddie Irvine","At college Paige meets Eddie, a fellow student from Denmark, whom she first dislikes but later accepts, likes, and loves; he proves to be Crown Prince Edvard. Paige follows him to Copenhagen, and he follows her back to school with a plan.",5.9,36938,$ 22000000,$ 28176497,$ 37666766,47,160,84,5.9,87.6361795953141,590
tt0343221,Äideistä parhain,Äideistä parhain,2005,2005-09-30,"Drama, War",111,"Finland, Sweden","Finnish, Swedish",Klaus Härö,"Veikko Aaltonen, Heikki Hietamies",Matila Röhr Productions (MRP),"Topi Majaniemi, Marjaana Maijala, Maria Lundqvist, Michael Nyqvist, Esko Salminen, Aino-Maija Tikkanen, Kari-Pekka Toivonen, Brasse Brännström, Penny Elvira Loftéen, Ia Langhammer, Leif Andrée, Marie Göranzon, Åsa Persson, Gustav Wiklund, Patrick Henriksen","During World War II, more than 70,000 Finnish children were evacuated to neutral Sweden to avoid the conflict. From the award-winning",7.6,4208,EUR 2900000,"",$ 2851888,,21,18,7.6,107.800098727718,760
tt0348214,Luen oi hang sing,Luen oi hang sing,2002,2002-03-28,"Fantasy, Romance",111,Hong Kong,Cantonese,Dante Lam,Kin Chung Chan,Universe Entertainment,"Nicholas Tse, Kar Yan Lam, Eason Chan, Candy Lo, Vincent Kok, Doddy P. Marcelo, Man-Tin Chan, Chan-Ting Yeung, Wing-Kei Wong, Dok-Fai Lee, Sek-Hang Ha, Altan Au, Linda Suk-Fan Choi, Kong Lee, Kenneth Yuen","Fung is a delivery boy who has several chance encounters with Jane. A budding relationship between the two is rapidly established, but when Jane is suddenly killed in a car accident, it ...",6.2,221,"","","",,3,5,6.2,88.057078045083,620
tt0348593,The Door in the Floor,The Door in the Floor,2004,2005-12-02,"Comedy, Drama",111,USA,English,Tod Williams,"John Irving, Tod Williams",Focus Features,"Elle Fanning, Jeff Bridges, Kim Basinger, Jon Foster, Larry Pine, John Rothman, Harvey Loomis, Bijou Phillips, Mimi Rogers, Mike S. Ryan, Libby Langdon, Louis Arcella, Robert LuPone, Rachel Style, Amanda Posner",A writer's young assistant becomes both pawn and catalyst in his boss's disintegrating household.,6.6,15040,$ 7500000,$ 3854624,$ 6715067,67,136,145,6.6,88.8380959191919,660
tt0349076,South from Granada,Al sur de Granada,2003,2003-01-10,"Comedy, Drama, Romance",111,Spain,"Spanish, English, Latin",Fernando Colomo,"Gerald Brenan, Fernando Colomo",Antena 3 Televisión,"Matthew Goode, Verónica Sánchez, Guillermo Toledo, Consuelo Trujillo, Ángela Molina, Antonio Resines, Laurence Fox, Bebe, Jessica Kate Meyer, James Fleet, María Alfonsa Rosso, Sebastián Haro, Mariana Cordero, Juan Margallo, Sandra Wahlbeck","In 1919, demobbed, Gerald Brenan rents a house for a year in Yegen, a village in Alpujarra. He has little but a love of reading and writing. He's soon the center of attention from his maid,...",6.1,803,EUR 4200000,"",$ 2464202,,7,2,6.1,87.7085813733151,610
tt0361679,Guardian of the Realm,Guardian of the Realm,2004,2006-11-03,"Sci-Fi, Horror, Thriller",111,USA,English,'Evil' Ted Smith,"'Evil' Ted Smith, Wyatt Weed",Pirate Pictures,"Glen Levy, Tanya Dempsey, Lana Piryan, Tom Seymour, Chris Sheets, Tracy Erickson, Ronald Quigley, Stephanie Kane, Robin Raedeke, Natalie Khoury, Heather Ashley Chase, Meagan Mangum, Isis McKenzie, Ardy Brent Carlson, Al Zequiera",Two demon hunters race to save the human race after an a cult accidentally releases a particularly dangerous demon.,4,264,"","","",,13,6,4,57.2221154147081,400
tt0365686,Revolver,Revolver,2005,2005-09-22,"Action, Crime, Drama",111,"France, UK","English, Cantonese",Guy Ritchie,"Luc Besson, Guy Ritchie",EuropaCorp,"Jason Statham, Ray Liotta, Vincent Pastore, André Benjamin, Terence Maynard, Andrew Howard, Mark Strong, Francesca Annis, Mem Ferda, Anjela Lauren Smith, Elana Binysh, Shend, Bill Moody, Stephen Walters, Vincent Riotta",Gambler Jake Green enters into a game with potentially deadly consequences.,6.4,88470,"",$ 84738,$ 7155807,25,512,112,6.4,88.6037850832659,640
tt0366416,Erbsen auf halb 6,Erbsen auf halb 6,2004,2004-03-04,"Comedy, Drama, Romance",111,Germany,"German, Russian",Lars Büchel,"Lars Büchel, Ruth Toma",Mr. Brown Entertainment,"Fritzi Haberlandt, Hilmir Snær Guðnason, Tina Engel, Harald Schrott, Jenny Gröllmann, Petra Hartung, Jens Münchow, Annett Renneberg, Alice Dwyer, Max Mauff, Michael Hanemann, Heinz Petters, Jens Peter Brose, Ina Holst, Matthias Brenner",A film director loses his sight in an accident and must learn to live without his eyes. He and the blind woman assigned to help him go on a funny and romantic adventure that will change both their lives.,7,1023,"","",$ 1589140,,9,10,7,98.6608807364835,700
tt0369424,The Horror Vault,The Horror Vault,2008,2016-10-31,"Horror, Thriller",111,"Denmark, USA, Australia, UK",English,"Rusty Apper, David Boone","Rusty Apper, Drew English",Cetus Productions,"Claire Ross-Brown, Kim Sønderholm, Sally Wells Cook, Chad Mehle, Elisa Richardson, James Terry, Heather Tom, Jonathon Trent, Mandy Amano, Jerod Edington, Rusty Apper, Katelin Ewing, Joyia Fitch, Paul Kelleher, Maja Muhlack","Nine tales of human cruelty, nine tales of human depravity, nine tales of true horror",4.3,197,$ 750000,"","",,2,9,4.3,60.5281145882282,430
tt0370425,Renai shashin,Renai shashin,2003,2003-05-16,"Comedy, Drama, Romance",111,Japan,"Japanese, English",Yukihiko Tsutsumi,Kaoru Ogawa,Eisei Gekijo,"Ryôko Hirosue, Ryûhei Matsuda, Eiko Koike, Adeyto, Robert Baldwin, Kansai Eto, Maria Theresa Gow, Atsushi Harada, Eric Jones, Dominic Marcus, Mayuko Nishiyama, Rei Okamoto, Ren Osugi, Gregory Pekar, Jirô Satô","(Japanese with English subtitles) Down-on-his-luck photographer Makoto (Ryuhei Matsuda) receives a letter from his old girlfriend, who, according to a friend, died a year ago in NYC. Eager ...",6.4,461,"","",$ 1383874,,4,1,6.4,91.7925457699585,640
tt0371712,Hirer Angti,Hirer Angti,1992,1992,"Drama, Family, Fantasy",111,India,Bengali,Rituparno Ghosh,"Rituparno Ghosh, Shoubhik Mitra",Children's Film Society of India,"Vasant Choudhury, Gyanesh Mukherjee, Sunil Mukherjee, Bankim Ghosh, Shakuntala Barua, Pradip Mukherjee, Moon Moon Sen, Barun Chanda, Sumanta Mukherjee, Dulal Lahiri, Ayan Banerjee, Subhradeep Dey, Sudhir Dey, Anchita Dutta, Sunil Ghosh",Gandharva Kumar reveals a long-forgotten secret wherein he claims to be heir to the family property to Ratanlal Babu.,7.2,164,"","","",,2,,7.2,101.428182724176,720
tt0371772,Kaze no jûtan,Kaze no jûtan,2003,2003-05-17,"Drama, Family",111,"Japan, Iran","Japanese, Persian",Kamal Tabrizi,"Masako Imai, Mohammad Soleymani",Heisei Project,"Rentarô Mikuni, Takaaki Enoki, Miyu Yagyu, Yûki Kudô, Yuri Masuda, Reza Kianian, Fereydoon Heydari, Mohammadreza Khorshidi, Reza Nabavi, Farboud Ahmadjoo, Fariba Kamran, Hushang Harirchiyan, Maryam Boubani, Hossein Ghgiabi, Shirin Bina","",6.8,363,"","","",,1,2,6.8,93.1719971696129,680
tt0372359,Juoksuhaudantie,Juoksuhaudantie,2004,2004-08-27,"Comedy, Drama",111,Finland,Finnish,Veikko Aaltonen,"Veikko Aaltonen, Kari Hotakainen",Kinotar,"Eero Aho, Kari Väänänen, Esko Pesonen, Tiina Lymi, Ella Aho, Aake Kalliala, Eeva Litmanen, Matleena Kuusniemi, Kaija Pakarinen, Katariina Kaitue, Eila Roine, Lotta Lehtikari, Juha Kukkonen, Johanna Mukkula, Teija Sopanen",Matti Virtanen is trying to get his family back by buying a house.,6.2,781,EUR 1100000,"",$ 1014636,,2,,6.2,91.5146145312579,620
tt0373024,Imaginary Heroes,Imaginary Heroes,2004,2005-07-22,"Comedy, Drama",111,"USA, Germany, Belgium",English,Dan Harris,Dan Harris,ApolloProMedia GmbH & Co. 1. Filmproduktion KG (I),"Sigourney Weaver, Emile Hirsch, Jeff Daniels, Michelle Williams, Kip Pardue, Deirdre O'Connell, Ryan Donowho, Suzanne Santo, Jay Paulson, Luke Robertson, Lee Wilkof, Terry Beaver, Sara Tanaka, Ned Benson, Larry Fessenden",The Travis family façade is destroyed by an event incomprehensible to them -- an event which will open locked doors and finally reveal the secrets that have haunted them for decades.,7.1,9362,$ 4000000,$ 228767,$ 291118,53,58,74,7.1,99.5763608628052,710
tt0373707,Baka no hakobune,Baka no hakobune,2003,2003-04-26,Comedy,111,Japan,Japanese,Nobuhiro Yamashita,"Kôsuke Mukai, Nobuhiro Yamashita",Midnight Child Theater,"Hiroshi Yamamoto, Tomoko Kotera, Yûko Hosoe, Takeshi Yamamoto, Hana Kino, Tetsuaki Matsue, Takashi Sasano",A budding capitalist and his girlfriend abandon their failure in the big city and return to his isolated hometown to try their hand again at launching a health product. The problem is that ...,6.9,101,"","","",,2,2,6.9,95.1157540115565,690
tt0382932,Ratatouille,Ratatouille,2007,2007-10-17,"Animation, Adventure, Comedy",111,USA,"English, French","Brad Bird, Jan Pinkava","Brad Bird, Jan Pinkava",Walt Disney Pictures,"Patton Oswalt, Ian Holm, Lou Romano, Brian Dennehy, Peter Sohn, Peter O'Toole, Brad Garrett, Janeane Garofalo, Will Arnett, Julius Callahan, James Remar, John Ratzenberger, Teddy Newton, Tony Fucile, Jake Steinfeld",A rat who can cook makes an unusual alliance with a young kitchen worker at a famous restaurant.,8,624762,$ 150000000,$ 206445654,$ 623726085,96,747,330,8,110.25751172749,800
tt0387823,Alithini zoi,Alithini zoi,2004,2004-11-05,"Drama, Fantasy, Romance",111,"Greece, France","French, Greek, English",Panos H. Koutras,"Panagiotis Evangelidis, Panos H. Koutras",Program 33,"Nikos Kouris, Themis Bazaka, Marina Kalogirou, Yiannis Diamantis, Odysseas Papaspiliopoulos, Maria Panouria, Aneza Papadopoulou, Christos Mantakas, Stavros Karelis, Anna Mouglalis, Dora Anthi, Ioanna Artemiou, Christophe Bersult, Marilin Blazoudaki, Elissavet Chronopoulou",A rich man loves a poor woman. A rich mother loves her poor self. A rich city loves its poor...end,5.6,260,"","","",,3,1,5.6,76.369452940226,560
tt0388075,Fu bo,Fu bo,2003,2003-09-18,Thriller,111,Hong Kong,"Cantonese, Portuguese","Kung-Lok Lee, Ching-Po Wong",Simon Lai,Yi Yi Production,"Kai Chi Liu, Sze-Chit Lee, Tung Cho 'Joe' Cheung, Jacob Mense, Paulyn Sun, Oni Tsuka, Hugo Ng, Eric Tsang, Anthony Chau-Sang Wong, Gam-Yeung Chan, Wai-Sing Chan, Chung Gwai, Kai-Ming Hui, Shu-Wing Lai, Koon-Hung Lau","A morgue assistant witnesses gut-wrenching autopsies and mutilated corpses on a daily basis. But strangest of all is the behaviour of his oddball colleagues. In another part of town, a ...",5.5,136,"","","",,1,3,5.5,78.2337598765516,550
tt0388838,Clean - Quando il rock ti scorre nelle vene,Clean,2004,2005-05-27,"Drama, Music, Romance",111,"France, Canada, UK","French, English, Cantonese",Olivier Assayas,Olivier Assayas,Rectangle Productions,"Maggie Cheung, Nick Nolte, Béatrice Dalle, Jeanne Balibar, Don McKellar, Martha Henry, James Johnston, James Dennis, Rémi Martin, Laetitia Spigarelli, Arnaud Churin, Man Kit Cheung, Kurtys Kidd, Shaun Austin-Olsen, Jodi Crawford","After she ends up in prison and loses custody of her son, a woman struggles to assimilate outside her former life and remain clean long enough to regain custody of her son.",6.8,4423,GBP 4500,$ 138711,$ 2971219,75,41,83,6.8,95.017965012547,680
tt0390808,36,36 Quai des Orfèvres,2004,2005-01-21,"Action, Crime, Drama",111,France,French,Olivier Marchal,"Olivier Marchal, Franck Mancuso",Gaumont International,"Daniel Auteuil, Gérard Depardieu, André Dussollier, Roschdy Zem, Valeria Golino, Daniel Duval, Francis Renaud, Catherine Marchal, Guy Lecluyse, Alain Figlarz, Vincent Moscato, Anne Consigny, Stéphane Metzger, Solène Biasch, Aurore Auteuil","2 cops are promised by the retiring chief of the Paris police that the one, getting the violent gang robbing armored trucks, will get his job. The 2 will do whatever it takes to get the promotion, even if it means breaking the law.",7.1,16134,EUR 13580000,"","",,72,58,7.1,99.6203371018103,710
tt0391892,Crying Ladies,Crying Ladies,2003,2003-12-25,"Comedy, Drama",111,Philippines,"Filipino, Mandarin, English, Tagalog",Mark Meily,"Mark Meily, Melvin Lee",Unitel Pictures,"Sharon Cuneta, Hilda Koronel, Angel Aquino, Eric Quizon, Ricky Davao, Julio Pacheco, Shamaine Buencamino, Sherry Lara, Gilleth Sandico, Joan Bitagcol, Johnny Delgado, Edgar Mortiz, Raymond Bagatsing, Bella Flores, Lou Veloso","A whimsical comedy about three women who cry at funerals, professionally.",6.9,227,"",$ 132920,$ 132920,54,10,8,6.9,99.9500709051533,690
tt0399854,La visionetele 2,Vizontele Tuuba,2003,2003,"Comedy, Drama",111,Turkey,"Turkish, Dutch, English, French, German",Yilmaz Erdogan,Yilmaz Erdogan,Besiktas Kültür Merkezi (BKM),"Yilmaz Erdogan, Demet Akbag, Altan Erkekli, Tarik Akan, Tuba Ünsal, Idil Firat, Tolga Çevik, Iclal Aydin, Cezmi Baskin, Bican Günalan, Salih Kalyon, Sener Kökkaya, Zeynep Tokus, Meral Çetinkaya, Bülent Inal","Vizontele Tuuba is the sequel to Vizontele and recounts the 1980 military coup, the repercussions of the coup in a small southeastern town in Turkey. This is a very confusing period: every ...",6.5,14058,$ 3000000,"",$ 13954476,,4,5,6.5,90.9038073727801,650
tt0403579,Svoi,Svoi,2004,2004-11-11,"Action, Drama, War",111,Russia,"Russian, German",Dmitriy Meskhiev,Valentin Chernykh,Slovo,"Konstantin Khabenskiy, Sergey Garmash, Ben Perino, Mikhail Evlanov, Bohdan Stupka, Natalya Surkova, Anna Mikhalkova, Fedor Bondarchuk, Sergei Dyachkov, Aleksandr Polovtsev, Anna Belova, Oksana Glushkova, Yuriy Zaytsev, Sergey Kozik, Johannes Brand","With the battle line far away in the east, three soldiers who have managed to escape from captivity find it difficult to hide. An old man offers to help them because one of them, the sniper, is his son.",7.5,1215,$ 2500000,"","",,8,7,7.5,102.531063933176,750
tt0405866,La damigella d'onore,La demoiselle d'honneur,2004,2005-09-23,"Thriller, Drama, Romance",111,"France, Germany, Italy",French,Claude Chabrol,"Ruth Rendell, Pierre Leccia",Alicéléo,"Benoît Magimel, Laura Smet, Aurore Clément, Bernard Le Coq, Solène Bouton, Anna Mihalcea, Michel Duchaussoy, Suzanne Flon, Éric Seigne, Pierre-François Dumeniaud, Philippe Duclos, Thomas Chabrol, Isolde Barth, Mazen Kiwan, Chantal Banlier",A hard-working young man meets and falls in love with his sister's bridesmaid. He soon finds out how disturbed she really is.,6.6,2585,"",$ 111728,$ 3162662,74,20,65,6.6,91.5256765290796,660
tt0406754,Evilenko,Evilenko,2004,2004-04-16,"Crime, Drama, Horror",111,Italy,English,David Grieco,David Grieco,Ministero per i Beni e le Attività Culturali (MiBAC),"Malcolm McDowell, Marton Csokas, Ronald Pickup, Frances Barber, John Benfield, Eugenia Gandij, Ihor Ciszkewycz, Fabrizio Sergenti Castellani, Vladimir Levizkiy, Alexei Chadyuk, Viktor Gluskov, Ostap Stupka, Vernon Dobtcheff, Adrian McCourt, Romana Pollak","A disgraced communist schoolteacher in Kiev becomes a brutal, unfeeling serial killer. Based on the crimes of Andrei Chikatilo.",6.2,3105,$ 9700000,"",$ 87760,,33,26,6.2,84.583025782183,620
tt0413466,Wassup Rockers,Wassup Rockers,2005,2006-04-05,"Comedy, Drama",111,USA,"Spanish, English",Larry Clark,"Larry Clark, Larry Clark",Capital Entertainment,"Jonathan Velasquez, Francisco Pedrasa, Milton Velasquez, Usvaldo Panameno, Eddie Velasquez, Luis Rojas-Salgado, Carlos Ramirez, Iris Zelaya, Ashley Maldonado, Laura Cellner, Jessica Steinbaum, Chris Neville, Jeremy Scott, David Livingston, Joe Myles","Instead of adhering to the norms of their South Central neighborhood, a group of skater boys opt to bus into Hollywood and Beverly Hills, where they attract local rich girls - and plenty of...",6,4620,"",$ 221574,$ 634074,56,45,57,6,83.4142096263169,600
tt0416040,Moy svodnyy brat Frankenshteyn,Moy svodnyy brat Frankenshteyn,2004,2004-10-21,Drama,111,Russia,Russian,Valeriy Todorovskiy,Gennadiy Ostrovskiy,"","Leonid Yarmolnik, Daniil Spivakovskiy, Elena Yakovleva, Artyom Shalimov, Marianna Ilyina, Sergey Gazarov, Sergey Garmash, Elvira Danilina, Vladimir Bogdanov, Tatyana Shumova, Sergey Yakubenko, Darya Belousova, Anton Lutsenko, Yuliana Soldatova, Tatyana Zhdanova",A touching story of a soldier who doesn't understand how to live a peaceful life. Kinotaur 2004 Grand-prix and Golden Eagle Award for Best Director to Valery Todorovsky. 2004,7,294,"","",$ 60000,,1,3,7,96.5314842618609,700
tt0420982,Zhmurki,Zhmurki,2005,2005-06-02,"Comedy, Crime, Thriller",111,Russia,"Russian, English",Aleksey Balabanov,"Stas Mokhnachev, Aleksey Balabanov",CTB Film Company,"Aleksey Panin, Dmitriy Dyuzhev, Nikita Mikhalkov, Sergey Makovetskiy, Anatoliy Zhuravlyov, Grigoriy Siyatvinda, Viktor Sukhorukov, Aleksey Serebryakov, Garik Sukachyov, Andrey Panin, Kirill Pirogov, Yuriy Stepanov, Renata Litvinova, Zhanna Bolotova, Tatyana Dogileva","This movie is about the stern gangster customs of one of the Russian provincial cities in the mid-90s . And you could expect either a stupid game of blind man's buffets or a truly bloody showdown with the stacks of """"bluffers"""".",7.2,5995,"","",$ 4180000,,21,9,7.2,101.135340125474,720
tt0422621,Lavorare con lentezza,Lavorare con lentezza,2004,2004-10-01,Drama,111,"Italy, France",Italian,Guido Chiesa,"Guido Chiesa, Wu Ming",Fandango,"Claudia Pandolfi, Valerio Mastandrea, Marco Luisi, Tommaso Ramenghi, Valerio Binasco, Jacopo Bonvicini, Max Mazzotta, Massimo Coppola, Alberto Gimignani, Antonio Petrocelli, Franco Ravera, Alison J. Forest, Alessandro Agnello, Giulio Brunetti, Simone Gandolfo","This documentary-style film takes place in Bologna, Italy. The Radio Alice program began on February 9, 1976. The radio station used an ex-military transmitter. They were mao-dadaists. The ...",6.9,535,"","",$ 1135591,,3,6,6.9,94.6144148663342,690
tt0423232,Sonhos de Peixe,Sonhos de Peixe,2006,2006-05-21,Drama,111,"USA, Brazil, Russia",Portuguese,Kirill Mikhanovsky,Kirill Mikhanovsky,Unison Films,"Rúbia Rafaelle da Silva, Chico Díaz, Phellipe Haagensen, Yves Hofer, Zé Maria","Jusce, a lobster fisherman from a northeastern village in Brazil, is in love with Ana, interested only in a dream life through images she sees in television soap opera. When Jusce?s old ...",6.5,120,$ 1000000,"","",,1,3,6.5,91.3854861305861,650
tt0423360,Tengoku no honya - koibi,Tengoku no honya - koibi,2004,2004-06-05,"Drama, Romance",111,Japan,Japanese,Tetsuo Shinohara,"Atsushi Matsuhisa, Wataru Tanaka",Tengoku no Hon'ya: Koibi Film Partners,"Yûko Takeuchi, Tetsuji Tamayama, Karina, Hirofumi Arai, Teruyuki Kagawa, Yoshio Harada, Ayumu Saitô, Akashi Takei, Yasunari Takeshima","KENTA (Tetsuji Tamayama), a young pianist who has just lost his job, is drowning his woes at a bar, when he meets a man in a Hawaiian shirt named YAMAKI (Yoshio Harada). He invites Kenta to...",6.6,314,"","",$ 1222765,,5,4,6.6,93.5496646007264,660
tt0423584,Kalbin zamani,Kalbin zamani,2004,2004-12-10,Romance,111,"Turkey, Bulgaria",Turkish,Ali Özgentürk,"Ali Özgentürk, Onur Ünlü",Asya Film,"Hülya Avsar, Halil Ergün, Birol Ünel, Oktay Kaynarca, Zeki Alasya, Güler Ökten, Kayhan Yildizoglu, Dolunay Soysert, Engin Altan Düzyatan, Tayanç Ayaydin, Fatih Dönmez, Arda Kanpolat, Mahmut Gökgöz, Meral Küçükerol, Özlem Turhal","In this lush police mystery, the love of three different men for one woman spans five decades and results in one man's death.",4.9,257,"","",$ 267182,,,2,4.9,66.3631332287096,490
tt0427954,The Protector - La legge del Muay Thai,Tom yum goong,2005,2007-08-03,"Action, Crime, Drama",111,"Thailand, USA, Hong Kong, France","Thai, English, Mandarin, Vietnamese",Prachya Pinkaew,"Napalee, Piyaros Thongdee",Sahamongkolfilm Co.,"Tony Jaa, Petchtai Wongkamlao, Bongkoj Khongmalai, Xing Jin, Nathan Jones, Johnny Nguyen, Lateef Crowder, Jonathan Patrick Foo, Damian de Montemas, David Asavanond, Sotorn Rungruaeng, Amonphan Gongtragan, Nutdanai Kong, Dean Alexandrou, Jintana Arromyen","A young fighter named Kham must go to Australia to retrieve his stolen elephant. With the help of a Thai-born Australian detective, Kham must take on all comers, including a gang led by an evil woman and her two deadly bodyguards.",7.1,34771,THB 200000000,$ 12044087,$ 27165581,52,221,122,7.1,102.456755897461,710
tt0434345,Snow White,Snow White,2005,2007-04-19,Drama,111,"Switzerland, Austria","German, Swiss German, French",Samir,"Samir, Michael Sauter",Dschoint Ventschr Filmproduktion AG,"Julie Fournier, Carlos Leal, Zoé Mikuleczky, Stefan Gubser, Xaver Hutter, Sunnyi Melles, Benedict Freitag, Tony Harrisson, Stefan Kurt, Wolfram Berger, Pascal Ulli, Martin Rapold, Patrick Rapold, Karin Pfammatter, Liliana Heimberg","The life of 20-year-old Nico from upper class Zurich is all party, sex and drugs when she meets Carlos, the front man of a hip hop band. With naivete and infinite self-confidence, she tries to adopt his lifestyle - with harsh consequences.",5.8,526,"","",$ 17414,,6,9,5.8,85.198680477902,580
tt0435153,Rabudo gan,Rabudo gan,2004,2004-06-19,"Drama, Thriller",111,Japan,Japanese,Kensaku Watanabe,Kensaku Watanabe,Eisei Gekijo,"Masatoshi Nagase, Aoi Miyazaki, Hirofumi Arai, Ittoku Kishibe, Hironobu Nomura, Seiichi Tanabe, Genjiro Arato, Ryûshi Mizukami, Kumiko Tsuchiya","A story about a hitman named Hayamada who carries a distinctive red gun and his reason for his work, and how he came to be alone. His aim right now is to reach a destination, but he's late....",7,241,"","","",,2,2,7,100.201720768758,700
tt0441674,Operetta tanuki goten,Operetta tanuki goten,2005,2005-05-28,"Comedy, Fantasy, Musical",111,Japan,"Japanese, Mandarin",Seijun Suzuki,Yoshio Urasawa,Ogura Jimusyo Co.,"Ziyi Zhang, Joe Odagiri, Hiroko Yakushimaru, Mikijirô Hira, Tarô Yamamoto, Gentaro Takahashi, Saori Yuki, Miwako Ichikawa, Hibari Misora, Eisuke Sasai, Papaya Suzuki, Taro Nanshu, Federico Aletta, Akira Matsushita, Noriko Shiina","Amechiyo (The banished prince) falls in love with Tanukihime (a princess of raccoon dog disguised to human). This is an Operetta which includes comedy, singing and dancing, and a love story.",6.5,710,"","",$ 8844,,12,30,6.5,88.3242717941431,650
tt0448845,Finger Print,Finger Print,2005,2005-02-18,"Crime, Mystery, Thriller",111,India,Malayalam,Satheesh Paul,"Siddique, Satheesh Paul","","Jayaram, Indrajith Sukumaran, Gopika, Devan, Nedumudi Venu, Murali Menon, Saikumar, Renji V. Nair, Tom George, Krupa","A patriarch (Nedumudi Venu) of a royal family whose descendant was murdered, assigns the task of finding the culprit to two of his police officer nephews - Vivek (Jayaram) and Kishore (Indrajith).",4.7,212,"","","",,1,,4.7,66.8195217611843,470
tt0454190,Maha'lai muang rae,Maha'lai muang rae,2005,2005-05-26,"Biography, Comedy, Drama",111,Thailand,"Thai, English",Jira Maligool,"Jira Maligool, Ajin Panjapan",Dedicate Ltd.,"Pijaya Vachajitpan, Donlaya Mudcha, Sonthaya Chitmanee, Anthony Howard Gould, Bill O'Leary, Ajin Panjapan, Jaran 'See Tao' Petcharoen, Niran Sattar, Jumpol Thongtan","Set in 1950 and based on the series of autobiographical short stories by Archin Panjabhan, the beginning finds Archin (Pijaya Vachajitpan) expelled from Bangkok's Chulalongkorn University ...",8,406,THB 70000000,"",$ 604100,,3,2,8,114.173436230071,800
tt0455983,Nightmare,Nightmare,2005,2008-02-14,"Horror, Thriller",111,USA,English,Dylan Bank,"Dylan Bank, Morgan Pehme",Merlion Entertainment,"Nicole Roderick, Jonatha Bates, J. Bloomrosen, Jolan Boockvor, Jason Scott Campbell, Jennifer Carta, Richard Daniel Cohen, Sabrina Farhi, Raymond Russell Hamlin, Amin Joseph, Dana Krashin, Steve Krashin, Steve Lord, Sean Matic, Marcos Antonio Miranda",A director is forced to make a movie chronicling the horrific murders he believes he is committing.,5.2,280,"","","",,11,13,5.2,73.7985152138901,520
