imdb_title_id,title,original_title,year,date_published,genre,duration,country,language,director,writer,production_company,actors,description,avg_vote,votes,budget,usa_gross_income,worlwide_gross_income,metascore,reviews_from_users,reviews_from_critics,avg_vote_10,avg_vote_100,avg_vote_1000
tt1696198,Zombie Driftwood,Zombie Driftwood,2010,2010,"Comedy, Horror",75,UK,English,Bob Carruthers,Phil Eckstein,Zombie Driftwood,"Brian Braggs, Rita Estevanovich, Peter Kosa, Kaz B., Colin G. Wilson, Lucy Darkness, Malcolm Ellis, Sue Howe, Bill Mervyn, Phil Pace, Fawad Siddiqui, Eric Valdes","When a cruise ship full of Caribbean tourists turn into zombies two metal fans must battle against zombie Armageddon armed only with a baseball bat, booze...and bagpipes.",2,396,GBP 1500000,"","",,21,3,2,32.1770641739494,200
tt1701992,Gadkiy utyonok,Gadkiy utyonok,2010,2010-09-16,"Animation, Family, Musical",75,Russia,Russian,Garri Bardin,"Hans Christian Andersen, Garri Bardin",Stayer Studio,"Khor Turetskogo, Svetlana Stepchenko, Armen Dzhigarkhanyan, Konstantin Raykin, Vladimir Spivakov, Yuliya Rutberg, Vladimir Kachan, Grigoriy Anashkin, Lyubov Matyushina","Adapted from the Andersen tale and played out in musical comedy mode, The Ugly Duckling is set in a farmyard where roosters, hens, ducks and geese live and lay eggs together. One fine day, ...",6.5,209,$ 1500000,"",$ 162484,,1,6,6.5,96.3481927749753,650
tt1712563,Promises Written in Water,Promises Written in Water,2010,2010-09-07,Drama,75,USA,English,Vincent Gallo,Vincent Gallo,Gray Daisy Films,"Vincent Gallo, Delfine Bafort, Hope Tomaselli, Lisa Love, Sage Stallone, Brenda Epperson, Livia Treviño, Patrick O'Connor, Nathalie Love","Promises Written in Water is an extremely stripped down abstract romantic story of a man and a woman, both in crisis. Kevin (Vincent Gallo) is a long-time, professional assassin, ...",6.7,143,$ 500000,"","",,7,12,6.7,90.0808725605958,670
tt1716747,Hellraiser: Revelations,Hellraiser: Revelations,2011,2011-10-18,Horror,75,USA,"English, Spanish",Víctor García,"Gary J. Tunnicliffe, Clive Barker",Dimension Films,"Steven Brand, Nick Eversman, Tracey Fairaway, Sebastien Roberts, Devon Sorvari, Sanny van Heteren, Dan Buran, Jay Gillespie, Stephan Smith Collins, Jolene Andersen, Camelia Dee, Sue Ann Pien, Adel Marie Ruiz, Fred Tatasciore","Two friends discover a puzzle box in Mexico, which unleashes cenobite Pinhead.",2.7,6854,$ 350000,"","",,102,76,2.7,34.5910411936014,270
tt1717229,The Unforgiving,The Unforgiving,2010,2010-08-20,"Horror, Thriller",75,South Africa,English,Alastair Orr,Alastair Orr,Illusionz Unlimited Entertainment,"Ryan Macquet, Claire Opperman, Michael Thompson, Craig Hawks","Two survivors, who appear unwilling to answer questions, are the only links authorities have to a spate of attacks that have hit rural South Africa.",4.3,482,$ 5000,"",$ 16743,,10,11,4.3,65.4584127889212,430
tt1718766,Detyam do 16...,Detyam do 16...,2010,2010-09-16,"Drama, Romance",75,Russia,Russian,Andrey Kavun,Oleg Malovichko,Krasnaya Strela,"Dmitriy Kubasov, Lyanka Gryu, Pavel Priluchnyy, Aleksey Gorbunov, Rodion Dolgirev, Mariya Filshtinskaya, Naira Khachaturyan, Olesya Potashinskaya, Kirill Shchennikov, Aleksey Shevchenkov, Anna Starshenbaum","Cyrus, Leia, Dasha, Max are still students. They have everything - for the first time. The first words of love, first sex, first joint dreams, first mistakes, first disappointments and first discoveries.",6.3,508,"","",$ 975201,,,2,6.3,87.0691853207982,630
tt1726871,Rsasa taycheh,Rsasa taycheh,2010,2010-11-01,Drama,75,Lebanon,Arabic,Georges Hachem,"",Abbout Productions,"Badi Abu-Shaqra, Badih Bouchakra, Takla Chamoun, Nadine Labaki, Haddad Pauline, Rodrigue Sleiman, Hind Taher",Noha is about to get married. Her family is relieved to see her take advantage of this last chance before officially becoming a spinster just like her sister. Everything seems to be going ...,6.2,257,"","","",,2,5,6.2,83.7097264907125,620
tt1728978,Longhorns,Longhorns,2011,2011-06-25,"Comedy, Drama, Romance",75,USA,"English, French, German, Polish",David Lewis,David Lewis,Morning View Films,"Jacob Newton, Derek Efrain Villanueva, Dylan Vox, Kevin Held, Stephen Matzke, Bonnie Marion, Katrina Sherwood, Sophia Revelli","Back in 1982, a Texas University student who was curious about the male sex fantasies he had been having, decides he needs to hook up with an out gay student on campus.",5.4,1372,"","","",,11,8,5.4,75.871910815278,540
tt1734067,Atrocious,Atrocious,2010,2012-06-16,"Horror, Mystery, Thriller",75,"Spain, Mexico",Spanish,Fernando Barreda Luna,Fernando Barreda Luna,Claqueta y Accion,"Cristian Valencia, Clara Moraleda, Chus Pereiro, Sergi Martin, Xavi Doz, Jose Masegosa, Rafael Amaya, Sammy Gad, Ferran Casterà Mosquera, Anne Sanz, Carlos Blanco Barberà, Rebecca Gil, Efrem Pinto, Silvia Arnau, Carlos Gaya",Two teenage siblings endure a terrifying experience while investigating a rural legend near their family's vacation home.,5,4735,"","",$ 4472,,34,82,5,71.2402343478025,500
tt1746196,Nosferatu. Uzhas nochi,Nosferatu. Uzhas nochi,2010,2010-10-28,"Animation, Horror, Thriller",75,Russia,Russian,Vladimir Marinichev,Vladimir Marinichev,CTB Film Company,"",Young clerk Jonathan travels to Transylvania in order to meet with a mysterious count.,3.5,103,"","",$ 45482,,,,3.5,50.4409243714354,350
tt1772371,The Catechism Cataclysm,The Catechism Cataclysm,2011,2011-10-19,Comedy,75,USA,English,Todd Rohal,Todd Rohal,"Littleman, Littleman, Littleman & Biggs","Judy Findlay, Steve Little, Robert Longstreet, Carlos Lopez, Derek Erdman, Ronald McGill, Alice Bridgforth, Laurel Paxton, Kevin Seal, Lynn Shelton, Vinny Smith, Andrew Tribolini, Sharon Vanderveer, Timothy Watkins, Wally Dalton","Father William Smoortser drops his bible into a toilet at a rest stop just before embarking on a day-long canoe trip, breaking loose all glorious hell.",5.6,644,"",$ 4373,$ 4373,47,9,30,5.6,79.8847714250867,560
tt1773467,House of Purgatory,House of Purgatory,2016,2016-10-21,"Horror, Thriller",75,USA,English,Tyler Christensen,Tyler Christensen,Watching Eye Productions,"Torey Adkins, Laura Coover, Marika Engelhardt, Brad Fry, Aaron Galvin, Elaine Ivy Harris, Dustin James, Brian Krause, Anne Leighton, Tom Lodewyck, Lisa Musser, Samantha Novak, Danny Rhodes, Catherine Smitko, Evan Vogel","Four teenagers go looking for a legendary haunted house that gives you money back for every floor you can complete. Once finding it, they realize the house is much more terrifying than a ...",4.2,497,$ 200000,"","",,24,11,4.2,59.1844394334916,420
tt1787636,300 Killers,300 Killers,2010,2010-12-07,"Action, Horror, Thriller",75,USA,English,Matt Jaissle,Matt Jaissle,Carilliam Pictures,"Johnny Andrews, Matt Jaissle, Sabastian Love, Tierra Peterson, J.P. Simmons, Tim Tinsman, Anthony Tomei","In the near future, drugs and crime have risen 500%. A disintegrating police force is unable to deal with this horrifying problem. When an undercover cop (Anthony Tomei) disappears, his ...",2.1,161,$ 10000,"","",,7,1,2.1,30.0138605382126,210
tt1796657,Tri bogatyrya i Shamakhanskaya tsaritsa,Tri bogatyrya i Shamakhanskaya tsaritsa,2010,2010-12-30,Animation,75,Russia,Russian,Sergei Glezin,"Aleksandr Boyarskiy, Vitaly Kozlov",Galaxy Vision,"Valeriy Solovyov, Anna Geller, Oleg Kulikovich, Liya Medvedeva, Sergey Makovetskiy, Konstantin Bronzit, Dmitri Bykhovski, Dmitriy Vysotskiy, Elena Shulman, Mariya Tsvetkova, Igor Shibanov, Anatoliy Petrov, Natalya Danilova","The 3 heroes are united to rescue the Prince of Kiev from the evil queen, who tries to regain her youth and beauty by means of magic.",6.4,1310,"","",$ 20157447,,,2,6.4,87.1770239424984,640
tt1819603,Mondomanila: Kung paano ko inayos ang buhok ko matapos ang mahaba-haba ring paglalakbay,Mondomanila: Kung paano ko inayos ang buhok ko matapos ang mahaba-haba ring paglalakbay,2012,2012-11-29,"Comedy, Horror, Musical",75,"Philippines, Germany","Filipino, Tagalog",Khavn,"Khavn, Norman Wilwayco",Kamias Road,"Timothy Castillo, Marife Necesito, Jim Rocky Tangco, Jonathan Reyes, Stefan Punongbayan, Alex Tiglao, Tony Hunt, Palito, Rodney Aquino, Whitney Tyson, Dante Perez, Paulo Vicente, Raymart Tangco, Manuel 'Bonbon' Valerozo, Rey Miyano","Tony knows nothing but tough times, living in the bleak circus of the slums he calls home amongst denizens of the underworld: the crippled pimp, the lonely housewife, the neighborhood gay ...",6,132,"","","",,,16,6,83.0071997093498,600
tt1828224,La Leyenda de la Llorona,La Leyenda de la Llorona,2011,2011-10-21,"Animation, Family",75,Mexico,"Spanish, Nahuatl",Alberto Rodriguez,"Ricardo Arnaiz, Omar Mustre",Anima Estudios,"Andrés Couturier, Mónica Del Carmen, Rafael Inclán, Rocio Lara","Based on a famous Mexican legend, a group of kids must stop the ghost of a woman whose guilt over the drowning of her own children leads her to abduct youngsters who wander the woods at ...",6.2,416,"","",$ 3898653,,1,2,6.2,85.5754221240079,620
tt1843303,The VelociPastor,The VelociPastor,2018,2018-08-31,"Action, Adventure, Comedy",75,"USA, China","English, Cantonese, Mandarin, Korean",Brendan Steere,Brendan Steere,Cyfuno Ventures,"Alyssa Kempinski, Greg Cohan, Aurelio Voltaire, Claire Hsu, Jesse Turits, Daniel Steere, Fernando Pacheco De Castro, Nicholas M. Garofolo, Zachary Steere, David Sokol, Jiechang Yang, George Schewnzer, Pat Hroncich, Douglas Saint James, Janice Young","After losing his parents, a priest travels to China, where he inherits a mysterious ability that allows him to turn into a dinosaur. At first horrified by this new power, a hooker convinces him to use it to fight crime. And ninjas.",5.1,2751,"","","",,120,48,5.1,70.9304562333608,510
tt1855232,Invasion of Alien Bikini,Eillieon bikini,2011,2011-08-25,"Comedy, Romance, Sci-Fi",75,South Korea,Korean,Young-doo Oh,"","","Eun-Jung Ha, Young-geun Hong",A city hero saves a girl but she is an alien which needs sperms to reproduce. She seduces the city hero who has taken a vow of chastity.,4.5,255,$ 4300,"","",,3,12,4.5,66.3847412261549,450
tt1861307,Deadly Detour,Deadly Detour,2011,2011-04-02,Horror,75,USA,English,Mike O'Mahony,"Andrew Hall, Mike O'Mahony",Maniac Films,"James Costa, Corinne Liz, Jon Owens, Stacie Hartman, Terence Salmon, Brian Harrington, Murphy Richards, Julie Ann Hamolko, Tina Khaladze, Erich Ficke, Andrew Hall, Heather Rubenstein, Allie Brennan, Rob Nawrocki, Kevin McClellan Jr.","Two carloads of friends are heading to Florida, the only thing on their minds: sex, booze, drugs and rock and roll. Engine trouble leaves the group stranded in rural Maryland, home of the ...",2.8,160,$ 200,"","",,14,8,2.8,36.8581829113339,280
tt1863160,Bambieffekten,Bambieffekten,2011,2011-07-22,Drama,75,Norway,Norwegian,Øystein Stene,"Linda Gabrielsen, Øystein Stene",Feil Film,"Kim S. Falck-Jørgensen, Knut Joner, Kristoffer Joner, Julia Schacht, Ane Dahl Torp, Viktoria Winge","Two girls meet on the Internet. Veronica and Cecilie are carrying different stories, but they have a common goal: To disappear. They meet up and go on a weekend trip to Veronica's hyper ...",5.2,167,NOK 3700000,"",$ 33144,,2,1,5.2,72.4879547528623,520
tt1870425,Mac & Devin Go to High School,Mac & Devin Go to High School,2012,2012-07-03,Comedy,75,USA,English,Dylan C. Brown,"Snoop Dogg, Wiz Khalifa",Yard Entertainment,"Snoop Dogg, Wiz Khalifa, Mike Epps, Teairra Mari, Derek Kane, Luenell, Teni Panosian, Paul Iacono, Andy Milonakis, Mystikal, Far East Movement, Kendre Berry, Samantha Cope, Alicia Monet Caldwell, Affion Crockett","A comedy that follows two high school students -- one overachiever struggling to write his valedictorian speech, the other a senior now going on his 15th year of school.",4.4,7941,"","","",,43,10,4.4,59.4109467858565,440
tt1884378,7 Splinters in Time,7 Splinters in Time,2018,2018-03-03,"Mystery, Sci-Fi, Thriller",75,USA,English,Gabriel Judet-Weinshel,Gabriel Judet-Weinshel,Intrinsic Value Films,"Emmanuelle Chriqui, Al Sapienza, Austin Pendleton, Lynn Cohen, Sarah Sokolovic, Akiva Schaffer, Edoardo Ballerini, Lauren Fox, Ashley Nicole Anderson, Giuliana Carullo, Greg Bennick","A detective investigates a murder, only to find that the victim is... himself. Soon, he discovers multiple versions of himself, not all of them friendly.",3.3,487,"","","",,24,7,3.3,45.3652724619731,330
tt1900817,Area 51 Confidential,Area 51 Confidential,2011,2011-09-24,"Horror, Sci-Fi, Thriller",75,USA,English,Brandon Slagle,"Brandon Slagle, Devanny Pinn",Pinnovating Productions,"Adrian Quihuis, Devanny Pinn, Brandon Slagle, Wolfgang Meyer, Angie Johnson, Tawny Amber Young, Matthew Landon, Marc Fearney, Morgan Swanson, Jimmy ScreamerClauz, Victor Bonacore, James Hawley",People from various walks of life find themselves held captive in a desolate area surrounding a secret government installation rumored to contain extraterrestrial life.,4.6,364,"","","",,4,5,4.6,62.291500237852,460
tt1927012,Dead Shadows,Dead Shadows,2012,2012,"Horror, Sci-Fi",75,France,French,David Cholewa,"Vincent Julé, Sean Whitley",DC Medias,"Fabian Wolfrom, Blandine Papillon, John Fallon, Rurik Sallé, Johanna Seror, Sylvain Dubois, Dominique Maud, Baya Rehaz, Ludovic Bastide, Claude Jules, Terence Missala, Norbert Ferrer, Margaux Devy, Clément Noblecourt, Gilles Barret","Chris' parents were murdered on the same day the Halley comet was visible from Earth. Eleven years later, a new comet lights up the Parisian sky, but as the night goes on, people begins to transform into horrible creatures.",3.7,1085,"","","",,14,49,3.7,48.0498175380872,370
tt1929237,The Nightingale of Tibet,The Nightingale of Tibet,2013,2015-03-10,"Drama, Musical",75,India,"English, Tibetan",IYER,"IYER, Pooja Ladha Surti",Iceberg Nine Films,"Chris Constantinou, Namgyal Lhamo, Robert Lin, Joseph Rezwin",A chronicle of the heroic life of one of the greatest singers of our times.,7.7,174,$ 2000000,"","",,1,1,7.7,102.281830514098,770
tt1948209,Viagem a Portugal,Viagem a Portugal,2011,2011-06-16,"Biography, Drama, Romance",75,Portugal,"Portuguese, French, Russian",Sérgio Tréfaut,Sérgio Tréfaut,Faux - Edições e Audiovisuais,"Maria de Medeiros, Isabel Ruth, Makena Diop, Rebeca Close, Pedro Pacheco, José Wallenstein, Mykola Chaban, Miguel Mendes, António Pires, Jorge Barros, Miguel Figueira, Nuno César, Nuno Milagre, Gracinha, João Pedro Bénard","Maria, a Ukrainian doctor, comes to Portugal to spend a year in with her husband, also a doctor. She is approached by agents of the Immigration Services that take her to an interrogation ...",6.6,141,"","","",,1,3,6.6,97.6191766503271,660
tt1954520,House with 100 Eyes,House with 100 Eyes,2013,2013,Horror,75,USA,English,"Jay Lee, Jim Roof",Jim Roof,Tapir Co,"Jim Roof, Shannon Malone, Larissa Lynch, Liz Burghdorf, Andrew Hopper, Jade Bryce, Katie Costick, Kelly Cunningham, Lauren Lakis, Michael O'Grady Moriarty, Max Potesky","Ed and Susan appear to be a normal loving couple, however, they are far from it. They are snuff filmmakers and want to make the first ever triple feature; Three victims, three kills, all in...",4.4,300,"","","",,6,41,4.4,66.6534566830609,440
tt1972740,Sierpniowe niebo. 63 dni chwaly,Sierpniowe niebo. 63 dni chwaly,2013,2013-09-13,"Drama, War",75,Poland,Polish,Irek Dobrowolski,Irek Dobrowolski,Grupa Filmowa Rekontrplan,"Krzysztof Kolberger, Anna Nehrebecka, Anna Romantowska, Jerzy Nowak, Lukasz Konopka, Stanislaw Brejdygant, Justyna Sienczyllo, Aleksander Mikolajczak, Emilian Kaminski, Kaja Grabowska, Michal Sekiewicz, Maciej Bilka, Dariusz Biskupski, Robert Darkowski, Irek Dobrowolski",A count of the Warsaw uprising in 1944 that mixes present when human remains are found and the past with a battalion of young people fighting the Nazis.,3.7,143,"","",$ 892817,,,1,3.7,54.4382366245468,370
tt1974287,JC comme Jésus Christ,JC comme Jésus Christ,2011,2012-02-08,Comedy,75,"France, Belgium",French,Jonathan Zaccaï,Jonathan Zaccaï,Vicious,"Vincent Lacoste, Elsa Zylberstein, Aure Atika, Ella Waldmann, Gilles Lellouche, Kad Merad, Jonathan Zaccaï, Nathanaël Karmitz, Charles Gillibert, Tania Garbarski, Élodie Hesme, Eric de Montalier, Jemima West, Juliette Ménager, Charles Thomé","Jean-Christophe Kern, known as JC, is not a teenager like the others. At 17, he has already won a Palme d'Or and a César. But this year, a new challenge awaits him: he must pass the baccalaureate",4.2,156,EUR 800000,"",$ 86419,,,5,4.2,57.0151388817692,420
tt1979379,Turning Point,Turning Point,2011,2011,"Comedy, Drama",75,USA,English,Ryan Moser,Ryan Moser,The 1248 Collective,"Swen Temmel, Manuel Domenech, Ashton Bingham, Kesia Elwin, Melanie Manooki, Blake Owens, Jacqueline Su-yuo, Jason Rudd, Guido Ghedin, Nathan Barnatt, Laurie Roberts, Katie Melcer, Douglas Myers, John Stobbe, Rick Padilla",A coming-of-age tale of three friends and the high school road trip that will forever influence their lives.,4.2,102,$ 2000,"","",,,,4.2,55.1806684407731,420
tt1997618,Another Superhero Movie,Another Superhero Movie,2011,2011-10-07,"Action, Comedy",75,USA,English,Creep Creepersin,Creep Creepersin,Creepersin Films,"David Andreiw, Creep Creepersin, John Karyus, Veronica Ricci, Charlie Vaughn, Peter Stickles, Kevin E. Scott, Matty Thunders, Robbyn Leigh, Bear Badeaux, Benjamin R. Brown III, Ann Grant, Dawna Lee Heising, Rob Hoflund, Naoyuki Ikeda","The story of Bruce, an out-of-shape, kind of geeky, kind of guy. The story starts off by this nerdy guy accidentally killing his brand new (and first) girlfriend during their first intimate...",2.4,485,"","","",,,,2.4,31.0806205775068,240
tt2008647,Termite: The Walls Have Eyes,Termite: The Walls Have Eyes,2011,2011,"Action, Drama, Mystery",75,USA,"",John Walcutt,"Jennie Marie Pacelli, John Walcutt","","Herb Astrow, Paul Ballin, Irene Carole, Reichel Caviteno, Alexandra Duran, Velinda Godfrey, Jesse Golden, Jen Hong, Dana Joiner, Emily Kosloski, Jonathan Leiva, Ty McGee, Simona Ondrejkova, Jennifer Ortega, Jennie Marie Pacelli",A troubled young girl gets a job at a modeling school where she is tortured by the voices in her head and the sounds in the walls. Roman Polanski meets Roger Corman in this micro-budget ...,3.5,149,"","","",,2,1,3.5,50.1605416434784,350
tt2071491,Jurassic Shark,Jurassic Shark,2012,2012-04-20,"Action, Adventure, Comedy",75,Canada,English,Brett Kelly,"Brett Kelly, Brett Kelly",Brett Kelly Entertainment,"Emanuelle Carriere, Christine Emes, Celine Filion, Angela Parent, Duncan Milloy, Phil Dukarsky, Kyle Martellacci, Joshua Gilbert Crosby, Kevin Preece, Jurgen Vollrath, Sarah Mosher, Kala Gray, Sherry Thurig, Jody Haucke, Darren Stevens","When an oil company unwittingly unleashes a prehistoric shark from its icy prison, the Jurassic killer maroons a group of thieves and beautiful young female college students on an abandoned island.",1.5,3922,"","","",,89,23,1.5,23.9968525310865,150
tt2073091,Taking Stock,Taking Stock,2015,2016-02-05,"Comedy, Crime, Drama",75,UK,"English, Japanese",Maeve Murphy,Maeve Murphy,Swipe Films,"Kelly Brook, Georgia Groome, Scot Williams, Lorna Brown, Femi Oyeniran, Jay Brown, Junichi Kajioka, Jack Waldouck, Xavier Alcan, Maeve Murphy, Alison Cain, Natalia Kapchuk, Pauline Murphy",A 'Bonnie and Clyde' inspired contemporary comedy drama.,3.8,188,"","",$ 837,,5,12,3.8,56.8008739222923,380
tt2073672,The Crumbles,The Crumbles,2012,2012,"Comedy, Drama, Music",75,USA,English,Akira Boch,Akira Boch,Chicken Teriyaki Bingo,"Teresa Michelle Lee, Katie Hipol, Jeff Torres, Seth Millwood, Adrian Torres, Ebony Perry, Amy Hill, Eugene Lee",An indie rock slice-of-life tragic-comedy about two young female musicians struggling with the ups and downs of being in the world's greatest band - that no one's ever heard of.,6.6,171,"","","",,4,,6.6,93.8903197794385,660
tt2080337,Lotte ja kuukivi saladus,Lotte ja kuukivi saladus,2011,2011-08-25,"Animation, Family",75,"Estonia, Latvia",Estonian,"Heiki Ernits, Janno Põldma","Janno Põldma, Heiki Ernits",Eesti Joonisfilm,"Evelin Võigemast, Margus Tabor, Mait Malmsten, Mikk Jürjens, Tõnu Oja, Lembit Ulfsak, Priit Võigemast, Tiit Sukk, Merle Palmiste, Garmen Tabor, Elina Reinold, Tõnu Kark, Anne Reemann, Anu Lamp, Hannes Kaljujärv",Plucky young Lotte embarks on an adventure with her uncle Klaus to solve the mystery of three stones that a pair of hooded figures are attempting to retrieve.,6.8,223,"","",$ 533442,,1,9,6.8,96.7910545641768,680
tt2081359,Sehrli xalat,Sehrli xalat,1964,1966-06-17,"Adventure, Comedy, Family",75,Soviet Union,"Azerbaijani, Russian",Alisattar Atakishiyev,"Alisattar Atakishiyev, A. Tarasov",Azerbaijanfilm,"Azer Kurbanov, Solmaz Hatamova, Kolya Loginov, Yusif Seyxov, Aliagha Aghayev, Anatoliy Falkovich, Movsoum Sanani, Aghahuseyin Javadov, Ismayil Osmanli, Hüseynaga Sadiqov, Mammad Sadiqov, Afrasiyab Mamedov, Alakbar Huseynzade, Mollaga Babirli, Lutfi Memmedbeyli","In second half of XX century a couple of student who had been called """" pioneer"""" in Azerbaijan USSR try to make a opening after repairing in Shah Palace. Indian wizard shows up and gives a ...",7.2,161,"","","",,2,,7.2,101.109049316308,720
tt2104896,"Faith, Love + Whiskey","Faith, Love + Whiskey",2012,2013-11-01,"Drama, Romance",75,Bulgaria,"Bulgarian, English",Kristina Nikolova,"Paul Dalio, Kristina Nikolova",Magic Shop,"Yavor Baharov, Odessa Buell, Lydia Indjova, John Keabler, Juri Rahnev, Ana Stojanovska, Valeri Yordanov","Neli, a bright, young Bulgarian woman, engaged to a well-off American panics and runs back home. She reunites with her drifter friends and the wild life of her past. Among stray dogs and ...",5.9,166,"","",$ 28928,,,5,5.9,78.5329111179932,590
tt2141789,Ivan Tsarevich i Seryy Volk,Ivan Tsarevich i Seryy Volk,2011,2011-12-29,"Animation, Adventure, Comedy",75,Russia,Russian,Vladimir Toropchin,Aleksandr Boyarskiy,CTB Film Company,"Liya Akhedzhakova, Kristina Asmus, Mikhail Boyarskiy, Tatyana Bunina, Nikita Efremov, Sergey Garmash, Ivan Okhlobystin, Sergey Russkin, Artur Smolyaninov, Viktor Sukhorukov","A fascinating story from the creators of the heroic trilogy, in which the heroes of Russian folk tales are waiting for new adventures, dangers and amusing situations.",6.2,1054,$ 3000000,"",$ 26420475,,1,1,6.2,83.7286397443381,620
tt2146834,Muirhouse,Muirhouse,2012,2012,"Drama, Horror, Thriller",75,Australia,English,Tanzeal Rahim,Tanzeal Rahim,Media Collective,"Iain P.F. McDonald, Kate Henderson, Steve Lynch, Libby Ashby, David Saporito, Jordie McKay, Lewis Ryan, Jacob Turner, Jack Walsh, Nicole Ryan, Sarah Leslie, Brenton Thompson",In 2007 author Phillip Muirhouse was left alone in a haunted homestead called 'Monte Cristo'. He was there making a documentary that was to accompany his latest book. He also broke the rule...,4.3,472,"","","",,15,10,4.3,61.9698463824225,430
tt2183194,Brev til Kongen,Brev til Kongen,2014,2014-01-17,Drama,75,"Norway, United Arab Emirates","Kurdish, Norwegian, English, Persian",Hisham Zaman,"Mehmet Aktas, Hisham Zaman",Film Farms,"Ali Bag Salimi, Zheer Durhan, Nazmi Kirik, Hassan Dimirci, Ivan Anderson, Derin Kader, Raouf Saraj, Amin Senatorzade, Catherine Elisabeth Howells, Iselin Doret Brandt Bestvold, Eilif Hartwig","Letter to the King portrays five people on a day trip from a refugee camp to Oslo, a welcome change in an otherwise monotonous life. But we soon realize that each and every one of them has ...",6.9,229,NOK 6000000,"",$ 529,,2,2,6.9,98.740902960946,690
tt2195498,Mer eller mindre mann,Mer eller mindre mann,2012,2012-09-14,"Comedy, Drama",75,Norway,Norwegian,Martin Lund,Martin Lund,Ape&Bjørn,"Henrik Rafaelsen, Egil Birkeland, Kim Eidhagen, Solvei Grimen Fosse, Aslag Guttormsgaard, Erik Haugstad, Janne Heltberg, Kristine Hessvik, Per Kjerstad, Elisabeth Lahr, Polly Lahr, Ina Lerner Grevstad, Anne Ma Usterud, Terje Ranes, Tore Sagen","35 year old Henrik is to establish himself with a pregnant girlfriend in a new apartment and start a new job. But he has some rather childish childhood friends, and is Henrik really ready to go from boy to more ore less a man?",5.9,436,"","",$ 114925,64,4,16,5.9,83.7848083241468,590
tt2201548,A Teacher,A Teacher,2013,2013-09-06,"Drama, Romance",75,USA,English,Hannah Fidell,Hannah Fidell,"","Lindsay Burdge, Will Brittain, Jennifer Prediger, Julie Dell Phillips, Jonny Mars, Chris Doubek, Matthew Genitempo, Cody Haltom, Robby King, Hannah Dannelly, Mark Farely, Michael J. Wilson, Don Hampton, Tony Layson, Elana Farley","A high school teacher in Austin, Texas takes sexual advantage over one of her students. Her life begins to unravel as the details of the relationship are exposed.",4.8,4242,"",$ 8348,$ 8348,47,30,32,4.8,68.7547023321808,480
tt2204456,Devir,Devir,2013,2013-05-31,Drama,75,Turkey,Turkish,Dervis Zaim,Dervis Zaim,"","Ali Ozel, Ramazan Bayar, Mustafa Salman, Engin Örsel, Mehmet Bayar, Çagla Köseogulari, Erdem Kiliç, Nimet Salman, Münire Bayat, Recep Atmaca, Mustafa Dimen, Süleyman Kücüktamer, Nadi Güler, Ibrahim Celikli, Hüseyin Sengün","At the end of every summer, 'Hasanpasa' village holds a shepherding contest. The traditional contest requires shepherds to herd their sheep one by one through a pool of water. The shepherd ...",6,177,"","",$ 3555,,1,2,6,75.7850871320065,600
tt2210985,Sloppy the Psychotic,Sloppy the Psychotic,2012,2012-02-25,Horror,75,USA,English,Mike O'Mahony,"Mike O'Mahony, Erich Ficke",Maniac Films,"Mike O'Mahony, James Costa, Lauren Myers, Lewis Beaver, Stacey Fitzpatrick, Fred Ficke, Norm Copsetta Jr., John O'Brien, Kayla Beaver, Rob Nawrocki, Matthew Thomason, Knox Chase, Tina Khaladze, Julie Ann Hamolko, Joseph Sheehan",A man whose main purpose in life is to make kids happy suddenly looses that privalige and decides to take revenge on all in a way so horrific that even the most cruelest of humans would shudder,4.6,105,$ 10000,"","",,6,20,4.6,60.8375672260628,460
