imdb_title_id,title,original_title,year,date_published,genre,duration,country,language,director,writer,production_company,actors,description,avg_vote,votes,budget,usa_gross_income,worlwide_gross_income,metascore,reviews_from_users,reviews_from_critics,avg_vote_10,avg_vote_100,avg_vote_1000
tt0053651,Beyond the Time Barrier,Beyond the Time Barrier,1960,1960-07-01,"Romance, Sci-Fi",75,USA,English,Edgar G. Ulmer,Arthur C. Pierce,Miller Consolidated Pictures (MCP),"Robert Clarke, Darlene Tompkins, Arianne Ulmer, Vladimir Sokoloff, Stephen Bekassy, John Van Dreelen, Boyd 'Red' Morgan, Ken Knox, Don Flournoy, Tom Ravick, Neil Fletcher, Jack Herman, James 'Ike' Altgens, William Shephard, John Loughney","In 1960, a military test pilot is caught in a time warp that propels him to year 2024 where he finds a plague has sterilized the world's population.",5.3,1243,$ 125000,"","",,42,24,5.3,75.0386004821926,530
tt0053658,Blaze Starr Goes Nudist,Blaze Starr Goes Nudist,1962,1962-07-01,Romance,75,USA,English,Doris Wishman,Doris Wishman,Juri Productions,"Blaze Starr, Ralph Young, Gene Berk, William Mayer, Sandra Sinclair, Stephen Bloom, Louise Downe, Jim Antonio, Warrene Gray, Richard Johnson, Mary Jo Walls, Joan Bamford, Craig Maudslay Jr., Dolores K. Norris, Lee Abell","Stripper Blaze Starr, playing herself, drives her agent--who is also her fiancé--to distraction by ignoring scheduled """"press functions"""" and spending her weekends at a nudist camp.",3.5,299,"","","",,9,5,3.5,49.4547231708488,350
tt0053911,High School Caesar,High School Caesar,1960,1960-11-01,Drama,75,USA,English,O'Dale Ireland,"O'Dale Ireland, Ethelmae Wilson Page",Marathon Pictures,"John Ashley, Gary Vinson, Steve Stevens, Lowell Brown, Judy Nugent, Daria Massey, Ken Plumb, Robin League, Beverly Franklin, Charles Leffler, Don Hinkle, Bob Head, Curtis Workman, Judi Vogelsang, Anton von Stralen","Matt Stevens is the big man at high school. He sweats the students for protection money, acquires copies of tests for a fee, and has rigged the votes so he can beat Kelly in the election ...",5.2,251,"","","",,19,3,5.2,75.6100630761962,520
tt0054393,Delitto del faro,Tormented,1960,1960-09-22,"Horror, Thriller",75,USA,English,Bert I. Gordon,"Bert I. Gordon, George Worthing Yates",Cheviot Productions,"Richard Carlson, Susan Gordon, Lugene Sanders, Juli Reding, Joe Turkel, Lillian Adams, Gene Roth, Vera Marshe, Harry Fleer, Merritt Stone, George Stanley, Dick Walsh, Leslie Thomas","A man lets a former flame fall to her death rather than let her interfere with his new relationship, but her ghost returns to disrupt his impending nuptials.",4.6,2115,"","","",,69,38,4.6,62.5075010141346,460
tt0054627,Anatomy of a Psycho,Anatomy of a Psycho,1961,1961-06-14,"Crime, Drama, Thriller",75,USA,English,Boris Petroff,"Jane Mann, Jane Mann",UNITEL,"Ronnie Burns, Pamela Lincoln, Darrell Howe, Judy Howard, Michael Granger, Frank Killmond, Russ Bender, Don Devlin, William Salzwedel, Robert Stabler, John B. Lee",The crazed brother of a condemned killer sent to the gas chamber swears vengeance on those he holds responsible for his brother's execution.,4,425,"","","",,24,28,4,53.0444253278693,400
tt0054663,Bara roligt i Bullerbyn,Bara roligt i Bullerbyn,1961,1961-12-16,"Adventure, Family",75,Sweden,Swedish,Olle Hellbom,"Astrid Lindgren, Astrid Lindgren",Artfilm,"Kaj Andersson, Tove Hellbom, Jan Erik Husbom, Tomas Johansson, Elisabeth Nordkvist, Lena Wixell, Kim Åsberg","",5.5,147,"","","",,,,5.5,84.3136205054635,550
tt0055562,L'astronave fantasma,Uchû Kaisokusen,1961,1971,"Action, Sci-Fi",75,Japan,Japanese,Kôji Ohta,"Shin Morita, Akihiro Watanabe",New Toei,"Shin'ichi Chiba, Ryûko Minakami, Mitsue Komiya, Seiichirô Kameishi, Rin'ichi Yamamoto, Kappei Matsumoto, Takashi Kanda, Shirô Okamoto, Junji Masuda, Hidemichi Ishikawa, Shinjirô Ebara, Harold Conway, Genji Kawai, Masazumi Okabe, Kôsaku Okano",Clumsy invaders from Neptune are thwarted by hero Space Chief and a nondescript group of microshort-wearing Japanese kids.,2.1,2435,"","","",,67,19,2.1,27.499474701227,210
tt0055863,Le concerto de la peur,Le concerto de la peur,1963,1963-11-29,Thriller,75,France,French,José Bénazéraf,"Anne-Marie Devillers, Guy Fanelli",Les Films Univers,"Yvonne Monlaur, Hans Verner, Michel Lemoine, Jean-Pierre Kalfon, Regine Rumen, Willy Braque, Marcel Champel, André Rouyer, Jean-Claude Massoulier, Christiane Arnaud",BANNED over half the World! A French crime potboiler starring Verner and Kalfon as rival gang leaders who clash over control of the narcotics trade. Parisian drug gangs are battling over ...,5.5,101,"","","",,3,7,5.5,75.7669251304259,550
tt0055872,The Creation of the Humanoids,The Creation of the Humanoids,1962,1962-07-03,Sci-Fi,75,USA,English,Wesley Barry,"Jay Simms, Jay Simms",Genie Productions Inc.,"Don Megowan, Erica Elliott, Frances McCann, Don Doolittle, David Cross, Richard Vath, Reid Hammond, Malcolm Smith, George Milan, Dudley Manlove","In a post holocaust society, robots take it on their own to help the dying human race by giving them android bodies.",5.8,883,"","","",,56,24,5.8,80.7513894442221,580
tt0055966,El espejo de la bruja,El espejo de la bruja,1962,1962-07-12,"Fantasy, Horror, Thriller",75,Mexico,Spanish,Chano Urueta,"Alfredo Ruanova, Carlos Enrique Taboada",Cinematográfica S.A.,"Rosita Arenas, Armando Calvo, Isabela Corona, Dina de Marco, Carlos Nieto, Alfredo Wally Barrón","A husband murders his wife, and years later her ghost emerges from a witch's mirror to take her revenge.",6.5,467,"","","",,13,17,6.5,94.5531614656093,650
tt0056905,Les carabiniers,Les carabiniers,1963,1963-05-31,"Comedy, Drama, War",75,"France, Italy",French,Jean-Luc Godard,"Beniamino Joppolo, Jean-Luc Godard",Cocinor,"Marino Masé, Patrice Moullet, Geneviève Galéa, Catherine Ribeiro, Barbet Schroeder, Jean-Louis Comolli, Gérard Poirot, Jean Brassat, Alvaro Gheri, Odile Geoffroy","During a war in an imaginary country, unscrupulous soldiers recruit poor farmers with promises of an easy and happy life. Two of these farmers write to their wives of their exploits.",6.9,2782,$ 140000,"","",,25,21,6.9,96.1563071023289,690
tt0056983,Terrore alla 13ª ora,Dementia 13,1963,1964-07-17,"Horror, Thriller",75,"USA, Ireland",English,Francis Ford Coppola,"Francis Ford Coppola, Jack Hill",Roger Corman Productions,"William Campbell, Luana Anders, Bart Patton, Mary Mitchel, Patrick Magee, Eithne Dunne, Peter Read, Karl Schanzer, Ron Perry, Derry O'Donavan, Barbara Dowling","Shocked by the death of her spouse, a scheming widow hatches a bold plan to get her hands on the inheritance, unaware that she is targeted by an axe-wielding murderer who lurks in the family's estate. What mystery shrouds the noble house?",5.7,6787,$ 40000,"","",,110,82,5.7,82.6951327911296,570
tt0057156,The Horror of It All,The Horror of It All,1964,1966-01-13,"Comedy, Horror, Mystery",75,UK,English,Terence Fisher,Ray Russell,Lippert Films,"Pat Boone, Erica Rogers, Dennis Price, Andree Melly, Valentine Dyall, Jack Bligh, Archie Duncan, Erik Chitty, Oswald Laurence",American salesman and his English fiancee visit her eccentric family who live in a remote old mansion in the countryside. The American soon realizes that someone is trying to kill everyone there to get the family fortune.,4.7,292,"","","",,13,9,4.7,68.3983537605137,470
tt0057238,Kyônetsu no kisetsu,Kyônetsu no kisetsu,1960,1960-09-03,"Crime, Drama",75,Japan,"Japanese, English",Koreyoshi Kurahara,Nobuo Yamada,Nikkatsu,"Tamio Kawaji, Yuko Chiyo, Eiji Gô, Hiroyuki Nagato, Noriko Matsumoto, Kôjirô Kusanagi, Chico Lourant, Chigusa Takayama, Reiko Arai, Yôko Kosono, Shôki Fukae","A juvenile delinquent gets out of the pen and causes reckless mayhem, mostly directed at the girlfriend of the journalist who helped send him up.",7,795,"","","",,10,19,7,100.256421494451,700
tt0057428,"Promesse, promesse",Promises..... Promises!,1963,1963-08-01,"Comedy, Drama, Romance",75,USA,English,King Donovan,"William Welch, Tommy Noonan",Noonan-Taylor Production,"Jayne Mansfield, Marie McDonald, Tommy Noonan, Mickey Hargitay, Fritz Feld, Eileen Barton, Claude Stroud, Eddie Quillan, Marjorie Bennett, Victor Lundin, T.C. Jones","After a drunken spree on a cruise ship, two women discover that they're pregnant, and set out to find who the fathers are.",5.1,406,$ 300000,"","",,12,9,5.1,73.309101866575,510
tt0057446,I temerari del West,The Raiders,1963,1963-12-01,"Action, Drama, Western",75,USA,English,Herschel Daugherty,Gene L. Coon,Revue Studios,"Brian Keith, Robert Culp, Judi Meredith, Jim McMullan, Alfred Ryder, Simon Oakland, Ben Cooper, Trevor Bardette, Harry Carey Jr., Richard H. Cutting, Addison Richards, Cliff Osmond, Paul Birch, Richard Deacon, Michael Burns","Wild Bill Hickok, Buffalo Bill and Calamity Jane help a Texas rancher against the railroad.",5.3,162,"","","",,7,,5.3,71.1557810007375,530
tt0057480,Scum of the Earth,Scum of the Earth,1963,1963-10-08,"Drama, Thriller",75,USA,English,Herschell Gordon Lewis,Herschell Gordon Lewis,"","William Kerwin, Louise Downe, Lawrence J. Aberwood, Sandra Sinclair, Mal Arnold, Craig Maudslay Jr., Christy Foushee, Doug Brennan, Christina Castel, Edward Mann, Lou Youngman, William Caulder",A naive and innocent teenage girl is blackmailed into modeling in the nude for a photographer who is in league with a teenage gang whose boss illegally sells photos of teenage girls being abused and degraded.,5.2,550,$ 11000,"","",,17,24,5.2,76.6405337656501,520
tt0057504,Live It Up!,Live It Up!,1963,1963-11-29,"Comedy, Musical",75,UK,English,Lance Comfort,"Lyn Fairhurst, Lyn Fairhurst",Three Kings,"David Hemmings, Jennifer Moss, John Pike, Heinz Burt, Steve Marriott, Joan Newell, Ed Devereaux, Veronica Hurst, Penny Lambirth, Peter Glaze, David Bauer, Anthony Ashdown, Douglas Ives, Paul Hansard, Geoff L'Cise","",5.5,131,"","","",,12,2,5.5,76.2803133044741,550
tt0057507,The Skydivers,The Skydivers,1963,1963-11-13,"Drama, Sport",75,USA,English,Coleman Francis,Coleman Francis,Crown International Pictures,"Kevin Casey, Eric Tomlin, Anthony Cardoza, Marcia Knight, Bob Carrano, Michael Rae, Jerry Mann, Keith Walton, Paul Francis, Titus Moede, Jimmy Bryant, Rue Barclay, Junior Nichols, Harold Hensley, Harold Saunders","A woman seeks revenge on her former lover, who owns a skydiving business.",3,4594,"","","",,56,15,3,38.1680338383852,300
tt0057864,Back Door to Hell,Back Door to Hell,1964,1964-11-01,"War, Drama",75,"Philippines, USA","English, Japanese",Monte Hellman,"Richard A. Guttman, John Hackett",Lippert Pictures,"Jimmie Rodgers, Jack Nicholson, John Hackett, Annabelle Huggins, Conrad Maga, Johnny Monteiro, Joe Sison, Henry Duval, Ben Perez, Vic Uematsu","During World War II, a three man commando team places its trust in the hands of a band of Filipino resistants, as they try to knock out a Japanese communication center.",5.3,715,"","","",,16,13,5.3,74.856952298845,530
tt0058629,El pantano de las ánimas,El pantano de las ánimas,1957,1957-09-05,"Mystery, Western, Horror",75,Mexico,Spanish,Rafael Baledón,"Ramón Obón, Ramón Obón",Alameda Films,"Gastón Santos, Rayo de Plata, Manola Saavedra, Pedro de Aguillón, Manuel Dondé, Sara Cabrera, Salvador Godínez, Lupe Carriles",A disappearing body leads a detective and his sidekick into an encounter with a gill man.,2.8,115,"","","",,12,7,2.8,42.7769050016695,280
tt0059921,The World of Abbott and Costello,The World of Abbott and Costello,1965,1965-04-01,Comedy,75,USA,English,"Charles Barton, Erle C. Kenton",Gene Wood,Vanguard Productions (I),"Jack E. Leonard, Bud Abbott, Lou Costello, Tom Ewell, Margaret Hamilton, Bela Lugosi, Marjorie Main, Nat Pendleton",A compilation of clips from 19 Abbott and Costello features:,6.4,232,"","","",,7,5,6.4,90.7203930008716,640
tt0060189,Brigitte et Brigitte,Brigitte et Brigitte,1966,1966-12-17,Comedy,75,France,French,Luc Moullet,Luc Moullet,Les Films Luc Moullet,"Colette Descombes, Françoise Vatel, Claude Melki, Michel Gonzalès, Joël Monteilhet, Gilles Chusseau, Claude Chabrol, Samuel Fuller, Michel Delahaye, Michel Mardore, Luc Moullet, Patrice Moullet, Dominique Rabourdin, Éric Rohmer, André Téchiné","A twenty minute documentary about the two smallest French villages. Then, Paris, 1960s. Two girls named Brigitte from the two villages share an apartment and study at the Sorbonne.",6.5,160,"","","",,2,4,6.5,96.0263788498618,650
tt0061069,Tatsu no ko Tarô,Tatsu no ko Tarô,1979,1979-03-17,"Adventure, Family, Fantasy",75,Japan,Japanese,"Kirio Urayama, Peter Fernandez","Miyoko Matsutani, Takashi Mitsui",Toei Animation,"Kazuo Kitamura, Sayuri Yoshinaga, Jun'ya Katô, Kirin Kiki, Kazuo Kumakura, Mîna Tominaga","A young boy has to make a voyage to a distant lake to save his mother, who has been turned into a dragon.",7.5,744,"","","",,9,7,7.5,107.05756674472,750
tt0061070,Teenage Gang Debs,Teenage Gang Debs,1966,1966-11-04,Crime,75,USA,English,Sande N. Johnsen,Hy Cahl,Jode Productions,"Diane Conti, Linda Gale, Eileen Dietz, Robin Nolan, Linda Cambi, Sue McManus, Joey Naudic, John Batis, Tom Yourk, Thomas Andrisano, George Winship, Douglas Mitchell, Tom Eldred, Alek Primrose, Gene Marrin",A no-good Manhattan girl moves in on a Brooklyn gang. Using her obvious charms she gets the leader killed in a fight over her and then takes up with the victor and new head man. Then she ...,5.8,148,"","","",,7,11,5.8,77.4697531198569,580
tt0061136,Ukamau,Ukamau,1966,1966-07-01,Drama,75,Bolivia,"Aymara, Spanish",Jorge Sanjinés,"Jorge Sanjinés, Óscar Soria",Grupo Ukamau,"Elsa Antequera, Néstor Cárdenas, Benedicta Huanca, Benedicta Mendoza, Néstor Peredo, Vicente Verneros Salinas","While her husband is on his way to the market, a peasant woman is raped and murdered. Her widower carefully plans his revenge.",7,178,"","","",,,1,7,93.3829358064596,700
tt0061561,Indecent Desires,Indecent Desires,1968,1968-04-17,"Drama, Fantasy",75,USA,English,Doris Wishman,Doris Wishman,Mostest Productions,"Sharon Kent, Trom Little, Michael Alaimo, Jackie Richards","Zeb finds a doll and a ring in a garbage can. Then, he sees Ann going to work with her friend Babs. He thinks she looks like the doll. When he gets home, he caresses the doll... Ann feels ...",4.9,197,"","","",,2,7,4.9,69.0165384965016,490
tt0062036,Night Fright,Night Fright,1967,1967-11-01,"Horror, Sci-Fi",75,USA,English,James A. Sullivan,"Russ Marker, Russ Marker","","John Agar, Carol Gilley, Ralph Baker Jr., Dorothy Davis, Bill Thurman, Roger Ready, Gary McLain, Darlene Drew, Frank Jolly, Bill Hollingsworth, Janiz Menshew, Russ Marker, Toni Pearce, Christi Simmons, Brenda Venus","A government space experiment into the effects of cosmic rays on animal life goes horribly wrong, creating a mutant monster that terrorizes a rural community.",2.6,720,$ 18000,"","",,46,24,2.6,35.2178949942323,260
tt0062793,"Giannino, il coguaro solitario","Charlie, the Lonesome Cougar",1967,1967-10-18,"Adventure, Family",75,USA,English,Winston Hibler,"Jack Speirs, Jack Speirs",Walt Disney Productions,"Ron Brown, Brian Russell, Linda Wallace, Jim Wilson, Lewis Sample, Clifford Peterson, Edward C. Moller, Charlie, Rex Allen","When a cougar raised by a group of loggers in the Pacific Northwest reverts to its natural instincts, the consequence could threaten its life.",6.9,778,"","","",,12,2,6.9,100.554642145303,690
tt0063000,Il mostro invincibile,Gamera tai uchu kaijû Bairasu,1968,1968-03-20,"Action, Adventure, Family",75,Japan,Japanese,"Noriaki Yuasa, Shigeo Tanaka",Niisan Takahashi,Daiei Studios,"Kôjirô Hongô, Tôru Takatsuka, Carl Craig, Michiko Yaegaki, Mari Atsumi, Junko Yashiro, Peter Williams, Kôji Fujiyama, Yoshirô Kitahara, Munehiko Takada, Mary Morris, Chikara Hashimoto, Kenji Gô, Akira Natsuki, Ken Nakahara","Gamera the Flying Turtle falls under the spell of evil aliens, but two children free him and he returns to fight the aliens' monster, Viras.",4.6,1259,"","","",,35,39,4.6,64.6411639196193,460
tt0063752,Urok literatury,Urok literatury,1968,1968,"Comedy, Drama",75,Soviet Union,Russian,Aleksey Korenev,Viktoriya Tokareva,Mosfilm,"Evgeniy Steblov, Leonid Kuravlyov, Inna Makarova, Valentina Malyavina, Evgeniy Leonov, Nina Agapova, Lyubov Dobrzhanskaya, Viktoriya Fyodorova, Aleksandr Lenkov, Andrey Mironov, Nikolay Parfyonov, Larisa Pashkova, Gotlib Roninson, Olga Semyonova","",7.3,114,"","","",,,,7.3,104.106257656767,730
tt0064055,The Babysitter,The Babysitter,1969,1969-09-01,"Crime, Drama, Thriller",75,USA,English,Don Henderson,"James E. McLarty, George E. Carey",Dundee Productions,"Patricia Wymer, George E. Carey, Anne Bellamy, Kathy Williams, Robert Tessier, Ken Hooker, Ted C. Frank, James E. McLarty, Sheri Jackson, Ruth Noonan, Warren Rose, Doris Rose, Charlie Messenger, Mary Messenger, Paul Wilmoth",An Assistant District Attorney is about to prosecute members of a motorcycle gang for murder when he gets blackmailed because of an affair with a teenage babysitter.,5.7,430,"","","",,21,12,5.7,76.9108088104,570
tt0064466,The Ice House,The Ice House,1969,1972,"Horror, Thriller",75,USA,English,Stuart E. McGowan,"",C-B Productions,"David Story, Robert Story, Jim Davis, Scott Brady, Nancy Dow, Karen Lee, Ken Osborne, Kelly Ross, Sabrina","A serial killer who works in an ice house murders women, then brings their bodies back to the ice house and stores them there. He also murders his identical twin brother, who is a policeman, and takes his place in the investigation.",3.5,114,"","","",,6,4,3.5,51.0980431952934,350
tt0066739,Uma Abelha na Chuva,Uma Abelha na Chuva,1972,1972-04-13,Drama,75,Portugal,Portuguese,Fernando Lopes,"Carlos D'Oliveira, Fernando Lopes",Media Filmes,"Laura Soveral, João Guedes, Zita Duarte, Ruy Furtado, Carlos Ferreiro, Adriano Reys, Fernando de Oliveira, Geny Frias",A married couple of rich and depressed noblemen destroy the lives of their servants out of spite.,6.6,223,"","","",,,1,6.6,88.2803926192299,660
tt0067375,Agente segreto al servizio di madame Sin,Madame Sin,1972,1973,"Adventure, Crime, Thriller",75,UK,English,David Greene,"Lou Morheim, Barry Shear",2X Productions,"Bette Davis, Robert Wagner, Denholm Elliott, Gordon Jackson, Dudley Sutton, Catherine Schell, Pik Sen Lim, Paul Maxwell, David Healy, Alan Dobie, Al Mancini, Roy Kinnear, Charles Lloyd Pack, Frank Middlemass, Arnold Diamond",A C.I.A. Agent is used as a pawn in an insane woman's plan to steal a Polaris submarine.,6.3,835,"","","",,13,10,6.3,89.5140350098906,630
tt0068296,Le pillole del farmacista,Die liebestollen Apothekerstöchter,1972,1974,Comedy,75,"West Germany, Switzerland",German,"Franz Antel, Michel Caputo","Hans Billian, Gretl Löwinger",TV13 Filmproduktion,"Sybil Danning, Eva Garden, Alena Penz, Christiane Maybach, Claus Tinney, Wolfgang Jansen, Gernot Möhner, Sascha Hehn, Erich Padalewski, Thomas Hörbiger, Rinaldo Talamonti, Josef Moosholzer, Paul Löwinger","When their straight-laced sister loses her job and returns home, Maria and Christel's sex lives grinds to a halt. They conspire, with the aid of a """"potency pill,"""" to change her views about sex. But little goes as planned.",4.7,147,"","","",,6,9,4.7,63.2606956168151,470
tt0068425,The Cremators,The Cremators,1973,1973-05-16,"Horror, Sci-Fi",75,USA,English,Harry Essex,"Harry Essex, Julian C. May",Arista Productions Inc.,"Maria De Aragon, Marvin Howard, Eric Allison, Eric Sinclair, Mason Caulfield, R.N. Bullard, Cecil Reddick, Tim Frawley, Jax Jason Carroll, Ola Kauffman, John Barnum, Al Ward, Chuck Hillig, James Ragan, David Essex","An alien life form that is a huge ball of living matter invades earth, and replenishes itself by absorbing people.",2.5,321,$ 50000,"","",,5,11,2.5,35.1384248194223,250
tt0068438,Curse of the Headless Horseman,Curse of the Headless Horseman,1972,1972,Horror,75,USA,English,John Kirkland,Kenn Riche,"","Ultra Violet, Marland Proctor, Claudia Reame, Don Carrara, Lydia Rosenbloom, B.G. Fisher, Ray Saniger, Jefferson Clarke, Robert Moss, Margo Dean, Jacquline Gonzales, Joe Cody, Lee Byers, Gina Michaels, Stephan D'Amico",A phantom horseman who appears every night with a human head tucked under his arm lets it be known that he is searching for eight gunfighters.,1.9,339,"","","",,20,9,1.9,28.0294015147918,190
tt0068540,Enter the Devil,Enter the Devil,1972,1972-09-29,"Horror, Thriller, Western",75,USA,English,Frank Q. Dobbs,"Frank Q. Dobbs, David S. Cass Sr.","","Joshua Bryant, Irene Kelly, David S. Cass Sr., John Martin, Carle Bensen, Norris Domingue, Willie Gonzales, Ed Geldart, Robert John Allen, Happy Shahan, Linda Rascoe, Wanda Wilson, I. Van Charles, Dave Ford, Byron Quisenberry","Somewhere in south west Texas, where a christian cult is said to have resided in the past, a deputy sheriff investigates a number of suspicious deaths.",5,343,"","","",,19,13,5,66.4218680507016,500
tt0068606,Fragmentos de um Filme-Esmola: A Sagrada Família,Fragmentos de um Filme-Esmola: A Sagrada Família,1972,1972,Comedy,75,Portugal,Portuguese,João César Monteiro,"Esquilo, James Joyce",Centro Português de Cinema (CPC),"Manuela de Freitas, João Perry, Dalila Rocha, Catarina Coelho, Fernando Soares, Maria Clementina Monteiro, José Gabriel, Luís Miguel Cintra","",6.7,103,"","","",,1,2,6.7,95.6393212545079,670
tt0068727,La vera storia del Dottor Jekyll,"I, Monster",1971,1971-11-01,Horror,75,UK,English,Stephen Weeks,"Robert Louis Stevenson, Milton Subotsky",Amicus Productions,"Christopher Lee, Peter Cushing, Mike Raven, Richard Hurndall, George Merritt, Kenneth J. Warren, Susan Jameson, Marjie Lawrence, Aimée Delamain, Michael Des Barres","In the Nineteenth Century, in London, the psychologist Charles Marlowe researches a new drug capable to release inhibitions and uses his patients as guinea pigs. He discusses the principles...",5.8,1163,"","","",,32,25,5.8,77.148544294325,580
tt0068993,Samkauli satrposatvis,Samkauli satrposatvis,1971,1973-07-01,"Drama, History",75,Soviet Union,Georgian,Tengiz Abuladze,"Akhmed Abu-Bakar, Tengiz Abuladze",Georgian-Film,"Ramaz Giorgobiani, Nani Bregvadze, Erosi Manjgaladze, Gogi Gegechkori, Ramaz Chkhikvadze, Eteri Abzianidze, Leonid Yengibarov, Kakhi Kavsadze, Otar Megvinetukhutsesi, Davit Kobulovi, N. Qvlividze, Temuri Chkhikvadze, Leomer Gugushvili, Irakli Nijaradze, Irina Shestua","",6.7,108,"","","",,2,1,6.7,95.8192231068223,670
tt0069811,The Body Shop,The Body Shop,1972,1972-06-01,"Horror, Sci-Fi",75,USA,English,J.G. Patterson Jr.,J.G. Patterson Jr.,"","J.G. Patterson Jr., Jenny Driggers, Roy Mehaffey, Linda Faile, Jan Benfield, Jeannine Aber, Candy Furr, Vickie O'Neal, Jerry Kearns, Ken Sigmon, Linda Lindsey, Bill Nevins, Joe B. Lamb, Chris Allen, Howard Stewart",Emminent plastic surgeon and mad scientist Don Brandon loses his wife Anitra - pinup model and social butterfly - in a tragic accident. He and his faithful humpbacked and drooling assistant...,3.6,388,"","","",,25,22,3.6,53.3618694732623,360
tt0069933,La tumba de la isla maldita,La tumba de la isla maldita,1973,1973-06-01,Horror,75,"Spain, USA","Spanish, English","Julio Salvador, Ray Danton","Ricardo Ferrer, Lois Gibson",Coast Industries Inc.,"Andrew Prine, Mark Damon, Patty Shepard, Teresa Gimpera, Ihsan Gedik, Mariano García Rey, Frank Braña, Edward Walsh, John Alderman, Jack La Rue Jr., Jem Osmanoglu, Shera Osman, Daniel Martín",Two archaeologists on a scientific dig come across a vampire burial ground and discover that the creatures are about to awaken and attack a nearby village.,4.6,660,"","","",,27,34,4.6,66.3284233741914,460
tt0069952,La chiamavano Susy Tettalunga,Deadly Weapons,1974,1974-04-01,"Crime, Thriller",75,USA,English,Doris Wishman,Judy J. Kushner,Juri Productions,"Chesty Morgan, Harry Reems, Richard Towers, Saul Meth, Phillip Stahl, Mitchell Fredericks, Denise Purcell, John McMohon","After the mob hits a guy with a list, one of the hoods keeps the list for himself to blackmail the people on it. When the mobsters find out he's a double-crosser, they off him, which angers...",3.9,849,"","","",,24,43,3.9,52.0931504253904,390
tt0070779,Sicarius - Febbre di sesso,Tendre et perverse Emanuelle,1973,1973,"Drama, Mystery, Thriller",75,France,French,Jesús Franco,"Jesús Franco, Jesús Franco",Brux International Pictures,"Norma Kastel, Jack Taylor, Lina Romay, Alice Arno, Pierre Taylou, Monique Van Linden, Roger Germanes, Richard Kennedy, Alberto Dalbés, Richard Bigotini, Raymond Hardy, Carmen Carbonell, Dan van Husen, Antonio Mayans, Susana Taber","A Whodunit from the great! The investigation into the suicide of a young woman found dead at the bottom of a cliff uncovers many lovers of both sexes, including her Brother's sister and her...",3.7,207,"","","",,5,5,3.7,50.8733921067175,370
tt0070832,Three Wishes for Cinderella,Tri orísky pro Popelku,1973,1973-11-16,"Drama, Fantasy, Family",75,"Czechoslovakia, East Germany","German, Czech",Václav Vorlícek,"Bozena Nemcová, Frantisek Pavlícek",Deutsche Film (DEFA),"Libuse Safránková, Pavel Trávnícek, Carola Braunbock, Rolf Hoppe, Karin Lesch, Dana Hlavácová, Jan Libícek, Vítezslav Jandák, Jaroslav Drbohlav, Vladimír Mensík, Míla Myslíková, Helena Ruzicková, Jan Sus, Milos Vavruska, Jirí Ruzicka",Life changes dramatically for a Czech housemaid when the house driver gives her three magical hazel nuts.,7.8,8069,"","","",,51,27,7.8,104.245780466947,780
tt0071583,The Groove Tube,The Groove Tube,1974,1975-06-05,Comedy,75,USA,English,Ken Shapiro,"Lane Sarasohn, Ken Shapiro",K.S. Productions,"Ken Shapiro, Richard Belzer, Chevy Chase, Buzzy Linhart, Richmond Baier, Berkeley Harris, Jennifer Welles, Roy Wallace, Kirtus Allen, Laura Glicken, Hal Fore, Jennifer Zens, Leo Petrie, Lane Sarasohn, Paul Norman","A collection of skits that make fun of 1970s television, featuring early appearances by Chevy Chase and Richard Belzer.",5.9,1889,$ 200000,"","",,41,19,5.9,85.8669988752311,590
