imdb_title_id,title,original_title,year,date_published,genre,duration,country,language,director,writer,production_company,actors,description,avg_vote,votes,budget,usa_gross_income,worlwide_gross_income,metascore,reviews_from_users,reviews_from_critics,avg_vote_10,avg_vote_100,avg_vote_1000
tt0037680,Espoir - Sierra de Teruel,L'espoir,1940,1946-06-03,"Drama, War",76,"Spain, France",Spanish,"André Malraux, Boris Peskine","Max Aub, André Malraux",Les Productions André Malraux,"Andrés Mejuto, Nicolás Rodríguez, José Santpere, Julio Peña, Pedro Codina, José María Lado, Serafín Ferro, Miguel del Castillo","1937, during the spanish civil war, at Teruel. The fight of the Republicans (with very poor means but high commitment) against fascist army of General Franco. Can be seen as romanticized ...",6.4,285,"","","",,1,7,6.4,91.0397358809594,640
tt0037785,Mi piace quella bionda,Hold That Blonde!,1945,1945-11-23,Comedy,76,USA,English,George Marshall,"Earl Baldwin, Walter DeLeon",Paramount Pictures,"Eddie Bracken, Veronica Lake, Albert Dekker, Frank Fenton, George Zucco, Donald MacBride, Lewis L. Russell, Norma Varden, Ralph Peters, Bobby Watson, Lyle Latell, Edmund MacDonald, Willie Best","A kleptomaniac falls in love with a woman who is member of a gang of jewel thieves, initially unaware of her true occupation.",6.3,107,"","","",,5,,6.3,83.8085916681964,630
tt0037939,L'arca di Noè,The Naughty Nineties,1945,1945-07-06,"Adventure, Comedy, Music",76,USA,English,Jean Yarbrough,"Edmund L. Hartmann, John Grant",Universal Pictures,"Bud Abbott, Lou Costello, Alan Curtis, Rita Johnson, Henry Travers, Lois Collier, Joe Sawyer, Joe Kirk","When their captain is swindled out of his riverboat by a trio of gamblers, stage show star Abbott and his bumbling sidekick Costello must put things right.",7.2,1770,"","","",,27,11,7.2,103.670862748652,720
tt0038134,La schiava del sudan,Sudan,1945,1948-03-27,"Action, Adventure, Romance",76,USA,English,John Rawlins,Edmund L. Hartmann,Universal Pictures,"Maria Montez, Jon Hall, Turhan Bey, Andy Devine, George Zucco, Robert Warwick, Philip Van Zandt, Harry Cording, George Lynn, Charles Arnt","Young, lovely Naila becomes queen of the ancient Egyptian kingdom of Khemis when her father is killed in a slave revolt. Continuing her penchant for going incognito among the people, she ...",6.2,134,"","","",,4,4,6.2,88.2514041130697,620
tt0038151,Tarzan e le amazzoni,Tarzan and the Amazons,1945,1945-04-29,"Action, Adventure",76,USA,English,Kurt Neumann,"Hans Jacoby, Marjorie L. Pfaelzer",Sol Lesser Productions,"Johnny Weissmuller, Brenda Joyce, Johnny Sheffield, Henry Stephenson, Maria Ouspenskaya, Barton MacLane, Donald Douglas, Steven Geray, J.M. Kerrigan, Shirley O'Hara","A group of archaeologists asks Tarzan to help them find an ancient city in a hidden valley of women. He refuses, but Boy is tricked into doing the job. The queen of the women asks Tarzan to help them.",6.4,2251,"","","",,25,12,6.4,87.6872082926003,640
tt0038197,Baciami e lo saprai!,Twice Blessed,1945,1945-05-31,Comedy,76,USA,English,Harry Beaumont,"Ethel Hill, Ethel Hill",Metro-Goldwyn-Mayer (MGM),"Preston Foster, Gail Patrick, Lee Wilde, Lyn Wilde, Richard Gaines, Jean Porter, Marshall Thompson, Jimmy Lydon, Gloria Hope, Ethel Smith, Douglas Cowan, Warren Mills, Joel Friedkin, Ralph Brooke, Ralph Lee","Stephanie and Terry are two identical twins who have been split up since their parents divorced seven years before. Each envies the life style of the other so they decide, without telling ...",6.1,149,"","","",,7,5,6.1,83.4573712575181,610
tt0038462,Inganno,Decoy,1946,1947-06-12,"Crime, Drama, Film-Noir",76,USA,English,Jack Bernhard,"Nedrick Young, Stanley Rubin",Bernhard-Brandt Productions,"Jean Gillie, Edward Norris, Robert Armstrong, Herbert Rudley, Sheldon Leonard, Marjorie Woodworth, Philip Van Zandt, Carole Donne, John Shay, Bert Roach, Rosemary Bertrand","A mortally wounded female gangster recounts how she and her gang revived an executed killer from the gas chamber, to try and find out where he buried a fortune in cash.",6.8,1466,"","","",,47,19,6.8,94.5692540182276,680
tt0038494,Il mistero del carillon,Dressed to Kill,1946,1946-06-07,"Crime, Mystery",76,USA,English,Roy William Neill,"Leonard Lee, Frank Gruber",Universal Pictures,"Basil Rathbone, Nigel Bruce, Patricia Morison, Edmund Breon, Frederick Worlock, Carl Harbord, Patricia Cameron, Holmes Herbert, Harry Cording, Leyland Hodgson, Mary Gordon, Ian Wolfe","Sherlock Holmes sets out to discover why a trio of murderous villains, including a dangerously attractive female, are desperate to obtain three unassuming and inexpensive little music boxes.",6.9,5279,"","","",,71,25,6.9,104.035319934446,690
tt0039389,Per te io muoio,For You I Die,1947,1947-12-17,"Crime, Drama, Film-Noir",76,USA,English,John Reinhardt,Robert Presnell Sr.,Arpi Productions,"Cathy Downs, Paul Langton, Mischa Auer, Roman Bohnen, Jane Weeks, Marian Kerby, Mannela Callejo, Don C. Harvey, Charles Waldron Jr., Rory Mallinson","A young convict,Johnny Coulter, serving as a trustee and with only a year remaining on his sentence, is forced to participate in a prison break by one of the hardened criminals. They ...",6.2,176,"","","",,9,5,6.2,85.5244452051832,620
tt0039650,Voragine,Nada,1947,1947-11-11,Drama,76,"Spain, Italy",Spanish,Edgar Neville,"Carmen Laforet, Conchita Montes",Compañía Industrial Film Español S.A. (CIFESA),"Conchita Montes, Fosco Giachetti, María Denis, María Cañete, Tomás Blanco, Juana Mansó, Félix Navarro, Julia Caba Alba, José María Mompín, Diana Salcedo, Manuel Aguilera, Rosario Royo, Rafael Bardem, Anita Bass, Guillermo Méndez","Barcelona, in the forties. Young Andrea comes to town to start college in the midst of an oppressive environment and extreme poverty. She's staying at her aunt Angustias, along with other ...",6.3,108,"","","",,,,6.3,83.9969487980805,630
tt0040166,La freccia nera,The Black Arrow,1948,1948-06-30,"Action, Adventure, History",76,USA,English,Gordon Douglas,"Richard Schayer, David P. Sheppard",Columbia Pictures,"Louis Hayward, Janet Blair, George Macready, Edgar Buchanan, Rhys Williams, Walter Kingsford, Lowell Gilmore, Halliwell Hobbes, Paul Cavanagh, Ray Teal, Russell Hicks, Leslie Denison, Betty Fairfax, Billy Bevan","Young nobleman Richard Shelton returns from the War of the Roses to find his father murdered, a fugitive family friend blamed, and his uncle occupying his estates.",6.2,273,"","","",,10,1,6.2,84.435763047974,620
tt0040237,Close-Up,Close-Up,1948,1948-06-09,"Crime, Drama, Film-Noir",76,USA,English,Jack Donohue,"John Bright, Jack Donohue",Harry Brandt Productions,"Alan Baxter, Virginia Gilmore, Richard Kollmar, Loring Smith, Phillip Huston, Joey Faye, Russell Collins, Michael Wyler, Sid Melton, Wendell K. Phillips, Erin Selwyn, Jimmy Sheridan, Marcia Walter","After his photo is accidentally taken, that someone will do everything in his power to get hold of the negative.",6.1,102,"","","",,8,2,6.1,84.6788459875335,610
tt0040651,Nodo scorsoio,Noose,1948,1948-10-18,"Crime, Drama",76,UK,"English, French, Italian",Edmond T. Gréville,"Richard Llewellyn, Richard Llewellyn",Associated British Picture Corporation (ABPC),"Carole Landis, Joseph Calleia, Derek Farr, Stanley Holloway, Nigel Patrick, Ruth Nixon, Carol van Derman, John Slater, Leslie Bradley, Reginald Tate, Edward Rigby, John Salew, Robert Adair, Hay Petrie, Uriel Porter","In post- WW2 Britain, an American fashion journalist, her ex-army fiancé, and a gang of honest toughs from a local gym attempt to bring black market organized crime to justice.",6.3,274,"","","",,10,2,6.3,88.8084393010986,630
tt0040868,"Texas, Brooklyn & Heaven","Texas, Brooklyn & Heaven",1948,1948-07-16,"Comedy, Romance",76,USA,English,William Castle,"Barry Benefield, Lewis Meltzer",Robert S. Golden Productions,"Guy Madison, Diana Lynn, James Dunn, Michael Chekhov, Florence Bates, Lionel Stander, William Frawley, Roscoe Karns, Margaret Hamilton, Irene Ryan, Colin Campbell, Clem Bevans, Moyna MacGill, Audie Murphy, Jean Dean",A would-be playwright and a young woman escaping from a job at a gas station meet cute and fall in love.,6.2,282,$ 1000000,"","",,12,1,6.2,90.4825308643171,620
tt0041238,Il ritorno di Lassie,Challenge to Lassie,1949,1949-10-31,"Drama, Family",76,USA,English,Richard Thorpe,"William Ludwig, Eleanor Atkinson",Metro-Goldwyn-Mayer (MGM),"Edmund Gwenn, Donald Crisp, Geraldine Brooks, Reginald Owen, Alan Webb, Ross Ford, Henry Stephenson, Alan Napier, Sara Allgood, Edmund Breon, Arthur Shields, Lumsden Hare, Charles Irwin, Pal","When Lassie's master dies, an old friend tries to convince a judge that the dog's life should be spared.",6.3,513,"","","",,10,5,6.3,85.213850766072,630
tt0041529,Cocaina,Johnny Stool Pigeon,1949,1949-04-20,"Crime, Drama, Film-Noir",76,USA,English,William Castle,"Henry Jordan, Robert L. Richards",Universal International Pictures (UI),"Howard Duff, Shelley Winters, Dan Duryea, Tony Curtis, John McIntire, Gar Moore, Leif Erickson, Barry Kelley, Hugh Reilly, Wally Maher",US Treasury agent George Morton persuades convicted criminal Johnny Evans to help him destroy a drug smuggling ring in exchange for early parole.,6.7,381,"","","",,10,2,6.7,91.5850162106669,670
tt0041613,I milionari,Ma and Pa Kettle,1949,1949-04-01,Comedy,76,USA,English,Charles Lamont,"Al Lewis, Betty MacDonald",Universal International Pictures (UI),"Marjorie Main, Percy Kilbride, Richard Long, Meg Randall, Patricia Alphin, Esther Dale, Barry Kelley, Harry Antrim, Isabel O'Madigan, Ida Moore, Emory Parnell, Boyd Davis, O.Z. Whitehead, Ray Bennett, Alvin Hammer","On the verge of being evicted from their run-down farmhouse, the large Kettle family is given a new, modern home after Pa wins a contest, but he is accused of plagiarizing his winning slogan by a jealous local woman.",6.9,1166,"","","",,18,5,6.9,102.987784722303,690
tt0041823,La rosa di Bagdad,La rosa di Bagdad,1949,1949-12-22,"Animation, Fantasy",76,Italy,Italian,Anton Gino Domenighini,"E. D'Angelo, Lucio De Caro",Ima Film,"Stefano Sibaldi, Germana Calderini, Giulio Panicali, Olinto Cristina, Mario Besesti, Giovanna Scotto, Renata Marini, Lauro Gazzolo, Maria Saccenti, Beatrice Preziosa, Carlo Romano, Sakella Rio, Luisa Malagrida, F. Delle Fornaci, Giulio Fioravanti",An insane woman brings peace to her village by being the most ultimate singer around.,6.7,201,"","","",,6,4,6.7,96.5910469334048,670
tt0041917,Duello infernale,Stampede,1949,1949-05-01,Western,76,USA,English,Lesley Selander,"John C. Champion, Blake Edwards",Scott R. Dunlap Productions,"Rod Cameron, Gale Storm, Johnny Mack Brown, Don Castle, Donald Curtis, John Miljan, Jonathan Hale, John Eldredge, Adrian Wood, Wes Christensen, James Harrison, Duke York, Steve Clark, I. Stanford Jolley, Marshall Reed","In 1887 Arizona, in the context of the settler-vs-cattleman struggle, two rancher brothers fall in-love with the same settler girl while crooked businessmen try to swindle both sides.",6.4,130,"","","",,6,3,6.4,89.792988173571,640
tt0041986,Complotto a San Francisco,Treasure of Monte Cristo,1949,1949-08-27,"Crime, Drama, Film-Noir",76,USA,English,William Berke,"Aubrey Wisberg, Jack Pollexfen",Lippert Pictures,"Glenn Langan, Adele Jergens, Steve Brodie, Bobby Jordan, Michael Whalen, George Davis, Margia Dean, Sid Melton, Brian O'Hara, Robert Boon, Jeritza Novak, Jimmy O'Neil, Curtis Jarrett, Charles Regan, Larry Barton","This modern tale borrows from an old story in establishing Langan, who works on a ship that docks in San Francisco, as a descendant of the Count of Monte Cristo. Crooked Lawyer Brodie sets ...",6.2,100,"","","",,9,1,6.2,77.5144721554807,620
tt0042189,Alice in Wonderland,Alice in Wonderland,1949,1949-05-13,"Animation, Action, Family",76,"USA, France, UK",English,Dallas Bower,"Lewis Carroll, Henry Myers",Lou Bunin Productions,"Stephen Murray, Ernest Milton, Pamela Brown, Felix Aylmer, David Reed, Joyce Grenfell, Carol Marsh, Jack Train, Peter Bull, Ivan Staff, Claude Hulbert, Raymond Bussières",This exceptional theatrical version of Lewis Carroll's 1865 classic features a combination of live characters and stop motion animation.,6.5,721,"","","",,11,4,6.5,81.2856803326591,650
tt0042339,Pelle di bronzo,Comanche Territory,1950,1950-05-01,"Adventure, Romance, Western",76,USA,English,George Sherman,"Lewis Meltzer, Oscar Brodney",Universal International Pictures (UI),"Maureen O'Hara, Macdonald Carey, Will Geer, Charles Drake, Pedro de Cordoba, Ian MacDonald, Rick Vallin, Parley Baer, James Best, Edmund Cobb, Glenn Strange","White settlers plan to defy the agreement between the government and the Comanche in order to mine for silver on Comanche lands, while scout Jim Bowie tries to keep the peace in the territory.",5.7,554,"","","",,16,7,5.7,84.5032178456549,570
tt0042411,I filibustieri delle Antille,Double Crossbones,1951,1951-06-22,"Adventure, Comedy, History",76,USA,English,Charles Barton,"Oscar Brodney, Oscar Brodney",Universal International Pictures (UI),"Donald O'Connor, Helena Carter, Will Geer, John Emery, Stanley Logan, Kathryn Givney, Hayden Rorke, Morgan Farley, Robert Barrat, Alan Napier, Glenn Strange, Louis Bacigalupi, Hope Emerson, Charles McGraw","After being falsely accused of dishonesty, a young man decides to become a pirate.",5.9,251,"","","",,10,2,5.9,83.2685586543321,590
tt0042548,He's a Cockeyed Wonder,He's a Cockeyed Wonder,1950,1950-12-02,Comedy,76,USA,English,Peter Godfrey,Jack Henley,Columbia Pictures,"Mickey Rooney, Terry Moore, William Demarest, Charles Arnt, Ross Ford, Ned Glass, Mike Mazurki, Douglas Fowley, William 'Bill' Phillips","Freddie Frisby is informed by Bob Sears that he can't marry Bob's daughter, Judy, as he is only a fumbling failure as an orange picker, and Judy can do better. Freddie's prospects brighten ...",5.3,114,"","","",,5,,5.3,71.280382483866,530
tt0042642,Killer Shark,Killer Shark,1950,1950-03-19,Adventure,76,USA,English,Budd Boetticher,Charles Lang,Monogram Pictures,"Roddy McDowall, Laurette Luez, Roland Winters, Edward Norris, Rick Vallin, Douglas Fowley, Nacho Galindo, Ralf Harolde, Dickie Moore, Ted Hecht, Charles Lang, Robert Espinoza, John Sebastian","A college student takes a break and goes out to sea with his father, the captain of a shark-hunting boat. When his inexperience results in an accident in which his father and a crewman are ...",4.3,155,"","","",,8,4,4.3,61.7979372489757,430
tt0042686,Bagliori sulla giungla,The Lost Volcano,1950,1950-06-25,Adventure,76,USA,English,Ford Beebe,"Roy Rockwood, Jack DeWitt",Monogram Pictures,"Johnny Sheffield, Donald Woods, Marjorie Lord, John Ridgely, Tommy Ivo, Elena Verdugo, Don C. Harvey, Grandon Rhodes, Robert Lewis","When a young boy is kidnapped by hunters who believe he knows the location of a great treasure, Bomba the Jungle Boy seeks to rescue him from them and from a volcano which is about to erupt.",5.9,169,"","","",,10,2,5.9,81.4982129218224,590
tt0042744,Più forte dell'odio,Montana,1950,1951-01-24,Western,76,USA,English,"Ray Enright, Raoul Walsh","James R. Webb, Borden Chase",Warner Bros.,"Errol Flynn, Alexis Smith, S.Z. Sakall, Douglas Kennedy, James Brown, Ian MacDonald, Charles Irwin, Paul E. Burns, Tudor Owen, Lester Matthews","An Australian sheepman comes to Montana looking for grazing space, is opposed by local ranchers and a wealthy cattle-woman.",6.2,1036,$ 2000000,"","",,19,9,6.2,85.0526663128539,620
tt0042791,No Trace,No Trace,1950,1950-09-08,"Crime, Drama",76,UK,English,John Gilling,"John Gilling, Robert S. Baker",Tempean Films,"Hugh Sinclair, Dinah Sheridan, John Laurie, Dora Bryan, Barry Morse, Beatrice Varley, Michael Brennan, Michael Ward, Madoline Thomas, Ernest Butcher, Hal Osmond, Sidney Vivian, Sam Kydd, Anthony Pendrell",When crime-writer Robert Southley finds his well-healed London lifestyle threatened by blackmail from a former American criminal associate he murders him. He is surprised when a Scotland ...,6.3,129,"","","",,10,1,6.3,85.6506676821978,630
tt0042829,Canzone pagana,Pagan Love Song,1950,1950-12-29,"Musical, Romance",76,USA,English,Robert Alton,"Jerry Davis, Robert Nathan",Metro-Goldwyn-Mayer (MGM),"Esther Williams, Howard Keel, Minna Gombell, Charles Mauu, Rita Moreno","A man from Ohio inherits a coconut plantation and falls in love with a half-American, half-Tahitian beauty. Song-and-swim musical ensues in the tropical paradise.",5.8,420,$ 1906265,"","",,19,7,5.8,83.3625086422278,580
tt0043058,Totò cerca moglie,Totò cerca moglie,1950,1951-10-03,Comedy,76,Italy,Italian,Carlo Ludovico Bragaglia,"Sandro Continenza, Sandro Continenza",Forum Film,"Totò, Ave Ninchi, Marisa Merlini, Aroldo Tieri, Paul Muller, Mario Castellani, Nerio Bernardi, Bruno Cantalamessa, Giovanna Galletti, Enzo Garinei, Zoe Incrocci, Elvi Lissiak, Anna Maestri, Nino Marchesini, Mario Meniconi","Aunt Agatha writes to Toto, informing him not to send him a penny more until he is married.",6.2,182,"","","",,2,,6.2,91.6269615042056,620
tt0043291,La rivolta degli Apaches,Apache Drums,1951,1951-04-01,"Action, Adventure, Drama",76,USA,English,Hugo Fregonese,"David Chandler, Harry Brown",Universal International Pictures (UI),"Stephen McNally, Coleen Gray, Willard Parker, Arthur Shields, James Griffith, Armando Silvestre, Georgia Backus, Clarence Muse, Ruthelma Stevens, James Best, Chinto Guzman, Ray Bennett","A gambler is thrown out of a western town, but returns when the town is suddenly threatened by a band of marauding Apaches.",6.4,591,"","","",,18,14,6.4,89.9604099071281,640
tt0043392,Non cedo alla violenza,Cave of Outlaws,1951,1951-11-01,"Action, Drama, Romance",76,USA,English,William Castle,Elizabeth Wilson,Universal International Pictures (UI),"Macdonald Carey, Alexis Smith, Edgar Buchanan, Victor Jory, Hugh O'Brian, Houseley Stevenson, Hugh Sanders, Raymond Bond, Robert Osterloh",Released after serving 15 years in prison for train robbery Pete Carver being the only survivor of the gang goes looking for the loot in the caves where it was hidden.,5.9,254,"","","",,11,4,5.9,82.5761680877776,590
tt0043588,The Girl on the Bridge,The Girl on the Bridge,1951,1951-12-01,"Crime, Drama",76,USA,English,Hugo Haas,"Hugo Haas, Arnold Lipp",Hugo Haas Productions,"Hugo Haas, Beverly Michaels, Robert Dane, Anthony Jochim, John Close, Darr Smith, Judy Clark, Maria Bibikov, Al Hill, Dick Pinner, Rose Marie Valenzuela, Jose Duvall, Allan Ray, William Kahn, Jimmy Moss","An elderly watchmaker stops a beautiful young blonde from committing suicide by throwing herself off a bridge. They eventually marry, and things go well until a man from the woman's ...",6.7,130,"",$ 1708839,$ 1709141,,3,3,6.7,90.0893990348211,670
tt0043849,La roccia di fuoco,New Mexico,1951,1951-05-18,Western,76,USA,English,Irving Reis,Max Trell,Irving Allen Productions,"Lew Ayres, Marilyn Maxwell, Andy Devine, Robert Hutton, Donald Buka, Ted de Corsia, Lloyd Corrigan, John Hoyt, Jeff Corey, Raymond Burr, Verna Felton, Ian MacDonald, Walter Greaza, Peter Price, Bud Rae",A cavalry captain has great difficulty keeping the peace between his tyrannical colonel and an Indian chief bent on revenge.,5.7,123,$ 720000,"","",,12,,5.7,82.0686559725824,570
tt0044557,La tua bocca brucia,Don't Bother to Knock,1952,1953-02-05,"Drama, Film-Noir, Mystery",76,USA,English,Roy Ward Baker,"Daniel Taradash, Charlotte Armstrong",Twentieth Century Fox,"Richard Widmark, Marilyn Monroe, Anne Bancroft, Donna Corcoran, Jeanne Cagney, Lurene Tuttle, Elisha Cook Jr., Jim Backus, Verna Felton, Willis Bouchey, Don Beddoe, Emmett Vogan","After being dumped by his girlfriend, an airline pilot pursues a babysitter in his hotel and gradually realizes she's dangerous.",6.9,5842,"","","",,88,43,6.9,98.7866115992387,690
tt0044851,Gianni e Pinotto al Polo Nord,Lost in Alaska,1952,1952-08-01,"Adventure, Comedy",76,USA,English,Jean Yarbrough,"Elwood Ullman, Martin Ragaway",Universal International Pictures (UI),"Bud Abbott, Lou Costello, Mitzi Green, Tom Ewell, Bruce Cabot, Emory Parnell, Jack Ingram, Rex Lease, Joe Kirk, Minerva Urecal","Two volunteer firemen rescue a gold prospector from suicide. However, once they discover that the police mistakenly want them for murder, they travel with the prospector to Alaska to help ...",6.4,1852,$ 672000,"","",,12,8,6.4,94.1066686054402,640
tt0044908,Miss Robin Hood,Miss Robin Hood,1952,1952-11-01,"Comedy, Crime",76,UK,English,John Guillermin,"Reed De Rouen, Geoffrey Orme",Group 3,"Margaret Rutherford, Richard Hearne, Edward Lexy, Fanny Rowe, Michael Medwin, Eunice Gayson, Sidney James, Dora Bryan, Eric Berry, Russell Waters, Peter Jones, Reg Varney, Susanne Gibbs, Francis De Wolff, James Robertson Justice","Henry Wrigley (Richard Hearne) is happy writing stories for a children's' comic. Then he meets Miss Honey (Dame Margaret Rutherford), who encourages him to go into minor crime.",6,262,"","","",,12,,6,79.5763270819623,600
tt0045469,Gianni e Pinotto contro il dottor Jekyll,Abbott and Costello Meet Dr. Jekyll and Mr. Hyde,1953,1954-05-12,"Comedy, Horror, Mystery",76,USA,English,Charles Lamont,"Lee Loeb, John Grant",Universal International Pictures (UI),"Bud Abbott, Lou Costello, Boris Karloff, Craig Stevens, Helen Westcott, Reginald Denny, John Dierkes","Two bumbling American cops hunt for the mysterious Mr. Hyde in London, England.",6.6,4024,"","","",,51,32,6.6,95.775196936464,660
tt0045652,Le ore sono contate,Count the Hours!,1953,1953-08-13,"Crime, Drama, Film-Noir",76,USA,English,Don Siegel,"Doane R. Hoag, Karen DeWolf",Benedict Bogeaus Production,"Teresa Wright, Macdonald Carey, Dolores Moran, Adele Mara, Edgar Barrier, John Craven, Jack Elam, Ralph Sanford",Lawyer defends migrant worker falsely accused of two murders.,6.2,435,"","","",,16,8,6.2,86.7283274369937,620
tt0045924,Straniero in patria,"Jack McCall, Desperado",1953,1953-04-01,Western,76,USA,English,Sidney Salkow,"John O'Dea, David Chandler",Sam Katzman Productions,"George Montgomery, Angela Stevens, Douglas Kennedy, James Seay, Eugene Iglesias, William Tannen, Jay Silverheels, John Hamilton, Selmer Jackson","A Southerner fighting for the North is unjustly accused of treason and escapes to find the witness who could clear his name, but he also seeks the two Yankee soldiers who killed his parents.",5.1,111,"","","",,6,1,5.1,70.9361745093526,510
tt0046001,The Limping Man,The Limping Man,1953,1953-11-01,"Crime, Drama, Film-Noir",76,UK,English,Cy Endfield,"Ian Stuart Black, Reginald Long",Banner Films Ltd.,"Lloyd Bridges, Moira Lister, Alan Wheatley, Leslie Phillips, Hélène Cordet, Bruce Beeby, Andre Van Gyseghem, Tom Gill, Lionel Blair, Robert Harbin, Charles Botterill, Rachel Roberts, Verne Morgan, Raymond Rollett, Irissa Cooper",An American WWII veteran goes back to England after the war only to discover that his wartime sweetheart has got mixed up with a dangerous spy ring.,5.8,514,"","","",,36,7,5.8,84.9248220889635,580
tt0046020,Ma and Pa Kettle on Vacation,Ma and Pa Kettle on Vacation,1952,1953-04-20,Comedy,76,USA,"English, French",Charles Lamont,Jack Henley,Universal International Pictures (UI),"Marjorie Main, Percy Kilbride, Ray Collins, Bodil Miller, Sig Ruman, Barbara Brown, Ivan Triesault, Oliver Blake, Teddy Hart, Peter Brocco",The Kettles are in Paris along with their daughter-in-law's parents the Parkers. Pa tries to buy racy postcards. He also gets in big trouble when he is given a letter to deliver to Adolph ...,7,452,"","","",,7,1,7,89.8430697803043,700
tt0046026,Il mostro magnetico,The Magnetic Monster,1953,1953-02-18,"Horror, Sci-Fi",76,USA,English,"Curt Siodmak, Herbert L. Strock","Curt Siodmak, Ivan Tors",Ivan Tors Productions,"Richard Carlson, King Donovan, Jean Byron, Harry Ellerbe, Leo Britt, Leonard Mudie, Byron Foulger, Michael Fox, John Zaremba, Lee Phelps, Watson Downs, Roy Engel, Frank Gerstle, John Vosper, John Dodsworth",The Office of Scientific Investigation sends A-Men agents to investigate reports of unusual magnetic activity in various communities.,5.8,1030,$ 105000,"","",,42,38,5.8,80.0215738305297,580
tt0046130,No Escape,No Escape,1953,1953-07-31,"Crime, Drama, Film-Noir",76,USA,English,Charles Bennett,Charles Bennett,Matthugh Productions,"Lew Ayres, Sonny Tufts, Marjorie Steele, Lewis Martin, Gertrude Michael, Charles Cane, Renny McEvoy, Bobby Watson, James Griffith, Robert Bailey, Robert Carson, Leon Burbank, Jess Kirkpatrick, Barbara Morrison, Carleton Young","When the available evidence in a murder case points to a young woman as the main suspect, her boyfriend, a police detective, arranges for a struggling songwriter who is playing piano in a ...",5.6,287,"","","",,10,5,5.6,79.5811765939528,560
tt0046301,Street of Shadows,Street of Shadows,1953,1953-04-01,"Crime, Drama",76,UK,English,Richard Vernon,"Richard Vernon, Laurence Meynell",William Nassour Productions,"Cesar Romero, Kay Kendall, Edward Underdown, Victor Maddern, Simone Silva, Liam Gaffney, Bill Travers, Robert Cawdron, John Penrose, Molly Hamley-Clifford, Eileen Way, Paul Hardtmuth, Tony Sympson, Rose McLaren, Michael Kelly","Small-time Soho hustler gets caught up in the murder of an ex-girl friend, evades the police and finally helps them to corner the real murderer.",6,180,"","","",,13,4,6,81.5137953199425,600
tt0046351,Viaggio nell'interspazio,Spaceways,1953,1953-08-07,"Sci-Fi, Thriller",76,"UK, USA",English,Terence Fisher,"Richard H. Landau, Charles Eric Maine",Hammer Films,"Howard Duff, Eva Bartok, Alan Wheatley, Philip Leaver, Michael Medwin, Andrew Osborn, Cecile Chevreau, Anthony Ireland, Hugh Moxey, David Horne","A small group of closely-guarded British scientists test their first rocket amidst indications of matrimonial strife in the community. After the partial failure of the firing, a couple go ...",5.1,342,"","","",,16,11,5.1,70.1429913579751,510
