imdb_title_id,title,original_title,year,date_published,genre,duration,country,language,director,writer,production_company,actors,description,avg_vote,votes,budget,usa_gross_income,worlwide_gross_income,metascore,reviews_from_users,reviews_from_critics,avg_vote_10,avg_vote_100,avg_vote_1000
tt1890342,476 A.D. Capitolo uno: L'ultima luce del Ariete,476 A.D. Chapter One: The Last Light of Aries,2014,2014-02-01,"Biography, Drama, History",76,"Croatia, USA, Italy",English,Ivan Pavletic,"Ivan Pavletic, Ivan Pavletic",Artisk & Multix Entertainment,"Carter Baird, J.W. Bar, Corey Blair, Luckson Bonhomme, Richard Burns, Pete Calikes, Anthony Cubba, Jimmy Dawson, Kirsten Deane, Jason Delancy, Ernst Dorlus, Summer Drayer, Will Dupree, Frank Edmonds, Jarryl Edwards","After General Flavius Aetius frees the Roman Empire from the clutches of Attila the Hun, Rome is once again secure. However, this assurance is short-lived, as Attila is no longer a threat, ...",5.1,187,$ 100000,"","",,20,1,5.1,73.2248818672708,510
tt1891769,La tela animata,Le tableau,2011,2011-11-23,"Animation, Adventure, Drama",76,"France, Belgium, Canada",French,Jean-François Laguionie,"Nicky Baker, Jean-François Laguionie",Blue Spirit Animation,"Jean Barney, Chloé Berthier, JB Blanc, Steve Blum, Julien Bouanich, Colin DePaula, Serge Faliu, Wayne Grayson, Jason Griffith, Thierry Jahn, Christopher Kromer, Jean-François Laguionie, Adrien Larmande, Gary Littman, Mary Elizabeth McGlynn","Three characters of different social classes escape their unfinished painting in search of the Painter, hoping he will complete it.",7.4,3723,"",$ 21008,$ 22313,70,14,47,7.4,101.306383384852,740
tt1945081,Dva dnya,Dva dnya,2011,2011-09-08,"Comedy, Drama, Romance",76,Russia,Russian,Dunya Smirnova,"Dunya Smirnova, Anna Parmas",Art Pictures Studio,"Fedor Bondarchuk, Kseniya Rappoport, Evgeniy Muravich, Irina Rozanova, Gennadiy Smirnov, Konstantin Shelestun, Mariya Semyonova, Andrey Smirnov, Olga Dykhovichnaya, Sergey Umanov, Aleksey Bazanov, Kirill Boltaev, Mikhail Brashinskiy, Albina Evtushevskaya, Boris Kamorzin","When anyone thinks that you will endure a two-hour movie about a guy you don't like only because of two-minute scene with a woman you love, they are absolutely right.",7,796,"","",$ 609894,,,2,7,95.3981267542627,700
tt1986760,A puerta fría,A puerta fría,2012,2013-03-15,Drama,76,Spain,"Spanish, English",Xavi Puebla,"Jesús Gil Vilda, Xavi Puebla",Canal Sur Televisión,"Antonio Dechent, María Valverde, José Luis García Pérez, Héctor Colomé, Nick Nolte, José Ángel Egido, Sergio Caballero, Cesáreo Estébanez, Alex O'Dogherty, Fran Torres, Fernando Masilla, Juan Motilla, Carlos Vega, Celia Vioque, Javier Berger","A retiring electronics salesman is desperately trying to sign a deal with a big client at an electronics show, when he meets a young girl. They form a bond and she tries help him to seal the deal.",6.5,328,"","",$ 30163,,,6,6.5,94.488508607739,650
tt1990422,My Best Day,My Best Day,2012,2012-01-21,Comedy,76,USA,English,Erin Greenwell,Erin Greenwell,Smithy Productions,"Rachel Style, Ashlie Atkinson, Robert Salerno, Jo Armeniox, Raúl Castillo, Harris Doran, Molly Lloyd, Haley Murphy, Kate McKinnon, Hunt Block, Sonora Chase, Joe Arner, Danielle Book, John Bradley, Fred Broadbent","Karen's life as a small town receptionist is turned upside down when the father she never knew calls for a refrigerator repair. Karen sets out to investigate, dragging along her friend ...",5.1,176,"","","",,2,10,5.1,73.4619922563917,510
tt1995242,A tus espaldas,A tus espaldas,2011,2011-04-01,"Comedy, Drama",76,Ecuador,Spanish,Tito Jara,Tito Jara,Abre Comunicación,"Jenny Nava, Gabino Torres, Lily Alejandra, Israel Montenegro","The statue of the Virgin that crowns """"The Panecillo"""" looks and smiles to the north of the city, home to wealthier people, in the south, where most of its inhabitants are the most poor, they...",6.2,123,$ 500000,"","",,,,6.2,88.146683342083,620
tt2014346,Somebody Up There Likes Me,Somebody Up There Likes Me,2012,2013-03-08,"Comedy, Romance",76,USA,English,Bob Byington,Bob Byington,Somebody the Movie LLC,"Nick Offerman, Keith Poulson, Jess Weixler, Stephanie Hunt, Marshall Bell, Kate Lyn Sheil, Kevin Corrigan, Jonathan Togo, Megan Mullally, Anna Margaret Hollyman, Ted Beck, Allison Latta, Bob Schneider, Chris Doubek, Mike Wachs","A comedy about a man, his best friend, and the woman they both adore watching their lives fly by.",5.8,1491,"",$ 89435,$ 89435,58,7,32,5.8,85.0965365964111,580
tt2075392,Yurt,Yurt,2011,2012-09-14,Drama,76,Turkey,"",Muzaffer Özdemir,"","","Kanbolat Gorkem Arslan, Muzaffer Özdemir, Muhammet Uzuner, Halil Kilic, Kerim Olgun, Ilhami Sibil, Saygin Soysal, Pinar Unsal","This is the directorial debut of Muzaffer Ozdemir, Palme d'Or awarded actor of Uzak / Distant (2002) by Nuri Bilge Ceylan, and also an actor in the Ceylan films Kasaba / The Small Town (...",6.3,104,"","",$ 5316,,,4,6.3,84.4331859451771,630
tt2076372,Toad Road,Toad Road,2012,2013-10-25,Horror,76,USA,English,Jason Banker,Jason Banker,Random Bench Productions,"James Davidson, Sara Anne Jones, Whitleigh Higuera, Jamie Siebold, Scott Rader, Donnie Simmons, Damon Johansen, Andy San Dimas, Jim Driscoll, Andy Martin","A portrait of contemporary youth culture, where the lines between reality and fiction are blurred with often frightening results.",5.1,1196,"","","",54,25,42,5.1,72.2134042422949,510
tt2076862,I Am a Ghost,I Am a Ghost,2012,2014-03-01,"Drama, Horror, Thriller",76,USA,English,H.P. Mendoza,"H.P. Mendoza, H.P. Mendoza",Ersatz Film,"Anna Ishida, Jeannie Barroga, Rick Burkhardt, Juliet Heller, Diana Tenes, Jef Cunningham, Maia Mendoza, Rachel Wong","Emily, a troubled spirit, haunts her own house every day, wondering why she can't leave. With the help of Sylvia, a clairvoyant hired to rid the house of spirits, Emily is forced into a '...",6,977,$ 10000,"","",,23,14,6,85.8010576968251,600
tt2085865,Lovely Man,Lovely Man,2011,2012-05-10,Drama,76,Indonesia,Indonesian,Teddy Soeriaatmadja,Teddy Soeriaatmadja,Karuna Pictures,"Donny Damara, Raihaanun Soeriaatmadja, Yayu A.W. Unru, Ari Syarif, Lani Sonda","Cahaya (Raihaanun) travels to Jakarta, Indonesia, to search for her father and discovers that he is a prostitute for men.",7.2,208,"","","",,,7,7.2,104.03805112106,720
tt2112287,Thale,Thale,2012,2012-02-17,"Drama, Fantasy, Horror",76,Norway,"Norwegian, Swedish",Aleksander Nordaas,Aleksander Nordaas,Film Fund FUZZ,"Silje Reinåmo, Erlend Nervold, Jon Sigve Skard, Morten Andresen, Roland Astrand, Sunniva Lien",Estranged friends Leo (a crime-scene cleaner) and hired-hand Elvis are cleaning up a particularly messy casualty deep in the Norwegian woods. When Elvis accidentally finds a secret passage ...,5.6,5466,$ 1200000,"",$ 296500,,33,93,5.6,79.610606604792,560
tt2120025,Biology 101,Biology 101,2013,2013-09-07,Thriller,76,USA,English,Christopher R. Smith,"Liz Bradley, Christopher R. Smith",Second Feature Productions,"David Christian Welborn, Noelle DuBois, Deborah O'Brien, Emily Bicks, Gregory MacTavish, Morgan Peter Brown, David Alan Graf, Mark Kruhmin, Randy Stift, Sean Roslon","Bill Pollard is the very image of a mild-mannered suburbanite. He is a calm and stable husband and father, and teaches biology at Thatherton Community College. He is also hopelessly ...",3.3,250,"","","",,4,3,3.3,48.174288148571,330
tt2139965,Hang Loose,Hang Loose,2012,2012-12-14,Comedy,76,USA,English,Ryan Kawamoto,"Benjamin Arthur, Dante Basco",Kinetic Films,"Dante Basco, Kevin Wu, Justin Chon, Benjamin Arthur, Nicholle Tom, Dionysio Basco, Minae Noji, Kat Mills, Jennifer Fairbank, Augie Tulba, Kelemete Misipeka, Julias Alex Gilfiley, James Unabia, Duane Char, D'Lissa Wooten",Kevin must go to Hawaii to attend the wedding of his big sister. The day before the wedding he goes on a misadventure with his future brother in law and his crazy groomsmen that changes his life.,5.4,606,"","","",,4,,5.4,77.6679367603737,540
tt2170499,Man Camp,Man Camp,2013,2013-08-12,Comedy,76,USA,English,Brian Brightly,"Brian Brightly, Ryan Farhoudi",BB Film Productions,"Kate Siegel, Mariel Hemingway, Dean Cain, Danay Garcia, Anastasia Baranova, Jonathan Slavin, Alex Weed, Zibby Allen, Johnny Sneed, Greg Tuculescu, Skyler Stone, Devon Ogden, Noah Harpster, Justin James Hughes, Mary-Bonner Baker","Attempting to compete for the love of a beautiful woman, a self-declared sissy joins a man camp that """"transforms boys into men,"""" only to discover it's run by his dream girl's macho boyfriend.",4,121,"","","",,3,,4,52.2361881423595,400
tt2184398,Beside Still Waters,Beside Still Waters,2013,2014-11-14,"Comedy, Drama, Romance",76,USA,English,Chris Lowell,"Chris Lowell, Mohit Narang",Storyboard Entertainment,"Ryan Eggold, Beck Bennett, John Lorenger, Brett Dalton, Will Brill, Erin Darke, Jessy Hodges, Britt Lower, Reid Scott, Larry Rellinger",A young man struggles for closure after the death of his parents.,6.4,312,"","","",42,5,12,6.4,93.6225570540774,640
tt2210479,Berserk: L'epoca d'oro - Capitolo I - L'uovo del re dominatore,Berserk: Ougon Jidai-hen I - Haou no Tamago,2012,2013-10-14,"Animation, Action, Adventure",76,Japan,"Japanese, English",Toshiyuki Kubooka,"Kentaro Miura, Ichirô Ôkouchi",Beyond C.,"Hiroaki Iwanaga, Carrie Keranen, Takahiro Sakurai, Kevin T. Collins, Toa Yukinari, Yûki Kaji, Yoshiro Matsumoto, Minako Kotobuki, Takahiro Fujiwara, Kazuki Yao, Aki Toyosaki, Kenta Miyake, Nobuyuki Katsube, Rikiya Koyama, Hiroshi Arikawa","He trusts no one, only his sword.",7.6,10216,"","",$ 2152610,,15,14,7.6,105.117011214416,760
tt2226485,My Life on Planet B,My Life on Planet B,2012,2012-09-27,"Comedy, Drama",76,Netherlands,Dutch,Iván López Núñez,"Rogier de Blok, Iván López Núñez",Topkapi Films,"Serge Price, Rik Wezenberg, Alix Adams, Ceylan Can, Lindsay Zwaan, Raymond Thiry, Ward Weemhoff, Samir Veen, Morgan Knibbe, Coosje Smid, Rodney Beddal, Bas van Prooijen, Hetty Feteris, Bastiaan Bosma, Luuk Bouwman","Eppo and Nyke are school friends, B-Movie fans who have their own review show online. Suddenly things change, Nyke gets into the punk/goth scene, while Eppo got obsess with a certain film ...",6.6,109,"","","",,1,2,6.6,89.8582550952628,660
tt2251481,Sean Banan inuti Seanfrika,Sean Banan inuti Seanfrika,2012,2012-02-15,Comedy,76,Sweden,Swedish,Jesper Andersson,"Jesper Andersson, Sean Banan",Happy Fiction,"Sean Banan, Kikki Danielsson, Dr. Alban, Johannes Brost, Armando Sando Vilanculos, Antonio Rocha, Fatima Pedro, Benedito Duna, Inacio Duna, Constantino Mateus, Francisco Ihaca, Inacio Ricardo Chirute, Miguel Alfredo Manjate, Jeronimo Eduardo","Sean Banan is heading of to Africa, the world's coolest place. With him is the singing diva Kikki Danielsson Aka Kikki Dee,they are going to record a music video. Everything was supposed to...",1.6,750,SEK 30,"",$ 539841,,2,3,1.6,22.8787486060015,160
tt2311912,We Will Riot,We Will Riot,2013,2013-09-25,"Drama, Music",76,"Lithuania, USA","English, Lithuanian",Romas Zabarauskas,Romas Zabarauskas,Naratyvas,"Ebeneezer Nii Sowah, Beata Tiskevic, Sarunas Zenkevicius, Olita Dautartaite, Sakalas Uzdavinys, Juste Arlauskaite-Jazzu, Tyler Alterman, Giedrius Arbaciauskas, Greta Babarskaita, Josif Baliukevic, Genn Bo, Lucinda Carr, Dusty Childers, Sandra Dauksaite-Petrulene, Justas Fresh","Luke is an up-and-coming DJ from an affluent New York family with a Lithuanian father and an African-American mother. When Luke hears from an estranged grandmother in Lithuania, he defies ...",4,356,"","","",,6,5,4,55.8818776801565,400
tt2317744,Backkom-eui Mug-jan Yeo-haeng,Backkom-eui Mug-jan Yeo-haeng,2007,2007-03-22,"Animation, Adventure, Comedy",76,South Korea,"English, Korean","Aaron Lim, Aaron Lim",Aaron Lim,BRB Internacional S.A.,Stephen Hudges,A timid young boy named Sam befriends a brave polar bear named Bernard who teaches him that the best way to overcome his fears is by laughing at them.,4.1,126,$ 5900000,"",$ 618400,,2,2,4.1,57.9313876482064,410
tt2328505,Ashura,Ashura,2012,2012-09-29,"Animation, History, Horror",76,Japan,Japanese,Kei'ichi Sato,"George Akiyama, Ikuko Takahashi",Bandai Visual,"Tesshô Genda, Megumi Hayashibara, Hiroaki Hirata, Yoshihiro Ike, Kin'ya Kitaôji, Yû Mizushima, Masako Nozawa, Bin Shimada, Kaori Yamagata, Kappei Yamaguchi","Abandoned in the barren wasteland of Kyoto, a savage, enraged orphan does whatever it takes to survive in the wild. When he crosses paths with civilization, he must learn to tame the beast within.",6.7,1091,"","","",,6,15,6.7,90.5971367642165,670
tt2338399,Wingmen Incorporated,Wingmen Incorporated,2013,2013-03-01,Comedy,76,USA,English,"Ken Gayton, Jason W. Schaver","Jason W. Schaver, Ken Gayton",Moped Jones Entertainment,"Ken Gayton, Jason W. Schaver, Bethany Carol, Kevin Miller, Jacob Denenberg, Andrew Kudla, Matthew Babbs, Heath Cordts, Josh Razavi, Greg C. Williams, Jeff Gamlin, Walt Sloan, James Doherty, Christina Kyriakakis, Kim DeJesus","After being left at the altar, a jaded psychologist reluctantly forms a company that teaches desperate men how to pick up women at local hot spots by teaching them the tools he learned while getting his psychology degree.",7.4,237,$ 4000,"","",,2,2,7.4,101.708488698162,740
tt2350852,Raised by Wolves,Raised by Wolves,2014,2014-08-18,Horror,76,USA,English,Mitchell Altieri,"Mitchell Altieri, Mitchell Altieri",Helios Productions (II),"Monty Geer, Leore Hayon, Michael Hudson, Hassan Mahmoud, Alisa Torres, Kristina Emerson, Evan Crooks, Steven Flores, Keith Roenke, Jenna Haze, Eric Joseph, Rocky Abou-Sakher, Lane Thomas","When a group of friends come across an abandoned house in the barren desert, what follows is a terrifying tale of evil possession causing the friends to slowly turn against each other.",3.7,307,"","","",,2,5,3.7,52.327773893181,370
tt2354437,The Hooligan Wars,The Hooligan Wars,2012,2014-11-03,Crime,76,UK,English,Paul Tanter,Paul Tanter,Press on Features,"Nick Nevern, Glen Murphy, Peter Barrett, Simon Phillips, Lottie Lewis, Glyn Grimstead, Lorraine Stanley, Ewan Ross, Krzysztof Skonieczny, Martin Fisher, Anna Brecon, Nicola Posener, Pooja Shah, Ben Hollington, Danny Idollor","A bar fight leaves up-and-coming professional footballer Andy injured and out of the game. Needing money to support his wife and himself, he buys an ice cream van and sets to work. However,...",3.6,310,GBP 1500000,"","",,6,1,3.6,53.495348678387,360
tt2361846,Cheatin',Cheatin',2013,2014-04-23,"Animation, Comedy, Drama",76,USA,None,Bill Plympton,Bill Plympton,Bill Plympton Studios,"Sophia Takal, Jeremy Baumann, Alex Markowitz, Sita Steele, Jacob Steele, Mike Dragovic, Kelly Kriegshauser","In a fateful bumper car collision, Jake and Ella meet and become the most loving couple in the long history of romance. But when a scheming """"other"""" woman drives a wedge of jealousy into ...",7,803,"",$ 15077,$ 15077,74,7,27,7,98.3928298747171,700
tt2402127,Kick,Kick,2015,2015-01-09,"Drama, Horror, Thriller",76,UK,English,Marcus Warren,"Marcus Warren, Marcus Warren",Contraption,"Daniel Bayle, Robert Bond, Alexander Bracq, Oliver Bury, Mark Chan, Chris Cowlin, Nigel Genis, John Heartstone, Celine Jedidi, Simone Kaye, Pete Lee-Wilson, Steve Lorrigan, Bharat Mistri, Kumud Pant, Nicola Posener",The film centres around two aspiring young footballers who have bribed their way into a premier league football stadium to play illicit underground football only to discover that they are trapped in a game of survival.,2.8,222,"","","",,4,1,2.8,47.3881444500753,280
tt2503154,The Den,The Den,2013,2014-03-14,"Horror, Mystery, Thriller",76,USA,English,Zachary Donohue,"Zachary Donohue, Lauren Thompson",Cliffbrook Films,"Melanie Papalia, David Schlachtenhaufen, Adam Shapiro, Anna Margaret Hollyman, Matt Riedy, Katija Pevec, Saidah Arrika Ekulona, Anthony Jennings, Victoria Hanlin, Anushka Rani, Garrett Fornander, Lily Holleman, Jeff Rubino, Jonah Landow, Rikin Vasani","While studying the habits of web cam chat users from the apparent safety of her own home, a young woman's life begins to spiral out of control after witnessing a grisly murder online.",6,12946,$ 500000,"",$ 410129,48,97,70,6,83.2483879443681,600
tt2520578,Mike Case in: The Big Kiss Off,Mike Case in: The Big Kiss Off,2013,2013-06-15,Comedy,76,USA,English,Justin Baird,"Sherman Hirsh, Les Mahoney",Vagabond Entertainment,"Scott Ganyo, Kenyon Glover, Tony Gracia, David Alan Graf, Jasmine, Guillermo Jorge, Erica Juliet, Tracy Kisler, Les Mahoney, Vince Marazita, Debra Mayer, William Tell Mitchell, Jaimyon Parker, Devai Pearce, Hannah Pierce","Mike Case is a low-rent private detective who works out of his car and advertises on Craigslist. When approached by the wealthy socialite Victoria Billows to find her missing husband, Mike ...",6.8,251,$ 255000,"","",,3,4,6.8,96.2471093403318,680
tt2523692,Decay,Decay,2012,2012-12-08,Horror,76,UK,English,"Luke Thompson, Michael Mazur","Luke Thompson, Luke Thompson",H2ZZ Productions,"Zoë Hatherell, Tom Procter, Stewart Martin-Haugh, William P. Martin, Sara Mahmoud, Ed Friesen, Kurt Rinnert, Jenn Strauss, David Voong, Sergey Senkin, Katie Malone, Jake Searcy, Johannes Ebke, Christopher Young, Ty Gray",A group of PhD students who work at the Large Hadron Collider (LHC) at CERN find themselves in an emergency situation as a result of a problem with the accelerator. The maintenance crew ...,3.8,392,GBP 2000,"","",,16,7,3.8,57.707619660104,380
tt2525450,Badass Showdown,Badass Showdown,2013,2013-04-02,"Action, Drama",76,USA,English,David DeCoteau,"Charlie Meadows, David DeCoteau",Rapid Heart Pictures,"Cynthia Rothrock, Jarrid Balis, Brandon Schinaman, Josh Griego, Ryan Greco, Kip Canyon, Lorenzo Brunetti","Uber MMA fighter manager Ivy Reed (B-movie action star of the '80s and '90s Cynthia Rothrock) is unique as a woman in a male-dominated field, using a special formula to find her champion ...",2.2,158,$ 1000000,"","",,8,4,2.2,28.594049881674,220
tt2558022,Bunker of the Dead,Bunker of the Dead,2015,2016-02-18,"Action, Comedy, Horror",76,Germany,English,Matthias Olof Eich,"Matthias Olof Eich, Bernd Strack",Praetoria Productions,"Patrick Jahns, Esther Maaß, Aciel Martinez Pol, Christopher Lee Meadows, Carlos Lobo, Sarita Bradley, Christian Jungwirth, Werner Hofmann, Wesley Howard, Peter Koller, Benjamin Nolde, Bernd Strack, Yvonne Köhler, Andreas Pape, Christian Falk","In the picturesque Bavarian town of Oberammergau, two friends, Markus and Thomas, are using the instructions found in an old Jewish diary to gain access to a WW II underground military base formerly codenamed: CERUSIT.",3.9,391,EUR 525000,"",$ 10147,,9,8,3.9,52.3812315090274,390
tt2583814,Otto er et næsehorn,Otto er et næsehorn,2013,2013-02-07,"Animation, Comedy, Family",76,Denmark,Danish,Kenneth Kainz,"Ole Lund Kirkegaard, Rune Schjøtt",Crone Film Produktion A/S,"Nikolai Aamand, Noah Crone Back, Lars Brygmann, Kaya Brüel, Rebecca Brüel, Asta Danielsson, Helle Dolleris, Søs Egelind, Mikkel Brinch Hansen, Tom Jensen, Bodil Jørgensen, Kenneth Kainz, Lasse Guldberg Kamper, Tommy Kenter, Lars Knutzon","Topper is an optimistic young boy with a vivid imagination. He is also in love with Cilla, but she thinks he's very crazy. One day Topper finds a pencil and draws a rhino that comes to live! This changes everything.",5.1,278,"","",$ 2403520,,1,10,5.1,64.4120324703094,510
tt2609998,Classroom 6,Classroom 6,2015,2015-10-02,"Horror, Mystery",76,"USA, Germany, Brazil","English, Spanish",Jonas Odenheimer,Jonas Odenheimer,Old Jim Productions,"Valentina Kolaric, Mike McLaughlin, Maurice Mejia, Vince Major, Victor Manso, Jessica Amal Rice, Paul Thomas Arnold, Craig Cranic, Matt Poe, Wesley Rice, Jean-Louis Darville, Caroline Guivarch, Lauren Tess, Amanda Lee Gunnell, Devin Dygert","A local reporter and her assembled TV crew go into a school haunted by a horrific past. The team spends the night locked inside the building, capturing any and everything they find.",3.6,401,"","","",,15,13,3.6,49.9643212954469,360
tt2630300,To Jennifer,To Jennifer,2013,2013-10-09,"Horror, Thriller",76,USA,English,James Cullen Bressack,"James Cullen Bressack, Chuck Pappas",Psykik Junky Pictures,"Chuck Pappas, Jessica Cameron, James Cullen Bressack, Jody Barton, Tristan Risk, Maria Olsen, Marcus Bradford, Rebecca Abraham, Jarrett Furst, Jackie Bressack, Mike Blair, Angela Bray, Kitty Doll, Nella Jay, Conrad Kramer","Joey suspects his girlfriend of two years, Jennifer, is cheating on him. He is so convinced that he enlists the help of his cousin Steven to create a Video Diary of his attempt to catch her...",4.6,535,"","","",,10,47,4.6,61.7547254546768,460
tt2732140,Esto no es una cita,Esto no es una cita,2013,2013-04-22,"Comedy, Romance",76,Spain,Spanish,Guillermo Fernández Groizard,Pablo Flores,"","Virginia Rodríguez, Darío Frías, Alexandra Jiménez, Fernando Cayo, Jorge Pobes, Carlotta Cosials, Gerald B. Fillmore, María Garralón, Jesús Granda, Andrea Guasch, José Ángel Trigo, Clara Valencia","Robert and Paula, office co-workers, start a relationship full of ups and downs to forget their respective ex. Will they make it?",5.3,192,"","",$ 9152,,,4,5.3,73.5235825827231,530
tt2769896,Solan og Ludvig - Jul i Flåklypa,Solan og Ludvig - Jul i Flåklypa,2013,2013-11-08,"Animation, Family",76,Norway,Norwegian,Rasmus A. Sivertsen,"Kjell Aukrust, Karsten Fullu",Maipo Film,"Kari Ann Grønsund, Trond Høvik, Trond Brænne, Kåre Conradi, John F. Brungot, Toralv Maurstad, Anders Bye, Jakob Oftebro, Eli Anne Linnestad, Eilif Hellum Noraker, Ingrid Vollan, Fredrik Steen","The small town of Flåklypa is experiencing great lack of snow, which is why the inventor Reodor Felgen is asked to create a snow machine. However, things does not go as planned.",6.8,1510,NOK 25000000,"",$ 12345881,,2,11,6.8,93.2418951070146,680
tt2930144,Judge,Judge,2013,2013-11-08,"Mystery, Thriller",76,Japan,Japanese,Yo Kohatsu,"Yoshiki Tonogai, Yo Kohatsu",Aoi Promotion,"Kasumi Arimura, Kôji Seto, Jirô Satô, Yûko Nishimaru, Sôtarô Tanaka, Fukino Kawate, Kazuyoshi Taira, Sabrina Sayin","Seven people who committed the seven deadly sins : lust, gluttony, greed, sloth, wrath, envy and pride are locked up in a sealed space by someone. These seven people must play a game which is a matter of life or death.",5.6,111,"","","",,,,5.6,75.2843104790314,560
tt2950330,La piscina,De poel,2014,2014-05-01,Horror,76,Netherlands,Dutch,Chris W. Mitchell,"Chris W. Mitchell, Gijs Scholten van Aschat",House of Netherhorror,"Gijs Scholten van Aschat, Carine Crutzen, Bart Klever, Katja Herbers, Alex Hendrickx, Jamie Grant, Chris Peters","A father takes his wife, two sons, a friend and his daughter on a hiking trip in the woods. After a long search for a spot to set up camp, the father finds a perfect place overlooking a ...",5.4,1203,"","","",,15,18,5.4,72.6853944151123,540
tt2972044,Hitac,Hitac,2013,2014-02-27,"Crime, Drama",76,Croatia,Croatian,Robert Orhel,Robert Orhel,Kinorama,"Ecija Ojdanic, Iva Babic, Barbara Nola, Enes Vejzovic, Milan Strljic, Milan Plestina, Alen Liveric, Mia Biondic, Danko Ljustina, Branko Menicanin, Filip Nola, Tanja Tusek, Stefan Kapicic, Cvita Viljac, Lena Politeo","One accidental shot will intertwine the destinies of two young women - Anita, an inspector who gets on amazingly in professional and quite well in her private life and Petra, a young woman ...",6.1,119,"","","",,,2,6.1,86.0219551530937,610
tt3026824,Solo,Solo,2013,2013-10-17,Thriller,76,Argentina,Spanish,Marcelo Briem Stamm,Marcelo Briem Stamm,TLA Releasing,"Patricio Ramos, Mario Verón, Carlos Echevarría, Laura Agorreca, Mike Zubi","A sexy, romantic and uncomfortably chilling story from first time director Marcelo Briem Stamm. Handsome middle class Manuel (Patrico Ramos), hurt by his previous relationship and bored ...",6.3,1405,$ 30000,"","",,12,6,6.3,85.8381060766507,630
tt3043194,The Vatican Exorcisms,The Vatican Exorcisms,2013,2013-08-14,Horror,76,Italy,"English, Italian",Joe Marino,"Mauro Paolucci, Salvatore Scarico",Arturo and Mario Productions,"Piero Maggiò, Joe Marino, Anella Vastola","The Vatican Exorcisms was shot by Joe Marino, an American film-maker who went to Italy to shed light on the phenomenon of exorcisms. Accompanied by Padre Luigi, a true exorcist, Joe travels...",2.6,433,"","","",,12,9,2.6,33.8447238441497,260
tt3084022,Blood and Carpet,Blood and Carpet,2015,2015-02-12,"Comedy, Horror, Thriller",76,UK,English,Graham Fletcher-Cook,"Graham Fletcher-Cook, Graham Fletcher-Cook",Blood And Carpet,"Frank Boyce, Billy Wright, Andrew Tiernan, Nicola Stapleton, Robert Walters, Huggy Leaver, Debbie Krieger, Julian Firth, Graham Fletcher-Cook, Bill Fellows, Theresa Cole, Ellie Grace Cook, Shona McWilliams, Sammy Williams, Glyn Tomlinson","In the late 1960s there were no CCTV or crime scene DNA testing, but disposing of a dead body was still bloody murder.",5.6,265,GBP 3000,"","",,3,18,5.6,73.3037046366058,560
tt3088580,Phantom,Phantom,2013,2013-07-01,Drama,76,France,Japanese,Jonathan Soler,Jonathan Soler,Ganko Films,"Yuki Fujita, Masato Tsujioka","In Tokyo, a girl and her boyfriend spend a night talking about their life, their precarious condition and their difficulties in earning a living, finding their place in the world, if they ever have one.",7.4,1167,"","","",,14,25,7.4,102.376190768324,740
tt3121200,Breakdown Lane,Breakdown Lane,2017,2017-01-05,"Drama, Horror",76,Canada,English,"Bob Schultz, Robert Conway","Robert Conway, Bob Schultz",Twilight Pictures,"Whitney Moore, Kevin Tye, Clint James, Shane Dean, Dan Higgins, Owen Conway, William 'Bill' Connor, Monica Engesser, Nicole Zylstra, Liz Manning, Santiago Craig, Carrie Fee, Patrick Lick, Gianna Frangella, Rob S. Gray","When Kirby Lane's SUV breaks down in the middle of the desert, she must overcome the dehydration, coyotes, and lurking undead to find her way home.",2.7,363,"","","",,10,6,2.7,41.0242864226383,270
