imdb_title_id,title,original_title,year,date_published,genre,duration,country,language,director,writer,production_company,actors,description,avg_vote,votes,budget,usa_gross_income,worlwide_gross_income,metascore,reviews_from_users,reviews_from_critics,avg_vote_10,avg_vote_100,avg_vote_1000
tt0352002,Yes Sir! Madame...,Yes Sir! Madame...,1994,1994,Comedy,75,Canada,"French, English",Robert Morin,Robert Morin,Coop Vidéo de Montréal,Robert Morin,"In his livingroom, Earl Tremblay shows us the movie of his life. The main character is bilingual and schizophrenic. He becomes a car salesman, and a host in a stripper club before he goes into politics.",7.2,150,"","","",,1,,7.2,96.5681511227544,720
tt0353332,Dark Woods,Dark Woods,2003,2003-05-30,"Adventure, Comedy, Horror",75,USA,English,Jake Daniels,"Jake Daniels, Royce Freeman",JDB Produtions,"Bob Glazier, Jake Daniels, Carolyn Morse, Joe Vida, Gian Keys, Trish Dempsey, Catalina Kidd, Philip Hersh, Kassandra Counsidine, Dan McArthur, Jack Valvo, Natasha Hazen, Kevin Bangos, Yordanny Ledsman, Mark Bowie","Camp Vernon, quiet, peaceful, away from things.",3.5,146,"","","",,6,2,3.5,44.851929062176,350
tt0356398,Bash maystorat fermer,Bash maystorat fermer,1981,1981-05-24,Comedy,75,Bulgaria,Bulgarian,Petar B. Vasilev,Atanas Mandadzhiev,BNT,"Kiril Gospodinov, Silviya Avramova, Mariana Alamancheva, Inna Simeonova, Ivan Tanev","Bash mastorat has a pig farm, which employs four keepers - former buyer Raphael hiding from authorities, alcoholic poet Tcanko and beautiful gypsy Rose with her husband. Once again bash ...",7.4,148,"","","",,,,7.4,109.915391766991,740
tt0358243,Uroki v kontse vesny,Uroki v kontse vesny,1991,1991,Drama,75,Soviet Union,Russian,Oleg Kavun,Oleg Kavun,Mosfilm,"Valeriy Barinov, Nartay Begalin, Aleksandr Feklistov, Sergey Gabrielyan, Yelena Korolyova, Evgeniy Lazarev, Ivan Martynov, Yuriy Mazhuga, Yuriy Nazarov, Yekaterina Rednikova, Dunya Smirnova, Leonid Timtsunik, Danya Tolkachev, Nikolay Zasukhin","A young boy's loss of innocence in a pre-perestroika Russian prison is the harrowing, Kafkaesque premise of LESSONS AT THE END OF SPRING. During the chaotic last months of the Khrushchev ...",6.8,123,"","","",,1,1,6.8,95.9319793910774,680
tt0359784,Oseam,Oseam,2003,2003-04-25,"Animation, Family",75,South Korea,Korean,Baek-yeob Seong,"Min-yong Choi, Chae-bong Jeong","","","Two orphans, Gamie, a young blind girl and her little brother Gil-sun, are taken in by a Buddhist monk. While the shy little girl finds her at ease at the temple, the enthusiastic and ...",6.9,648,"","",$ 6658,,6,10,6.9,99.0374417196151,690
tt0369292,Bos besik,Bos besik,1969,1969,Drama,75,Turkey,Turkish,Orhan Elmas,"Necati Cumali, Orhan Elmas",Ugur Film,"Fatma Girik, Tugay Toksöz, Handan Adali, Esen Günay, Selahattin Içsel, Atif Kaptan, Kazim Kartal, Ahmet Kostarika, Sevda Nur, Serap Olguner, Aliye Rona, Talia Salti, Hayal Sirer, Selahattin Yazgan, Nermin Özses","",6,179,"","","",,,,6,86.9396079783845,600
tt0372238,Dinotopia: Quest for the Ruby Sunstone,Dinotopia: Quest for the Ruby Sunstone,2005,2005-05-17,"Animation, Adventure, Comedy",75,USA,English,Davis Doi,"Sean Roche, James Gurney",SD Entertainment,"Alyssa Milano, Jamie Kennedy, Kathy Griffin, Wayne Knight, Michael Clarke Duncan, Malcolm McDowell, George Segal, Diedrich Bader, Tara Strong, Gregg Berger, Alec Medlock","An Orphaned Boy sets out in search of adventure, but when a shipwreck lands him on an island where Dinosaurs and Humans coexist, he finds not only adventure but a family as well.",5.4,383,"","","",,8,2,5.4,76.4791163109568,540
tt0374574,Il cane e il suo generale,"Le chien, le général et les oiseaux",2003,2003-10-24,Animation,75,"France, Italy",French,Francis Nielsen,"Tonino Guerra, Tonino Guerra",Solaris,"Michel Elias, Tonino Guerra, Philippe Noiret","A long time ago, a young Russian general chose to sacrifice hundreds of birds to burn Moscow and save his motherland from the troops of Napoleon. For this feat, he was hailed as a hero by ...",6.4,144,"","",$ 240852,,2,4,6.4,90.3444915448977,640
tt0381985,Una secondina in un carcere femminile,Des diamants pour l'enfer,1975,1975,"Crime, Thriller",75,"France, Belgium",French,Jesús Franco,Marius Lesoeur,Brux International Pictures,"Lina Romay, Martine Stedil, Nathalie Chape, Roger Darton, Ronald Weiss, Denis Torre, Frieda Altstadt, Raymond Hardy, Jesús Franco, Joëlle Le Quément","A small-time hood brings the attention of the law with an insurance scam and diamond theft, but things become even more interesting when his moll murders him and is slammed behind bars ...",4,524,"","","",,11,26,4,54.8361072424772,400
tt0382028,Fat Slags,Fat Slags,2004,2004-10-15,Comedy,75,UK,English,Ed Bye,William Osborne,Artists Independent Productions,"Fiona Allen, Sophie Thompson, Jerry O'Connell, Anthony Head, Geri Horner, James Dreyfus, Metin Ahmet, Timur Ahmet, Chris Barnes, Oliver Bradshaw, Naomi Campbell, Sarah Cawood, Angus Deayton, Hugh Dennis, Les Dennis",The Fat Slags from Viz hit the big time and become celebrities.,2.5,3739,"","",$ 105091,,20,9,2.5,36.7566391752653,250
tt0387472,Opopomoz,Opopomoz,2003,2003-12-05,"Animation, Family",75,"Italy, France, Spain",Italian,Enzo D'Alò,"Enzo D'Alò, Furio Scarpelli",Albachiara,"Tonino Accolla, Peppe Barra, Xsuela Douglas, Oreste Lionello, Silvio Orlando, Francis Pardeilhan, Ciro Ricci, Marina Ruffo, Vincenzo Salemme, Paolo Salomone, John Turturro, Fabio Volo","The story takes place in Naples on the eve of Christmas. Rocco is a small boy, the son of Peppino and Mariu. But his parents are expecting the imminent birth of his little brother, ...",6.4,152,EUR 6000000,"","",,,1,6.4,96.2062406466371,640
tt0390145,John Wycliffe: The Morning Star,John Wycliffe: The Morning Star,1984,1984-11-01,"Biography, Drama, History",75,USA,English,Tony Tew,Douglas McIntosh,Gateway Films,"Michael Bertenshaw, James Downie, Peter Howell, Barrie Cookson, Jeremy Roberts, Peter J. Cassell, Mel Churcher, Noel Howlett, Robert James, Malcolm Terris, Martin Matthews, Sebastian Abineri, Anna Lindup, Keith Buckley, Colin Russell","The story of 14th century John Wycliffe, AKA """"The Morning Star of the Reformation"""", who was the first to translate the Bible into English.",6.7,126,"","","",,5,,6.7,90.7739140657456,670
tt0390159,Kaptein Sabeltann,Kaptein Sabeltann,2003,2004-11-19,"Animation, Family",75,Norway,"Norwegian, English, Spanish","Stig Bergqvist, Rasmus A. Sivertsen","Arthur Johansen, David Regal",Seven Seas Production A/S,"Terje Formoe, Ole Alfsen, Nina Lund Feste, Brit Elisabeth Haagensli, Dennis Storhøi, Knut Haugmark, Ingolf Karinen, Paul Åge Johannessen, Helge Jordal, Øystein Dolmen, Fredrik O. Knutsen, Elisabeth Moberg, Finn Schau, Bendik Østbye Johannessen, Terje Ranes","Sabeltann is a pirate looking for a big treasure. Aboard Sabeltanns big ship, Den Sorte Dame, they are preparing for a long and dangerous journey.",5.6,181,NOK 41500000,$ 105152,$ 1361061,,,4,5.6,76.2735360265837,560
tt0390350,Patoruzito,Patoruzito,2004,2004-07-08,"Animation, Musical, Adventure",75,Argentina,Spanish,José Luis Massa,"Dante Quinterno, Omar Quiroga",Admira,"Claudio Martínez Bel, Lionel Campoy, Mariano Chiesa, Hernán Chiozza, Lucila Gómez, Noemí Morelli, Florencia Otero",An animated adventure tale about a young boy and his family who live in the Patagonian outback.,4.7,173,"","",$ 3782751,,2,1,4.7,64.6401130897331,470
tt0393479,Papà ha perso l'aereo,Min søsters børn i Ægypten,2004,2004-10-08,"Adventure, Comedy, Family",75,Denmark,Danish,Kasper Barfoed,"Søren Frellesen, Lars Mering",Moonlight Film Production,"Lotte Andersen, Peter Gantzler, Niels Olsen, Wencke Barfoed, Stefan Pagels Andersen, Neel Rønholt, Mikkel Sundøe, Benedikte Maria Mouritsen, Fritz Bjerre Donatzsky-Hansen, Sawsan Adly, Edward Betro, Therese Damsgaard, Kristian Leth, Christina Ibsen Meyer, Amira Shahin",Dad takes 5 kids to Egypt but the plane leaves without him. The kids can't enter Egypt without an adult supervisor. A Danish woman finally agrees to take them but she wants to visit museums and the kids want pool and camel race.,4.7,445,"","","",,,,4.7,67.2630580421163,470
tt0396890,Tamara,Tamara,2004,2004-10-14,Drama,75,Hungary,Hungarian,Szabolcs Hajdu,Szabolcs Hajdu,Objektív Film,"Orsolya Török-Illyés, Ágnes Anna Kovács, Domokos Szabó, Illés Nyitrai, Tünde Bacskó, Valter Csonka, Imre Gelányi, László Katona, Attila Kozma","",6.9,226,"","","",,1,,6.9,97.6492544729807,690
tt0397431,Freakstars 3000,Freakstars 3000,2004,2004-01-28,Comedy,75,Germany,German,Christoph Schlingensief,Christoph Schlingensief,Filmgalerie 451,"Werner Brecht, Susanne Bredehöft, Ilse Garzaner, Mario Garzaner, Horst Gelonneck, Kerstin Graßmann, Irm Hermann, Brigitte Kausch, Christoph Schlingensief, Helga Stöwhase, Achim von Paczensky","An apparent social satire that attempts to take off various reality TV programs, most notably the Idol series, and TV in general.",7.1,183,"","","",,3,4,7.1,99.5298639152627,710
tt0400244,Bolívar: el héroe,Bolívar: el héroe,2003,2003-12-25,"Animation, Biography",75,Colombia,Spanish,Guillermo Rincón,Ricardo Pachón,"","Manuel Cabral, Julio César Luna, Luis Fernando Orozco, Edgardo Román, Mario Ruíz, Flor Vargas","this film is based on the life of Simón Bolívar (a Latin American military and political leader who fought against Spanish colonial rule), with a very cartoonish style.",1.3,538,$ 70000,"","",,7,1,1.3,15.5415888803772,130
tt0413669,Alien Factor 2: The Alien Rampage,Alien Factor 2: The Alien Rampage,2001,2001-08-01,"Horror, Sci-Fi",75,USA,English,Don Dohler,Don Dohler,"","Donna Sherman, Patrick Bussink, Jonas Grey, Jaime Kalman, Shannon Bucci, Steven King, George Stover, Joe Ripple, Bill Ulrich, LauraLee O'Shell, Shawn Doyle, Anne Frith, Jamie Bell, Teresa Altoz, Julie Kurzava","Witness the return of Baltimore's greatest alien terror in this monstrous saga. Watch in horror as alien space specimens escape to pillage the countryside, leaving pandemonium in their wake!",3.5,146,$ 35000,"","",,7,6,3.5,53.4784655407351,350
tt0414135,A porcelánbaba,A porcelánbaba,2005,2005-10-06,"Drama, Family, Fantasy",75,Hungary,Hungarian,Péter Gárdos,"Péter Gárdos, Ervin Lázár",Tivoli Film Produkcio,"Juci Balog, Juci Barabás, László Beles, Lajos Bertók, Istvánné Burga, István Csala, Sándor Csányi, Ferencné Császár, Rozál Csótár, Elemér Czifra, Lipót Gombár, Béláné Gorstein, Pisti Gál, Mihály Gáspár, Attila Horváth","Farm folk, who are amiable and simple yet cunning lived here on this Farm. From time to time strangers come to the Farm. And it is then that all hell always breaks loose. Because the ...",5.9,132,$ 330000,"","",,4,,5.9,80.517164685901,590
tt0414261,Mano mazyte zmona,Mano mazyte zmona,1984,1984-12-01,"Drama, Romance",75,Soviet Union,"Lithuanian, Russian",Raimundas Banionis,Rimantas Savelis,Lietuvos Kinostudija,"Eleonora Korisnaite, Saulius Balandis, Ingeborga Dapkunaite, Linas Paugis, Juozas Marcinkevicius, Arunas Sakalauskas, Vytautas Paukste, Eleonora Matulaite, Antanas Barcas, Dalia Melenaite, Egle Sedrisovaite, Galina Dauguvietyte, Grazina Balandyte, Raimundas Banionis, Vaclovas Bledis","This contemporary urban drama tells of a love story, of a girl with a very strong character who fights against the social prejudices, and a young man who wins her heart, and their wedding.",7.2,145,"","","",,,,7.2,98.9213528911846,720
tt0414322,Noah's Arc,Noah's Arc,2004,2004-07-27,Drama,75,USA,English,Patrik-Ian Polk,Patrik-Ian Polk,Tall Skinny Black Boy Productions,"Alistair Abell, Nate Adams, Jennia Fredrique Aponte, Jensen Atwood, Keith Boykin, Rodney Chester, Dwen Curry, Michael Franklin, C.J. Jackman-Zigante, Jonathan Julian, Gregory Kieth, Johnny Smith, Doug Spearman, Darryl Stephens, J.R. Taylor","Four gay friends live in L.A. and deal with today's issues, boyfriends, aids, your boyfriend's children, making it in the movie biz, etc.",7.6,418,"","","",,15,2,7.6,103.419152353963,760
tt0416908,La stella di Laura,Lauras Stern,2004,2005-04-22,"Animation, Family",75,Germany,German,"Piet De Rycker, Thilo Rothkirch","Klaus Baumgart, Piet De Rycker",Rothkirch Cartoon Film,"Céline Vogt, Sandro Iannotta, Maximilian Artajo, Brit Gülland, Heinrich Schafmeister, Mirco Nontschew, Martin Reinl, Eva Mattes, Peter Fitz, Mogens von Gadow, Hildegard Krekel, Adrian Wilms, Carolin von der Groeben, Adrian Killian, Tobias Klausmann","An adolescent girl and her toddler brother, find a star that has actually fallen to earth, that turns out to be living being...complete with cosmic powers",6.2,569,EUR 3400000,"",$ 8673632,,8,15,6.2,88.4870653623364,620
tt0417096,Room,Room,2005,2005-01-01,"Drama, Mystery",75,USA,English,Kyle Henry,Kyle Henry,C-Hundred Film Corporation,"Cyndi Williams, Kenneth Wayne Bradley, Alex Kiester, Hannah Nicolas, Jacqui Cross, Marco Perella, Gretchen Krich, J. Shanon Weaver, Jessica Hedrick, Suzanne Savoy, Carlos Treviño, George Manly, Frank Barajas, David R. Jarrott, Juan Camargo","An overworked, middle-aged Texas woman embezzles from her employer and abandons her family to seek out a mysterious room that has been appearing to her in visions during seizure-like attacks.",4.4,415,"",$ 5228,$ 5228,64,20,14,4.4,63.1435788700623,440
tt0418602,Turma da Mônica em Cinegibi: O Filme,Turma da Mônica em Cinegibi: O Filme,2004,2004-07-09,"Animation, Comedy, Family",75,Brazil,Portuguese,José Márcio Nicolosi,"Márcio Araújo, Paulo Back",Maurício de Souza Produções Cinematográficas,"Rodrigo Andreatto, Marli Bortoletto, Wanessa Camargo, Paulo Cavalcante, Maurício de Sousa, Elza Gonçalves, Luciano Huck, Pedro Leonardo, Fernanda Lima, Angélica Santos, Thiago, Sibele Toledo","Franklin, the inventor kid in Monica and Friends, tired of reading the comics, invents a new device to read the stories: a kind of a story-processor, that swallows the printed pages and projects the scenes in movement, on the wall.",5.9,191,"","","",,1,1,5.9,85.5996789067523,590
tt0420170,Sex pice i krvoprolice,Sex pice i krvoprolice,2004,2004-11-25,"Action, Comedy, Drama",75,Croatia,"","Zvonimir Juric, Boris T. Matic","Zvonimir Juric, Boris T. Matic",Propeler Film,"Franjo Dijak, Bogdan Diklic, Matko Fabekovic, Admir Glamocak, Daria Lorenci, Leon Lucev, Ksenija Marinkovic, Kresimir Mikic, Bojan Navojec, Leona Paraminski, Kristijan Potocki, Rakan Rushaidat, Drazen Sivak, Hrvoje Keckes, Ivan Bartulovic","Three loosely connected stories about football fans in Zagreb, Croatia, during the day of the country's biggest derby between Zagreb's GNK Dinamo and Split's NK Hajduk.",6.3,212,"","","",,,,6.3,84.0145204887798,630
tt0425298,A Night in Compton,A Night in Compton,2004,2004-09-07,Comedy,75,USA,English,"Daven Baptiste, DBaptiste","",Unyon Media Group,"Joshua David Brown, Tommy 'Tiny' Lister, James Aaron Smith, Roscoe, Patrice Stewart, Jerome Hawkins, P.R. Banks, Mary Christina Brown, Marcelle Larice, Joel Kindrick, Chiquita Fuller, Dannon Green, David Jean Thomas, Dwight R. Williams, Poppy Davis","Zion wants to have spend time with his girlfriend, Lanise, but her friends and family keep getting in the way.",3.2,113,"","","",,3,,3.2,46.4124522162382,320
tt0426592,Superhero - Il più dotato fra i supereroi,Superhero Movie,2008,2008-05-16,"Action, Comedy, Sci-Fi",75,USA,English,Craig Mazin,Craig Mazin,Dimension Films,"Drake Bell, Sara Paxton, Christopher McDonald, Leslie Nielsen, Kevin Hart, Marion Ross, Ryan Hansen, Keith David, Brent Spiner, Robert Joy, Jeffrey Tambor, Robert Hays, Nicole Sullivan, Sam Cohen, Tracy Morgan","Orphaned high school student Rick Riker is bitten by a radioactive dragonfly, develops super powers (except for the ability to fly), and becomes a hero.",4.5,62728,$ 35000000,$ 25881068,$ 71571300,33,194,121,4.5,57.3717634464151,450
tt0427424,Kanzashi,Kanzashi,1941,1941-08-26,Drama,75,Japan,Japanese,Hiroshi Shimizu,"Masuji Ibuse, Yoshitomo Nagase",Shochiku,"Shin'ichi Himori, Kanji Kawahara, Hiroko Kawasaki, Koji Matsumoto, Hideko Mimura, Tsuneo Ohsugi, Chishû Ryû, Tatsuo Saitô, Takeshi Sakamoto, Kinuyo Tanaka, Kayoko Terada, Jun Yokoyama, Munenobu Yui, Masayoshi Ôtsuka","At a rural spa, a soldier accidentally cuts his foot on a hairpin. Soon enough he tracks down its lovely owner and finds himself smitten.",7.2,516,"","","",,4,17,7.2,101.574163761556,720
tt0431387,Serseriler krali,Serseriler krali,1967,1967,"Adventure, Comedy, Drama",75,Turkey,Turkish,Mehmet Dinler,Osman F. Seden,Kemal Film,"Filiz Akin, Mehmet Ali Akpinar, Sadri Alisik, Ergül Buharali, Hasan Ceylan, Ali Demir, Tülin Elgin, Mümtaz Ener, Hikmet Gül, Hüseyin Güler, Engin Inal, Feridun Karakaya, Hakki Kivanç, Kenan Pars, Yasar Sener","",6.3,231,"","","",,,,6.3,87.8210741309203,630
tt0436607,The Motel,The Motel,2005,2005-01-24,"Comedy, Drama",75,USA,"Cantonese, English",Michael Kang,"Michael Kang, Ed Lin",Flan de Coco Films,"Jeffrey Chyau, Sung Kang, Jade Wu, Samantha Futerman, Alexis Chang, Stephen Chen, Conor J. White, Jackson Budinger, Clint Jordan, Eleanor Hutchins, Ron Domingo, Jackie Nova, Jake Holbrook, Ian Boyd, Glen Brackenridge","Thirteen-year-old Ernest Chin lives and works at a sleazy hourly-rate motel on a strip of desolate suburban bi-way. Misunderstood by his family and blindly careening into puberty, Ernest ...",6.7,1278,"",$ 51540,$ 51540,70,12,25,6.7,92.0150880894616,670
tt0445494,Keskpäevane praam,Keskpäevane praam,1967,1967-05-29,"Comedy, Drama",75,Soviet Union,"Estonian, Russian",Kaljo Kiisk,Juhan Smuul,Tallinnfilm,"Enn Kraam, Kersti Gern, Ada Lundver, Eino Tamberg, Uno Loit, Lea Unt, Aarne Laos, Kalju Karask, Heino Arus, Robert Gutman, Rudolf Allabert, Kalju Komissarov, M. Kruse-Brodskaja, Mare Garsnek, M. Moissejeva","The events take place in Estonia in a summer in the 1960s. The Boy and the Girl want to go from mainland Estonia to the island of Saaremaa, but they do not have any money to buy the ticket ...",7,159,"","","",,,,7,93.51118429392,700
tt0445689,Röövlirahnu Martin,Röövlirahnu Martin,2005,2005-02-24,"Comedy, Family, Fantasy",75,Estonia,Estonian,René Vilbre,"Kristian Taska, Mihkel Ulman",Amrion,"Madis Ollikainen, Kadi Sink, Andry Zhagars, Ott Sepp, Piret Kalda, Maria Avdjushko, Jaan Rekkor, Lembit Ulfsak, Juhan Ulfsak, Sander Valdma, Tanel Pihlak, Rasmus Lepp, Maris Reintal, Linda Randoja, Nitram","10-year-old Martin meets a cat, who turns into a boy who helps Martin to solve his problems which occured after he changed school.",6.4,229,"","","",,,,6.4,88.6830063776039,640
tt0446043,Sunnyvale,Sunnyvale,2005,2005-03-04,"Comedy, Romance",75,USA,English,James Ricardo,James Ricardo,The Company Pictures,"James Ricardo, April Wade, Ute Werner, Jesselynn Desmond, Gina DeVettori, Samantha Turk, Heidemarie Fuentes, Mark Wood, Hutchi Hancock, Ellen Hughes, Peder Fedde, Michael L. Connelly, Laith Arasaf, Chris Mitchell, Rob Lanza","Opie (James Ricardo) arrived at age 30 with his virginity intact, primarily because he prefers eating to dating.",4.7,230,$ 100000,"","",,3,10,4.7,68.862336903948,470
tt0448150,Tiffany e i tre briganti,Die drei Räuber,2007,2008-11-07,"Animation, Comedy, Crime",75,"USA, Germany","German, English",Hayo Freitag,"Tomi Ungerer, Bettine von Borries",Animation X Gesellschaft zur Produktion von Animationsfilmen mbH,"Joachim Król, Bela B., Charly Hübner, Katharina Thalbach, Elena Kreil, Konstantin Seidenstücker, Maximilian Roca Jungfer, Erwin Leder, Hayo Freitag, Tomi Ungerer, Taylor Autumn Bertman, Gabe Eggerling, Marc Graue, Charity James, Lex Lang",Countryside thieves are won over by a young orphan girl.,7,650,"","",$ 5878372,,2,34,7,98.9740990816819,700
tt0452180,Krojaceva tajna,Krojaceva tajna,2006,2006-01-25,"Drama, Horror, Mystery",75,Serbia,Serbian,Milos Avramovic,Milos Avramovic,Zillion Films,"Goran Susljik, Lazar Ristovski, Marija Vickovic, Dragan Micanovic, Vanja Ejdus, Ljuba Tadic, Milutin Jevdjenijevic, Tatjana Beljakova, Igor Djordjevic, Slobodan Pavelkic, Nada Sargin",The mysterious woman will excite unrest ... And start a dangerous game.,3,202,"","","",,1,2,3,42.6564994493173,300
tt0452226,Frank & Wendy,Frank & Wendy,2004,2005-03-25,"Animation, Comedy",75,Estonia,Estonian,"Kaspar Jancis, Ülo Pikkov",Priit Pärn,Eesti Joonisfilm,"Peeter Oja, Jan Uuspõld, Janne Shevtshenko, Andrus Vaarik, Anne Reemann, Eduard Toman, Tarmo Männard","",6.4,172,"","","",,2,1,6.4,89.8385456806144,640
tt0453383,Naboer,Naboer,2005,2005-03-11,"Horror, Mystery, Thriller",75,"Norway, Sweden, Denmark","Norwegian, Swedish","Pål Sletaune, Tony Spataro",Pål Sletaune,4 1/2 Film,"Kristoffer Joner, Cecilie A. Mosli, Julia Schacht, Anna Bache-Wiig, Michael Nyqvist, Øystein Martinsen, Odd Arno Midtsjø, Magne Kipperrud","John has just been left by his girlfriend Ingrid. That day he allows himself to be seduced into a mystical and scary world, where it is impossible to separate truth from the lies",6.5,8623,NOK 15155100,"",$ 1297446,,46,60,6.5,92.2306979226562,650
tt0455142,Kirikù e gli animali selvaggi,Kirikou et les bêtes sauvages,2005,2005-12-21,"Animation, Adventure, Family",75,France,French,"Bénédicte Galup, Michel Ocelot","Philippe Andrieu, Bénédicte Galup",Les Armateurs,"Pierre-Ndoffé Sarr, Awa Sene Sarr, Robert Liensol, Marie-Philomène Nga, Emile Abossolo M'bo, Pascal N'Zonzi, Marthe Ndome, Emilie Gaydu, Gwénaël Sommier, Alex Carrete, Yanis Durancy, Jean Bediebe, Michel Elias, Noémie Germain, Ebra Kouahoulé","Kirikou's Grandfather says that the story of Kirikou and The Witch was too short, so he proceeds to explain more about Kirikou's accomplishments. We find out how little boy became a ...",6.6,1314,"","",$ 1623,,3,19,6.6,95.3089374790805,660
tt0458509,Turn Left,Turn Left,2006,2006-06-06,"Action, Adventure, Comedy",75,"Germany, USA",English,Dominic Jackson,"Marc Coronado, Dominic Jackson",Adowa Productions,"Chris Bland, John Bourke, Marc Coronado, Leon Deavers, Dominic Jackson, Viola Jackson, Keyle Kosowsky, Julia Leneschmidt, Fred Melott, Herdis Petrovic, Donald Phillips, Emma Potter, Teresa Schuldt, Evelyn Sharma, Karen Siber","Three hit men and a young recruit come out of hiding to do one final job that promises to be a huge payday. Their last hit, which was a setup, went totally wrong. Their new assignment comes...",2,132,EUR 30000,"","",,7,,2,32.2380804728397,200
tt0459929,Pervye na Lune,Pervye na Lune,2005,2005-09-29,"Mystery, Sci-Fi",75,Russia,"Russian, Spanish",Aleksey Fedorchenko,"Aleksandr Gonorovskiy, Ramil Yamaleyev",Kinokompaniya Strana,"Boris Vlasov, Viktoriya Ilyinskaya, Anatoliy Otradnov, Aleksei Slavnin, Viktor Kotov, Andrey Osipov, Aleksey Anisimov, Igor Sannikov, Nina Kameneva, Polina Litovskaya, Sergey Paramonov","By means of archival footage, this mockumentary """"reconstructs"""" how the Russians secretly realised the first manned flight to the moon as early as the 1930s.",6.8,673,$ 1000000,"","",,4,15,6.8,94.6803853176229,680
tt0462726,Yeladim Tovim,Yeladim Tovim,2005,2005,"Crime, Drama, Romance",75,Israel,"Hebrew, English",Yair Hochner,Yair Hochner,"","Daniel Efrat, Dana Balalti, Michael Hamel, Yuval Raz, Gila Goldstein, Danni Lachman, Nili Tserruya, Yuval Dushi, Idan Bosian, Ori Urian, Tomer Ilan, Mor Deri, Dvir Benedek, Benny Eldar, Eyal Harel","Two rent boys, hired by a trick to perform together, develop a relationship.",5.6,347,"","","",,3,3,5.6,76.8591502613964,560
tt0466647,Adamini bul,Adamini bul,1975,1975,"Comedy, Romance",75,Turkey,Turkish,Aram Gülyüz,Suavi Sualp,Melek Film,"Kamer Baba, Ihsan Bayraktar, Ali Demir, Meral Deniz, Müjdat Gezen, Seyhan Gümüs, Nurettin Kaygisiz, Selim Nasit, Kenan Pars, Zeynep Ramazanoglu, Hale Soygazi, Baki Tamer, Ayçin Tansel, Mustafa Yavuz, Yüksel Yurdum","",3.9,129,"","","",,,,3.9,57.6746090856074,390
tt0468538,Ride or Die,Ride or Die,2005,2005-09-16,"Action, Western",75,USA,English,Chris W. Hill,"Jeff Chasin, Chris W. Hill",Warning Films Inc.,"Sarah Kozer, Jesse Wells Martin, Kira Madallo Sesay, Tracia Daye, Julia Ling, Carissa Rosario, Jon Budinoff, Lamont Clayton, Anne Stobaugh, Raphael Saadiq, Hawk Younkins, Johann John Jean, Matt Medrano, Tyson Breech, Menamy Mitanes","When her sister is killed by a band of outlaws, Mei Ling must gather an all-new group of sexy, female gunslingers to avenge the death of one of their own. As the tension hits a fever pitch,...",1.7,118,$ 10000000,"","",,4,,1.7,24.6142850925142,170
tt0469683,Automaton Transfusion,Automaton Transfusion,2006,2008-05-19,Horror,75,USA,English,Steven C. Miller,Steven C. Miller,Through the Heart,"Garrett Jones, Juliet Reeves London, William Howard, Rowan Bousaid, Ashley Elizabeth Pierce, Kendra Farner, Joel Ezra Hebner, Kevin J. O'Neill, John Youmans, Larry Miller, Jeff Denton, Chris Shepardson, Jason Brague, Steven C. Miller, Timothy Miller","Three teens find themselves in a town over run with zombies. Deciding to fight back, they go on a punch you in the throat, action packed, non stop ride through the city, woods, and schools.",3.7,2242,$ 50000,"","",,77,55,3.7,53.1313499063703,370
tt0477430,Fu-Rai,Fu-Rai,2005,2005-08-06,"Horror, Thriller",75,Japan,Japanese,Shugo Fujii,Shugo Fujii,Fresh Hearts,"Shûgo Oshinari, Ayaka Maeda, Kazuo Yashiro, Fumiaki Mitsuyama","One day, when four young men wakes up in the morning, they're all in a small room filled with the white powder, naked.Why they are gathered? What is this room mean to be? Who brought them into this room? How to escape from this room?",5.1,105,$ 60000,"","",,2,2,5.1,74.0246676025097,510
tt0479887,Cutting Room!,Cutting Room!,2005,2005-05-01,Horror,75,USA,English,Krist Rufty,"Steve Beaver, Krist Rufty",Lazarus Entertainment,"Lyla Sullivan, Noelle D'Amato, Shaun O'Rourke, Chace Ambrose, Vanelle, Langley McArol, Nikky Irene, Trent Haaga, Paisley Blackburn, Katie Lester, Jan Jackson, Lloyd Kaufman, Steve Beaver, Mac Dre",A director of a low budget movie decides to kill her fellow cast and crew members as they have used her art to become rich and famous.,4.1,103,"","","",,2,4,4.1,57.7212740339955,410
