imdb_title_id,title,original_title,year,date_published,genre,duration,country,language,director,writer,production_company,actors,description,avg_vote,votes,budget,usa_gross_income,worlwide_gross_income,metascore,reviews_from_users,reviews_from_critics,avg_vote_10,avg_vote_100,avg_vote_1000
tt0007801,Cleopatra,Cleopatra,1917,1917-10-14,"Biography, Drama, History",125,USA,English,J. Gordon Edwards,"Adrian Johnson, Émile Moreau",Fox Film Corporation,"Theda Bara, Fritz Leiber, Thurston Hall, Alan Roscoe, Herschel Mayall, Dorothy Drake, Delle Duncan, Henri De Vries, Art Acord, Hector V. Sarno, Genevieve Blinn","The story of Cleopatra, the fabulous queen of Egypt, and the epic romances between her and the greatest men of Rome, Julius Caesar and Antony.",6.5,298,$ 500000,"","",,3,3,6.5,89.1757170474255,650
tt0013496,Fantasma,Phantom,1922,1922-11-13,"Drama, Romance",125,Germany,German,F.W. Murnau,"Gerhart Hauptmann, Thea von Harbou",Uco-Film GmbH,"Alfred Abel, Frida Richard, Aud Egede-Nissen, Hans Heinrich von Twardowski, Adolf Klein, Olga Engl, Lya De Putti, Ilka Grüning, Grete Berger, Anton Edthofer, Karl Etlinger, Lil Dagover, Heinrich Witte, Wilhelm Diegelmann, Gerhart Hauptmann",A shiftless young man becomes obsessed with a mysterious woman and yearns to find her again.,6.9,1528,"","","",,19,24,6.9,92.6168593412145,690
tt0013515,The Prisoner of Zenda,The Prisoner of Zenda,1922,1922-09-11,"Adventure, Romance",125,USA,None,Rex Ingram,"Anthony Hope, Mary O'Hara",Metro Pictures Corporation,"Lewis Stone, Alice Terry, Robert Edeson, Stuart Holmes, Ramon Novarro, Barbara La Marr, Malcolm McGregor, Edward Connelly, Lois Lee, John George, Snitz Edwards, Fairfax Burger, S.E. Jennings","When the king is drugged and abducted by his ambitious brother, a lookalike relative must take his place to keep the evil sibling off the throne.",6.7,452,$ 323062,"","",,16,5,6.7,94.1842649853249,670
tt0015842,La via senza gioia,Die freudlose Gasse,1925,1926-03-22,Drama,125,Germany,German,Georg Wilhelm Pabst,"Hugo Bettauer, F.H. Lyon",Sofar-Film,"Asta Nielsen, Greta Garbo, Ágnes Eszterházy, Werner Krauss, Henry Stuart, Einar Hanson, Gregori Chmara, Karl Etlinger, Ilka Grüning, Jaro Fürth, Dorothea Thiele","Vienna in the biggest depression, directly after WW1. In a slum, Lila Leid, the wife of lawyer Leid is murdered, Egon, secretary of one of Leid's clients is arrested. He was with her, and ...",7.2,1348,"","","",,19,18,7.2,91.7324089196584,720
tt0020691,Il grande sentiero,The Big Trail,1930,1931-03-14,"Adventure, Western, Romance",125,USA,English,"Raoul Walsh, Louis R. Loeffler",Hal G. Evarts,Fox Film Corporation,"John Wayne, Marguerite Churchill, El Brendel, Tully Marshall, Tyrone Power Sr., David Rollins, Frederick Burton, Ian Keith, Charles Stevens, Louise Carver",Breck Coleman leads hundreds of settlers in covered wagons from the Mississippi River to their destiny out West.,7.2,3312,$ 2000000,"","",,63,43,7.2,101.927628311339,720
tt0026249,I crociati,The Crusades,1935,1935-10-25,"Adventure, Drama, History",125,USA,English,Cecil B. DeMille,"Harold Lamb, Waldemar Young",Paramount Pictures,"Loretta Young, Henry Wilcoxon, Ian Keith, C. Aubrey Smith, Katherine DeMille, Joseph Schildkraut, Alan Hale, C. Henry Gordon, George Barbier, Montagu Love, Ramsay Hill, Lumsden Hare, Maurice Murphy, William Farnum, Hobart Bosworth",King Richard and the Third Crusade (1190-1192) are given the DeMille treatment with more spectacle than history.,6.6,990,"","","",,18,13,6.6,89.8273248169465,660
tt0028203,Giulietta e Romeo,Romeo and Juliet,1936,1936-09-03,"Drama, Romance",125,USA,English,George Cukor,"William Shakespeare, Talbot Jennings",Metro-Goldwyn-Mayer (MGM),"Norma Shearer, Leslie Howard, John Barrymore, Edna May Oliver, Basil Rathbone, C. Aubrey Smith, Andy Devine, Conway Tearle, Ralph Forbes, Henry Kolker, Robert Warwick, Virginia Hammond, Reginald Denny, Violet Kemble Cooper",Young love is poisoned by a generations long feud between two noble families.,6.5,1719,"","","",,46,13,6.5,90.5057148978822,650
tt0031516,Il conquistatore del Messico,Juarez,1939,1939-06-10,"Biography, Drama, History",125,USA,"English, Spanish",William Dieterle,"John Huston, Æneas MacKenzie",Warner Bros.,"Paul Muni, Bette Davis, Brian Aherne, Claude Rains, John Garfield, Donald Crisp, Joseph Calleia, Gale Sondergaard, Gilbert Roland, Henry O'Neill, Harry Davenport, Louis Calhern, Walter Kingsford, Georgia Caine, Montagu Love",Louis Napoleon III takes advantage of the American Civil War to circumvent the Monroe Doctrine and expand his power by helping Emperor Maximillian Hapsburg to add Mexico to his empire.,7.1,1951,"","","",,41,12,7.1,97.8912846187411,710
tt0032221,Arizona,Arizona,1940,1940-12-25,Western,125,USA,"English, Spanish",Wesley Ruggles,"Claude Binyon, Clarence Budington Kelland",Columbia Pictures,"Jean Arthur, William Holden, Warren William, Porter Hall, Edgar Buchanan, Paul Harvey, George Chandler, Byron Foulger, Regis Toomey, Paul Lopez, Colin Tapley, Uvaldo Varela, Earl Crawford, Griff Barnett, Ludwig Hardt","During the 1860s Tucson, a pioneer woman struggles to succeed in the freight and cattle business while at risk at the hands of corrupt and violent local businessmen and rampaging Indians.",6.7,1157,$ 2000000,"","",,25,13,6.7,94.2094964172845,670
tt0032455,Fantasia,Fantasia,1940,1946-09-19,"Animation, Family, Fantasy",125,USA,English,"James Algar, Samuel Armstrong","Joe Grant, Dick Huemer",Walt Disney Productions,"Deems Taylor, Leopold Stokowski, The Philadelphia Orchestra",A collection of animated interpretations of great works of Western classical music.,7.8,86795,$ 2280000,$ 76408097,$ 76411401,96,342,119,7.8,112.705839706776,780
tt0032553,Il grande dittatore,The Great Dictator,1940,1945-06-25,"Comedy, Drama, War",125,USA,"English, Esperanto",Charles Chaplin,Charles Chaplin,Charles Chaplin Productions,"Charles Chaplin, Jack Oakie, Reginald Gardiner, Henry Daniell, Billy Gilbert, Grace Hayle, Carter DeHaven, Paulette Goddard, Maurice Moscovitch, Emma Dunn, Bernard Gorcey, Paul Weigel, Chester Conklin, Esther Michelson, Hank Mann",Dictator Adenoid Hynkel tries to expand his empire while a poor Jewish barber tries to avoid persecution from Hynkel's regime.,8.4,197381,$ 2000000,"",$ 969879,,267,141,8.4,112.658752505646,840
tt0033405,Sangue e arena,Blood and Sand,1941,1941-05-30,"Drama, Sport",125,USA,English,Rouben Mamoulian,"Vicente Blasco Ibáñez, Jo Swerling",Twentieth Century Fox,"Tyrone Power, Linda Darnell, Rita Hayworth, Alla Nazimova, Anthony Quinn, J. Carrol Naish, Lynn Bari, John Carradine, Laird Cregar, Monty Banks, Vicente Gómez, George Reeves, Pedro de Cordoba, Fortunio Bonanova, Victor Kilian",Illiterate peasant Juan Gallardo rises meteorically to fame and fortune in the bullfight arena only to sow the seeds of his own fall.,6.9,2293,"","","",,41,29,6.9,98.1674741799259,690
tt0033750,Io accuso,Ich klage an,1941,1941-08-29,Drama,125,Germany,German,Wolfgang Liebeneiner,"Eberhard Frowein, Wolfgang Liebeneiner",Tobis Filmkunst,"Heidemarie Hatheyer, Paul Hartmann, Mathias Wieman, Margarete Haagen, Charlotte Thiele, Christian Kayßler, Harald Paulsen, Albert Florath, Ilse Fürstenberg, Karin Evans, Hans Nielsen, Franz Schafheitlin, Erich Ponto, Otto Graf, Werner Pledath","In this pro-euthanasia melodrama, a successful doctor is forced to make a heart-wrenching decision after his beautiful young wife is diagnosed with multiple sclerosis.",6.3,141,"","","",,11,2,6.3,88.4189939119,630
tt0034272,Il grande ammiraglio,That Hamilton Woman,1941,1947-01-31,"Drama, History, Romance",125,USA,"English, French, Italian",Alexander Korda,"Walter Reisch, R.C. Sherriff",Alexander Korda Films,"Vivien Leigh, Laurence Olivier, Alan Mowbray, Sara Allgood, Gladys Cooper, Henry Wilcoxon, Heather Angel, Halliwell Hobbes, Gilbert Emery, Miles Mander, Ronald Sinclair, Luis Alberni, Norma Drury, Olaf Hytten, Juliette Compton","The story of courtesan and dance-hall girl Emma Hamilton, including her relationships with Sir William Hamilton and Admiral Horatio Nelson and her rise and fall, set during the Napoleonic Wars.",7.2,3917,"","","",,66,36,7.2,102.574093581116,720
tt0036432,La parata delle stelle,Thousands Cheer,1943,1944-01-01,"Comedy, Drama, Musical",125,USA,English,George Sidney,"Paul Jarrico, Richard Collins",Metro-Goldwyn-Mayer (MGM),"Kathryn Grayson, Gene Kelly, Mary Astor, John Boles, Ben Blue, Frances Rafferty, Mary Elliott, Frank Jenks, Frank Sully, Dick Simmons, Ben Lessy, Mickey Rooney, Judy Garland, Red Skelton, Eleanor Powell","Acrobat Eddie Marsh is in the army now. His first act is to become friendly with Kathryn Jones, the colonel's pretty daughter. Their romance hits a few snags, including disapproval from her...",6.2,911,"","","",,23,9,6.2,88.0160201391027,620
tt0038622,Perdutamente,Humoresque,1946,1947-10-08,"Drama, Music, Romance",125,USA,English,Jean Negulesco,"Clifford Odets, Zachary Gold",Warner Bros.,"Joan Crawford, John Garfield, Oscar Levant, J. Carrol Naish, Joan Chandler, Tom D'Andrea, Peggy Knudsen, Ruth Nelson, Craig Stevens, Paul Cavanagh, Richard Gaines, John Abbott, Robert Blake, Tommy Cook, Don McGuire","A classical musician from the slums is sidetracked by his love for a wealthy, neurotic socialite.",7.3,3819,$ 2164000,"","",,70,22,7.3,100.854816559218,730
tt0039694,Il caso Paradine,The Paradine Case,1947,1952-02-02,"Crime, Drama, Romance",125,USA,English,Alfred Hitchcock,"Robert Hichens, Alma Reville",Selznick International Pictures,"Gregory Peck, Ann Todd, Charles Laughton, Charles Coburn, Ethel Barrymore, Louis Jourdan, Alida Valli, Leo G. Carroll, Joan Tetzel, Isobel Elsom",A happily married London barrister falls in love with the accused poisoner he is defending.,6.6,9841,$ 4258000,"",$ 6789,,106,38,6.6,94.8612846497675,660
tt0040288,Il diavolo zoppo,Le diable boiteux,1948,1948-09-29,History,125,France,"English, Spanish, German, French",Sacha Guitry,Sacha Guitry,Union Cinématographique Lyonnaise (UCIL),"Sacha Guitry, Lana Marconi, Émile Drain, Henry Laverne, Maurice Teynac, Philippe Richard, Georges Spanelly, Renée Devillers, Georges Grey, Jeanne Fusier-Gir, José Noguéro, Maurice Escande, Jean Debucourt, Pierre Bertin, Roger Gaillard","From the late 18th thru the early 19th century Talleyrand, known for his skill at compromise, serves 6 regimes.A George Arliss style vehicle gave Guitry, accused of opportunism during the Occupation, a chance to defend himself.",7,205,"","","",,2,1,7,93.792488220976,700
tt0040876,I tre moschettieri,The Three Musketeers,1948,1950-03-15,"Action, Adventure, Drama",125,USA,English,George Sidney,"Alexandre Dumas, Robert Ardrey",Metro-Goldwyn-Mayer (MGM),"Lana Turner, Gene Kelly, June Allyson, Van Heflin, Angela Lansbury, Frank Morgan, Vincent Price, Keenan Wynn, John Sutton, Gig Young, Robert Coote, Reginald Owen, Ian Keith, Patricia Medina, Richard Wyler",D'Artagnan (Gene Kelly) and his Musketeer comrades thwart the plans of Cardinal Richelieu (Vincent Price) to usurp King Louis XIII's (Frank Morgan's) power.,7.2,5605,$ 4474000,"","",,47,25,7.2,104.901774755656,720
tt0043670,Ibn el Nil,Ibn el Nil,1951,1951-01-10,"Drama, Romance, Thriller",125,Egypt,Arabic,Youssef Chahine,"Nairuz Abdel Malek, Youssef Chahine","","Yehia Chahine, Mahmoud El-Meliguy, Nader Galal, Faten Hamamah, Mahmoud Al Meleji, Shukri Sarhan",A young man from outskirt rebels against his life and abandons his woman for goes to Cairo .,7,123,"","","",,1,,7,99.0792505133844,700
tt0047128,Jan Hus,Jan Hus,1955,1955-04-29,Drama,125,Czechoslovakia,Czech,Otakar Vávra,"Milos Václav Kratochvíl, Otakar Vávra",Studio Umeleckých Filmu Praha,"Zdenek Stepánek, Karel Höger, Vlasta Matulová, Ladislav Pesek, Gustav Hilmar, Vítezslav Vejrazka, Eduard Kohout, Bedrich Karen, Frantisek Smolík, Otomar Krejca, Vladimír Repa, Marie Tomásová, Rudolf Deyl, Frantisek Kreuzmann, Vilém Besser","",6.7,166,"","","",,2,,6.7,88.9941141251758,670
tt0048353,Margherita della notte,Marguerite de la nuit,1955,1955-12-29,"Drama, Fantasy, Romance",125,"France, Italy",French,Claude Autant-Lara,"Pierre Dumarchais, Ghislaine Autant-Lara",Société Nouvelle des Établissements Gaumont (SNEG),"Michèle Morgan, Yves Montand, Jean Debucourt, Jacques Clancy, Paul Demange, Jacques Erwin, Camille Guérini, Suzet Maïs, Max Mégy, Geneviève Morel, Fernand Sardou, Hélène Tossy, Massimo Girotti, Louis Seigner, Jean-François Calvé",Based on novel by Pierre Dumarchais. The story of the aging pedant who sells his soul to Satan in exchange for youth and knowledge.,6.6,192,"","","",,2,3,6.6,87.809703350238,660
tt0048473,Il lamento sul sentiero,Pather Panchali,1955,1955-08-26,Drama,125,India,Bengali,Satyajit Ray,"Bibhutibhushan Bandyopadhyay, Satyajit Ray",Government of West Bengal,"Kanu Bannerjee, Karuna Bannerjee, Chunibala Devi, Uma Das Gupta, Subir Banerjee, Runki Banerjee, Reba Devi, Aparna Devi, Tulsi Chakraborty, Haren Banerjee, Rampada Das, Nibhanani Devi, Rama Gangopadhaya, Roma Ganguli, Binoy Mukherjee","Impoverished priest Harihar Ray, dreaming of a better life for himself and his family, leaves his rural Bengal village in search of work.",8.6,22206,"",$ 134241,$ 135342,,130,117,8.6,118.194718992292,860
tt0050367,Le spie,Les espions,1957,1957-09-19,"Drama, Mystery, Thriller",125,"France, Italy",French,Henri-Georges Clouzot,"Henri-Georges Clouzot, Jérôme Géronimi",Filmsonor,"Curd Jürgens, Peter Ustinov, O.E. Hasse, Sam Jaffe, Paul Carpenter, Véra Clouzot, Martita Hunt, Gérard Séty, Gabrielle Dorziat, Louis Seigner, Pierre Larquey, Georgette Anys, Jean Brochard, Bernard Lajarrige, Dominique Davray","Short of cash for his private clinic, a French psychiatrist accepts money from a NATO Intelligence agent to shelter a defecting Soviet-bloc scientist but enemy spies are closing-in.",6.8,787,"","","",,11,15,6.8,94.5011811321952,680
tt0052918,Lo specchio della vita,Imitation of Life,1959,1959-09-18,Drama,125,USA,English,Douglas Sirk,"Eleanore Griffin, Allan Scott",Universal International Pictures (UI),"Lana Turner, John Gavin, Sandra Dee, Susan Kohner, Robert Alda, Dan O'Herlihy, Juanita Moore, Karin Dicker, Terry Burnham, John Vivyan, Lee Goodman, Ann Robinson, Troy Donahue, Sandra Gould, David Tomack","An aspiring white actress befriends an African American widow, but trouble arises when the latter is rejected by her daughter, who tries to pass for white.",7.9,14433,$ 2000000,"","",87,169,64,7.9,114.786478368619,790
tt0053108,Sacro e profano,Never So Few,1959,1959-12-07,"Drama, War",125,USA,English,John Sturges,"Millard Kaufman, Tom T. Chamales",Metro-Goldwyn-Mayer (MGM),"Frank Sinatra, Gina Lollobrigida, Peter Lawford, Steve McQueen, Richard Johnson, Paul Henreid, Brian Donlevy, Dean Jones, Charles Bronson, Philip Ahn, Robert Bray, Kipp Hamilton, John Hoyt, Whit Bissell, Richard Lupino","During WW2, the American OSS mounts covert operations with the native Kachin against the Japanese army in the jungles of Burma.",5.9,2819,$ 3480000,"","",,39,18,5.9,75.4940913882905,590
tt0053604,L'appartamento,The Apartment,1960,1960-10-06,"Comedy, Drama, Romance",125,USA,English,Billy Wilder,"Billy Wilder, I.A.L. Diamond",The Mirisch Corporation,"Jack Lemmon, Shirley MacLaine, Fred MacMurray, Ray Walston, Jack Kruschen, David Lewis, Hope Holiday, Joan Shawlee, Naomi Stevens, Johnny Seven, Joyce Jameson, Willard Waterman, David White, Edie Adams","A man tries to rise in his company by letting its executives use his apartment for trysts, but complications and a romance of his own ensue.",8.3,158999,$ 3000000,"",$ 177066,94,337,233,8.3,116.914875957119,830
tt0054161,Il passaggio del Reno,Le passage du Rhin,1960,1960-11-04,"Drama, War",125,"France, Italy, West Germany","French, German",André Cayatte,"Maurice Aubergé, André Cayatte",Franco London Films,"Charles Aznavour, Nicole Courcel, Georges Rivière, Cordula Trantow, Georges Chamarat, Jean Marchat, Albert Dinan, Michel Etcheverry, Serge Frédéric, Ruth Hausmeister, Benno Hoffmann, Henri Lambert, Lotte Ledl, Bernard Musson, Alfred Schieske","Following the defeat of France by Germany during WWII, two French soldiers are taken to a German farm as forced laborers. In the ensuing years they become deeply involved in the lives of ...",6.6,193,"","","",,5,1,6.6,90.3137900741828,660
tt0054271,Scent of Mystery,Scent of Mystery,1960,1960-01-06,"Adventure, Crime, Mystery",125,USA,English,Jack Cardiff,"Kelley Roos, William Roos","","Denholm Elliott, Peter Lorre, Beverly Bentley, Paul Lukas, Liam Redmond, Leo McKern, Peter Arne, Mary Laura Wood, Diana Dors, Judith Furse, Maurice Marsac, Michael Trubshawe, Juan Olaguivel, Billie Miller",Vacationing Englishman Oliver Larker (Denholm Elliott) stumbles upon a plot to kill a young American tourist (Beverly Bentley) in Spain.,5.6,284,"","","",,16,12,5.6,73.9670237108559,560
tt0055184,Gli spostati,The Misfits,1961,1961-04-01,"Drama, Romance, Western",125,USA,English,John Huston,Arthur Miller,Seven Arts Productions,"Clark Gable, Marilyn Monroe, Montgomery Clift, Thelma Ritter, Eli Wallach, James Barton, Kevin McCarthy, Estelle Winwood",A divorcée falls for an over-the-hill cowboy who is struggling to maintain his romantically independent lifestyle.,7.2,16852,$ 4000000,"","",77,143,82,7.2,98.9067147422419,720
tt0055841,Sessualità,The Chapman Report,1962,1962-10-05,"Drama, Romance",125,USA,English,George Cukor,"Wyatt Cooper, Don Mankiewicz",Darryl F. Zanuck Productions,"Efrem Zimbalist Jr., Shelley Winters, Jane Fonda, Claire Bloom, Glynis Johns, Ray Danton, Ty Hardin, Andrew Duggan, John Dehner, Harold J. Stone, Corey Allen, Jennifer Howard, Cloris Leachman, Chad Everett, Henry Daniell","Based on the best-selling novel by Irving Wallace that was inspired by the Kinsey Report on the sexual mores of suburban women, the film follows the personal (read sexual) lives of four ...",5.6,717,"","","",,23,7,5.6,76.1402042977114,560
tt0056447,Storia cinese,Satan Never Sleeps,1962,1962-03-23,"Drama, History, War",125,USA,"English, Cantonese","Leo McCarey, David W. Orton","Claude Binyon, Leo McCarey",Twentieth Century Fox,"William Holden, Clifton Webb, France Nuyen, Athene Seyler, Martin Benson, Edith Sharpe, Robert Lee, Marie Yang, Andy Ho, Burt Kwouk, Weaver Levy","During the Chinese Civil War of 1949, the Communists constantly harass the two priests of a remote Catholic mission outpost.",6.1,591,$ 2885000,"","",,24,6,6.1,90.3846147440032,610
tt0057212,Jûsan-nin no shikaku,Jûsan-nin no shikaku,1963,1963-12-07,"Adventure, Action",125,Japan,Japanese,Eiichi Kudô,Kaneo Ikegami,Toei Company,"Takayuki Akutagawa, Chiezô Kataoka, Kôtarô Satomi, Ryôhei Uchida, Tetsurô Tanba, Satomi Oka, Yuriko Mishima, Sumiko Fuji, Chôichirô Kawarasaki, Michitarô Mizushima, Kunio Kaga, Seishiro Sawamura, Kusuo Abe, Shingo Yamashiro, Kôshirô Harada",A group of samurai plan to assassinate a sadistic feudal lord.,7.5,798,"","","",,4,13,7.5,106.714459391406,750
tt0058265,"Baciami, stupido","Kiss Me, Stupid",1964,1964-12-22,"Comedy, Romance",125,USA,English,Billy Wilder,"Billy Wilder, I.A.L. Diamond",The Mirisch Corporation,"Dean Martin, Kim Novak, Ray Walston, Felicia Farr, Cliff Osmond, Barbara Pepper, Skip Ward, Doro Merande, Bobo Lewis, Tom Nolan, Alice Pearce, John Fiedler, Arlen Stuart, Howard McNear, Cliff Norton","Jealous piano teacher Orville Spooner sends his beautiful wife, Zelda, away for the night while he tries to sell a song to famous nightclub singer Dino, who is stranded in town.",7,6817,$ 3500000,"",$ 8869,63,80,60,7,101.895676812215,700
tt0058404,La notte dell'iguana,The Night of the Iguana,1964,1964-10-28,Drama,125,USA,"English, Spanish",John Huston,"Tennessee Williams, Anthony Veiller",Seven Arts Productions,"Richard Burton, Ava Gardner, Deborah Kerr, Sue Lyon, Skip Ward, Grayson Hall, Cyril Delevanti, Mary Boylan",A defrocked Episcopal clergyman leads a bus-load of middle-aged Baptist women on a tour of the Mexican coast and comes to terms with the failure haunting his life.,7.6,10499,$ 3000000,"",$ 3942,,93,31,7.6,106.496516456054,760
tt0059252,"Jean Harlow, la donna che non sapeva amare",Harlow,1965,1965-06-23,"Biography, Drama, Romance",125,USA,English,Gordon Douglas,"John Michael Hayes, Arthur M. Landau",Embassy Pictures,"Carroll Baker, Red Buttons, Raf Vallone, Angela Lansbury, Peter Lawford, Mike Connors, Martin Balsam, Leslie Nielsen, Mary Murphy, Hanna Landy, Peter Hansen, Kipp Hamilton, Peter Leeds, Bobby Vinton",A screen adaption of the blistering best-seller which examines the story of platinum blonde bombshell Jean Harlow (Carroll Baker) who rose to fame in the reckless Hollywood of the 1930s.,5.6,765,$ 2500000,"","",,38,12,5.6,80.2794051158963,560
tt0060227,Le avventure e gli amori di Miguel Cervantes,Cervantes,1967,1967-11-03,"Adventure, Biography, Drama",125,"Spain, France, Italy","English, Spanish",Vincent Sherman,"Bruno Frank, Enrique Llovet",Procinex,"Horst Buchholz, Gina Lollobrigida, José Ferrer, Louis Jourdan, Francisco Rabal, Antonio Casas, Soledad Miranda, Ángel del Pozo, Ricardo Palacios, Maurice de Canonge, Tiziano Cortini, José Jaspe, Claudine Dalmas, José Nieto, Andrés Mejuto","A highly fictionalized filming of the early life of Miguel de Cervantes, author of """"Don Quixote"""".",5.8,155,"","","",,4,,5.8,81.0472996223588,580
tt0060424,Non per soldi... ma per denaro,The Fortune Cookie,1966,1966-12-21,"Comedy, Romance",125,USA,English,Billy Wilder,"Billy Wilder, I.A.L. Diamond",Phalanx-Jalem,"Jack Lemmon, Walter Matthau, Ron Rich, Judi West, Cliff Osmond, Lurene Tuttle, Harry Holcombe, Les Tremayne, Lauren Gilbert, Marge Redmond, Noam Pitlik, Harry Davis, Ann Shoemaker, Maryesther Denver, Ned Glass",A crooked lawyer persuades his brother-in-law to feign a serious injury.,7.3,12380,$ 3705000,"","",63,69,54,7.3,98.1446601516278,730
tt0061474,Chiriyakhana,Chiriyakhana,1967,1967,"Crime, Drama, Mystery",125,India,Bengali,Satyajit Ray,"Saradindu Bandopadhyay, Satyajit Ray",Angel Digital Private Limited,"Uttam Kumar, Kalipada Chakraborty, Nripati Chatterjee, Shekhar Chatterjee, Subhendu Chatterjee, Subrata Chatterjee, Subrata Chatterjee, Nilotpal Dey, Binoy Dutta, Jahar Ganguli, Shailen Ganguli, Bankim Ghosh, Shyamal Ghoshal, Ramen Gupta, Kanika Majumdar","Byomkesh Bakshi, a detective, is hired by a rich man to investigate the name of an actress appeared in a movie decades ago, who has eloped ever since. The case became complicated when the rich man is murdered by someone for that.",7.2,748,"","","",,11,2,7.2,98.1549579537239,720
tt0061780,Masquerade,The Honey Pot,1967,1967-09-28,"Comedy, Crime, Mystery",125,"USA, Italy",English,Joseph L. Mankiewicz,"Frederick Knott, Thomas Sterling",Famous Artists Productions,"Rex Harrison, Susan Hayward, Cliff Robertson, Capucine, Edie Adams, Maggie Smith, Adolfo Celi, Herschel Bernardi, Massimo Serato, Hugh Manning, David Dodimead, Antonio Corevi, Cy Grant, Frank Latimore, Carlos Alberto Valles","In Venice, a millionaire hires an actor to help him prank three greedy ex-girlfriends into thinking he's dying and leaving his fortune to one of them.",6.9,2075,$ 6000000,"",$ 11159,,22,16,6.9,96.4195701645087,690
tt0063775,Viva! Viva Villa!,Villa Rides,1968,1968-08-23,"War, Western",125,USA,English,Buzz Kulik,"Robert Towne, Sam Peckinpah",Paramount Pictures,"Yul Brynner, Robert Mitchum, Maria Grazia Buccella, Charles Bronson, Herbert Lom, Robert Viharo, Frank Wolff, Alexander Knox, Robert Carricart, Andrés Monreal, Fernando Rey, Julio Peña, José María Prada, Regina de Julián, Antoñito Ruiz",Mexican rebel Pancho Villa lead a revolution helped by an American aviator imprisonned in Mexico.,6.4,1758,"",$ 2640000,"",,23,16,6.4,82.5478951224238,640
tt0064041,Il compromesso,The Arrangement,1969,1969-12-23,"Drama, Romance",125,USA,English,Elia Kazan,"Elia Kazan, Elia Kazan",Athena Productions,"Kirk Douglas, Faye Dunaway, Deborah Kerr, Richard Boone, Hume Cronyn, Michael Higgins, Carol Eve Rossen, William Hansen, Harold Gould, Michael Murphy, John Randolph Jones, Anne Hegira, Charles Drake, E.J. André, Philip Bourneuf","A suicidal advertising executive is forced to re-evaluate his life while dealing with his unhappy marriage, his mistress, and his aging father.",6.5,2510,"","",$ 9536,,39,18,6.5,89.1731303425686,650
tt0064660,"Metti, una sera a cena","Metti, una sera a cena",1969,1969-04-03,Drama,125,Italy,Italian,Giuseppe Patroni Griffi,"Giuseppe Patroni Griffi, Dario Argento",Euro International Film (EIA),"Jean-Louis Trintignant, Florinda Bolkan, Lino Capolicchio, Tony Musante, Annie Girardot, Silvia Monti, Milly, Adriana Asti, Titina Maselli, Ferdinando Scarfiotti, Claudio Carrozza, Nora Ricci, Mariano Rigillo, Antonio Jaia, Helmut Berger",A liberal-thinking author watches his wife as she attempts to seduce his best friend at a dinner party.,6.4,178,"","","",,3,2,6.4,93.5008068510495,640
tt0064718,Nell'anno del Signore,Nell'anno del Signore,1969,1969-10-23,"Comedy, Drama, History",125,"Italy, France","Italian, German",Luigi Magni,Luigi Magni,Francos Films,"Nino Manfredi, Enrico Maria Salerno, Claudia Cardinale, Robert Hossein, Renaud Verley, Britt Ekland, Ugo Tognazzi, Alberto Sordi, Franco Abbina, Bruno Erba, Pippo Franco, Maria Cristina Farnese, Emilio Marchesini, Piero Nistri, Stefano Oppedisano","Rome, 1825. Bishop Rivarola (Tognazzi) and colonel Nardoni (Salerno) are in charge to suppress liberal revolution. Shoemaker Cornacchia (Manfredi) got the information that the liberal ...",7.3,632,"","","",,2,1,7.3,101.644722651111,730
